price,address,Diện tích,Details,Ngày đăng,Loại tin,id,Số tầng,Hướng,Mặt tiền,Số phòng ngủ,Số toilet
"4,55 tỷ VNĐ",Phan Đình Giót- Hà Đông, 53m2,"HIẾM! ngõ ô tô thông gần phố Phan Đình Giót, Hà Đông, 53m, nhỉnh 4 tỷ Nhà nằm trên con phố đẹp huyết mạch trung tâm quận Hà Đông, giao thông đi lại thuận tiện các phố: Lê TRọng Tấn, Tố Hữu, Văn Phú, Quang Trung, Lý Thường Kiệt,....Ngõ ô tô rất hiếm, gần phố ô tô tránh, ngõ rộng thông tứ tung, nhà lô góc rất thoáng đẹp, không có căn thứ 2. Tiện ích xung quanh không xuể, ra khỏi nhà muốn mua gì cũng có, khu vực cơ sở hạ tầng tốt, an sinh đỉnh, an ninh tuyệt đối. Nhà được chủ xây và giữ gìn vô cùng chắc chắn, phòng đầy đủ công năng mở cửa sổ ban công vô cùng sáng thoáng mát mẻ, chỉ việc đến ở. Chủ nhà rất hiểu chuyện, con cái thành đạt, bán đi ở biệt thự to hơn. Sổ đỏ cất két, pháp lý sạch. Giá: 4.55 tỷ ( có thương lượng). Liên hệ ngay với em Huyền địa ốc KINH NGHIỆM TRÊN 8 NĂM ( 0363703491- 0965472910) - Để sở hữu hàng nghìn ngôi nhà cùng khu vực, tiết kiệm THỜI GIAN - CÔNG SỨC - TIỀN BẠC.- Tư vấn miễn phí 24/24h( zalo, fb). Tư vấn Pháp lý, vay vốn.",28/12/2021,Tin thường,batdongsan_so_com_vn_1673834332.8344939,,,,,
"4,5 tỷ VNĐ",Cầu Am- Hà Đông, 53m2,"Cần bán gấp nhà Cầu Am, Hà Đông , ô tô, ngõ thông,53m x4 tầng, nhỉnh 4 tỷ. Nhà bán siêu hiếm vị trí đẹp nhất phố, chủ thiết kế tâm huyết xây chắc chắn, các phòng ốc hiện đại đủ công năng mở cửa sổ ban công thoáng mát, chỉ việc xách vali đến ở. Ngõ rộng thông, mát mẻ mùa hè, ấm áp về mùa đông, vài phút ra phố, giao thông thuận tiện nối các phố: Yết Kiêu, Ngô Quyền, Thanh Bình, Văn Quán, Phùng Hưng, Quang Trung,... Rất hợp để ở nằm trong khu dân cư yên tĩnh, hàng xóm quan chức văn minh.Tiện ích ngập tràn siêu thị, chợ, bể bơi, vườn hoa, khu vui chơi, ngân hàng, trường học các cấp. Chủ nhà con cháu đuề huề thành đạt, nhà rất có lộc. Giá: 4.5 tỷ ( có thương lượng). Sổ đỏ vuông, pháp lý sạch. Liên hệ ngay với em Huyền địa ốc KINH NGHIỆM TRÊN 8 NĂM ( 0363703491- 0965472910) - Để sở hữu hàng nghìn ngôi nhà cùng khu vực, tiết kiệm THỜI GIAN - CÔNG SỨC - TIỀN BẠC.- Tư vấn miễn phí 24/24h( zalo, fb). Tư vấn Pháp lý, vay vốn.",28/12/2021,Tin thường,batdongsan_so_com_vn_1673834334.556821, 4,,,,
"2,8 tỷ VNĐ",Vạn Phúc- Hà Đông, 41m2," Cần tiền bán gấp nhà  Phố Vạn Phúc, Hà Đông, ngõ thông, 41m, 4 tầng nhỉnh 2 tỷ. + Chủ cần tiền bán gấp căn nhà đẹp Vạn Phúc, Quận Hà Đông, diện tích 41m2, 4 phòng ngủ rộng. + Nhà nằm trên trục chính nối liền các tuyến phố quan trọng bậc nhất Hà Đông: Quang Trung, Ngô Quyền, Tố Hữu, Yết Kiêu, Thanh Bình, Văn Quán, Trần Phú, Phùng Hưng,...  + Khu vực nhiều trường đại học lớn tập trung như: Kiến Trúc, Bưu chính viễn Thông, Học viện Quân y, Học Viện an ninh, trường học các cấp, siêu thị, chợ, bệnh viện lớn... + Chủ thiện chí, cần bán gấp lấy tiền đầu tư nhà xưởng, máy móc. + Sổ đỏ vuông đẹp như viên gạch, chủ cất két cho mới. + Giá chỉ 2.8 tỷ, thương lượng trực tiếp với chủ nhà, miễn trung gian. - Liên hệ ngay với em Huyền địa ốc KINH NGHIỆM TRÊN 10 NĂM ( 0363703491- 0965472910) - Để sở hữu hàng nghìn ngôi nhà cùng khu vực, tiết kiệm THỜI GIAN - CÔNG SỨC - TIỀN BẠC.         - Tư vấn miễn phí 24/24h( zalo, fb). Tư vấn Pháp lý.",28/12/2021,Tin thường,batdongsan_so_com_vn_1673834337.2529988, 4,,,,
"2,8 tỷ VNĐ",La Khê- Hà Đông, 40m2,"Căn nhà siêu đẹp duy nhất phố La Khê, Hà Đông 40mx4 tầng, ô tô gần, ngõ thông. - Căn nhà siêu đẹp phố La Khê, trung tâm khu hành chính quận Hà Đông, thủ đô Hà Nội, khu vực sầm uất, dân trí cao, đáng sống bậc nhất quận Hà Đông. Giao thông vô cùng thuận lợi thông thương : Lê TRọng Tấn, Tố Hữu, Văn Phú, Quang Trung,... - Nhà xây dựng trên mảnh đất vượng khí rộng 40m2, với 4 tầng thiết kế đẹp, đủ công năng sử dụng. Khu dân trí cao, trí thức về đây tụ họp rất nhiều. Cảm giác quan chức nhiều như quần long hội tụ vậy. Khu vực hiếm nhà bán, nhu cầu ở và thuê rất cao. - Chủ nhà thương gia con cái thành đạt bán đi định cư nước ngoài, mong muốn bán nhanh, giá cả rất tốt so với khu vực. - Sổ đỏ chính chủ sẵn sàng giao dịch. - Giá chỉ 2.8 tỷ cho căn nhà siêu đẹp ( có thương lượng). - Liên hệ ngay với em Huyền địa ốc KINH NGHIỆM TRÊN 10 NĂM ( 0363703491- 0965472910) - Để sở hữu hàng nghìn ngôi nhà cùng khu vực, tiết kiệm THỜI GIAN - CÔNG SỨC - TIỀN BẠC.         - Tư vấn miễn phí 24/24h( zalo, fb). Tư vấn Pháp lý, vay vốn. ",28/12/2021,Tin thường,batdongsan_so_com_vn_1673834342.1420887, 4,,,,
"6,3 tỷ VNĐ","Trương Định, phường Thịnh Liệt, quận Hoàng Mai, Hà Nội.", 43m2,"BÁN NHÀ MẶT PHỐ TRƯƠNG ĐỊNH, TRỤC CHÍNH KINH DOANH ĐỈNH, HƠN 100TR/M2. GIÁ 6.3 TỶ.- Diện tích: 43m2 x 4 tầng, mặt tiền 4.2m, giá  6.3 tỷ.- Nhà 4 tầng khung cột chắc chắn mới xây được 3 năm. Thiết kế thông sàn.- T1: Đang cho thuê tầng 1 kinh doanh. - T2,3: Thông sàn 1 phòng ngủ, vệ sinh.- T4: Bếp, phòng thờ, sân phơi. - Sổ đỏ chờ sẵn sàng giao dịch, (có thương lượng).- Chi tiết liên hệ chị Yến ĐT, Zalo.",28/12/2021,Tin thường,batdongsan_so_com_vn_1673834344.516026,,,,,
,Bán nhà số 20 Ngõ 92 Đào Tấn - Ba Đình; 0913069546, 51m2,"Bán nhà số 20 Ngõ 92 Đào Tấn - Ba Đình; 0913069546 Diện tích: 51m2; mặt tiền : 4,2mm, nở hậu;  - Hướng: Đông Bắc. - Sổ đỏ chính chủ - Nhà 4 tầng, 2 mặt thoáng, thiết kế 4 Phòng Ngủ, 1 phòng khách, 1 bếp, 3 vệ sinh, có khoảng sân rộng để xe.- Đường trước nhà rộng 3m, không có xe chạy, yên tĩnh- Địa điểm trung tâm gần công viên trường học, bệnh viện, chợ, trung tâm thương mại ... giao thông đi lại cực kỳ thuận tiện. Giá bán : thoả thuậnLiên hệ Anh Linh chủ nhà: 0913069546      http://www.sanbatdongsanviet.com.vn",28/12/2021,Tin thường,batdongsan_so_com_vn_1673834346.7432888,,,,,
30 tỷ VNĐ,"Phố Vũ Tông Phan, Khương Đình, Thanh Xuân, Hà Nội", 116m2,"Chính Chủ Bán Nhà Mặt Phố Vũ Tông Phan Kinh Doanh. Dt 116m*5t giá 30 tỷ.+ Mặt phố Vũ Tông Phan, phường Khương Đình, quận Thanh Xuân. Vị trí tiếp giáp với các đường Nguyễn Trãi, Định Công, Kim Giang, Hoàng Đạo Thành, khu vực có nhiều tòa nhà văn phòng, trung tâm thương mại, giao thông thuận tiện, tiềm năng phát triển mạnh.+ Tòa nhà văn phòng, trung tâm thương mại, khách sạn.+ Sổ đỏ đẹp, chính chủ, sẵn sàng giao dịch.+ Chủ thiện chí bán, chuyển định cư nước ngoài cần bán nhanh, có thương lượng.+ Liên hệ: Đức Thành. 0912525146",28/12/2021,Tin thường,batdongsan_so_com_vn_1673834348.9043283,,,,,
15 tỷ VNĐ,"Khu ĐTM Đô Nghĩa, Hà Đông", 102m2,"❤️❤️❤️SHOPHOUSE - CÓ Ô CHỜ THANG MÁY- CĂN GÓC 2 MẶT THOÁNG KINH DOANH CỰC ĐỈNH❤️❤️❤️ + Nhà xây mới 5 tầng thiết kế hiện đại. + Tầng 1: Thông sàn. + Tầng 2 Phòng khách + bếp + Tầng 3,4 mỗi tầng 2 phòng ngủ. + Tầng 5: phòng thờ + sân phơi. - An ninh dân trí tốt - Đường rộng kinh doanh tốt, gần vườn hoa, công viên âm nhạc, kết nối trục tố hữu, vành đai 4, tiện ích đầy đủ,.... - Sổ đỏ vuông đẹp, pháp lý chuẩn.",28/12/2021,Tin thường,batdongsan_so_com_vn_1673834350.8766513, 5, Đông bắc, 20, 4, 4
"2,77 tỷ VNĐ",Yên Phúc- Hà Đông, 40m2,"Cần bán nhà trước tết, Yên Phúc, Hà Đông, 40m, 4 ngủ, nhỉnh 2 tỷ, ô tô gần, ngõ thoáng + Quận Hà Đông đang phát triển rất nhanh về cơ sở hạ tầng, quỹ đất ở hạn hẹp dần, sở hữu một căn nhà trung tâm Quận Hà Đông là bắt kịp xu thế đầu tư lợi nhuận, ở đẳng cấp và tiện ích, quận trung tâm, di chuyển đi đâu cũng vô cùng thuận lợi. + Nhà phố Yên Phúc 40m2 vuông vắn, ô tô đỗ gần, với 4 tầng  xây hiện đại ngập tràn ánh sáng tự nhiên là sự lựa chọn số 1 cho anh chị đang tìm nhà hơn 2 tỷ để đầu tư hoặc an cư lập nghiệp. Căn nhà tại vị trí vô cùng đắc địa, thuận lợi di chuyển các quận như Hà Đông. + Tôi và anh chị có thể tham khảo so sánh thêm một số căn nhà rất đẹp đang chào bán khoảng dưới 3 tỷ: - Nhà Ngô Quyền 32m, 4 tầng mới đẹp. - Nhà Mậu Lương  30m ngay mặt phố. - Đất Đa Sỹ 35m sổ đỏ vuông vức, gần trường chợ. -Nhà Vạn Phúc 30m xung quanh đầy đủ tiện ích -  Sổ đỏ vuông, pháp lý sạch. - Giá: 2.77 tỷ ( có thương lượng). -  Liên hệ ngay với em Huyền địa ốc KINH NGHIỆM TRÊN 8 NĂM ( 0363703491- 0965472910) - Để sở hữu hàng nghìn ngôi nhà cùng khu vực, tiết kiệm THỜI GIAN - CÔNG SỨC - TIỀN BẠC.         -  Tư vấn miễn phí 24/24h( zalo, fb). Tư vấn Pháp lý, vay vốn.",25/12/2021,Tin thường,batdongsan_so_com_vn_1673834352.8183167,,,, 4,
"6,33 tỷ VNĐ",Văn Quán- Hà Đông, 62m2,"HOT! Trung tâm Quận Hà Đông, gara ô tô, ngõ thông, nội thất Xịn, 62m2x 5 tầng, nhỉnh 6 tỷ Người thân gửi bán nhà đẹp nằm vị trí đắc địa trung tâm nơi đáng sống bậc nhất Quận Hà Đông Văn Quán, Hà Đông, ngõ thông muôn nơi, gần hồ, gần chợ, nhiều tiện ích xung quanh. Giao thông thuận lợi thông: Yên Phúc, Phùng Hưng, Quang Trung, Yết Kiêu, Chiến Thắng, An Hòa, Ao Sen, Vạn Phúc, ...xung quanh các trường đại học lớn, siêu thị Coop mark, Big C , ngân hàng, trường học các cấp tư nhân đến quốc tế. Nhà thiết kế khung cột chắc chắn, khu hiếm nhà bán ra căn nào hết căn đó, các phòng mở cửa sổ thoáng sáng, vài bước ra phố ô tô tránh. Giá: 6.33 tỷ ( có thương lượng). Sổ đỏ vuông, pháp lý sạch. Liên hệ ngay với em Huyền địa ốc KINH NGHIỆM TRÊN 8 NĂM ( 0363703491- 0965472910) - Để sở hữu hàng nghìn ngôi nhà cùng khu vực, tiết kiệm THỜI GIAN - CÔNG SỨC - TIỀN BẠC.- Tư vấn miễn phí 24/24h( zalo, fb). Tư vấn Pháp lý, vay vốn.",27/12/2021,Tin thường,batdongsan_so_com_vn_1673834354.8405752, 5,,,,
"2,8 tỷ VNĐ",Phùng Hưng- Hà Đông, 40m2,"Căn nhà siêu đẹp duy nhất phố Phùng Hưng, Hà Đông 40mx4 tầng, ô tô gần, ngõ thông. - Căn nhà siêu đẹp phố Phùng Hưng, trung tâm khu hành chính quận Hà Đông, thủ đô Hà Nội, khu vực sầm uất, dân trí cao, đáng sống bậc nhất quận Hà Đông. Giao thông vô cùng thuận lợi thông thương : Mậu Lương, Đa Sỹ, Phúc La, Yên Xá, Thanh Hà, Văn Phú, Phú Lương, Tân Triều, Văn Quán,... - Nhà xây dựng trên mảnh đất vượng khí rộng 40m2, với 4 tầng thiết kế đẹp, đủ công năng sử dụng. Khu dân trí cao, trí thức về đây tụ họp rất nhiều. Cảm giác quan chức nhiều như quần long hội tụ vậy. Khu vực hiếm nhà bán, nhu cầu ở và thuê rất cao. - Chủ nhà thương gia con cái thành đạt bán đi định cư nước ngoài, mong muốn bán nhanh, giá cả rất tốt so với khu vực. - Sổ đỏ chính chủ sẵn sàng giao dịch. - Giá chỉ 2.8 tỷ cho căn nhà siêu đẹp ( có thương lượng). - Liên hệ ngay với em Huyền địa ốc KINH NGHIỆM TRÊN 10 NĂM ( 0363703491- 0965472910) - Để sở hữu hàng nghìn ngôi nhà cùng khu vực, tiết kiệm THỜI GIAN - CÔNG SỨC - TIỀN BẠC.         - Tư vấn miễn phí 24/24h( zalo, fb). Tư vấn Pháp lý, vay vốn. ",25/12/2021,Tin thường,batdongsan_so_com_vn_1673834357.09786, 4,,,,
"6,32 tỷ VNĐ",Phùng Hưng- Hà Đông, 61m2,"Nhỉnh 6 tỷ nhà đẹp gara ô tô, ngõ thông, Phùng Hưng, Hà Đông, 61m2, dân xây Phố Phùng Hưng nổi tiếng một trong những nơi đáng sống bậc nhất Hà Đông, dân đông, phố rộng hè thoáng, môi trường trong lành, tiện ích ngút ngàn: Siêu thị, chợ, trường học các cấp, bệnh viện lớn,trục chính di chuyển thuận lợi:, Văn Quán, Vạn Phúc, Mỗ Lao,Nguyễn Khuyến, Ao Sen, Trần Phú, An Hòa, Nguyễn Văn Trỗi, Bà Triệu, Nhuệ Giang, Xa La, Yên Xá... Nhà được xây dựng trên mảnh đất đẹp, vượng khí tài lộc, gia chủ làm ăn rất phất, nhiều nhà nay bán bớt để mở rộng kinh doanh. Nhà có gara ô tô, ngõ thông tứ tung, các phòng đẹp thoáng sáng. Sổ đỏ chính chủ, sẵn sàng giao dịch. Giá: 6.32 tỷ ( có thương lượng). Liên hệ ngay với em Huyền Thổ cư KINH NGHIỆM GẦN 10 NĂM ( 0363703491- 0965472910) - Để sở hữu hàng nghìn ngôi nhà cùng khu vực, tiết kiệm THỜI GIAN - CÔNG SỨC - TIỀN BẠC.- Tư vấn miễn phí 24/24h( zalo, fb). Tư vấn Pháp lý, vay vốn. ",27/12/2021,Tin thường,batdongsan_so_com_vn_1673834360.1531487,,,,,
"6,35 tỷ VNĐ",Ngô Thì Nhậm- Hà Đông, 62m2,"Chính chủ bán nhà đẹp Ngô Thì Nhậm, Hà Đông, nở hậu, ô tô tránh, 62m2, nhỉnh 6 tỷ Ngô Thì Nhậm, Hà Đông khu vực đáng sống bậc nhất, nổi tiếng môi trường trong lành, dân trí cao quan chức về đây tụ họp rất nhiều như quần long tụ tụ, gần chợ Bông Đỏ, xung quanh đầy đủ tiện ích không thiếu thứ gì. Nhà bán rất đẹp mới toanh chủ tự thuê thiết kế, phong cách Châu Âu hiện đại, nội thất xịn đẳng cấp, khu vực rất hiếm nhà bán, không có căn thứ 2, các phòng thoáng sáng đầy đủ công năng, vài bước chân ra phố ô tô tránh. Giao thông thuận lợi di chuyển các phố: Ngô Quyền, Quang Trung, Lê Trọng Tấn, Vạn Phúc, Phan Đình Giót, Nguyễn Viết Xuân,...gần gas Cát Linh, bến xe bus, bệnh viện lớn, ngân hàng, trường học các cấp... Giá: 6.35 tỷ ( có thương lượng). Sổ đỏ vuông, pháp lý sạch. Liên hệ: Em Huyền ( Cháu gái chủ nhà) 0965472910- 0363703491- Miễn trung gian.",25/12/2021,Tin thường,batdongsan_so_com_vn_1673834362.5569026,,,,,
"2,79 tỷ VNĐ",Hà Trì- Hà Đông, 40m2,"HOT! Hà Trì, Hà Đông, ngõ thông, ô tô gần, 40mx4 tầng nhỉnh 2 tỷ - Vị trí: Phố Hà Trì quận Hà Đông nơi giao thoa nhiều tuyến phố quan trọng: Quang Trung, Lê Lợi, Bà Triệu, Đa Sỹ, Mậu Lương, Xa La, ... nằm trên trục chính di chuyển thuận lợi. - Tiện ích: gần nhà có đầy đủ tiện ích xã hội như: chợ, siêu thị,  bãi xe, chợ dân sinh, ngân hàng, trường học các cấp, bệnh viện, sân bóng.... Nhà nằm lô góc, ánh sáng ngập tràn. - Nhà được thiết kế hiện đại chuẩn công năng sử dụng gần phố các phòng thoáng mát, khu hiếm nhà bán, an ninh tuyệt đối. - Giá chỉ có 2.79 tỷ ( có thương lượng) cho một căn nhà 4 tầng siêu đẹp diện tích 40m trung tâm quận Hà Đông. - Sổ đỏ vuông, pháp lý sạch. - Liên hệ ngay với em Huyền địa ốc KINH NGHIỆM TRÊN 10 NĂM ( 0363703491- 0965472910) - Để sở hữu hàng nghìn ngôi nhà cùng khu vực, tiết kiệm THỜI GIAN - CÔNG SỨC - TIỀN BẠC.         - Tư vấn miễn phí 24/24h( zalo, fb). Tư vấn Pháp lý, vay vốn.",27/12/2021,Tin thường,batdongsan_so_com_vn_1673834364.5094752, 4,,,,
"6,33 tỷ VNĐ","Văn Quán, Hà Đông", 62m2,"HOT! Trung tâm Quận Hà Đông, gara ô tô, ngõ thông, nội thất Xịn, 62m2x 5 tầng, nhỉnh 6 tỷ Người thân gửi bán nhà đẹp nằm vị trí đắc địa trung tâm nơi đáng sống bậc nhất Quận Hà Đông Văn Quán, Hà Đông, ngõ thông muôn nơi, gần hồ, gần chợ, nhiều tiện ích xung quanh. Giao thông thuận lợi thông: Yên Phúc, Phùng Hưng, Quang Trung, Yết Kiêu, Chiến Thắng, An Hòa, Ao Sen, Vạn Phúc, ...xung quanh các trường đại học lớn, siêu thị Coop mark, Big C , ngân hàng, trường học các cấp tư nhân đến quốc tế. Nhà thiết kế khung cột chắc chắn, khu hiếm nhà bán ra căn nào hết căn đó, các phòng mở cửa sổ thoáng sáng, vài bước ra phố ô tô tránh. Giá: 6.33 tỷ ( có thương lượng). Sổ đỏ vuông, pháp lý sạch. Liên hệ ngay với em Huyền địa ốc KINH NGHIỆM TRÊN 8 NĂM ( 0363703491- 0965472910) - Để sở hữu hàng nghìn ngôi nhà cùng khu vực, tiết kiệm THỜI GIAN - CÔNG SỨC - TIỀN BẠC.- Tư vấn miễn phí 24/24h( zalo, fb). Tư vấn Pháp lý, vay vốn.",27/12/2021,Tin thường,batdongsan_so_com_vn_1673834366.854111, 5,,,,
"6,32 tỷ VNĐ",Phùng Hưng- Hà Đông, 62m2,"Nhỉnh 6 tỷ nhà đẹp gara ô tô, ngõ thông, Phùng Hưng, Hà Đông, 61m2, dân xây Phố Phùng Hưng nổi tiếng một trong những nơi đáng sống bậc nhất Hà Đông, dân đông, phố rộng hè thoáng, môi trường trong lành, tiện ích ngút ngàn: Siêu thị, chợ, trường học các cấp, bệnh viện lớn,trục chính di chuyển thuận lợi:, Văn Quán, Vạn Phúc, Mỗ Lao,Nguyễn Khuyến, Ao Sen, Trần Phú, An Hòa, Nguyễn Văn Trỗi, Bà Triệu, Nhuệ Giang, Xa La, Yên Xá... Nhà được xây dựng trên mảnh đất đẹp, vượng khí tài lộc, gia chủ làm ăn rất phất, nhiều nhà nay bán bớt để mở rộng kinh doanh. Nhà có gara ô tô, ngõ thông tứ tung, các phòng đẹp thoáng sáng. Sổ đỏ chính chủ, sẵn sàng giao dịch. Giá: 6.32 tỷ ( có thương lượng). Liên hệ ngay với em Huyền Thổ cư KINH NGHIỆM GẦN 10 NĂM ( 0363703491- 0965472910) - Để sở hữu hàng nghìn ngôi nhà cùng khu vực, tiết kiệm THỜI GIAN - CÔNG SỨC - TIỀN BẠC.- Tư vấn miễn phí 24/24h( zalo, fb). Tư vấn Pháp lý, vay vốn.",27/12/2021,Tin thường,batdongsan_so_com_vn_1673834369.056479,,,,,
,bằng liệt hoàng mai ha noi, 32m2,"+Nhà tự xây dt 32m.mt4m,thiết kế hiện đại thông sàn rất đẹp,ở ngay,5tầng.3 ngủ thoáng sáng. +Ngõ rộng nông,gần phố,gần ô tô tránh,gần bãi gửi xe, chợ, trường MN,THCS. +Khu dân cư đông đúc,môi trường sống văn minh,thân thiện +Khu vực nhiều người tìm mua,kết nối KĐT Tây Nam Linh Đàm,HH Linh Đàm,chung cư Linh Đàm nhiều tiện ích VIP. +Giao thông thuận tiện khi di chuyển vào TTTP,gần vành đai 3,cao tốc Pháp Vân,bến xe.bệnh viện. + Sổ đỏ đẹp sẵn sàng sang tên. +Chào 2.75tỷ(có thương lượng). +LH Mr Phúc 097.8895.889(zalo)-0912.338.038 ",28/12/2021,Tin thường,batdongsan_so_com_vn_1673834371.430354,,,,,
"3,46 tỷ VNĐ","lê quang đạo ,phú đô ,nam từ liêm", 33m2,"Nhà view chọn đường đua F1, ngõ vào cực rộng ô tô đỗ cửa. Chỉ mấy bước chân là ra đến đường F1 Phú Đô thông các ngả Lê Quang Đạo, Nguyễn Văn Giáp.... Hưởng trọn không gian thoáng đãng và môi trường tuyệt vời của khu tổ hợp thể thao Mỹ Đình. Tiện ích lớn nhỏ xung quanh không thiếu một cái gì. Nhà 5 tầng chủ tự xây tỉ mỉ từng chi tiết với đầy đủ công năng sử dụng. Nội thất sang trọng được chủ nhà tặng lại nên chỉ việc xách vali về ở luôn. Chủ nhà làm trong lực lượng vũ trang muốn bán để chuyển gần đơn vị. Giá chào 3 tỷ 460 triệu (thương lượng trực tiếp với chủ nhà). Sổ nở hậu, sẵn sang tên ngay. Cam kết nhà thật, việc thật 100% (hỗ trợ pháp lý và các thủ tục liên quan đến ngân hàng). Anh chị quan tâm gọi cho em Sơn (thổ cư) ngay được tư vấn từ A->Z và xem thêm miễn phí hàng trăm căn ở Từ Liêm 0932382236",28/12/2021,Tin thường,batdongsan_so_com_vn_1673834373.4053254,,,,,
"3,95 tỷ VNĐ","mỹ đình ,nam từ liêm", 42m2,"Nhà nằm ở vị trí đắc địa cách đường Nguyễn Hoàng 2 chiều vỉa hè chỉ mấy chục mét, ngõ thông vào nhà bằng nhiều ngõ. Thông các ngả Mỹ Đình, Lê Đức Thọ, Phạm Hùng, Trần Bình.... Nằm trong khu vực phát triển nhất Nam Từ Liêm với vô vàn tiện ích lớn nhỏ. Nhà diện tích 42m2, lô góc nên phòng nào cũng có cửa sổ, không gian vô cùng thoáng sáng. Nhà được chủ tâm huyết xây dựng chắc chắn, thiết kế hài hoà và có sự đầu tư với nội thất gỗ, cầu thang gỗ. Nhà còn có sân để xe rộng rãi, sạch sẽ. Chủ nhà làm ăn có lộc chuyển về liền kề tiện kinh doanh. Giá chào 3 tỷ 950 triệu (khách gặp chủ thương lượng trực tiếp). Sổ đỏ cất két sẵn sang tên. Cam kết nhà thật, việc thật 100% (hỗ trợ pháp lý và các vấn đề liên quan đến ngân hàng). Gọi ngay em Sơn (thổ cư) để gặp trực tiếp chủ nhà và tiếp xúc thêm kho hàng bđs cực lớn hoàn toàn miễn phí 0932382236",28/12/2021,Tin thường,batdongsan_so_com_vn_1673834376.6178482,,,,,
"4,2 tỷ VNĐ",Phố Ngọc Đại, 63m2,"NGAY NGÃ TƯ VẠN PHÚC – TRUNG TÂM VẠN PHÚC & ĐẠI MỖ – PHÂN LÔ – Ô TÔ QUA NHÀ - VỊ TRÍ ĐẸP NHẤT – HÀNG XÓM HIMLAM VẠN PHÚC. + Liên hệ: Mr.Hiển 0902.08.31.39 + Chính chủ cần bán lô đất tại ngõ 63 phố Ngọc Đại, Phường Đại Mỗ, Quận Nam Từ Liêm, Hà Nội.  - Diện tích 63m²  -  Mặt tiền rộng 3.6m  - Đường rộng ô tô qua nhà.  + Giá chào 4 tỷ 2 (Có thương lượng)  + Vị trí: Tuyệt đẹp, đất phân lô vuông đét, ngõ thông, ô tô qua, 10m ô tô tránh ngay Ngã Tư Vạn Phúc – Tố Hữu, sát Tiểu Khu Đô Thị Vạn Phúc, shophouse Himlam Vạn Phúc, Khu nhà ở Cảnh sát hình sự, Phố Vạn Phúc, Tố Hữu, dân cư đông đúc, tiện ích dịch vụ ngập tràn, vài bước ra phố, giao thông cực thuận lợi.  + Diện tích rộng, thửa đất sổ đỏ vuông đẹp, xây nhà ở quá đẹp hoặc xây CCMN 7 tầng thang máy khoảng 20 Phòng thì doanh thu quá đỉnh.  + Pháp lý : Sổ đỏ chính chủ sãn sàng giao dịch.",28/12/2021,Tin thường,batdongsan_so_com_vn_1673834378.317881,,, 3,,
