price,address,Diện tích,Số phòng ngủ,Details,Ngày đăng,Loại tin,id,Số tầng,Hướng,Mặt tiền,Lộ giới,Số toilet
"2,78 tỷ VNĐ",Phan Đình Giót- Hà Đông, 41m2, 4,"Cần bán nhà trước tết, Phan Đình Giót, Hà Đông, 41m, 4 ngủ, nhỉnh 2 tỷ, ô tô gần, ngõ thoáng + Quận Hà Đông đang phát triển rất nhanh về cơ sở hạ tầng, quỹ đất ở hạn hẹp dần, sở hữu một căn nhà trung tâm Quận Hà Đông là bắt kịp xu thế đầu tư lợi nhuận, ở đẳng cấp và tiện ích, quận trung tâm, di chuyển đi đâu cũng vô cùng thuận lợi. + Nhà phố Phan Đình Giót 41m2 vuông vắn, ô tô đỗ gần, với 4 tầng  xây hiện đại ngập tràn ánh sáng tự nhiên là sự lựa chọn số 1 cho anh chị đang tìm nhà hơn 2 tỷ để đầu tư hoặc an cư lập nghiệp. Căn nhà tại vị trí vô cùng đắc địa, thuận lợi di chuyển các quận như Hà Đông. + Tôi và anh chị có thể tham khảo so sánh thêm một số căn nhà rất đẹp đang chào bán khoảng dưới 3 tỷ: - Nhà Mậu Lương 32m, 4 tầng mới đẹp. - Nhà Ngô Quyền  30m ngay mặt phố. - Đất Đa Sỹ 35m sổ đỏ vuông vức, gần trường chợ. -Nhà Vạn Phúc 30m xung quanh đầy đủ tiện ích -  Sổ đỏ vuông, pháp lý sạch. - Giá: 2.78 tỷ ( có thương lượng). -  Liên hệ ngay với em Huyền địa ốc KINH NGHIỆM TRÊN 8 NĂM ( 0363703491- 0965472910) - Để sở hữu hàng nghìn ngôi nhà cùng khu vực, tiết kiệm THỜI GIAN - CÔNG SỨC - TIỀN BẠC.         -  Tư vấn miễn phí 24/24h( zalo, fb). Tư vấn Pháp lý, vay vốn.",23/12/2021,Tin thường,batdongsan_so_com_vn_1673834853.7651107,,,,,
"2,76 tỷ VNĐ",Ngô Quyền- Hà Đông, 41m2,,"HOT! Ngô Quyền, Hà Đông, ngõ thông, ô tô gần, 41mx4 tầng nhỉnh 2 tỷ - Vị trí: Phố Ngô Quyền quận Hà Đông nơi giao thoa nhiều tuyến phố quan trọng: Vạn Phúc, Ngô Thì Nhậm, Phan Đình Giót, Nguyễn Viết Xuân, khu đô thị Văn Khê, nằm trên trục chính di chuyển thuận lợi. - Tiện ích: gần nhà có đầy đủ tiện ích xã hội như: chợ, siêu thị,  bãi xe, chợ dân sinh, ngân hàng, trường học các cấp, bệnh viện.... Nhà nằm lô góc, ánh sáng ngập tràn. - Nhà được thiết kế hiện đại chuẩn công năng sử dụng gần phố các phòng thoáng mát, khu hiếm nhà bán, an ninh tuyệt đối. - Giá chỉ có 2.76 tỷ ( có thương lượng) cho một căn nhà 4 tầng siêu đẹp diện tích 41m trung tâm quận Hà Đông. - Sổ đỏ vuông, pháp lý sạch. - Liên hệ ngay với em Huyền địa ốc KINH NGHIỆM TRÊN 10 NĂM ( 0363703491- 0965472910) - Để sở hữu hàng nghìn ngôi nhà cùng khu vực, tiết kiệm THỜI GIAN - CÔNG SỨC - TIỀN BẠC.         - Tư vấn miễn phí 24/24h( zalo, fb). Tư vấn Pháp lý, vay vốn. ",22/12/2021,Tin thường,batdongsan_so_com_vn_1673834855.985739, 4,,,,
"6,5 tỷ VNĐ",Quang Trung- Hà Đông, 58m2,,"Nhỉnh 6 tỷ, gara ô tô, ngõ thông, nở hậu, 58m2x4 tầng, nhỉnh 6 tỷ, Quang Trung, Hà Đông Tôi cần bán nhà đẹp mới, ở ngay, nhà tự xây chắc chắn đầy đủ công năng sử dụng, phòng nào cũng có cửa sổ đón nắng gió với 4 tầng rộng đẹp nhất khu vực. Ngõ rộng thông, ô tô vào nhà, vừa ở- kinh doanh hoặc cho thuê quá Đỉnh, khu vực không có căn thứ 2. Giao thông di chuyển các phố: Cầu Đơ, Văn Phú, Vạn Phúc, Nguyễn Trãi, Hoàng Hoa Thám, Nguyễn Viết Xuân, Vạn Phúc, Văn Quán, Mỗ Lao, gần ga tàu điện Cát Linh trên cao, bến xe bus rất gần, vài bước ra phố Quang Trung ô tô tránh. Xung quanh đầy đủ tiện ích: Trường học, chợ, siêu thị, bệnh viện, ngân hàng, trung tâm mua sắm sầm uất bậc nhất Hà Đông, khong thiếu thứ gì, không ở đây quá phí. Giá: 6.5 tỷ ( có thương lượng). Sổ đỏ vuông, pháp lý sạch. Liên hệ ngay với em Huyền địa ốc KINH NGHIỆM TRÊN 8 NĂM ( 0363703491- 0965472910) - Để sở hữu hàng nghìn ngôi nhà cùng khu vực, tiết kiệm THỜI GIAN - CÔNG SỨC - TIỀN BẠC.- Tư vấn miễn phí 24/24h( zalo, fb). Tư vấn Pháp lý, vay vốn.",22/12/2021,Tin thường,batdongsan_so_com_vn_1673834857.8306348, 4,,,,
"6,4 tỷ VNĐ",Mỗ Lao- Hà Đông, 63m2,,"Bán nhà đẹp trung tâm Quận Hà Đông, ô tô, ngõ thông, nội thất Vip, 63m2, nhỉnh 6 tỷ, nở hậu Người thân gửi bán nhà đẹp nằm vị trí đắc địa trung tâm nơi đáng sống bậc nhất Quận Hà Đông phường Mỗ Lao, Hà Đông, ngõ thông muôn nơi, gần hồ, gần chợ, nhiều tiện ích xung quanh. Giao thông thuận lợi thông: Văn Quán, Quang Trung, Yết Kiêu, Chiến Thắng, An Hòa, Ao Sen, Vạn Phúc, ...xung quanh các trường đại học lớn, siêu thị Coop mark, Big C , ngân hàng, trường học các cấp tư nhân đến quốc tế. Nhà thiết kế khung cột chắc chắn, khu hiếm nhà bán ra căn nào hết căn đó, các phòng mở cửa sổ thoáng sáng, vài bước ra phố ô tô tránh. Giá: 6.4 tỷ ( có thương lượng). Sổ đỏ vuông, pháp lý sạch. Liên hệ ngay với em Huyền địa ốc KINH NGHIỆM TRÊN 8 NĂM ( 0363703491- 0965472910) - Để sở hữu hàng nghìn ngôi nhà cùng khu vực, tiết kiệm THỜI GIAN - CÔNG SỨC - TIỀN BẠC.- Tư vấn miễn phí 24/24h( zalo, fb). Tư vấn Pháp lý, vay vốn.",22/12/2021,Tin thường,batdongsan_so_com_vn_1673834859.8425574,,,,,
"6,3 tỷ VNĐ",Văn Quán- Hà Đông, 62m2,,"Chính chủ bán nhà đẹp Văn Quán, Hà Đông, nở hậu, gara ô tô, 62m2, nhỉnh 6 tỷ Văn Quán, Hà Đông khu vực đáng sống bậc nhất, nổi tiếng môi trường trong lành, dân trí cao quan chức về đây tụ họp rất nhiều như quần long tụ tụ, gần hồ Văn Quán lộng gió, xung quanh đầy đủ tiện ích không thiếu thứ gì. Nhà bán rất đẹp mới toanh chủ tự thuê thiết kế, phong cách Châu Âu hiện đại, nội thất xịn đẳng cấp, khu vực rất hiếm nhà bán, không có căn thứ 2, các phòng thoáng sáng đầy đủ công năng, vài bước chân ra phố ô tô tránh. Giao thông thuận lợi di chuyển các phố: Phùng Hưng, Yên Phúc, Yên Xá, Thanh Bình, Trần Phú, Nguyễn Khuyến, Chiến Thắng, Quang Trung, Nguyễn Trãi,....gần gas Cát Linh, bến xe bus, bệnh viện lớn,... Giá: 6.3 tỷ ( có thương lượng). Sổ đỏ vuông, pháp lý sạch. Liên hệ: Em Huyền ( Cháu gái chủ nhà) 0965472910- 0363703491- Miễn trung gian. ",22/12/2021,Tin thường,batdongsan_so_com_vn_1673834861.8033903,,,,,
"6,4 tỷ VNĐ",Mỗ Lao- Hà Đông, 63m2,,"Bán nhà đẹp trung tâm Quận Hà Đông, ô tô, ngõ thông, nội thất Vip, 63m2, nhỉnh 6 tỷ, nở hậu Người thân gửi bán nhà đẹp nằm vị trí đắc địa trung tâm nơi đáng sống bậc nhất Quận Hà Đông phường Mỗ Lao, Hà Đông, ngõ thông muôn nơi, gần hồ, gần chợ, nhiều tiện ích xung quanh. Giao thông thuận lợi thông: Văn Quán, Quang Trung, Yết Kiêu, Chiến Thắng, An Hòa, Ao Sen, Vạn Phúc, ...xung quanh các trường đại học lớn, siêu thị Coop mark, Big C , ngân hàng, trường học các cấp tư nhân đến quốc tế. Nhà thiết kế khung cột chắc chắn, khu hiếm nhà bán ra căn nào hết căn đó, các phòng mở cửa sổ thoáng sáng, vài bước ra phố ô tô tránh. Giá: 6.4 tỷ ( có thương lượng). Sổ đỏ vuông, pháp lý sạch. Liên hệ ngay với em Huyền địa ốc KINH NGHIỆM TRÊN 8 NĂM ( 0363703491- 0965472910) - Để sở hữu hàng nghìn ngôi nhà cùng khu vực, tiết kiệm THỜI GIAN - CÔNG SỨC - TIỀN BẠC.- Tư vấn miễn phí 24/24h( zalo, fb). Tư vấn Pháp lý, vay vốn.",22/12/2021,Tin thường,batdongsan_so_com_vn_1673834863.918562,,,,,
"6,3 tỷ VNĐ",Văn Quán- Hà Đông, 62m2,,"Chính chủ bán nhà đẹp Văn Quán, Hà Đông, nở hậu, gara ô tô, 62m2, nhỉnh 6 tỷ Văn Quán, Hà Đông khu vực đáng sống bậc nhất, nổi tiếng môi trường trong lành, dân trí cao quan chức về đây tụ họp rất nhiều như quần long tụ tụ, gần hồ Văn Quán lộng gió, xung quanh đầy đủ tiện ích không thiếu thứ gì. Nhà bán rất đẹp mới toanh chủ tự thuê thiết kế, phong cách Châu Âu hiện đại, nội thất xịn đẳng cấp, khu vực rất hiếm nhà bán, không có căn thứ 2, các phòng thoáng sáng đầy đủ công năng, vài bước chân ra phố ô tô tránh. Giao thông thuận lợi di chuyển các phố: Phùng Hưng, Yên Phúc, Yên Xá, Thanh Bình, Trần Phú, Nguyễn Khuyến, Chiến Thắng, Quang Trung, Nguyễn Trãi,....gần gas Cát Linh, bến xe bus, bệnh viện lớn,... Giá: 6.3 tỷ ( có thương lượng). Sổ đỏ vuông, pháp lý sạch. Liên hệ: Em Huyền ( Cháu gái chủ nhà) 0965472910- 0363703491- Miễn trung gian.",22/12/2021,Tin thường,batdongsan_so_com_vn_1673834865.8623629,,,,,
"6,5 tỷ VNĐ",Quang Trung- Hà Đông, 58m2,,"Nhỉnh 6 tỷ, gara ô tô, ngõ thông, nở hậu, 58m2x4 tầng, nhỉnh 6 tỷ, Quang Trung, Hà Đông Tôi cần bán nhà đẹp mới, ở ngay, nhà tự xây chắc chắn đầy đủ công năng sử dụng, phòng nào cũng có cửa sổ đón nắng gió với 4 tầng rộng đẹp nhất khu vực. Ngõ rộng thông, ô tô vào nhà, vừa ở- kinh doanh hoặc cho thuê quá Đỉnh, khu vực không có căn thứ 2. Giao thông di chuyển các phố: Cầu Đơ, Văn Phú, Vạn Phúc, Nguyễn Trãi, Hoàng Hoa Thám, Nguyễn Viết Xuân, Vạn Phúc, Văn Quán, Mỗ Lao, gần ga tàu điện Cát Linh trên cao, bến xe bus rất gần, vài bước ra phố Quang Trung ô tô tránh. Xung quanh đầy đủ tiện ích: Trường học, chợ, siêu thị, bệnh viện, ngân hàng, trung tâm mua sắm sầm uất bậc nhất Hà Đông, khong thiếu thứ gì, không ở đây quá phí. Giá: 6.5 tỷ ( có thương lượng). Sổ đỏ vuông, pháp lý sạch. Liên hệ ngay với em Huyền địa ốc KINH NGHIỆM TRÊN 8 NĂM ( 0363703491- 0965472910) - Để sở hữu hàng nghìn ngôi nhà cùng khu vực, tiết kiệm THỜI GIAN - CÔNG SỨC - TIỀN BẠC.- Tư vấn miễn phí 24/24h( zalo, fb). Tư vấn Pháp lý, vay vốn.",22/12/2021,Tin thường,batdongsan_so_com_vn_1673834867.9971929, 4,,,,
"2,75 tỷ VNĐ",Hà Trì - Hà Cầu - Hà Đông, 39m2,,"- Do không có nhu cầu ở nên tôi cần bán gấp mảnh đất tại Hà Trì 1 – Hà Cầu – Hà Đông - Dt : 39m2                                       - Hướng : Tây tứ mệnh - Mặt tiền : 4,5m - - Vị trí nhà cách trường cấp 3 Lê Lợi 50m, cách chợ Hà Đông 300m, BV 103 cách 1km, siêu thị BigC, trung tâm mua sắm Aeon, rất nhiều tiện ích xung quanh ngôi nhà.Kv dân cư đông đúc dân trí cao,an ninh rất tốt. - Nhà cấp 4 hiện gia đình vẫn đang sử dụng rất tốt. - Pháp lý : SĐCC - Giá : 2,75 tỷ ( có gia lộc , bao phí sang tên ) - Liên hệ : 0989677971 ( Mạnh 32t )",23/12/2021,Tin thường,batdongsan_so_com_vn_1673834870.099172,, Tây,,,
"28,9 tỷ VNĐ",KĐT Nam Trung Yên, 75m2,,"Chủ ra nước ngoài định cư, nhờ bán căn biệt thự liền kề lô góc (KĐT Nam Trung Yên)Nhà thiết kế dạng biệt thự đẳng cấp, mặt tiền lớn vỉa hè rộng. Oto đỗ cửa ngày đêm.Diện tích: 75m2 x 4 tầng, mặt tiền 6mGiá: 28.9 tỷ (CÒN THƯƠNG LƯỢNG, LÀM VIỆC TRỰC TIẾP CHỦ)BIỆT THỰ LIỀN KỀ, KĐT TRUNG TÂM CẦU GIẤY - THANG MÁY - OTO ĐỖ CỬALiên hệ xem nhà và nhận thông tin chi tiết: 0981367887Thửa đất vuông đẹp, sổ pháp lý chuẩn 1 chủ, cất két chờ giao dịch",23/12/2021,Tin thường,batdongsan_so_com_vn_1673834872.3947256, 4,, 6, 11,
,thịnh liêt. hoàng mai ha noi, 73m2,,"+Khu p/lô liền kề.ô tô vào nhà chạy vòng quanh.an sinh đỉnh.kinh doanh văn phòng rất tốt.Khu vực hiếm nhà bán. +Nhà xây4tầng,mt5m chắc chắn,đẹp.chủ mới ở được 2 năm nay chuyển vào Đà Nẵng nên bán. +Vị trí nhiều tiện ich. Môi trường sống văn minh, dân trí cao +Cạnh chung cư Hồng Hà TOWER.gần Đại siêu thị AEON Hoàng Mai. +Giao thông rất thuận tiên di chuyển vào TTTP nhiều ngả đường,kết nối Giai Phóng,Giáp Nhị. Trương Định, bến xe Giap Bát,Nước Ngầm,vành đai 3,cao tốc Pháp Vân. +Pháp lý chuẩn,đẹp sẵn sàng giao dịch. + Gía 7.9 tỷ có thương lượng +LH Mr Phúc 0912.338.038-0978.895.889zalo .miễn (MG) ",17/12/2021,Tin thường,batdongsan_so_com_vn_1673834874.1028075,,,,,
,tương mai giáp bát ha noi, 48m2,,"+Nhà xây dt48m.mt4m.5 tầng mới koong,thiết kế hiện đại chắn chắn đẹp,5 ngủ , 2 thoáng.có sân rộng để được ô tô và xe máy rất an toàn.khách xem là thích +Nội,ngoại thất tuyển chọn toàn hàng thương hiệu. +Ngõ đẹp thẳng tắp ô tô vào nhà, ba bước ra mặt phố,ô tô thông tứ tung. +Vị trí đẹp ,với bạt ngàn tiện ích.Cùng với giao thông thuận tiện : đi ngã tư Vọng,vành đai 2,5,bệnh viện,các trường Đại hoc,bến xe ,vành đai 3,cao tốc Pháp Vân +Pháp lý chuẩn giao dịch ngay. +5.68tỷ (có thương lượng) +LH Mr Phúc 0912.338.038-0978.895.889(zalo)",13/12/2021,Tin thường,batdongsan_so_com_vn_1673834880.0288064,,,,,
,kim giang ha noi, 50m2,,"+NHÀ 2 thoáng trước sau,xây4 tầng,4 ngủ,nhà rất có lộc.Chủ làm ăn phát đạt mua biệt thự. +Ngõ ô tô qua cửa,thông,mấy mét ra phố,ở sướng, kinh doanh tốt. +Khu dân cư đông đúc,hàng xóm văn minh,gần chợ,trường,bệnh viện. +Gần KĐT Linh Đàm,Kim Văn Kim Lũ. +Giao thông thuận tiện kết nối Ngã Tư Sở,vành đai 3. +Sổ chuẩn vuông đẹp. +Gía 3.99 tỷ (có thương lượng). +LH Mr Phúc.0912.338.038-0978.895.889(miễn MG). ",06/12/2021,Tin thường,batdongsan_so_com_vn_1673834882.0747564,,,,,
,nguyễn xiển ha đình ha noi, 50m2,,"+Khu nhà p/lô liền kề.dành cho cán bộ công chức. ô tô tránh,dừng đỗ +Nhà xây,5tầng,6 ngủ đẹp.vừa ở vừa kinh doanh tốt. +Nhà ở rất có lộc,chủ mở rộng kinh doanh nên bán. +Hàngg xóm quan chức,môi trường sống văn minh dân trí cao. +Đường trước nhà thông kết nối chung cư 214 Ngyễn Xiển,trường THCS,THPT Thanh Xuân Nam và nhiều tiện ích VIP. +Vị trí cực kỳ thuận tiện về giao thông : sát vành đai 3,ngã tư Nguyễn Trãi Khuất Duy Tiến.di chuyển các ngả vào TT thành phố. +Sổ đỏ đẹp chuẩn pháp lý. +Gía 8.8 tỷ ( có thương lượng) +LH Mr Phúc. 0912.338.038- 0978.895.889.(miễn MG)",10/12/2021,Tin thường,batdongsan_so_com_vn_1673834884.1070023,,,,,
"2,55 tỷ VNĐ","xuân phương ,nam từ liêm", 33m2,,"Nhà 5 tầng được thiết kế theo phong cách hiện đại còn mới. Bố trí công năng hợp lý tạo sự thoải mái cho mọi sinh hoạt sống của gia đình. Là khu vực đang được rất nhiều người tìm mua với hạ tầng hoàn thiện, môi trường sống lý tưởng. Nhà cách mặt phố Xuân Phương chỉ hơn 30m, ngõ vào rộng rãi. Nằm gần điểm giao cắt của Xuân Phương, Phương Canh, Trịnh Văn Bô nên có thể nhanh chóng đi Nhổn, Mỹ Đình, Cầu Diễn, Tây Mỗ. Xung quanh tiện ích phong khi cạnh nhiều KĐT lớn, trường học mầm non đến Đại học, trụ sở chính quyền, chợ dân sinh. Giá chào chỉ 2 tỷ 550 triệu (khách và chủ thương lượng trực tiếp). Sổ vuông cất két sẵn sang tên. Cam kết nhà thật, việc thật 100% (hỗ trợ pháp lý và các vấn đề liên quan đến ngân hàng). Anh chị gọi em Sơn (thổ cư) ngay để được tư vấn nhiệt tình và xem thêm miễn phí hàng nghìn căn ở Từ Liêm: 0932382236",23/12/2021,Tin thường,batdongsan_so_com_vn_1673834885.8361108,,,,,
"3,4 tỷ VNĐ","Khương Hạ, Khương Đình", 35m2, 3,"NHÀ ĐẸP - NGÕ TO HƠN PHỐ - TRƯỚC NHÀ NGÕ BA GÁC - SỔ ĐẸP NỞ HẬU Mô tả : Vị trí nhà phân lô xe ba gác tránh, ô tô đỗ cách nhà 30m; tuy nhiều chấm nhưng chỉ 2 ngoặt; Ngõ 29 to đẹp hơn phố chính, thông các ngả ra Bùi xương Trạch, Khương Trung, Vũ Tông Phan, Khương Đình, Kim Giang; đi ngã tư Sở, tới Khuất Duy Tiến hay ra cầu Dậu để lên đường vành đai 3 cũng rất gần... Gần chợ Khương Đình, gần ao xóm Hồng, hồ điều hòa Đầm Hồng và hồ Khương Trung, gần trường học các cấp, cách trạm y tế phường hay Bệnh viện Bưu điện không xa. Gần cơ quan công quyền nên an ninh cực kì đảm bảo, dân trí cao. Nhà mới xây hơn 3 năm, diện tích 35m2, mặt tiền 3,6m; thiết kế 5 tầng. Tầng 1: khách, bếp Tầng 2-3-4: mỗi tầng 1 PN khép kín Tầng 5: khu giặt đồ, phòng thờ, sân phơi Sổ đỏ chính chủ nở hậu Giá 3,4 tỷ VNĐ Liên hệ: Mr. Ngọc – 0344.978.570 (miễn phí xem nhà, miễn môi giới, trung gian). Hỗ trợ cho vay trả góp chỉ từ 7 triệu/tháng, thủ tục đơn giản, giải ngân nhanh.",23/12/2021,Tin thường,batdongsan_so_com_vn_1673834887.6834924, 5,,,, 4
"3,4 triệu VNĐ/m2",Xóm CHÓNG- YÊN BÀI- BA VÌ- HN, 2.187m2,,"ĐẤT NGHỈ DƯỠNG - XÓM CHÓNG- YÊN BÀI - BA VÌ- HN Xung quanh toàn biệt thự và homestay View núi Ba Vì DT: 2.187m2 Giá chỉ: 3,Xtr/m2 LH chính chủ: 0968285568",23/12/2021,Tin thường,batdongsan_so_com_vn_1673834889.5940983,,,,,
8 tỷ VNĐ,Minh Khai Hai Bà Trưng Hà Nội, 50m2, 4,"+ Bán nhà Phố Dương Văn Bé vị tri siêu đẹp, nhà cực chắc chắn, lên tầng thoải mái. + Chỉ 8 tỷ nhà lô góc cực kỳ thoáng mát, kinh doanh đa dạng, khu vực tương lai không ngừng phát triển. + Kinh doanh đa dạng các mặt hàng, spa, nail, thẩm mỹ, hiệu thuốc, tạp hóa, văn phòng….. + Thiết kế hợp lý cho việc vừa ở vừa kinh doanh. + Nhà 4 tầng, từ tầng 2 mỗi tầng 2 phòng ngủ, nhà vẫn lên tầng được. + Sổ đỏ đẹp, sẵn sàng giao dịch. + giá 8 tỷ ( còn thương lượng ) Lh Minh Quang: 0327085656 ( để xem nhà sớm nhất )",05/06/2021,Tin thường,batdongsan_so_com_vn_1673834891.6310067, 4,, 4,,
"2,7 tỷ VNĐ",Phố Đại Đồng Hoàng Mai Hà Nội, 31m2, 3,"+ Bán nhà Phố Đại Đồng, Hoàng Mai, Nhà mình vị trí rất đẹp, rất gần ô tô, trước nhà xe 3 gác, nhà mới xây được vài năm nên khách về không cần sửa sang gì, ở ngay. + Diện tích 31m2, thiết kế chuẩn công năng 5 tầng. + 3 ngủ, 4 vệ sinh. + Mặt tiền 5m. + Nhà mình ở vị trí rất đẹp và thoáng, trước nhà 3 gác, 100m ra tới mặt phố, ngõ thông nhiều hướng, gần chợ, TTTM, công viên bến xe, trường học các cấp…. + Khu vực phát triển, cơ sở hạ tầng không ngừng tăng. + Sổ đỏ vuông đẹp, sẵn sàng giao dịch. + giá 2.7 tỷ ( có ra lộc ) Liên hệ Minh Quang: 0327085656 ( chuyên nhà đất thổ cư khu vực Hà Nội – xem nhà trực tiếp hỗ trợ hoàn toàn miễn phí )",11/06/2021,Tin thường,batdongsan_so_com_vn_1673834893.4011595, 5,, 5,,
"9,6 tỷ VNĐ",Đê Trần Khát Chân Hai Bà Trưng Hà Nội, 45m2,,"+ Nhà mặt phố kinh doanh, kinh doanh sầm uất, tìm không có căn thứ 2. + Nhà mới đẹp, khu vực kinh doanh thu lợi nhuận cực lớn. + Diện tích 45m2, xây dựng 5 tầng khung cột bê tông chắc chắn. + Thiết kế thông sàn, thang máy, nội thất cực xịn. + giá 9.6 tỷ Liên hệ Minh Quang: 0327085656 ( chuyên nhà đất thổ cư khu vực Hà Nội – xem nhà trực tiếp hỗ trợ hoàn toàn miễn phí )",12/06/2021,Tin thường,batdongsan_so_com_vn_1673834895.7285807, 5,,,,
