price,address,Diện tích,Mặt tiền,Lộ giới,Số tầng,Số phòng ngủ,Số toilet,Details,Ngày đăng,Loại tin,id,Hướng
"3,1 tỷ VNĐ","Đường Trần Văn Lai, Mỹ Đình 1, Nam Từ Liêm", 85m2, 9, 50, 30, 2, 2,"
    

Bán căn hộ tại tòa CT9, khu đô thị Mỹ Đình - Sông Đà, diện tích sử dụng 85m2, gồm 2 phòng ngủ, 2 WC, chủ nhà đã làm full nội thất 500 triệu, đẹp long lanh, khách mua chỉ việc xách valy về ở.
Giá bán 3,1 tỷ, có thương lượng cho khách mua thiện chí.Liên hệ 0913966981 để xem nhà trực tiếp.
",09/11/2022,Tin thường,batdongsan_so_com_vn_1673788951.8519936,
4 tỷ VNĐ,"Đường Phạm Văn Đồng, Đông Ngạc, Bắc Từ Liêm", 83m2, 8, 50, 30, 2, 2,"
    Bán căn hộ efzese dự án Sunshine City Ciputra, Tây Hồ. Căn hộ tại tòa S6, tầng trung, căn góc, các phòng đều được ốp kính từ sàn lên trần view quảng trường nội khu, diện tích sử dụng 80,3m2, gồm 2 phòng ngủ, 2 WC, điều hòa âm trần toàn bộ căn hộ.
Giá bán 4,0 tỷ, có thương lượng cho khách mua thiện chí.
Liên hệ 0913966981 để xem nhà trực tiếp.
",09/11/2022,Tin thường,batdongsan_so_com_vn_1673788953.1066356,
5 tỷ VNĐ,"Đường Phạm Văn Đồng, Đông Ngạc, Bắc Từ Liêm", 98m2, 10, 50, 30, 3, 2,"Bán căn hộ dự án Sunshine City Ciputra, Tây Hồ. Căn hộ tại tòa S5, tầng trung, các phòng đều được ốp kính từ sàn lên trần view quảng trường nội khu, diện tích sử dụng 105/98,1m2, gồm 3 phòng ngủ, 2 WC, nội thất đầy đủ chỉ việc xách valy về ở, đi
",09/11/2022,Tin thường,batdongsan_so_com_vn_1673788954.3413334,
"3,3 tỷ VNĐ","Cầu Diễn, Minh Khai, Bắc Từ Liêm", 71m2,,,,,,"+ Vị trí đẹp, xung quanh tiện ích đầy đủ, dân cư đông đúc, gần các trường đại học Công Nghiệp, Đại Học Thành Đô, cao đẳng FPT,...  + Giao thông: Quốc lộ 32, Ngọa Long, Tu Hoàng, Đình Quán, Văn Trì, Phú Minh, Văn Tiến Dũng,...  + Hiện trạng: Nhà 2 tầng, 2 ngủ, trước nhà có sân rộng.  + Sổ đỏ cất két, chủ nhà thiện chí.  + Liên hệ em Trường: 0373680538 để được xem nhà tư vấn miễn phí, miễn tiếp môi giới. ",09/11/2022,Tin thường,batdongsan_so_com_vn_1673788955.5491033,
"5,8 tỷ VNĐ","Đường Ngọc Thụy, phường Ngọc thụy , Quận Long Biên, Hà Nội", 42m2, 3,, 5, 4,,"Bán Nhà Ngọc Thụy, Long Biên 5T, 42m2, Giá 5,8 Tỷ (Lô Góc, Ô Tô Vào Nhà) + Tầng 1: Gara ô tô, 1 phòng, wc + Tầng 2: Phòng khách, bếp, wc + Tầng 3,4: Mỗi tầng 2 phòng, wc + Tầng 5: Phòng thờ và sân  Nhà có vị trí đẹp, ngõ vào nhà thuận tiện và rộng rãi, xung quanh gần chợ, trường học cấp 1,2, vườn hoa Ngọc Thụy KĐT Khai Sơn, trường quốc tế Việt Pháp, học viện Hậu Cần.. Sổ đẹp, pháp lý rõ ràng, sẵn sàng giao dịch. Lh : Mr Tùng 0965 722 358",09/11/2022,Tin thường,batdongsan_so_com_vn_1673788956.7169776,
"3,65 tỷ VNĐ","Đường Phương Liệt, Phương Liệt, Thanh Xuân", 40m2, 4, 3, 4, 5,,"+ Chính chủ cần bán nhà Phố Phương Liệt, Quận Thanh Xuân, diện tích 40 m2 x 4 tầng mặt tiền rộng, giá 3,65 tỷ. + Nhà mặt ngõ rất gần mặt phố, gần ô tô nhà chủ tự xây cực kỳ đẹp. Nội thất xịn xò đầy đủ công năng.  Tầng 1: Khách, bếp  Tầng 2: 1 Ngủ to, vệ sinh.  Tầng 3: 2 ngủ, 1 vệ sinh  Tầng 4: 1 ngủ, sân phơi Sổ đỏ chính chủ sẵn sàng giao dịch.  + LH,Hoàng Bắc,ĐT: 0377 610 275, chuyên nhà đất hà nội, dẫn khách xem nhà và Tư vấn miễn phí 24/7 ",09/11/2022,Tin thường,batdongsan_so_com_vn_1673788957.9446957,
4 tỷ VNĐ,"Đường Định Công Thượng, Định Công, Hoàng Mai", 30m2, 4, 2, 5, 3, 4,"Nhà ngõ Định Công Thượng, Định Công, Thanh Xuân. Chỉ 4 tỷ x 5 tầng New  Diện tích nhà : 30 m2 x 5 tầng. Tầng 1 nhà : Phòng khách, bếp và WC. Tầng 2, 3, 4 nhà : 1 phòng ngủ và WC khép kín. Tầng 5 nhà : Phòng thờ và sân phơi.  Giá; 3,95 tỷ. Sổ đỏ vuông vắn. sẵn sàng giao dịch. Mọi chi tiết xin liên hệ Trung - O357 x 71 x 8 bảy, bảy, bảy 8 Cảm ơn đã đọc tin.",09/11/2022,Tin thường,batdongsan_so_com_vn_1673788959.3569157, Nam
"37,9 tỷ VNĐ",Hoàng Cầu Đống Đa Hà Nội, 93m2, 9,,,,,"- Diện tích 93m2 X4 Tầng. Mt 9m Giá bán 37.9 tỷ ( có thương lượng )- Căn nhà thuộc trung tâm quận ĐỐNG ĐA thuận lợi kinh doanh ô tô dừng đỗ thoải mái. - Chủ nhà xác định bán đất tặng nhà 4 tầng! Tầng 1 : Gara, Khách.Tầng 2-3  : Mỗi tầng 2 phòng ngủ!Tầng 4 : Phòng thờ và sân phơi.Khu vực phát triển từng ngày.- Sổ đỏ chính chủ, pháp lý rõ ràng, sẵn sàng giao dịch.Liên hệ em Quân để được tư vấn0385 94 1802Miễn ( TG Quảng Cáo )",09/11/2022,Tin thường,batdongsan_so_com_vn_1673788960.6574354,
"5,5 tỷ VNĐ","Đường Nguyễn Khang, Quan Hoa, Cầu Giấy", 35m2, 4, 3, 6, 5,,"+ Chính chủ cần bán gấp vì đã dao dịch nhà mới lên giảm xuống 300triệu tiếp chỉ còn 5,5 tỷ 35m2 x 6 tầng. + Nhà trong ngõ, chỉ 3 bước chân ra  phố Nguyễn Khang kinh doanh sầm uất khu vực đang phát triển từng ngày. + Nhà Trước đây gia đình kinh doanh hàng ăn tại nhà. Nay do nhu cầu cần bán để chuyển đổi hướng kinh doanh. + Nhà xây được 10 năm. Chủ nhà tự xây vô cùng tâm huyết, kiên cố. Thiết kế tầng 1 phòng, có gác lửng. Tổng 3 phòng ngủ. + Sổ đỏ chính chủ vuông đẹp như tờ A4. + LH,Hoàng Bắc,ĐT: 0377 610 275, chuyên nhà đất hà nội, dẫn khách xem nhà và Tư vấn miễn phí 24/7  ",09/11/2022,Tin thường,batdongsan_so_com_vn_1673788961.989872,
"6,8 tỷ VNĐ","Đường Láng Thượng, Láng Thượng, Đống Đa", 40m2, 3, 3, 5, 2, 3,"
    Bán nhà tại Chùa Láng 40m2 5 tầng mặt tiền 3.9m 6.8 tỷ Đống Đa  HÀNG HIẾM  Ô TÔ ĐỖ CỬA Thiết kế : 5 tầng.- Tầng 1 : để xe, bếp, wc.- Tầng 2, 3, 4 : mỗi tầng 2 phòng, wc.- Tầng 5 : Phòng thờ, sân phơi.Vị trí tuyệt đẹp khu vực Trung Tâm, 1 rẽ ra phố, ô tô đỗ cửa. Nhà thiết kế hợp lý xây dựng tâm huyết. Gia chủ xây nhà để con  học đại học giờ không có nhu cầu ở nên bán đi. ",09/11/2022,Tin thường,batdongsan_so_com_vn_1673788963.4230382,
"5,5 tỷ VNĐ","Đường Láng Thượng, Láng Thượng, Đống Đa", 45m2, 4, 3, 5, 6,,"+ Chính chủ cần bán căn nhà Phố Đường Láng, Phường Láng Thượng, Quận Đống Đa, diện tích 45m2 x 5 tầng mặt tiền rộng giá 5,5 tỷ kinh doanh nhỏ. + Vị trí tuyệt đẹp, cách ô tô chỉ 30m, ngõ thông các ngả, xung quanh nhiều trường ĐH danh tiếng, khu vực Sinh viên nhiều nhất Hà Nội, nên đầu tư cho Sinh viên thuê tuyệt vời. + Thiết kế: Nhà chủ tự xây 5 tầng kiên cố và chắc chắn, kiểu cách cổ kính, chỉ cần thêm nước sơn là long lanh. Nhà lên thêm tầng và cải tạo thành nhiều phòng thoải mái. - Tầng 1: phòng khách, bếp và wc. - Tầng 2, 3 và 4 là 6 phòng ngủ, Wc ở giữa. - Tầng 5 là phòng thờ, sân phơi. + Truóc nhà có sân để xe thoải mái, khu dân trí cực kỳ thân thiện, sạch sẽ và yên tĩnh, an sinh không thiếu thứ gì, giá cả Sinh viên. + Sổ đỏ chính chủ vuông đẹp như tờ A4. + LH,Hoàng Bắc,ĐT: 0377 610 275, chuyên nhà đất hà nội, dẫn khách xem nhà và Tư vấn miễn phí 24/7",09/11/2022,Tin thường,batdongsan_so_com_vn_1673788964.6058726,
"14,4 tỷ VNĐ","Đường Phạm Văn Đồng, Mai Dịch, Cầu Giấy", 45m2, 4, 12, 4, 3, 3,"Bán nhà mặt phố Phạm Văn Đồng 45m2-giá hơn 14 tỷ-vỉa hè ô tô-lô góc-kinh doanh đa loại hình MẶT PHỐ LỚN - VỈA HÈ ĐÁ BÓNG - LÔ GÓC - KINH DOANH SIÊU ĐẮC ĐỊA - TẦM TIỀN NHÀ MẶT PHỐ LỚN HIẾM NHÀ    + Vị trí đẹp mê ly , Lô Góc 1 mặt Phố + 1 mặt Ngõ + vỉa hè 15m , Kinh Doanh siêu đắc địa mọi loại hình. + Cả tuyến phố duy nhất đoạn này đáng giá, vị trí đẹp miễn chê. Tuyến phố đã xong quy hoạch ổn định, gần ngã ba Trần Quốc Hoàn, ngã tư Xuân Thủy, Hồ Tùng Mậu. + Thiết kế hợp lý thông sàn. Ở kết hợp Kinh Doanh thuận tiện.Thiết kế: Thông sàn từ tầng 1-tầng 4, Lô Góc cửa trổ 2 mặt , phòng nào cửa sổ thoáng sáng.Liên hệ E.Luân:0386.39.2021(zalo)Xem nhà miễn phí",09/11/2022,Tin thường,batdongsan_so_com_vn_1673788965.7508113,
"12,5 tỷ VNĐ","Đường Hoàng Ngân, Nhân Chính, Thanh Xuân", 43m2, 4, 7, 7, 6, 6,"SIÊU PHẨM MẶT PHỐ 7 TẦNG THANG MÁY - KINH DOANH BẤT CHẤP - PHÂN KHÚC SIÊU HIẾM.Hoàng Ngân 43m2, xây 7 tầng, mặt tiền 4m, giá chào 12.5 tỷ  Mô tả:Vị trí:- Vô cùng đắc địa, gần Ngã Tư Sở, Lê Văn Lương, Giáp liền 3 quận Thanh Xuân, Đống Đa, Cầu Giấy- Kinh doanh đỉnh cao, phân khúc quá hiếm Thiết kế:+ Mặt phố Hoàng Ngân 7 tầng thang máy, thiết kế thông sàn, full nội thất, thích hợp kinh doanh spa, văn phòng,....+ Nhà chủ mới hoàn thiện, giá tốt nhất thị trường, phân khúc mặt phố siêu hiếm. + Sổ đỏ pháp lý sạch sẵn sàng giao dịch.",09/11/2022,Tin thường,batdongsan_so_com_vn_1673788966.9855087,
38 tỷ VNĐ,"Đường Nghi Tàm, Tứ Liên, Tây Hồ", 146m2, 9, 15, 4, 6, 4,"MẶT PHỐ TÂY HỒ - VIP - HIẾM - MỘT MẶT NGÕ MỘT MẶT PHỐ - KINH DOANH ÁC LIỆT  VỊ TRÍ TUYỆT ĐỈNH - GẦN HỔ TÂY - VIEW SÔNG HỒNG - MẶT TIỀN LỚN - VỪA THOÁNG VỪA ĐẸP - QUY HOẠCH ỔN ĐỊNH

Mô tả:

+ Mặt phố Nghi Tàm đã hạ đê, quy hoạch ổn định, đường siêu rộng, kinh doanh sầm uất, đỉnh nhất phố Nghi Tàm, đối diện Honda Tây Hồ.

+ Vị trí đẹp mặt tiền view Hồ Tây, mặt sau view Sông Hồng, cách phố cổ vài phút đi bộ, phố Nghi Tàm con phố hot hit của Tây Hồ.

+ Vị trí nhà mình một mặt phố một mặt ngõ, ngõ sau ô tô tránh để được vài chiếc luôn. 

+ Thiết kế lệch tầng:
- Tầng 1: phòng khách + bếp + WC
- Tầng2,3: 5 ngủ +WC. 

+ Sổ đỏ vuông đẹp, nở hậu, giao dich ngay. DỄ THANH KHOẢN
LIÊN HỆ NGAY 0774134888 ĐẺ ĐƯỢC TƯ VẤN MIỄN PHÍ
TRUNG TUẤN CHUYÊN MG NHÀ MẶT PHỐ, DÒNG TIỀN 0774134888",09/11/2022,Tin thường,batdongsan_so_com_vn_1673788968.1992629,
"4,68 tỷ VNĐ","Đường Nguyễn Trãi, Khương Đình, Thanh Xuân", 42m2, 3, 2, 5, 4, 3,"
    Bán nhà mới tinh cực đẹp tại Nguyễn Trãi , cách Royal City 5p di chuyển
- Xung quanh bán kính 2km tập trung nhiều trường ĐH , khối VP , TT thương mại Royal City , chợ dân sinh , bệnh viện Thu Cúc , Xây Dựng , BV ĐH Y.....
Vị trí cực đẹp khi nhà ngay ngõ thông kinh doanh được, tương lai chỉ vài bước chân ra đường 25m và ra mặt đường rộng 10m
- Thiết kế hợp lý dư công năng full nội thất:
Tầng 1: phòng khách lớn, WC, chỗ để xe
Tầng 2: bếp, WC, phòng khách nhỏ 
Tầng 3 và 4: mỗi tầng gồm 2 phòng ngủ, WC giữa
Tầng 5: 2 sân phơi rộng lợp mái tôn có thể cải tạo thêm 1 phòng ngủ nếu cần
- Sổ đỏ nở hậu đẹp.
Liên hệ trực tiếp e Tiến Vũ gặp chủ nhà sớm nhất
 
",09/11/2022,Tin thường,batdongsan_so_com_vn_1673788969.3192632,
"4,2 tỷ VNĐ","Đường Văn Phú, Phú La, Hà Đông", 38m2, 5, 11, 5, 4, 3,"Cần bán gấp nhà KDT Văn Phú, Hà Đông diện tích 38m2 giá chào 4.2 tỷ có thương lượng  NHÀ ĐẸP Ở NGAY, THOÁNG TRƯỚC SAU, DIỆN TÍCH RỘNG, GIÁ HỢP LÝ  + Diện tích 38m2 5 tầng giá 4.2 tỷ có thương lượng  + Mô tả : Vị trí đẹp, nhà nằm trong khu tiếp giáp KĐT văn phú hưởng trọn tiện ích của KĐT văn phú. Nhà mới, chủ thiết kế 5 tầng còn mới tinh,nay chuyển công tác mua nhà MỹĐình nên cần bán nhanh. + Thiết kế : Tầng 1: Để xe, phòng khách, bếp, wc. Tầng 2,3,4: Tổng 6 Phòng, 3wc. Tầng 5: sân phơi, có thể thiết kế thêm phòng thờ. + Nhà chủ thiết kế BTCT chắc chắn chuẩn công năng sử dụng, có khe thoáng đằng sau , nên rất thoáng mát và đầy đủ ánh sáng. + Sổđỏ nở hậu, cực lộc ...
",09/11/2022,Tin thường,batdongsan_so_com_vn_1673788970.560942,
"1,82 tỷ VNĐ","Đường Tô Hiệu, Hà Cầu, Hà Đông", 57m2, 5, 1,, 2, 1,"Gia đình chuyển sang căn hộ to nên cần bán lại căn hộ đang ở tại tòa A CT2 Xuân mai, Tô Hiệu, Hà Đông DT: 57 m2 - 2 Pn - 1 phòng khách , 1 bếp, 1 vs Cả hai phòng ngủ đều hướng sáng và đón gió thoáng LH 0943444415 xem nhà 24/7",09/11/2022,Tin thường,batdongsan_so_com_vn_1673788971.7318091,
"3,79 tỷ VNĐ","Đường Mỹ Đình, Mỹ Đình 2, Nam Từ Liêm", 31m2, 4, 2, 4, 4, 4,"
    
SIÊU PHẨM NHÀ ĐẸP MỸ ĐÌNH - GẦN PHỐ - Ô TÔ NHỎ QUA NHÀ - TIỆN ÍCH NGẬP TRÀN 
- Dt 31 m2 
- Nhà nằm tại vị trí đẹp gần phố, trung tâm tiện ích không thiếu thứ gì...
- Vị trí đắc địa tại Mỹ Đình, ngõ thông tứ tung, thuận tiện đi lại.
- Nhà nằm gần các Trường đại học lớn, Bệnh viện và các khu TTTM lớn...
-Cuối ngõ có chỗ để ô tô 

- Nhà thiết kế 4 tầng :
+ Tầng 1: Chỗ để xe, Bếp, WC .
+ Tầng 2:1 khách, 1 Phòng ngủ, WC.
+ Tầng 3: 2 ngủ , wc
+ Tầng 4 : phòng thờ, sân phơi

- Giá : 3,79 tỷ 
",09/11/2022,Tin thường,batdongsan_so_com_vn_1673788973.072224,
24 tỷ VNĐ,"Đường Vương Thừa Vũ, Khương Trung, Thanh Xuân", 125m2, 5, 1, 7, 26, 28,"
    Tòa nhà căn hộ dịch vụ 7 tầng thang máy, gần 30 phòng căn hộ khép kín, 125m2, mặt tiền 5.5m, 24 tỷ, nhà xây mới hiện đại sang trọng, cách mặt phố Vương Thừa Vũ 15m, trung tâm Quận Thanh Xuân, tiện ích xung quoanh ngập tràn, dòng tiền ổn định gần 2 tỷ/ năm. Sổ đỏ chính chủ, liên hệ Quang Huy 0925005999 ( không tiếp MG, trung gian).
",09/11/2022,Tin thường,batdongsan_so_com_vn_1673788974.4555237,
47 triệu VNĐ/m2,"Số 1 Đại Lộ Thăng Long, P. Trung Hòa, Q. Cầu Giấy, Hà nội", 108.2m2,,, 1, 3, 2,"Đây là căn có tầm view rất đẹp, view ra công viên hồ điều hòa Nhân Chính, xem pháo hoa vào các dịp lễ tết. Căn hộ có kèm 1 vị trí đỗ xe miễn phí ( Trị giá 500Tr theo giá thị trường). ",09/11/2022,Tin thường,batdongsan_so_com_vn_1673788980.0844815, Đông bắc
