price,address,Diện tích,Hướng,Mặt tiền,Lộ giới,Số tầng,Số phòng ngủ,Số toilet,Details,Ngày đăng,Loại tin,id
3 tỷ VNĐ,"Đường Gia quất, Thượng Thanh, Long Biên", 36m2, Đông bắc, 3, 2, 3, 3, 3,"Căn nhà tôi bán nằm ở phố Gia Quất trung tâm thượng thanh - long biên, khu vực ổn định, sổ đỏ chính chủ.  Cách khu chung cư thượng thanh đang xây dựng chỉ 30m  cách vài trăm mét đến trường học cấp 1.2 thượng thanh. ( gần chung cư Homeland )  15 phút sang trung tâm Hà Nội.  Nhà xây 3 tầng chắc chắn, về ở luôn.  ngõ thoáng rộng, khu đông dân cư.   Nhà còn mới chỉ việc xách vali về ở.   Diện tích 36m, mặt tiền 3.6m, giá 3.35 tỷ   THIẾT KẾ:  + Tầng 1: PK, Bếp và WC, Sân.  + Tầng 2: 2 phòng ngủ và WC  + Tầng 3: 1 Phòng ngủ và sân phơi  Sổ đỏ chính chủ, chờ sang tên chủ mới  Liên hệ: 0977811387 - 0936018488 (Mr Khanh)  Để được tư vấn pháp lý & xem chi tiết căn nhà.",01/11/2022,Tin thường,batdongsan_so_com_vn_1673791031.2880614
69 tỷ VNĐ,Phố Huế Hai Bà Trưng Hà Nội, 168m2,,,, 4, 4,,"+ Bất chấp mọi lĩnh vực kinh doanh đều rất tuyệt vời. + Vị trí nằm tại khu vực trung tâm cực kỳ đẹp, rất hiếm nhà bán, kinh doanh sầm uất. + Diện tích 168m2 xây 4 tầng. + Có vị trí đẹp như thế mà xây khách sạn, tòa nhà văn phòng... thì siêu chất. + Liên hệ: Nguyễn Minh Quang + Điện thoại: 0327085656",01/11/2022,Tin thường,batdongsan_so_com_vn_1673791032.9466262
45 tỷ VNĐ,"Đường Võ Chí Công, Phú Thượng, Tây Hồ", 150m2, Nam, 7, 12, 4, 3, 5,"Bán căn liền kề trong quần thể dự án Ciputra- Nam Thăng Long.Nhận nhà ngay- Vị trí đẹp nhất Ciputra, tiện ích đủ đầy: bệnh viện, trường học, Trung tâm thương mại Lotte lớn nhất Việt Nam, công viên nội khu rộng 23haChi tiết liền kề:+ Diện tích: 150m2, xây 4 tầng 1 hầm+ Kiến trúc Tân cổ điển+ Mặt tiền 7m+ Tổng diện tích sàn xây dựng: 400m2+ Mật độ xây dựng 65%+ Lùi sau: 2m, lùi trước 3m+ Giá bán: 45 tỷ- Chính sách ưu đãi:+ Thanh toán nhanh 95%: chiết khấu 7%+ Thanh toán nhanh 60%: chiết khấu 4%+ Nhận nhà sớm: chiết khấu 3% (không áp dụng với thanh toán nhanh 95% và 60%)+ Chiết khấu khách hàng mua nhiều: 1-1.5%+ Ngân hàng hỗ trợ vay vốn 70%, hỗ trợ lãi suất đến 24 tháng+ Miễn phí quản lý 1 năm- Đây là Khu đô thị đời đầu của Việt Nam, đến nay đã đi vào hoạt động 25 năm. Với tổng quy mô 401ha, được mệnh danh là Khu đô thị có mật độ xây dựng thấp nhất, tỷ lệ cây xanh, mặt nước lý tưởng chưa có tiền lệ từ trước đến nayNội khu không thiếu tiện ích gì. Đặc biệt gia đình có con trong độ tuổi đi học, trong khu rất nhiều trường học để gia đình có thể lựa chọn- Liên hệ: 0907023278 để tham qua dự án",01/11/2022,Tin thường,batdongsan_so_com_vn_1673791034.3071578
115 tỷ VNĐ,"Đường Trần Thủ Độ, Hoàng Liệt, Hoàng Mai", 10700m2,, 300,,,,,"Bán Đất Dự Án Trần Thủ Độ 10700m, Mặt Tiền 300m, Gía 115 tỷ Hoàng Mai  + Dự án đất 50 năm được UBND Thành Phố Hà Nội và Viện Quy Hoạch xây dựng Hà Nội cấp Xây dựng trường đào tạo nghề.- Lô đất thuộc dự án khu đô thị mới pháp Vân - Tứ hiệp - Hoàng Mai - Hà Nội. + Quyết định phê duyệt từ 2008, nay không có nhu cầu nên chuyển nhượng lại bao gồm mặt bằng và hiện trạng là tổng 10700m2, hồ sơ và một số giấy tờ pháp lý liên quan. + Nếu xây dựng đúng mục đích thì đơn vị chủ sở hữu hoàn tất một vài thủ tục là đi vào thì công còn nếu muốn chuyển đổi mục đích khác bên mua tự tìm hiểu chạy hồ sơ, bên bán hỗ trợ bằng mọi mặt tốt nhất. - + Đất nộp thuế đầy đủ.+ Gía bán thương lượng.+ Liên hệ để biết thông tin chi tiết alo Msr Phương. ",01/11/2022,Tin thường,batdongsan_so_com_vn_1673791035.45716
"14,85 tỷ VNĐ","Đường Cầu Diễn, Minh Khai, Bắc Từ Liêm", 150m2,, 7, 3, 7, 31, 31,"
    CẦN BÁN CCMN CẦU DIỄN, Nam Từ Liêm 150M 7 tầng THANG MÁY 14,x tỷ+ Vị trí rất đẹp:
- Lợi thế thuận tiện gần các trường Đại Học Đại học Công Nghiệp, Đại học Thành Đô, Đại học Tài Nguyễn Môi Trường, Đại Học Mỏ Địa Chất, Đại Học Thương Mại...
- Nhu cầu thuê rất cao, Đông Sinh viên, Công nhân viên..
+ Giao thông thuận tiện đường thông rộng.
+ Tiện ích: Nội thất đầy đủ, Xung quanh đầy đủ dịch vụ phát tiển mạnh, vài phút đi xe vào trung tâm.
+ Sổ đầy đủ cất tủ, pháp lý sạch sẽ, sẵn sàng sang tên nhanh gọn.+ Giá thương lượng, chủ thiện chí.
+ Thiện trí xem nhà liên hệ Mr Đức Nhà Đẹp 0898839292 - 0812212525
",01/11/2022,Tin thường,batdongsan_so_com_vn_1673791044.6296682
9 tỷ VNĐ,"Vạn Phúc, Hà Đông", 80m2,, 5,, 6, 10,,"+ Vị trí đắc địa, trung tâm Hà Đông, 40m ra mặt phố, 1 phút ra mặt đường Tố Hữu, Vạn Phúc, Quang Trung, 1km ra Aeon Hà Đông, Big C hà Đông, giao thông thuận tiện. + Đường trước nhà taxi đỗ cửa, trải nhựa rất đẹp. + Nhà mới hoàn thiện, doanh thu hiện đạt 800 triệu/năm. + Diện tích 80M2, 6 tầng, Tầng 1 gửi xe + 1 phòng, tầng 2345: mỗi tầng 4 phòng khép kín. + Thang máy nhập khẩu, full nội thất cao cấp, khách chỉ việc đến ở. + Giá chào 9 tỷ  ( Có thương lượng ). + Sổ đỏ sẵn sàng, pháp lý chuẩn, sang tên tích tắc. + Miễn phí 100% dịch vụ , Khách chủ tự đàm phán giá, Chúng tôi hỗ trợ tư vấn, pháp lý phong thuỷ, quy hoạch… --------------------------------------------------- Ngôi nhà mới của bạn là HẠNH PHÚC của tôi. Thuận ( Nhà Đẹp ) - Tư vấn BDS miễn phí, tận tâm. ĐT: 0986.581.285.",01/11/2022,Tin thường,batdongsan_so_com_vn_1673791045.7167227
12 tỷ VNĐ,"Đường Thiên Hiền, Mỹ Đình 1, Nam Từ Liêm", 64m2,,, 1, 6,,,"Bán nhà phố Thiên Hiền Diện tích: 64 m2 , 5,5 tầng  - Phố Thiên Hiền nơi đóng quân của những đơn vị cao cấp quân đội, an ninh tuyệt đối.  - Ô tô 7 chỗ vào nhà, sân rộng rào cao, nhà mới đẹp chắc chắn.  - Nhà thoáng trước và sau, lắp thêm thang máy, kinh doanh văn phòng.  Liên hệ em Linh: 0856219956",01/11/2022,Tin thường,batdongsan_so_com_vn_1673791055.6952045
7 tỷ VNĐ,"Đường Nguyễn Lam, Phúc Đồng, Long Biên", 70m2,, 5,,,,,"Chủ nhà cần bán gấp lô đất phố Nguyễn Lam cực đẹp, diện tích 70 m2, mặt tiền 5 m, giá chỉ 7 tỷ. + Vị trí đất rất đẹp, chỉ 20 m ra Mặt phố Nguyên Lam, ngỏ thông rộng thoáng ô tô 7 chổ vào nhà thoải mái, giao thông kết nối phố Chu Huy Mân, ngay gần Vinhomes. + Khu dân trí cao, an ninh chất lượng. Lô đất có tỷ lệ hài hoà, mặt tiền rộng, khách mua về xây toà nhà 7 tầng thang máy an sinh quá đỉnh. + Sổ đỏ pháp lý rõ ràng, sẵn sàng giao dịch. Chủ nhà cần bán gấp nên rất thiện chí, giá chỉ 7 tỷ. Khách mua nhà thiện chí có thể thương lượng và gia lộc thông tin nhà hoàn toàn đầy đủ và chính xác.Anh/chị có nhu cầu mua nhà liên hệ em Phúc chuyên nhà đất thổ cư tại quận Long Biên để được tư vấn và xem nhà hoàn toàn miễn phí.Gọi ngay khi đất còn chưa bán: Mr. Hoàng Phúc (Chuyên thổ cư). ",01/11/2022,Tin thường,batdongsan_so_com_vn_1673791059.8558953
900 triệu VNĐ,"Đường 19/12, Chương Dương Độ, Hoàn Kiếm", 132m2,, 6,,,,,"+Đất nền full thổ cư ngay trung tâm hành chính mới với giá cực tốt dành cho quý nhà đầu tư cuối năm 2022 Vị trị cực kỳ đắc địa trên tuyến đường liên xã 22m, kết nối vùng cực tốt Khu dân cư mới, quy hoạch bàn cờ cực đẹp, hạ tầng chuẩn chỉnh 8m-22m  Gần chợ, bách hóa xanh, trường học, trạm y tế, trung tâm hành chính mới  Cách 5p đển QL29 và 10p đến QL14 (trục đường Hồ Chí Minh)
       --------------------- +Diện tích: 132m2. 264m2, 396m2… Sổ đỏ sẵn từng lô Phù hợp kinh doanh để kinh doanh và ở ngay Liên hệ ngay em Nga 0335.944.400 để nhận thông tin chi tiết và chiết khấu tốt nhất",01/11/2022,Tin thường,batdongsan_so_com_vn_1673791060.8352761
"9,3 tỷ VNĐ","Đường Cầu Giấy, Quan Hoa, Cầu Giấy", 45m2,, 4, 4, 6, 8,,"+ Vị trí đắc địa: Trung tâm quận Cầu Giấy, NHÀ ĐẸP phân lô, khu dân trí cao, an ninh tốt, để ở hoặc kết hợp làm văn phòng, kinh doanh đều phù hợp. Ngõ trước nhà to rộng ô tô phóng, thông khắp các ngả.. + Phù hợp kinh doanh cửa hàng, online, tạp hoá, tiệm làm tóc móng, hàng ăn uống, văn phòng Công ty... + Hiện trạng nhà mới xây năm 2020, thiết kế 6 tầng hiện đại, chủ xây tâm huyết để ở, móng ép cọc BT có thể lên thêm vài tầng vô tư, có ô chờ thang máy.. - Tầng 1: Thông sàn, Gara ô tô, kinh doanh, vệ sinh. - Tầng 2: Thông sàn, Bếp, phòng khách, WC. - Tầng 3,4: Tổng 4 phòng ngủ, mỗi tầng 1 vệ sinh.  - Tầng 5: 1 phòng thờ+ khu phơi, vườn hoa cây cảnh. - Tầng 6: Kho chứa đồ, sân chơi.  + Sổ đỏ đẹp, sẵn sàng giao dịch. + LH,Hoàng Bắc,ĐT: 0377 610 275, chuyên nhà đất hà nội, dẫn khách xem nhà và Tư vấn miễn phí 24/7",01/11/2022,Tin thường,batdongsan_so_com_vn_1673791061.892448
"8,8 tỷ VNĐ","Đường Bồ Đề, Bồ Đề, Long Biên", 50m2,, 6, 20, 7, 4, 5,"Homestay 7 tầng phố Bồ Đề - Ô tô - Thang máy - View sông – Dòng tiền khủng. TẶNG LUÔN TOÀN BỘ NỘI THẤT NHẬP KHẨU, NHỈ CẦN XÁCH VALI VỀ Ở LUÔN. + Vị trí siêu đẹp và hiếm, gần ngay cầu Chương Dương, tuyến phố lớn Nguyễn Văn Cừ. + Mặt tiền 6m, để ô tô, ngõ trước nhà rộng, tầm tiền không thể tốt hơn.+ Nhà mới rất đẹp thiết kế tiện nghi, phong cách tân cổ điển, có thang máy, thang bộ cuối nhà, phòng vệ sinh đầy đủ, sang trọng.Khu vực an sinh tốt, chung quang không thiếu tiện ích, winmart bệnh viện, cây xăng, Mipec và Aeon Mall.+ Mô tả nhà:- Tầng 1: Để xe.- Tầng 2,3,4,5: mỗi tầng 1 phòng ngủ khép kín sang trọng full nội thất.- Tầng 6: Bếp + phòng ăn.- Tầng 7: Phòng thờ + sân phơi + vườn cây rau xanh+ Tặng toàn bộ nội thất sang trọng cho chủ mới.+ Sổ đỏ luôn trong trạng thái sẵn sàng giao dịch.☎️ Liên hệ ngay để được tư vấn xem nhà và sổ.",01/11/2022,Tin thường,batdongsan_so_com_vn_1673791062.9735565
3 tỷ VNĐ,Chính chủ cần tiền đầu tư bán nhanh lô LK -C7 Chi Đông- Mê Linh; nhỉnh 3 tỷ; 0986494152, 68m2,,,,,,,"Chính chủ cần tiền đầu tư bán nhanh lô LK -C7 Chi Đông- Mê Linh; nhỉnh 3 tỷ; 0986494152 -    Diện tích: 68,5m2. Mặt tiền = mặt hậu: 5.5m2-    Địa chỉ: Xã Chi Đông, Huyện Mê Linh, Hà Nội-    Vị trí: View sông Cà Lồ, đường 12m, trung tâm huyện Mê Linh, đường thông hè thoáng, kết nối trung tâm Hà Nội bằng đường cao tốc cầu Thăng Long - Sân bay Nội Bài; đại lộ Võ Nguyên Giáp - cầu Nhật Tân. Thích hợp đầu tư, xây nhà vườn, biệt thự, mua đầu tư mà tiềm năng tăng giá cao vì gần những trục đường chính 35 (Vành đai 4).Sát  trường  cấp 1, cấp  2 Quang Minh. Xung quanh đầy đủ tiện ích-    Pháp lý : Sổ đỏ chính chủ -    Giá bán: 3,xx Tỷ-    Liên hệ: 0986494152       http://www.sanbatdongsanviet.com.vn",01/11/2022,Tin thường,batdongsan_so_com_vn_1673791064.0258157
"2,7 tỷ VNĐ","Đường Thanh Bình, Mộ Lao, Hà Đông", 81m2,, 4, 20, 12, 3, 2,"+ Vị trí chung cư 2 mặt tiền một mặt ở phía đường Thanh Bình, một mặt giáp đường đô thị khu làng Việt Kiều Châu Âu, nằm gần khu EuroLand, thuộc KĐT Mỗ Lao, Quận Hà Đông. Kế bên là KĐT Văn Quán và các khu chung cư sầm uất như Hồ Gươm Plaza, Booyoung Vina, Westa, Fodacon Bắc Hà… Xa hơn chút nữa là các KĐT đang phát triển như Dương Nội, Văn Phú, The Pride, Văn Khê … + Các tiện ích ngoại khu như : Trường Tiểu học, THCS và THPT và Đại Học lớn nằm trong khu vực như: Mỗ Lao, Amsterdam, Lương Thế Vinh, HV An Ninh, ĐH Kiến Trúc, HV Công Nghệ Bưu Chính Viễn Thông, ĐH KHTN, FPT Aptech,…Gần làng lụa Vạn Phúc nổi tiếng, các khu bệnh viện 103, Bệnh Viên Đa Khoa Hà Đông, Bến xe Hà Đông, Siêu thị mua sắm Big C, Parkson ….+ Sổ đỏ đẹp, chủ đang rất cần bán+ Liên hệ: Em Thảo Thảo: 0793021170, để đi xem nhà miễn phí, và được tư vân tận tâm nhất, TRÂN TRỌNG!!!",01/11/2022,Tin thường,batdongsan_so_com_vn_1673791065.1627815
"6,4 tỷ VNĐ",Mỗ Lao- Hà Đông, 39m2,,,, 6,,,"Bán nhà kinh doanh Mỗ Lao, Hà Đông 39mx 6 tầng ô tô hơn 6 tỷ Bán nhà tại con phố sầm uất bậc nhất Quận Hà Đông, Mỗ Lao với thông số đẹp 39m nhà 6 tầng mặt tiền rộng, ngõ ô tô, nhà mới mua về khai thác luôn sinh dòng tiền lớn. Bán kính xung quanh nhà gần các trường đại học cạnh khu dân sinh gần chợ luôn tấp nập ngày đêm, vị trí đắc địa kinh doanh đa dạng. Giao thông thuận lợi đi muôn nơi giáp Văn Quán sang Nguyễn Khuyến gần Phúc La xuôi xuống Vạn Phúc cắt ngang Quang Trung. Sổ vuông sẵn sàng giao dịch. Giá: 6.4 tỷ ( gia lộc). Liên hệ : Em Huyền cháu gái chủ nhà ( 0363703491- 0965472910) gặp trực tiếp chính chủ.",01/11/2022,Tin thường,batdongsan_so_com_vn_1673791066.7565188
"6,4 tỷ VNĐ",Văn Quán - Hà Đông, 38m2,,,, 6,,,"Bán nhà Văn Quán, Hà Đông 38m, 6 tầng ô tô kinh doanh hơn 6 tỷ Bán nhà đẹp kinh doanh tại Phố Văn Quán, Hà Đông với thông số vàng 38m nhà mới 6 tầng thoáng sáng, các phòng rộng hiện đại đầy đủ công năng gần phố phù hợp ở kết hợp kinh doanh. Nhà bán nằm cạnh khu dân cư đông đúc, xung quanh nhiều toà văn phòng và các chung cư cao tầng rất thuận tiện cho việc kinh doanh nhiều mặt hàng. Giao thông thuận lợi giáp Phúc La gần Yên Xá đối diện Mỗ Lao ra Nguyễn Khuyến cắt trục chính Quang Trung xuống Vạn Phúc. Sổ vuông sẵn sàng giao dịch. Giá: 6.4 tỷ ( gia lộc). Liên hệ : Em Huyền cháu gái chủ nhà ( 0363703491- 0965472910) gặp trực tiếp chính chủ.",01/11/2022,Tin thường,batdongsan_so_com_vn_1673791067.7977355
10 tỷ VNĐ,Vạn Phúc - Hà Đông, 50m2,,,, 6,,," Bán liền kề Vạn Phúc 50m, 6 tầng, vỉa hè kinh doanh chỉ 10 tỷ Cô tôi chính chủ bán nhà đẹp tự xây tại khu liền kề Vạn Phúc, Hà Đông với thông số vàng diện tích 50m nhà 6 tầng rộng đẹp, mặt tiền khủng vỉa hè mênh mông đường ô tô tránh mua về ở ngay. Nhà đẹp xung quanh nhà trường Vạn Bảo gần shophouse Him Lam ra trục đường đôi, đầy đủ tiện ích xung quanh. Giao thông nối với Khu đô thị Văn Khê sang Tố Hữu ra Nguyễn Thanh Bình giáp Ngô Quyền hàng xóm Yết Kiêu xuống Đại Mỗ rất gần. Sổ vuông sẵn sàng giao dịch. Giá: 10 tỷ ( gia lộc) Liên hệ : Em Huyền cháu gái chủ nhà ( 0363703491- 0965472910) gặp trực tiếp chính chủ.",01/11/2022,Tin thường,batdongsan_so_com_vn_1673791069.2099552
"9,7 tỷ VNĐ",Vạn Phúc- Hà Đông, 50m2,,,, 6,,,"Bán liền kề Vạn Phúc 50mx6 tầng, kinh doanh ô tô vỉa hè hơn 9 tỷ Chính chủ bác tôi bán nhà liền kề gần Shophouse Him Lam, Vạn Phúc với thông số vàng diện tích rộng 50m thiết kế 6 tầng vừa ở vừa kinh doanh, đường ô tô phân lô vỉa hè cực đẹp mua về sử dụng ngay. Vị trí đắc địa xung quanh đầy đủ tiện ích, giao thông thuận lợi nối với Khu đô thị Văn Khê sang Tố Hữu ra Nguyễn Thanh Bình giáp Ngô Quyền hàng xóm Yết Kiêu xuống Đại Mỗ rất gần. Khu vực cực sầm uất đang phát triển rất mạnh nhiều toà nhà cao tầng, toà văn phòng lớn nhỏ các chung cư biệt thự mọc lên sẽ là một Khu đô thị rất phát triển. Sổ vuông sẵn sàng giao dịch. Giá: 9.7 tỷ ( gia lộc) Liên hệ : Em Huyền cháu gái chủ nhà ( 0363703491- 0965472910) gặp trực tiếp chính chủ.",01/11/2022,Tin thường,batdongsan_so_com_vn_1673791070.452632
"6,5 tỷ VNĐ","Đường Chùa Láng, Láng Hạ, Đống Đa", 77m2,, 3, 2, 5, 5, 4,"
    
Nhà đẹp phố Chùa Láng 77m2 5 tầng. Cách ô tô 50m. Ngõ thông, ba gác đỗ cửa. thoáng. Ở ngay. Giá 6.5 tỷ. 0836797686.

Vị trí: Phố Chùa Láng thông ngõ 1194 đường Láng. Ngõ trước nhà 3m. Khu vực đông dân cư, an ninh tốt. Tiện ích xung quanh nhiều. Gần bãiđể xe ô tô, gần các trường Đại học Giao thông vận tải, Ngoại thương, Ngoại giao, Luật.... Chùa Láng thông các tuyến phố Nguyễn Chí Thanh, Láng, Pháo Đài Láng.

Nhà mới đẹp, xây khung cột chắc chắn. Thiết kế đẹp, hiện đại, đầy đủ công năng, các phòng nhiều cửa sổ, nhiều ánh sáng.

Sổ đỏ sẵn sàng giao dịch.

LH: Ngọc Duyên
",01/11/2022,Tin thường,batdongsan_so_com_vn_1673791071.3742206
