price,address,Diện tích,Mặt tiền,Lộ giới,Số tầng,Số phòng ngủ,Số toilet,Details,Ngày đăng,Loại tin,id,Hướng
"12,25 tỷ VNĐ","Đường Lê Trọng Tấn, An Khánh, Hoài Đức", 135m2, 7, 20, 5, 4, 3,"
    
Cực Hiếm, Bán Nhà Liền Kề Khu Thiên Đường Bảo Sơn, An Khánh, Hoài Đức, Ô tô, Kinh doanh, 135m Chỉ 12,x tỷ
- Vị trí cực đẹp, Kinh doanh, Cho thuê đỉnh, vỉa hè rộng thoáng, Ô tô đỗ thoải mái.
- Đầu tư sinh lời, Nhà hàng, Văn phòng..
-Giao thông thuận tiện, Đại lộ Thăng long, Lê Trong Tấn, Đường Quốc lộ 32, Đường TL 422, Đường vành đai 3.5
- Tiện ích Xung quanh Trường học cấp 1,2,3, Đại Học Thành Đô, Đại Học Công Nghiệp HN, chợ, Y tế.
- Sổ Hoa Hậu CC, Sang tên nhanh gọn.
- Giá thương lượng. Thiện chí
Xem nhà gọi Mr Đức Nhà Đẹp 0898839292. Rất nhiều Nhà Đẹp phù hợp mọi nhu cầu Anh Chị Em nhé.
",28/12/2022,Tin thường,batdongsan_so_com_vn_1673781815.9397454,
"10,5 tỷ VNĐ","Đường Đại lộ Thăng Long, Lại Yên, Hoài Đức", 145m2, 8,,,,,"
    Cực Hiếm, Cần Bán Đất Lại Yên, Hoài Đức 145m Đường 40m chỉ 10,x tỷ
- Nhanh tay Đầu tư sinh lời, xây CCMN, Nhà hàng, Khánh sạn, Building, Văn Phòng Công ty, Chia lô...
- Vị trí cực đẹp. Hàng xóm Trường THPT Hoài Đức C, Học Viện Chính Sách,Gần các trường học cấp 1,2,3 Kinh doanh, cho thuê, tương lai trung tâm phát triển, gần Thiên Đường Bảo Sơn, Khu đô thị, KCN.. TTTM Vincom Mega Mall, AEon Mall,.. Khu vực phát triển mạnh, Tương lai lên Quận Hoài Đức.
- Giao thông thuận tiện, Đường Đại lộ Thăng long, Lê Trọng Tấn, TL 70, vành đai 4, vành đai 3.5
- Sổ CC, sang tên nhanh gọn. Giá thương lượng. Chủ thiện chí
Thông tin chi tiết liên hệ Mr Đức Nhà Đẹp.
Rất nhiều Nhà Đất đẹp phù hợp mọi nhu cầu Anh Chị Em nhé.
",28/12/2022,Tin thường,batdongsan_so_com_vn_1673781816.8760936,
"7,8 tỷ VNĐ","Đường Cầu Đơ, Quang Trung, Hà Đông", 58m2, 4, 3, 4, 4, 4,"+ Bán nhà mặt ngõ Cầu Đơ, chủ nhà đến tuổi nghỉ hưu bán nhà để chia cho con cháu. + Nhà nằm khu phố Cầu Đơ gần TTHC Quận Hà Đông, ba bước ra Đường Quang Trung, nối liền các tuyến phố chính, kinh doanh sầm uất, khách mua để ở hay kinh doanh nhà hàng, cafe đều hợp. + Nhà diện tích 58 m2, siêu rộng! Nội thất cao cấp, đầy đủ chủ tặng lại toàn bộ cho khách mua nhà. + Sổ đỏ chính chủ, chờ giao dịch. + Giá: 7,8 tỷ (có thương lượng với khách thiện chí) + Liên hệ Cồ Linh 0968994350 để được tư vấn và xem nhà ngay.",28/12/2022,Tin thường,batdongsan_so_com_vn_1673781818.0919435,
"8,5 tỷ VNĐ","Đường Khuất Duy Tiến, Nhân Chính, Thanh Xuân", 42m2, 4, 3, 4, 6,,"+ Chính chủ cần ban nhà diện tích 42 m2 x 4 tầng giá 8.5 tỷ. + Nhà kiên cố chủ tự xây tâm huyết ở vô cùng có lộc. Thiết kế tầng 2 phòng cầu thang và vệ sinh ở giữa. Tổng có 5 phòng, 3 vệ sinh.   + Khách mua về chỉ việc thêm thùng sơn là lại lung linh. Ô tô vào nhà, khu dân cư toàn cán bộ dân trí cao. Có thể kinh doanh cho thuê văn phòng.   + Vị trí đẹp cách mặt ngõ chỉ 10m, cách đường Khuất Duy Tiến chỉ 50m. Ngõ thông ô tô tránh sang Nguỵ Như Kon Tum. Giao thông thuận tiện.  + LH,Hoàng Bắc,ĐT: 0377 610 275, chuyên nhà đất hà nội, dẫn khách xem nhà và Tư vấn miễn phí 24/7",28/12/2022,Tin thường,batdongsan_so_com_vn_1673781819.62409,
"3,5 tỷ VNĐ","Lai Xá, Kim Chung, Hoài Đức, Hà Nội.", 50m2, 4,, 5,,,"HOT!HOT!HOT! Nhà 5 tầng tại vị trí Lai Xá, Kim Chung, Hoài Đức, Hà Nội. + Diện tích: 50m2, nhà 5 tầng, mặt tiền: 4.5m, giá: 3.5 tỷ + Nhà mới tinh, vị trí đỉnh, chủ tự xây chắc chắn và kiên cố + Nhà lô góc, nở hậu, 2 mặt tiền cực đẹp + Ôtô đỗ cửa thoải mái, đường rộng thông các phía. + Thiết kế cực đẹp, nội thất sang trọng, đầy đủ công năng + Khu vực phát triển, tiềm năng đáng sống. Vì đầu tư quá tay nên thiếu nợ cần bán gấp, kể cả cắt lỗ với khách có thiện trí. + Sổ đỏ đẹp, pháp lý siêu nét, giao dịch sẵn sàng Quý khách quan tâm vui lòng liên hệ Mrs. Bích Phượng: 0915568218 / 0834081167",28/12/2022,Tin thường,batdongsan_so_com_vn_1673781820.6564696,
13 tỷ VNĐ,"Đường , La Khê, Hà Đông", 83m2, 8, 25, 5, 5, 5,"Mô tả: + Vị trí nhà cực kỳ đẹp nằm trên KDT mới An Hưng La Khê Hà Đông xung quanh toàn văn phòng, dân trí cao tiện ích xung quanh 150m không thiếu gì, gần Aeon Mall Hà Đông, gần Công Viên Thiên Văn Học, giao thông thuận tiện thông vô cùng. + Thiết kế nhà gồm 5 tầng có ô chờ thang máy. Tầng 1,2,3 thông sàn đã hoàn thiện đẹp. Tầng 4,5 trong nhà để thô chưa chát chờ chủ mời về hoàn thiện nốt theo ý mình. Hiện trạng nhà đang cho thuê gần 200tr/năm hợp đồng dài hạn. + Sổ đỏ vuông đét, không lỗi gì sẵn sàng sang tên ngay. Liên hệ 0832421286",28/12/2022,Tin thường,batdongsan_so_com_vn_1673781821.6369302,
"3,3 tỷ VNĐ","Đường Hồ Tùng Mậu, Phú Diễn, Bắc Từ Liêm", 84m2, 9, 50, 30, 2, 2,"
    

Chủ nhà cần bán gấp căn hộ chung cư cao cấp diện tích 83,5m2 tòa Ruby R2 Goldmark City, Cầu Diễn được mệnh danh là khu đô thị mang âm hưởng Singapore tại Hà Nội. Nhà tầng cao, thoáng mát, 2 phòng ngủ, đã đầy đủ nội thất, khách chỉ việc xách valy về ở. 

Giá bán nhỉnh 3 tỷ xíu có thương lượng, bao toàn bộ thuế, phí
Liên hệ zalo 0912822424 (Mr. Linh) để xem nhà.
--------------------------------------------------------------------------
Công ty TNHH Dịch vụ, Thương mại, Đầu tư Bất động sản Hà Nội Online.
Trụ sở: Lô 49, TT4 Khu đô thị Mỹ Đình – Sông Đà, phường Mỹ Đình 1, quận Nam Từ Liêm, thành phố Hà Nội.
Văn phòng Khu đô thị Goldmark City: 222 Hoàng Công Chất, phường Phú Diễn, quận Bắc Từ Liêm.
Hotline: Mr. Toàn 0974938949, Mr. Chiến: 0987964433, Mr. Linh 0912822424.
-----------------------------------------------------------------------
Thông tin về chuyển nhượng và cho thuê căn hộ chung cư cao cấp, nhà đất thổ cư Hà Nội, chi tiết tại fanpage https://www.facebook.com/100068303180263 (ĐẶC BIỆT giảm thêm 20 triệu trên một giao dịch mua bán chuyển nhượng khi KHÁCH MUA like, follow và tương tác với fanpage để trao đổi thông tin, thương lượng)
#chungcucaocap #canhocaocap #vinhomes #muabanchungcu #chothuecanho #muabancanho #1ngu #2ngu #3ngu #sunshinecity #sunshinecity #batdongsan #thocu #lienke #ecopark #2PN #1PN #3PN #goldmarkcity #shophouse #chande #greenbay #dsiee
",28/12/2022,Tin thường,batdongsan_so_com_vn_1673781823.0157201,
700 triệu VNĐ,Mỹ Văn - Chuyên Mỹ, 70m2,,,,,,"Vị trí: Gần cầu Vân Từ, tiếp giáp làng nghề da giày, complex veston Phú Xuyên - Hà NộiLô đất nằm trên trục đường thông rộng 5,5m. Ô tô chạy vòng quanh đấtBán kính 500m đầy đủ tiện ích như Chợ, tạp hoá, Trường học các cấp, UBND xã, Trạm Y tếGiao thông đi lại thuận tiện kết nối đường tỉnh 428 , Quốc Lộ 1A và cách trung tâm hành chính huyện Phú Xuyên chỉ 15 phút đi xeHuyện Phú Xuyên là đầu mối giao thông kết nối với trung tâm Thủ đô Hà Nội và các tỉnh lân cận.Huyện được mệnh danh là “đất trăm nghề” - huyện nghề, với 154/154 làng có nghề, trong đó có 43 làng được thành phố Hà Nội công nhận làng nghề truyền thống,nên kinh tế khu vực rất phát triển, đời sống văn minh dân trí caoTrung Quốc mở cửa khẩu nên gia chủ cần tiền nhập hàng và bán giá tốt - có ra lộc cho khách hàng thiện chí giao dịch",28/12/2022,Tin thường,batdongsan_so_com_vn_1673781824.0131412,
"3,15 tỷ VNĐ",Yên Phúc - Hà Đông, 37m2,,, 4,,,"Bán nhà Yên Phúc, Hà Đông ngõ nông ở ngay 37mx4 tầng hơn 3 tỷ Tôi cần bán nhà trước Tết giáp Khu đô thị Văn Quán, Hà Đông ngõ nông gần phố nội thất hiện đại ở ngay với 4 tầng rộng đẹp 37m. Xung quanh tiện ích khu đô thị Văn Quán gần bến xe, tàu điện, siêu thị, bệnh viện, bưu điện, hàng xóm văn minh ở sướng. Giáp Xa La gần Mỗ Lao xuống Vạn Phúc sang Quang Trung ra Yết Kiêu. Sổ vuông sẵn sàng giao dịch. Giá: 3.15 tỷ ( gia lộc).  Liên hệ : Huyền ( 0363703491- 0965472910) – Gặp trực tiếp chính chủ.",28/12/2022,Tin thường,batdongsan_so_com_vn_1673781825.1608481,
"3,15 tỷ VNĐ",Xa La- Hà Đông, 38m2,,, 4,,," Bán nhà Xa La, Hà Đông 38mx4 tầng dân xây ngõ nông ở ngay hơn 3 tỷ Chính chủ bán nhà riêng trước Tết tại Xa La, Hà Đông ở ngay dân xây 4 tầng rộng đẹp 38m gần khu đô thị Xa La đầy đủ tiện ích. Trung tâm Hà Đông gần các bệnh viện lớn và các Khu đô thị hiện đại như Kiến Hưng, Văn Phú, Phú Lương xuôi xuống Thanh Hà Giáp Thanh Trì Bán nhanh chuyển vào Sài Gòn sống cùng gia đình, giá tốt nhất khu vực Sổ vuông sẵn sàng giao dịch. Giá: 3.15 tỷ ( gia lộc).  Liên hệ : Huyền em gái chủ nhà ( 0363703491- 0965472910) – Gặp trực tiếp chính chủ.",28/12/2022,Tin thường,batdongsan_so_com_vn_1673781826.211338,
"16,88 tỷ VNĐ",Văn Phú - Hà Đông, 59m2,,, 7,,,"Mặt phố Văn Phú, Hà Đông 59m, 7 tầng thang máy KD hơn 16 tỷ Hiếm quá mặt phố Văn Phú, Hà Đông kinh doanh đỉnh cao các loại hình với 7 tầng thang máy nhập khẩu, vỉa hè đá bóng đoạn đẹp nhất phố vài bước ra Quang Trung. Vị trí đắc địa có thể làm văn phòng, nhà hàng, thẩm mỹ viện, siêu thị,…mặt phố 4 ô tô tránh gần Quận uỷ, Nhà thi đấu thông Hà Cầu phố Hoàng Đôn Hoà sang Lý Thường Kiệt qua Trần Đăng Ninh. Sổ vuông sẵn sàng giao dịch. Giá: 16.88 tỷ ( gia lộc).  Liên hệ : Huyền ( 0363703491- 0965472910) – Gặp trực tiếp chính chủ.",28/12/2022,Tin thường,batdongsan_so_com_vn_1673781827.2158513,
15 tỷ VNĐ,Quang Trung - Hà Đông, 60m2,,, 7,,,"Mặt phố Quang Trung, Hà Đông 60m, 7 tầng thang máy KD chỉ 15 tỷ Cần bán nhà mặt phố Quang Trug, Hà Đông với 7 tầng thang máy nhập khẩu kinh doanh các loại hình 60m, mặt tiền khủng, vỉa hè đá bóng, dòng tiền lớn. Vị trí đắc địa đoạn đẹp nhất phố qua các phố cầu Đơ , Ngô Thì Nhậm sang Văn Phú dọc Lê Trọng Tấn ra Hoàng Đôn Hoà. Sổ vuông sẵn sàng giao dịch. Giá: 15 tỷ ( gia lộc).  Liên hệ : Huyền ( 0363703491- 0965472910) – Gặp trực tiếp chính chủ.",28/12/2022,Tin thường,batdongsan_so_com_vn_1673781828.1954257,
35 triệu VNĐ,"Đường Lương Quy, Xuân Nộn, Đông Anh", 95m2, 5,,,,,"Bán đất xã xuân nộn Đông Anh giá rẻ năm 2022 Chính chủ gửi bán 95m2 đường Yên Xuân Nộn Đông Anh Hà Nội Mặt tiền : 5m Chiều dài : 19m Đường trước đất rộng 5m Vị trí tại đường Yên Xuân Nộn Đông Anh Hà Nội, bên cạnh là dự án khu công nghiệp Đông Anh sắp triển khai. Vị trí lô đất cách trung tâm huyện 2km, cách bệnh viện Than Ba , trường học cấp 1-2-3 Đông Anh 1,5km, chợ Cửa Hàng Mới 1km. Xung quanh dân cư đông đúc , dân trí cao, hạ tầng đồng bộ . Phù hợp đầu tư hoặc xây nhà biệt thự ngoại thành không khí mát mẻ Giá bán 35tr/m2 Liên hệ em Linh 0919841234 để xem đất và thương lượng trực tiếp với chủ đất  Bán đất Đường Yên Xuân Nộn Đông Anh Bán đất xã Xuân Nộn Đông Anh Bán đất xã Xuân Nộn giá rẻ Bán đất giá rẻ tại Đông Anh",28/12/2022,Tin thường,batdongsan_so_com_vn_1673781829.4432962, Đông bắc
"6,8 tỷ VNĐ","⭐️Chính chủ bán nhà riêng 72m2 tại ngõ 773 Giải Phóng, P.Giáp Bát; 6,8 tỷ; 0368423596", 72m2,,,,,,"⭐️Chính chủ bán nhà riêng 72m2 tại ngõ 773 Giải Phóng, P.Giáp Bát; 6,8 tỷ; 0368423596  Địa chỉ: Ngõ 773 đường Giải Phóng, Phường Giáp Bát, quận Hoàng Mai, Hà Nội - Nhà thiết kế 4 tầng, diện tích: 72m2 (4 x 18), xây chắc chắn gồm: + Tầng 1: Để xe (để được 4 - 5 xe), phòng khách, bếp + WC nhỏ. + Tầng 2 + 3: Mỗi tầng có 2 Phòng ngủ + WC. Mỗi tầng 2 phòng ngoài có ban công làm sân phơi. + Tầng 4: Phòng thờ + sân phơi. - Ngõ để được ô tô ngày đêm, ô tô đỗ cách vào nhà 10m. Giao thông đi lại thuận tiện.- Cách Bến xe Giáp Bát 5 phút đi xe. - Chợ dân sinh trong đường Giáp Bát 5 phút đi bộ. - Trường mầm non, trường tiểu học, trung học cơ sở Giáp Bát 5 phút đi bộ. - Siêu thị Mega Market, rạp phim Beta Cineplex 360 Giải Phóng đối diện bên đường. - Cách Aeon Mall Giáp Bát chuẩn bị xây lên 5 phút đi xe. - Nội thất gỗ cực đẹp để lại cho chủ tiếp theo, trước gia đình rất tâm huyết với nội thất này bao gồm: bộ bàn ghế, kể để tivi, Quan Công, Gia Cát Lượng,... - Sổ đỏ chính chủ, không có tranh chấp, liên quan đến pháp lý. Sẵn sàng giao dịch.  Giá: 6,8 tỷ (có thương lượng) Liên hệ: 0368423596 - anh Quang Anh (miễn tiếp Qc)       http://www.sanbatdongsanviet.com.vn",28/12/2022,Tin thường,batdongsan_so_com_vn_1673781830.5233843,
"16,8 tỷ VNĐ",Ngọc Khánh, 43m2, 4,, 5, 4, 5,"Hiện trạng nhà 5 đang kinh doanh sầm uất doanh thu khủng. Thiết kế hiện đại có thể cải tạo lắp thêm Thang Máy. Tầng 1.2.3.4: Thông sàn + Wc Tầng 5: Thiết kế để khu bếp siêu rộng, Sổ hoa hậu, pháp lí rõ ràng,sẵn sàng giao dịch. Liên hệ trực tiếp A Tuyên 0969945393 để được tư vấn và xem nhà miễn phí.",28/12/2022,Tin thường,batdongsan_so_com_vn_1673781831.6617315,
"25,2 tỷ VNĐ",Hoàng Quốc Việt Cầu Giấy Hà Nội, 96m2, 4,, 5, 4, 4,"- Diện tích 96m2 X5 Tầng, Mặt tiền 4.5mGiá 25.2 tỷ ( có thương lượng )- Vị trí nhà nằm trong ngõ 234 Hoàng Quốc Việt nhà thuộc khu phân lô trước nhà 4 ô tô tránh vừa ở vừa kinh doanh! Thiết kế xây dựng 5 tầng cực kỳ chắc chắn.dầy đủ công năng sử dụng!  Bán kính xung quanh gần các trường Đại học danh tiếng!- Khu dân trí cao an ninh đảm bảo! - Sổ đỏ phân lô, đẹp sẵn sàng giao dịch!ACE có nhu cầu liên hệ em Quân để được tư vấn và xem nhà miễn phí!0385 94 1802Miễn ( TG Quảng Cáo )",28/12/2022,Tin thường,batdongsan_so_com_vn_1673781832.8583007,
"25,2 tỷ VNĐ",Hoàng Quốc Việt Cầu Giấy Hà Nội, 96m2, 4,, 5, 4, 4,"- Diện tích 96m2 X5 Tầng, Mặt tiền 4.5mGiá 25.2 tỷ ( có thương lượng )- Vị trí nhà nằm trong ngõ 234 Hoàng Quốc Việt nhà thuộc khu phân lô trước nhà 4 ô tô tránh vừa ở vừa kinh doanh! Thiết kế xây dựng 5 tầng cực kỳ chắc chắn.dầy đủ công năng sử dụng!  Bán kính xung quanh gần các trường Đại học danh tiếng!- Khu dân trí cao an ninh đảm bảo! - Sổ đỏ phân lô, đẹp sẵn sàng giao dịch!ACE có nhu cầu liên hệ em Quân để được tư vấn và xem nhà miễn phí!0385 94 1802Miễn ( TG Quảng Cáo )",28/12/2022,Tin thường,batdongsan_so_com_vn_1673781834.0239477,
27 tỷ VNĐ,Hồ Hạ Đình - Thanh Xuân - Hà Nội, 110m2,,, 8,,,"Bán nhà mặt hồ Hạ Đình, Thanh Xuân, vỉa hè 110m, 5.8m mặt tiền, ở kinh doanh, chỉ 27 tỷ. Vị trí: Mặt hồ Hạ Đình, quận Thanh Xuân, view hồ Hạ Đình, mặt tiền 5.8m vỉa hè trước nhà rộng 4m. Tiện ích: Kinh doanh hay ở đều tuyệt vời, phố rộng rãi, hàng xóm toàn nhà cao tầng mới đẹp, chỉ vài trăm mét sang phố Nguyễn Trãi, Khương Đình, di chuyển tới quận Đống Đa, Hà Đông, Hoàng Mai chỉ 5 phút, bán kính 1km là các trường địa học như Khoa Học Tự Nhiện, Xã Hội Nhân Văn, Hà Nội, Học viện An Ninh, Bưu Chính Viễn Thông, Học viện Ngân Hàng..vv. Giao thông: Thuận lợi di chuyển tới các tuyến phố Nguyễn Trãi, Kim Giang, Khương Đình, Khuất Duy Tiến, Nguyễn Xiển, bến xe Nước Ngầm…vv. Pháp lý: Sổ đỏ chính chủ sẵn sàng sang tên, có thương lượng. Liên hệ: Minh Hoàng 0902253303, miễn trung gian môi giới.",28/12/2022,Tin thường,batdongsan_so_com_vn_1673781835.206762,
"7,5 tỷ VNĐ","Đường Thịnh Liệt, Thịnh Liệt, Hoàng Mai", 55m2, 4, 1, 5, 6, 4,"NHÀ MỚI, 5 TẦNG THANG MÁY MỚI CỨNG - ĐẸP LONG LANH - Ô TÔ 7 CHỖ VÀO NHÀ.- Vị trí: cách trường tiểu học Thịnh Liệt đúng 100m, ngõ rộng rãi, sạch sẽ, sáng- Nhà được thiết kế tổng 6 phòng ngủ rộng rãi, phòng nào cũng có cửa sổ (ánh sáng ngập tràn)Cụ thể:- Tầng 1 là phòng khách, bếp- Tầng 2,3,4 mỗi tầng 2 phòng ngủ và WC- Tầng 5 là phòng thờ và sân phơi- Sổ đỏ vuông vắn, chính chủ, pháp lý chuẩn, chờ giao dịch. ----------------------Liên hệ xem nhà MIỄN PHÍ: 0965 399 689 (Mr Châu)",28/12/2022,Tin thường,batdongsan_so_com_vn_1673781836.5970833,
"3,2 tỷ VNĐ",Lò Đúc - Hà Nội, 42m2,,,,,,"+ Vị trí thuộc khu vực trung tâm quận Hai Bà Trưng, tiếp giáp các quận Hoàng Mai, Hoàn Kiếm, Thanh Xuân, Ba Đình, Tây Hồ đi đâu cũng tiện .  + Chủ tâm huyết xây khung cột bê tông chắc chắn, ngõ nông đúng bước chân ra mặt phố Lò Đúc, ô tô đỗ cửa phi vèo vèo.  Cách phố Cổ độ chỉ ba bước chạy bộ, được coi là 1 trong những trung tâm bậc nhất của Thủ đô chả thiếu thứ gì. Đường đi thông các phố lớn như Trần Khát Chân, Đại Cồ Việt, Lò Đúc, Phố Huế…  + Sổ đỏ đẹp vuông vắn, pháp lý sạch, sẵn sàng giao dịch ngay.  + Giá 3.2 tỷ có thương lượng nhẹ cho khách hữu duyên. Chi tiết LH: Nhật Nhà Đất  0977194820 (Chuyên Nhà đất Thổ cư với nguồn hàng Hơn 6000 Căn Nhà  Lớn nhỏ Từ 1 – 100 Tỷ trên khắp địa bàn Hà Nội sẵn sàng giúp Khách hàng tìm được những căn nhà ưng ý nhất).Phương châm làm việc:-Tận Tâm, Uy tín , Chuyên nghiệp cái Tâm và cái Tầm đặt lên hàng đầu- Không kênh giá chủ nhà- Miễn phí toàn bộ dịch vụ: Dẫn khách xem nhà, tư vấn pháp lý. ",28/12/2022,Tin thường,batdongsan_so_com_vn_1673781837.6139941,
