price,address,Diện tích,Mặt tiền,Lộ giới,Số tầng,Số phòng ngủ,Số toilet,Details,Ngày đăng,Loại tin,id,Hướng
4 tỷ VNĐ,Đường bà triệu phường nguyễn trãi, 45m2, 4, 5, 5, 4, 4,+ Ô tô đỗ cổng + Sổ đỏ chính chủ vuông đét như tớ A4.,13/10/2022,Tin thường,batdongsan_so_com_vn_1673795001.5564191,
"3,4 tỷ VNĐ",Đường Xuân Đỉnh phường Xuân Đỉnh, 30m2, 4, 3, 4, 3, 3,"
    Giao thông thuận tiện, thông các ngả: Phố Lộc, Đỗ Nhuận, Phạm Văn Đồng, Xuân La, Võ Chí Công… 
+ Giá bán: Thương lượng sâu cho khách thiện chí (chủ nhà cần tiền bán gấp). 

",13/10/2022,Tin thường,batdongsan_so_com_vn_1673795003.0663786,
950 triệu VNĐ,Đường Quốc lộ 3 phường Xuân Nộn, 42m2, 4,,,,,,13/10/2022,Tin thường,batdongsan_so_com_vn_1673795004.8645682,
"4,5 tỷ VNĐ",Trần Phú- Hà Đông, 47m2,,, 4,,,"Bán nhà Trần Phú, Hà Đông, 47mx4 tầng ô tô gần phố hơn 4 tỷ Cần bán nhà riêng tại phố Trần Phú, Hà Đông diện tích rộng 47m thiết kế 5 tầng hiện đại đầy đủ công năng cho khách hàng khó tính nhất, nội thất đẹp Châu Âu, 2 mặt thoáng ánh sáng chan hoà, ngõ nông thông, gần phố ở ngay. Nhà bán hưởng trọn tiện ích Khu đô Thị văn Quán và Khu đô thị Mỗ Lao, quanh nhà trường học, ngân hàng, siêu thị, công viên không thiếu. Giáp Vạn Phúc gần Yết Kiêu sang Phúc La lên Thanh Xuân hay sang Nam Từ Liêm rất gần. Chủ nhà cần bán gấp để mở rộng kinh doanh nhà rất có lộc. Sổ vuông sẵn sàng giao dịch. Giá 4.5 tỷ ( gia lộc). Liên hệ : Huyền Hà Đông ( 0363703491- 0965472910) – Chuyên gia nhà Thổ Cư tư vấn hàng nghìn ngôi nhà tiết kiệm THỜI GIAN- CÔNG SỨC- TIỀN BẠC. Hỗ trợ 24/7 và tư vấn pháp lý, vay vốn.",13/10/2022,Tin thường,batdongsan_so_com_vn_1673795006.9430082,
"4,5 tỷ VNĐ",Văn Quán- Hà Đông, 47m2,,, 4,,," Bán nhà Văn Quán, Hà Đông 47mx4 tầng ngõ nông ô tô hơn 4 tỷ Bán nhà khu vực trung tâm Văn Quán, Hà Đông vô cùng hiếm diện tích rộng 47m thiết kế 5 tầng thoáng trước sau, nội thất rất Châu Âu hiện đại, nhà đẹp như truyện cổ tích nhìn là mê. Nhà nằm trong khu dân cư rất văn minh môi trường sạch đẹp. Trung tâm chính trị - văn hoá của Quận. Xung quanh có Bưu điện, tàu điện trên cao, bến xe Bus, chợ, bệnh viện, ngân hàng không thiếu. Chủ nhà thành đạt nay mua biệt thự to hơn ở cần bán gấp . Giao thông giáp Mỗ Lao hàng xóm Phúc La sang Yên Xá gần Nguyễn Trãi vài bước ra Quang Trung sang Vạn Phúc xuống Yết Kiêu. Sổ vuông sẵn sàng giao dịch. Giá 4.5 tỷ ( gia lộc). Liên hệ : Huyền Hà Đông ( 0363703491- 0965472910) – Chuyên gia nhà Thổ Cư tư vấn hàng nghìn ngôi nhà tiết kiệm THỜI GIAN- CÔNG SỨC- TIỀN BẠC. Hỗ trợ 24/7 và tư vấn pháp lý, vay vốn.",13/10/2022,Tin thường,batdongsan_so_com_vn_1673795008.8987758,
"8,2 tỷ VNĐ",Ngô Thì Nhậm- Hà Đông, 51m2,,, 4,,,"Bán nhà Ngô Thì Nhậm, Hà Đông 51mx4T kinh doanh vỉa hè hơn 8 tỷ Nhà đẹp phố Ngô Thì Nhậm, Hà Đông kinh doanh tuyệt đỉnh gần chợ Bông Đỏ diện tích 51m với 4 tầng rộng đẹp vỉa hè ô tô tránh, nội thất hiện đại hơn 8 tỷ hiếm có. Nhà bán kinh doanh đủ loại hình: Café, spa, phòng khám, văn phòng phẩm, hoa quả sạch,….hoặc làm văn phòng kết hợp ở tuyệt vời. Giao thông trục chính đi muôn nơi giáp Quang Trung sang Hoàng Đôn Hoà ra Ngô Quyền lên Vạn Phúc hàng xóm Phan Đình Giót, đối diện Lý Thường Kiệt song song Trần Đăng Ninh lên Hà Cầu. Sổ vuông sẵn sàng gia dịch. Giá 8.2 tỷ ( gia lộc). Liên hệ : Huyền Hà Đông ( 0363703491- 0965472910) – Chuyên gia nhà Thổ Cư tư vấn hàng nghìn ngôi nhà tiết kiệm THỜI GIAN- CÔNG SỨC- TIỀN BẠC. Hỗ trợ 24/7 và tư vấn pháp lý, vay vốn.",13/10/2022,Tin thường,batdongsan_so_com_vn_1673795010.7578027,
"13,5 tỷ VNĐ",Đường Trần Quang Diệu phường Ô Chợ Dừa, 91m2, 10, 9, 6, 5, 4,"Liên hệ: Anh Thành chuyên 
",13/10/2022,Tin thường,batdongsan_so_com_vn_1673795012.3056617,
"2,5 tỷ VNĐ","Tựu Liệt, Thanh Trì HN", 30m2,,,,,,"+ Nhà thiết kế hiện đại, đầy đủ công năng, Điều hòa, Nóng lạnh, các phòng thoáng sáng, cách 10m ô tô thông, Trường học cấp 1-2 đi bộ + T1 P khách,wc, Bếp p ăn, khu để xe máy riêng rộng dãi  + T2+3, 4 p ngủ, 2 wc, P rộng thông thoáng + T4 P thờ, P để đồ hoặc có nhu cầu thêm p ngủ rộng dãi, Khu để máy giặt liền sân phơi, rất tiện dụng  Sổ đỏ cất két sẵn sàng giao dịch",13/10/2022,Tin thường,batdongsan_so_com_vn_1673795013.929318,
"6,2 tỷ VNĐ",Đường Ngô Quyền phường Quang Trung, 47m2,, 1, 4, 5, 4,"
    - Nhà nằm ngay góc cực đẹp, lô góc 2 mặt phố.- Mặt ngõ 2 ô tô tránh nhau thoải mái.- Dân cư xung quanh đông đúc, tiện ích bạt ngàn cái gì cũng có.Nhà xây 4 tầng diện tích 47m2 giá 6.2 tỷ.- Tầng 1 : Gara, phòng khách, bếp, wc.- Tầng 2 : 3 ngủ, wc.- Tầng 3 : 1 phòng ngủ, 1 phòng rộng chủ làm kho để hàng, wc.- Tầng 4 : Phòng thờ, sân phơi.- Sổ đỏ cực đẹp sẵn sàng giao dịch.- Liên hệ: + Ngọc Ánh thổ cư (miễn TG-MG): 0836582666 ",13/10/2022,Tin thường,batdongsan_so_com_vn_1673795015.9728513,
"3,28 tỷ VNĐ","Pháp Vân, Ngọc Hồi HN", 31m2,,,,,,"+ Nhà mới coong  cửa ngõ Thủ Đô, xe container đỗ cổng, ở sướng, kinh doanh online đỉnh, sát đường Ngọc Hồi,, giao thông tiện lợi + Nhà 5 tầng thiết kế hiện đại, nội thất xịn, đầy đủ công năng, chỉ xách vali về ở, hàng xóm ít thân thiện tình cảm, xem nhà là mê, +Sổ đỏ cất két giao dịch ngay",13/10/2022,Tin thường,batdongsan_so_com_vn_1673795017.8398569,
"4,55 tỷ VNĐ",Đường Trương Định phường Tương Mai, 42m2,, 1,,,,"+ Vị trí nhà mặt ngõ rộng, khu dân trí cao, an ninh tốt, kinh doanh, ngõ thông tứ tung. - T1: Phòng khách, bếp, wc.   T4: Phòng thờ, sân phơi.  ",13/10/2022,Tin thường,batdongsan_so_com_vn_1673795019.3837261,
2 tỷ VNĐ,Tôn Đức Thắng, 22m2, 4, 6, 4, 3, 3,"- Vị trí siêu đỉnh, vài bước chân ra mặt phố Tôn Đức Thắng.- Diện tích 22m2 x 4 tầng, 3 ngủ, mặt tiền 3.5m.- Nhà mới, đẹp, sổ vuông đẹp, thoáng, lên tầng thoải mái.- Chỉ 2 tỷ, thiết kế đầy đủ công năng, hiện đại, khách mua dọn về ở luôn. Liên hệ 0949559693 - Ms Chinh để được làm việc chính chủ.",13/10/2022,Tin thường,batdongsan_so_com_vn_1673795020.6812897,
"8,8 tỷ VNĐ",Đường Lê Trọng Tấn phường Yên Nghĩa, 75m2,, 1, 5, 5, 5,"
    - Đường trước nhà rộng đi 1p là ra đến công viên, là đến chợ.- Nằm ngay khu vực trung tâm nên tiện ích không thiếu thứ gì.- Dân cư xung quanh đông đúc, kinh doanh rất tiềm năng.- Khu vực này đang phát triển giá nhà giá đất tăng lên từng ngày.- Nhà rộng 75m2 THIẾT KẾ : + Tầng 1 : Gara + kinh doanh vp + wc + Tầng 2 : Khách + bếp + Tầng 3 + 4 Mỗi tầng 2 phùng ngủ rộng + Wc có thể tắm đc 10 người 1 lúc . + Tầng 5 : Phòng thờ + sân phơi phía sau + phía trước vườn thượng uyển thưởng trà . - Sổ dỏ chính chủ sẵn sàng giao dịch.- Liên hệ: + Ngọc Ánh thổ cư (miễn TG-MG): 0836582666
",13/10/2022,Tin thường,batdongsan_so_com_vn_1673795025.4226167,
"1,15 tỷ VNĐ",Đường bắc hồng phường Bắc Hồng, 52m2, 4,,,,,"
    Nhỉnh 1 tỉ có ngay 52.7m² đất thổ cư thôn Bến Trung, xã Bắc Hồng, huyện Đông Anh, Hà Nội.
Mặt tiền: 4.21m. Khổ đất vuông vắn.
Lô đất tại khu vực đông dân cư, an ninh rất tốt, Gần trường học cấp 1,2, UBND xã Bắc Hồng, giao thông đi lại thuận tiện.
Lô đất gần chợ, giáp đường liên xã, đường cầu Nhật Tân đi Nội Bài (đường Võ Nguyên Giáp), Khu CN Quang Minh, Công viên phần mềm.
",13/10/2022,Tin thường,batdongsan_so_com_vn_1673795027.2502542,
"2,8 tỷ VNĐ",iec, 53m2,,,,,," Chính chủ cần bán lô kiot IEC, shophouse chân đế IEC, S: 53m2, có sổ, dự án  IEC Tứ Hiệp, Thanh Trì Thông tin Căn Kiot IEC: - Diện tích 53m2. Cao 6.2m. Mặt tiền 3.8m. - Thiết kế: 2 tầng, tổng diện tích sử dụng 90m2 - Hướng: Tây Bắc trực diện đường lớn. - Vị trí đẹp, tiện kinh doanh, đường trước nhà 5m có thể đỗ xe thoải mái. - Thiết kế: Hoàn thiện 2 tầng (sơn bả, trần, đèn, wc). - Giá: 2.8 tỷ (có sổ đỏ). Vị trí: - Kiot IEC nằm trên quy hoạch tuyến đường lớn: Đường 27m nối Ngọc Hồi Khu TĐC X4 Khu đầu giá Tứ Hiệp; Đường Trần Thủ Độ kéo dài; Quốc lộ 1Adễ dàng di chuyển đến các tỉnh lân cận: Hưng Yên, Nam Định, Ninh Bình. - Cư dân tại dự án kiot IEC Tứ Hiệp cũng dễ dàng đến địa điểm: Hồ Gươm, Công viên Yên Sở, Aeon Mall Hoàng Mai. Chủ đầu tư uy tín: Tập đoàn IEC Group. Liên hệ xem nhà: Em Dương 0965 94 8983.",13/10/2022,Tin thường,batdongsan_so_com_vn_1673795029.185078,
3 tỷ VNĐ,Đường Yên Hòa Đại Mỗ phường Đại Mỗ, 32m2, 4, 4, 5, 4,,"+ Vị trí đắc địa,rất hiếm nhà bán, điện tích 32 m2 x 5 tầng giá nhỉnh 3 tỷ có thương lượng với ai thiện trí mua sớm. Nhà thiết kế, + Tầng 2 và 3: 4 phòng ngủ và wc. đỏ  ",13/10/2022,Tin thường,batdongsan_so_com_vn_1673795034.1379073,
"1,8 tỷ VNĐ","đường 5, Đông trù, Đông anh HN", 83m2,,, 10, 3, 2,"Bán căn hộ 83m2, căn góc hướng mát view đẹp.Căn hộ rộng, 3 phòng ngủ phù hợp với nhiều gia đình từ 3-4 người trở lên.Cách trung tâm nội đô chỉ 15 phút đi xe.Có đầy đủ các tiện ích hiện đại và cao cấp như TTTM, GYM, hồ bơi 4 mùa, công viên caasys xanh...Gía bán 1,8 tỷ/ căn.Đóng trước 70% được chiết khấu 6% giá trị căn hộ.LH ; Mr Hoàng : 0904.979.521",13/10/2022,Tin thường,batdongsan_so_com_vn_1673795036.2414641, Đông bắc
"4,65 tỷ VNĐ",Đường Hoàng Đạo Thành phường Kim Giang, 30m2, 3, 4, 5, 3, 4,"
    -NHÀ GẦN KIM GIANG-THANH XUÂN-GẦN NGÃ TƯ SỞ- NGÕ THÔNG-5M RA NGÕ OTO TRÁNH ,ĐỖ NGÀY ĐÊM- Tầng 1: PK, bếp, wc.
Tầng 2,3,4: Mỗi tầng 1PN, wc.
Tầng 5: Phòng thờ sân phơi.-Gần Trường Học ,Chợ,Ngã Tư Sở,Khương Đình ",13/10/2022,Tin thường,batdongsan_so_com_vn_1673795037.5692155,
"3,85 tỷ VNĐ",Đường Quang Trung phường Quang Trung, 33m2,, 1, 4, 3, 3,"
    - Nhà nằm vị trí mặt ngõ ô tô tránh thông khắp nơi, kinh doanh tốt.- Khu vực cơ sở hạ tầng đang phát triển mạnh mẽ.- Nhà lô góc kinh doanh thì cực đỉnh.- Xung quanh dân cư đông đúc tiện ích không thiếu thứ gì.- Nhà thiết kế 4 tầng 33m2 giá 3.85 tỷ.+ T1: Gara + bếp WC+ T2,3: mỗi tầng 1 ngủ + WC+ T4: 1 ngủ + phòng thờ sân phơi- Sổ đỏ vuông vức sẵn sàng giao dịch.- Liên hệ:+ Ngọc Ánh thổ cư (miễn TG-MG): 0836582666
",13/10/2022,Tin thường,batdongsan_so_com_vn_1673795038.7453485,
5 tỷ VNĐ,Đường Thái Hà phường Ô Chợ Dừa, 40m2, 4, 4, 5, 4, 3,"
    

BÁN NHÀ GẤP KHU VỰC ĐỐNG ĐA HOÀNG CẦU VÕ VĂN DŨNG TRẦN QUANG DIỆU. NHÀ MỚI ĐẸP CHỈ CẦN XÁCH VALI Ở LUÔN
 
10M RA PHỐ, NGÕ RỘNG 3M ( 3 GÁC TRÁNH XE MÁY ). CẠNH HỒ HOÀNG CẦU.

 Mô Tả: 
- Vị trị nhà miễn bàn, nhà mình đầu hồi 10m ra phố ngõ trước nhà lý thuyết ÔTÔ, hàng xóm vs Tân Hoàng Minh.
- Nhà dân xây khung cột bê tông cực chắc chắn, hiện đang cho thuê cả nhà 15tr/ tháng. 
Thiết Kế : 5 Tầng Cầu Thang Giữa
- Tầng 1: Để xe + BẾP + KHÁCH
- Tầng 2 3 4: 2 NGỦ + WC
- Tầng 5: Phòng Thờ + Sân Phơi
SỔ ĐỎ VUÔNG VẮN TRƯỚC SAU NHƯ 1.
 
",13/10/2022,Tin thường,batdongsan_so_com_vn_1673795039.9849727,
