price,address,Diện tích,Mặt tiền,Lộ giới,Số tầng,Số phòng ngủ,Số toilet,Details,Ngày đăng,Loại tin,id
"6,7 tỷ VNĐ",Đường Lê Trọng Tấn phường Định Công, 60m2, 4, 2, 5, 9, 9,"
    
Ban Ccmn Trần Cung - Cầu giấy 60m2 x 5T Mtien 4.7m giá 6.75

- Nhà dòng tiền Trần Cung , 500tr/1 năm
- Khu vip cầu giấy trung tâm xung quanh là, đh ngoại giao, ngoaii thương vip
- 2 mặt thoáng trước sau 9 phòng khép kín 
-Trước nhà hơn 2m từ nhà ra oto tránh gần
mới tinh - 9 phòng cho thuê đẹp như tranh - dòng tiền hơn 600 triệu/ năm, sát hồ - sổ đỏ phân lô - không thể hiếm hơn.
+ 9 phòng cho thuê đẹp long lanh, full phòng full đồ cho khách hàng. Chủ hỗ trợ lấp kín 9 phòng rồi khách mới phải thanh toán đủ tiền nhà.
Nội thất đầy đủ: Điều hòa, , giường tủ, chăn ga đệm... Khách chỉ việc mang vali đến ở.
+ Khu vực dân trí cao,. 
+ khu vực có lượng ng thuê nhu cầu cao. Quanh là các trường đại học lớn và thuận tiện đi lại 
+ Sổ vuông chính chủ
- LH 0347269248 mr Tuấn
",19/09/2022,Tin thường,batdongsan_so_com_vn_1673800774.583026
"34,89 tỷ VNĐ",123 Quốc Tử Giám, 151m2,,,,,,"MẶT PHỐ QUỐC TỬ GIÁM – ĐỐNG ĐA – QUY HOẠCH RÕ RÀNG, 151M2 – 34.89 TỶ Bán nhà 5 tầng cũ mặt phố Quốc Tử Giám – Đống Đa. Vị trí kinh doanh đẳng cấp – Quy hoạch ổn định Nhà cũ không có gì để miêu tả, đang cho thuê một phần để kinh doanh + văn phòng, mục đích chủ yếu để nhà luôn ấm cúng với giá yêu thương 75tr/tháng. Với hơn 200tr/m2 mặt phố trung tâm, mảnh đất phù hợp với mọi mục đích: Kinh doanh hoặc đơn giản chỉ để ở  - Liên hệ: K.S Phương – 0918120568 để được tư vấn về ngôi nhà và gặp chủ đàm phán trực tiếp",19/09/2022,Tin thường,batdongsan_so_com_vn_1673800775.735942
"3,95 tỷ VNĐ",Đường Minh Khai phường Mai Động, 33m2, 4, 3, 4, 4, 3,"
    Bán nhà MINH KHAI, NGÕ NÔNG, 3 GÁC CHẠY-2 THOÁNG-NHÀ MỚI, 33m2 x 4 tầng x 4 ngủ, Giá hơn 3 tỷ có thương lượng
 Cam kết ảnh thật, thông tin và pháp lý chuẩn
 Liên hệ để được tư vấn và xem nhà miễn phí
 Em Nam 0973.659.609 hoặc inb Zalo/FB
(Miễn trung gian, Môi giới)
",19/09/2022,Tin thường,batdongsan_so_com_vn_1673800777.404477
12 tỷ VNĐ,Đường Vạn Phúc phường Vạn Phúc, 48m2, 3, 20, 3, 4, 3,""",""sans-serif"";="""" color:="""" #001a33;="""" mso-ansi-language:="""" vi'mẶt="""" phỐ="""" vip="""" vẠn="""" phÚc="""" –="""" trung="""" tÂm="""" hÀ="""" ĐÔng="""" vỈa="""" hÈ="""" rỘng="""" kinh="""" doanh="""" sẦm="""" uẤt="""" nhẤt="""" span="""" p="""" class=""MsoNormalSPAN"" vi'="""">* Chính chủ cần bán gấp nhà Mặt phố Vạn Phúc, Hà Đông. "",""sans-serif"";="""" color:="""" #001a33;="""" mso-ansi-language:="""" vi'*="""" diện="""" tích="""" 45m="""" thực="""" tế="""" 48m,="""" nhà="""" 3="""" tầng,="""" mặt="""" tiền="""" 3m.="""" span="""" p="""" class=""MsoNormalSPAN"" vị="""" trí="""" đắc="""" địa="""" nằm="""" trên="""" mặt="""" phố="""" vạn="""" phúc="""" kết="""" nối="""" giữa="""" đường="""" quang="""" trung,="""" nguyễn="""" trãi="""" và="""" tố="""" hữu,="""" lê="""" văn="""" lương,="""" Đại="""" mỗ="""" tiếp="""" giáp="""" với="""" các="""" quận="""" hà="""" Đông="""" -="""" nam="""" từ="""" liêm="""" thanh="""" xuân="""" nên="""" lưu="""" lượng="""" người="""" đi="""" qua="""" rất="""" đông,="""" phù="""" hợp="""" cho="""" kinh="""" doanh,="""" buôn="""" bán,="""" phòng…="""" vi'="""">* Nhà mặt phố phù hợp kinh doanh mọi loại hình như, showroom, cửa hàng, hiệu thuốc, văn phòng, công ty, nhà hàng, spa... "",""sans-serif"";="""" color:="""" #001a33;="""" mso-ansi-language:="""" vi'*="""" hồ="""" sơ="""" pháp="""" lý="""" chuẩn,="""" sổ="""" đỏ="""" chính="""" chủ.="""" span="""" p="""" class=""MsoNormalSPAN"" giá="""" chào:="""" 12="""" tỷ="""" (có="""" thương="""" lượng)="""" vi'="""">* Liên hệ xem nhà: 0902083139 ",19/09/2022,Tin thường,batdongsan_so_com_vn_1673800778.9972446
"1,88 tỷ VNĐ",Đường Trần Khát Chân phường Thanh Lương, 25m2, 5, 3, 4, 3, 3,"Nằm ở vị trí giữa Thủ Đô bước ra cửa là các con phố lớn Trần Khát Chân, Võ Thị Sáu, Lò Đúc… Vô vàn tiện ích bệnh viện Thanh Nhàn, Bạch Mai, 108. Trường cấp 1,2,3 & Đại Học Bách Khoa, Xây Dựng, Kinh Tế. An sinh Lý tưởng với nhiều Công Viên xung quanh khu nhà. + Tầng 1 : phòng khách & bếp + nhà xe. + Tầng 2-3-4 : phòng ngủ và nhà vệ sinh. Khu dân trí văn hóa cao, với mặt tiền rộng căn nhà được phô diễn tất cả nội thất. -          SĐT & Zalo :0782479469 (Hải789) ",19/09/2022,Tin thường,batdongsan_so_com_vn_1673800780.240926
"6,5 tỷ VNĐ",Đường Phúc Diễn phường Cầu Diễn, 33m2, 3, 5, 6, 3, 5,"+ Nhà SIÊU ĐẸP, khách mua chỉ việc xách vali đến ở. Nhà số phát lộc, đường trước nhà ô tô đỗ ngày đêm, vỉa hè thanh thang.  Thiết kế:  - Tầng 1: ga ra 7 chỗ, wc.  - Tầng 2: Phòng khách, bếp,wc, ban công cafe.  - Tầng 3+4 mỗi tầng 1 phòng ngủ rộng, wc, cầu thang cuối nhà.  - Tầng 5 : 1 phòng ngủ, sân phơi.  - Tầng 6: cafe buổi tối, đặt cỗ ăn ban ngày khi nhà có công việc. Nhà đẹp ngất ngây, chủ mới mua chỉ việc xách vali về hưởng thụ.  + Vị trí : Sát trường Đại học Tài Nguyên môi trường, dân cư đông đúc, kinh doanh sầm uất.  + Chủ cần bán nhanh để ra mua mặt phố to rộng đẹp hơn. + Liên hệ Mr Yên để biết thêm thông tin. + Nguồn hàng phong phú, nhiệt tình, tận tâm.",19/09/2022,Tin thường,batdongsan_so_com_vn_1673800781.301409
"3,25 tỷ VNĐ",Đường Quyết Thắng phường Yên Nghĩa, 55m2, 4, 2, 3, 4, 4,"Vị trí đắc địa.Gần trường học các cấp mầm non,cấp 1,cấp2, đại hoc.An ninh tốt,Đăcj biệt gần siêu thị Aeon Hà Đông. Cuối tuần thỏa sưc vui chơi mua sắm. -Nhà 3 tầng,đầy đủ công năng -Tầng 1:Khu để xe,phòng khách,khi rửa đồ,bếp, wc -Tầng 2:, Khòng ngủ,ban công,wc -Tầng 3:2 Phòng ngủ, sân phơi,wc-Nhà sát quốc lộ 6,an ninh tốt,phù hơp cho mọi gia đình.Vì gần trường các cấp,mầm non,cấp1,cấp2,đại học....công viên văn -Sổ đỏ pháp lý chuẩn *Anh chị nào đang có nhu cầu tìm mua nhà khu vực Hà Đông, cứ liên hệ Tôi. A. Hóa-Nhà Phố-SĐT: 0983199056Tư vấn nhiệt tình. *Mua nhà là 1 việc lớn.Cần phảithận trọngxem xét kỹ,khảo sát nhiều căn.Anh chị đừng ngại,không mua, không sao,Cứ đi qua tham khảoxem nhà vô tư.Dẫn Anh Chị đi xem nhà là niềm vui của Tôi.Nếu Bạn ở xa,bên Tôi có hỗ trợ xe đưa đón khách đi xem nhà miễn phí.  ",19/09/2022,Tin thường,batdongsan_so_com_vn_1673800782.2917602
3 tỷ VNĐ,Đường Khâm Thiên phường Trung Phụng, 35m2, 3, 10, 5, 4, 4,"Chính chủ bán nhà Khâm Thiên, Đống Đa 35m2 x 5T, MT 3.6m, nhỉnh 3 tỷ. + Ngõ nông, thoáng, giao thông thuận tiện đi các ngả, nhà cách mặt phố vài bước chân, DÂN TRÍ CAO, kinh doanh online tuyệt vời gần chợ dân sinh, nhiều trường điểm các cấp, công viên Thống Nhất.+ Nhà xây kiên cố, khung cột bê tông chắc chắn, sáng thoáng, các tầng đều có vệ sinh khép kín.+ Sổ đỏ vuông vắn, đẹp, NỞ HẬU chính chủ,  chủ thiện chí, sẵn sàng giao dịch bất cứ khi nào.+ Liên hệ: Phú Khang, 0966037496 (Kho hàng phong phú đa dạng)Zalo: 0966037496",19/09/2022,Tin thường,batdongsan_so_com_vn_1673800783.5803118
10 tỷ VNĐ,Trường Chinh, 44m2,,, 5,,,"+ Vị trí đẹp nhất Phố Trường Chinh, Ô TÔ tránh 2 vỉa hè rộng, Ô TÔ chạy vòng quanh nhà, cách mặt Phố 20m, giao thông thuận tiện.+ Đặc điểm cực hiếm: Lô góc 3 mặt ngõ, 2 mặt ngõ ô tô tránh 2 vỉa hè rộng và 1 mặt ngõ 2 ba gác tránh nhau. Phù hợp kinh doanh tất cả mặt hàng.+ Giá: Nhỉnh 10 Tỷ.+ Sổ đỏ vuông đẹp, pháp lý chuẩn, sẵn sàng dao dịch.  LH: Em Hoan, 0925088355, nhiệt tình, vui vẻ dẫn khách, miễn phí xem nhà 24/7.",19/09/2022,Tin thường,batdongsan_so_com_vn_1673800784.7062995
"13,9 tỷ VNĐ",Đường Kim Đồng phường Giáp Bát, 47m2, 4, 8, 6, 2, 5,"Phố Kim Đồng 6 TẦNG LÔ GÓC, THANG MÁY, KINH DOANH, VỈA HÈ, Ô TÔ TRÁNH 13.89 Tỷ Tòa nhà phù hợp kinh doanh VP 6 Tầng Thang Máy lô góc 1 mặt đường 1 mặt ngõ Tầng 1 Kinh Doanh Tầng 2,3,4,5,6 Thông sàn Vị trí đẹp, Mặt chính O TÔ tránh, Vỉa hè rộng rãi, cách vài nhà ra mặt đường Kim Đồng Con Phố Kim Đồng sầm uất nổi tiếng, dân cư toàn Công An, Bộ Đội, lãnh đạo Ngân Hàng Chi tiết hơn xin liên hệ Quang Nhà đất thổ cư ! ",19/09/2022,Tin thường,batdongsan_so_com_vn_1673800786.1564214
"3,3 tỷ VNĐ",Đường Ngô Gia Tự phường Đức Giang, 36m2, 4, 3, 5, 4, 4,,19/09/2022,Tin thường,batdongsan_so_com_vn_1673800787.8538842
"2,9 tỷ VNĐ",Đường Xa La phường Phú La, 34m2, 4, 1, 5, 3, 4,"+ Chủ xây tâm huyết, xây cho con trai ở nhưng con trai định cư Nhật ko về  + Liên Hệ: Thanh Bình BĐS : 0353782113 – để xem nhà và tư vấn, hỗ trợ về Pháp Lý, Ngân hàng",19/09/2022,Tin thường,batdongsan_so_com_vn_1673800789.1384442
29 tỷ VNĐ,Đường Hoàng Cầu phường Ô Chợ Dừa, 93m2, 8, 5, 9, 28,,"+ Bán căn CCMN phố Hoàng Cầu, vị trí lô góc đắc địa, gần các trục phố lớn như Đê La Thành, Thái Hà, Hào Nam, Ô Chợ Dừa, v.v... + Tòa nhà bề thế với diện tích 93m2, 9 tầng thang máy, hầm để xe, với tổng cộng 28 căn hộ cho thuê đang vận hành hết công suất, mang đến dòng tiền hơn 2 tỷ mỗi năm. + Ngõ vào ô tô, an sinh đỉnh cao, tiện ích xung quanh không thiếu gì. + Lh: 0973222992 / 0906296696 Mr Tâm chuyên nhà đẹp Hà Nội (nhận ký gửi).",19/09/2022,Tin thường,batdongsan_so_com_vn_1673800790.189631
5 tỷ VNĐ,Đường NGUYỄN TRÃI phường Ngã Tư Sở, 36m2, 3, 3, 5, 3, 3,"
    
Ô TÔ ĐỖ CỬA- LÔ GÓC- TRƯỚC NHÀ THOÁNG- 10M RA MẶT PHỐ - NHÀ ĐẸP ĐẦY ĐỦ CÔNG NĂNG.

Bán nhà Quận Đống Đa ,36m2 x 5 Giá nhỉnh 5tỷ.

+ Nhà đã hoàn thiện xong đẹp khách chỉ việc về ở.
+ Nhà lô góc 2 mặt thoáng, thiết kế đầy đủ công năng.

- Sổ đỏ pháp lý chuẩn, cất két chờ giao dịch.
",19/09/2022,Tin thường,batdongsan_so_com_vn_1673800792.3009832
"9,6 tỷ VNĐ",Đường Giáp Bát phường Giáp Bát, 45m2, 3, 4, 6, 4, 5,"Nhà Kim Đồng phố VIP 6 tầng, Thang máy, đường oto tránh 10 tỷ -Căn nhà đẹp như trong tranh, thang máy, nội thất nhập khẩu, mặt ngõ thông  to hơn mặt phố oto tránh nhau -Nhà 6 tầng diện tích 50m Mặt tiền 4,4m sổ đỏ vuông như viên gạch - Từ T1 đến T4 thông sàn, thang máy, cầu thang bộ, WC cuối thuận tiện làm văn phòng, kinh doanh hay ở đều đẹp T5 bếp, phòng ăn T6 tum, phòng thờ chi tiết hơn xin lh Quang nhà đất thổ cư Hà Nội ",19/09/2022,Tin thường,batdongsan_so_com_vn_1673800794.1410608
"9,6 tỷ VNĐ",Đường Phúc Đồng phường Phúc Đồng, 52m2, 4, 15, 6, 4, 5,""",="""" segoeuipc,="""" ""san="""" francisco"",="""" ""helvetica="""" neue"",="""" helvetica,="""" ""lucida="""" grande"",="""" roboto,="""" ubuntu,="""" tahoma,="""" ""microsoft="""" sans="""" serif"",="""" arial,="""" sans-serif;="""" white-space:="""" pre-wrap;="""" word-spacing:="""" 0px;="""" text-transform:="""" none;="""" font-weight:="""" 400;="""" color:="""" rgb(0,26,51);="""" font-style:="""" normal;="""" orphans:="""" 2;="""" widows:="""" letter-spacing:="""" background-color:="""" rgb(229,239,255);="""" text-indent:="""" user-select:="""" text;="""" font-variant-ligatures:="""" font-variant-caps:="""" -webkit-text-stroke-width:="""" text-decoration-style:="""" initial;="""" text-decoration-color:="""" initial'bán="""" nhà="""" khu="""" 918="""" phân="""" lô="""" vỉa="""" hè,="""" ÔtÔ="""" tránh,6tx4n="""" thang="""" máy="""" ở="""" cực="""" thích="""" span="""" p="""" pspan="""" initial'+="""" phúc="""" Đồng="""" bộ="""" lô,="""" hè="""" ô="""" tô="""" tránh="""" thông="""" tứ="""" phía.="""" initial'="""">+ Nhà mới xây, 6 tầng, thang máy, thông sàn, thoáng trước sau.  "",="""" segoeuipc,="""" ""san="""" francisco"",="""" ""helvetica="""" neue"",="""" helvetica,="""" ""lucida="""" grande"",="""" roboto,="""" ubuntu,="""" tahoma,="""" ""microsoft="""" sans="""" serif"",="""" arial,="""" sans-serif;="""" white-space:="""" pre-wrap;="""" word-spacing:="""" 0px;="""" text-transform:="""" none;="""" font-weight:="""" 400;="""" color:="""" rgb(0,26,51);="""" font-style:="""" normal;="""" orphans:="""" 2;="""" widows:="""" letter-spacing:="""" background-color:="""" rgb(229,239,255);="""" text-indent:="""" user-select:="""" text;="""" font-variant-ligatures:="""" font-variant-caps:="""" -webkit-text-stroke-width:="""" text-decoration-style:="""" initial;="""" text-decoration-color:="""" initial'+="""" thích="""" hợp="""" ở,="""" làm="""" văn="""" phòng,...="""" span="""" p="""" pspan="""" gần="""" sân="""" golf="""" long="""" biên,="""" aeon="""" mall="""" biên.="""" khu="""" vực="""" an="""" sinh="""" đỉnh.="""" không="""" khí="""" trong="""" lành.="""" hàng="""" xóm="""" thân="""" thiện.="""" initial'="""">- Chợ cách nhà chỉ 20 bước chân.  "",="""" segoeuipc,="""" ""san="""" francisco"",="""" ""helvetica="""" neue"",="""" helvetica,="""" ""lucida="""" grande"",="""" roboto,="""" ubuntu,="""" tahoma,="""" ""microsoft="""" sans="""" serif"",="""" arial,="""" sans-serif;="""" white-space:="""" pre-wrap;="""" word-spacing:="""" 0px;="""" text-transform:="""" none;="""" font-weight:="""" 400;="""" color:="""" rgb(0,26,51);="""" font-style:="""" normal;="""" orphans:="""" 2;="""" widows:="""" letter-spacing:="""" background-color:="""" rgb(229,239,255);="""" text-indent:="""" user-select:="""" text;="""" font-variant-ligatures:="""" font-variant-caps:="""" -webkit-text-stroke-width:="""" text-decoration-style:="""" initial;="""" text-decoration-color:="""" initial'+="""" sổ="""" đỏ="""" cất="""" két="""" sẵn="""" sàng="""" giao="""" dịch.="""" span="""" p="""" pspan="""" initial'lh:="""" em="""" thu="""" span0916488589span="""" initial'=""""> để xem vị trí , pháp lý và đàm phán giá.",19/09/2022,Tin thường,batdongsan_so_com_vn_1673800796.510721
9 tỷ VNĐ,Đường Ngọc Thụy phường Ngọc Thụy, 113m2, 4, 1, 1, 1, 1,"
     BÁN  ĐẤT TẶNG NHÀ C4  NGỌC THỤY ÔTÔ TRÁNH NHAU - KINH DOANH TẤP NẬP - TƯƠNG LAI TƯƠI SÁNG - TIỆN ÍCH NGẬP TRÀN DT 113M, MT 4.5M CHỈ HƠN 80Tr/m + Vị trí  đẹp gần Khai Sơn Hill nơi đáng sống nhất Ngọc Thụy.
+ Gần đường 42M2 nối Hồng Tiến, Nguyễn Văn Cừ. 
+ Gần trường quốc tế pháp và các trung tâm thương mại, bệnh viện quốc tế thuộc dự án Khai Sơn đang chuẩn bị khởi công.
+ 250M đến công viên, hồ điều hòa.
+ Mảnh đất siêu hiếm, tương lai mở rộng đường giá trị tăng lên gấp nhiều lần.
+ Hiện trạng nhà cấp 4, VinMart muốn thuê 5 năm nhưng chủ quyết bán không cho thuê.KHÁCH MUA VỀ CHO THUÊ CÓ NGAY  DÒNG  TIỀN PHÁP LÝ CHUẨN, SỔ  ĐỎ SẴN  SANG. Liên hệ : Em Thu 0916488589  Xem nhà , Pháp Lý và đàm phán giá.
",19/09/2022,Tin thường,batdongsan_so_com_vn_1673800798.1883216
"3,3 tỷ VNĐ",Đường Xuân Đỗ phường Cự Khối, 70m2, 4,,,,,"+ Vị trí đắc địa, ngay gần Khu TĐC Cự Khối, đất sát mặt hồ cực thoáng, giao thông kết nối với ngõ Bát Khối, đường Cổ Linh, Cầu Thanh Trì.+ Đường vào đất rộng thoáng, 2 ô tô tránh nhau, ô tô 7 chỗ đánh vào nhà thoải mái. + Thử đất 70m2x4m mặt tiền vuông đẹp, thoáng trước sau vĩnh viễn, phù hợp với mọi loại khách mua.+ Sổ đỏ chính chủ, vuông đẹp, giá chào 3.3 tỷ có thương lượng.+ Liên hệ: 0979057536 Trung Kiên để được tư vấn và xem nhà miễn phí.+ CAM KẾT THÔNG TIN NHÀ và ẢNH THẬT 100%",19/09/2022,Tin thường,batdongsan_so_com_vn_1673800799.5337658
"5,2 tỷ VNĐ",Đường Đào Tấn phường Cống Vị, 33m2, 4, 7, 6, 3, 5,"Trung tâm Ba Đình 6T chỉ 5.2 tỷ Ô TÔ ĐỖ CỔNG, Ở NGAY 0912288365. Nhà phố Đội Cấn ô tô đỗ cổng, cách mặt phố chỉ 20m mà giá có 5.2 tỷ. Căn nhà xây mới đầy đủ công năng, nội thất đầy đủ, khách mới mua về ở ngay. Ngay gần Linh Lang, Đào Tấn, Phan Kế Bính… Sổ đỏ chính chủ pháp lý rõ ràng. Giá bán 5.2 tỷ LH Call/Zalo Cường Nhà Phố 0912288365. ( Miễn phí xem nhà, hỗ trợ pháp lý, cùng hàng nghìn căn nhà đẹp giá tốt )",19/09/2022,Tin thường,batdongsan_so_com_vn_1673800800.731518
"2,2 tỷ VNĐ",Đường Thạch Bàn phường Thạch Bàn, 41m2, 4,,,,,"
    BÁN ĐẤT OTO ĐỖ CỔNG PHỐ THẠCH BÀN QUẬN LONG BIÊN 41M- Vị trí: NGÕ OTO TRÁNH, SÁT CHỢ THẠCH BÀN, hàng xóm AEON, vài bước lên cầu VĨNH TUY.- Tiềm năng PHÁT TRIỂN cao.- ĐẦU TƯ giữ tiền, xây nhà đều hợp lý:- DT: 41 m2; MT: 4,5m. Chỉ hơn 50tr/m2'- Chuyên môi giới nhà đất Long Biên với nhiều năm kinh nghiệm.- Cam kết: TƯ VẤN, XEM NHÀ MIỄN PHÍ.- KHÁCH HÀNG TRỰC TIẾP ĐÀM PHÁN VỚI CHỦ.- UY TÍN - TẬN TÂM - CHUYÊN NGHIỆP.
",19/09/2022,Tin thường,batdongsan_so_com_vn_1673800802.4738545
