price,address,Diện tích,Mặt tiền,Số tầng,Details,Ngày đăng,Loại tin,id,Lộ giới,Số phòng ngủ,Số toilet,Hướng
9 tỷ VNĐ,Quan Nhân, 50m2, 4, 5,"+ Trung tâm Quận Thanh Xuân, tiện ích vô vàn. Thông sang Nhân Hòa, Vũ Trọng Phụng, Nguyễn Trãi.+ Vị trí đẹp, mặt ngõ thông, 2 ô tô tránh nhau, phù hợp kinh doanh tất cả mặt hàng hoặc ở thì tuyệt vời.+ Sổ đỏ vuông đẹp, pháp lý chuẩn, sẵn sàng dao dịch.  LH: Em Hoan, 0925088355, nhiệt tình, vui vẻ dẫn khách, miễn phí xem nhà 24/7.",18/09/2022,Tin thường,batdongsan_so_com_vn_1673800931.7626324,,,,
,Đường Hoàng Như Tiếp phường Bồ Đề,,, 4,"- Nhà gần Vườn hoa Bồ Đề Xanh khu vực khuôn viên HC Golden.  - Hệ thống trường công lập Trường Tiểu Học Ngọc Lâm, Trường THCS Ngọc Lâm, Trường PTTH Nguyễn Gia Thiều nổi tiếng của Hà Nội,....  ",18/09/2022,Tin thường,batdongsan_so_com_vn_1673800933.405237, 5, 5, 4,
2 tỷ VNĐ,Đường Thượng Cát phường Thượng Thanh, 38m2, 4, 1,"Bán nhà Thượng Cát, Long Biên, DT 38m, 1.5 Tầng, MT4m, Giá hơn 2 tỷ. SẠCH ĐẸP - NHỎ XINH - 10M ĐƯỜNG Ô TÔ + Nhà cấp 4: 1 tầng, 1 gác lửng sạch đẹp, khách mua về cấm sửa, chỉ việc ở luôn. + Ngõ thông thoáng, vài chục m ra đường Lý Sơn + Căn nhà nằm ngay sát khu Himlam, khu Tái Định Cư giá lên từng ngày. + Chỉ mất vài phút là tới Trường cấp 1, 2, 3.  + Khu ngõ dân trí cao, sạch sẽ. + Hiện trạng nhà C4 có gác xép, phù hợp cho cặp vợ, chồng hai con ở thoải mái. Có điều kiện xây căn 5 tầng thì quá đẹp. + Sổ đỏ phân lô không thể đẹp hơn, trước sau như một. LH: 
",18/09/2022,Tin thường,batdongsan_so_com_vn_1673800934.5302277, 3, 2, 1,
"46,78 tỷ VNĐ",21 Lê Văn Lương, 201m2, 8, 1,"LÊ VĂN LƯƠNG – THANH XUÂN, 201M2 ĐẤT MẶT TIỀN 8.2M, 46.78 TỶ - Chính chủ  nnhờ bán 201m2 đất mặt tiền 8m ngõ 21 Lê Văn Lương – Thanh Xuân. Khu vực giáp giữa Thanh Xuân và Cầu Giấy, kết nối Hoàng Đạo Thúy – Nguyễn Thị Định – Nguyễn Chí Thanh …. Khu vực tập trung cực nnhiều các công ty, tòa nhà văn phòng … - Vị trí cực đẹp, phân lô – vỉa hè, phù hợp xây tòa nhà văn phòng như hàng xóm đang xây - Sổ đỏ đẹp, sẵn sàng giao dịch. Chủ  thiện chí - Liên hệ: K.S Phương – 0918120568 để được tư vấn về mảnh đất và gặp chủ đàm phán trực tiếp",18/09/2022,Tin thường,batdongsan_so_com_vn_1673800935.9667666,, 1, 1,
"2,35 tỷ VNĐ",Đường Ngọc Lâm phường Ngọc Lâm, 22m2, 3, 1,"+ Vị trí nhà cạnh trung tâm thương mại Mipec Long Biên, khu vực đông dân cư, ba bước chân ra phố lớn, gần bãi đỗ xe. + Khu vực kinh doanh sầm uất với nhiều công ty, nhà hàng, giao thương thuận lợi, 5 phút sang phố cổ hoa lệ.+ Tầm tiền hiếm cả khu không có căn thứ 2. + Hiện trạng nhà cấp 4 rất hiếm cả về diện tích lẫn vị trí.+ Sổ đỏ chính chủ, giá chào 2.35 tỷ có thương lượng.+ Liên hệ: 0979057536 Trung Kiên để được tư vấn và xem nhà miễn phí.+ CAM KẾT THÔNG TIN NHÀ và ẢNH THẬT 100%",18/09/2022,Tin thường,batdongsan_so_com_vn_1673800937.201083, 2, 1, 1,
"5,98 tỷ VNĐ",Đường Bồ Đề phường Bồ Đề, 61m2, 3, 4,"Bán nhà Ngõ 53 Bồ Đề  61mx4T, 5N hơn 5 tỷ. Nhà đẹp,ở ngay LH0916488589 + Tiện ích cực tiện:       -  Nhà gần Vườn hoa Bồ Đề Xanh khu vực khuôn viên HC Golden.       - Bệnh Viện Đa Khoa Tâm Anh bậc nhất thành phố.       - Trường Quốc tế Wellspring liên cấp đẳng cấp.       - Hệ thống trường công lập Trường Tiểu Học Ngọc Lâm, Trường THCS Ngọc Lâm, Trường PTTH Nguyễn Gia Thiều nổi tiếng của Hà Nội,....        - Gần chợ trên đường về nhà cực thuận tiện chị em đi chợ tiết kiệm nhiều thời gian. + Vị trí Mặt ngõ 53 Ôtô thông cực tiện lợi   + Diện tích đất 61m2 nhà dân tự xây 4 tầng 1 tum tâm huyết có vườn lan mát phía sau có khe thoáng sáng ở cực sướng. + Sổ đỏ pháp ký chuẩn. + Liên hệ: E Thu 0916488589  Xem nhà, Pháp Lý và đàm phán giá.",18/09/2022,Tin thường,batdongsan_so_com_vn_1673800938.4218166, 5, 5, 4,
"12,8 tỷ VNĐ",Xuân Thủy Cầu Giấy Hà Nội, 62m2,, 7,"GẤP- 10 CĂN HỘ CCMN THANG MÁY NGÕ THÔNG GẦN PHỐ XUÂN THỦY CG 62M2 7T MT 5.2M CHỈ 12.8 TỶNgõ  Xuân Thủy vỉa hè ô tô dừng đỗ ngày đêm, ngay đối diện Đại học Quốc Gia, Đại học Sư Phạm Hà Nội, Học viện Báo Chí Tuyên Truyền, Đại học Thương Mại,... khu vực có nhu cầu thuê căn hộ nhiều nhất nhì thành phố Hà Nội.+ Tòa nhà xây mới tinh, thiết kế hiện đại, tối ưu tối đa công năng CCMN cao cấp.+ Thiết kế:- Tầng 1: Khách, để xe.- Tầng 2,3,4,5,6: Mỗi tầng 2 phòng ngủ khép kín, có ban công.- Tầng 7: Sân phơi, sân chơi, giải trí.+ Pháp lý chuẩn, sổ đỏ chính chủ, giao dịch trong ngày.Liên hệ: Mrs Phượng 0974352054 - Tư vấn tận tâm, miễn phí 24/24h (zalo, Fb) , hỗ trợ tư vấn Pháp lý, vay vốn.",18/09/2022,Tin thường,batdongsan_so_com_vn_1673800940.2269924,, 10, 10,
13 tỷ VNĐ,Đường Vĩnh Phúc phường Vĩnh Phúc, 41m2, 4, 5,"Mặt phố Ba Đình 41m 5T MT4 13 tỷ VỈA HÈ 7M, KINH DOANH 0912288365
Nhà mặt phố quận Ba Đình xây dựng 5 tầng mặt tiền rộng 4m có vỉa hè 7m. Hiện tại đang Kinh doanh SPA rất đông khách.
Thiết kế hiện đại đầy đủ công năng, full nội thất xịn.
Rất phù hợp Kinh doanh: Ngân Hàng, SPA, Văn Phòng công ty…
Sổ đỏ chính chủ pháp lý rõ ràng.
Giá bán 13 tỷ
LH Call/Zalo Cường Nhà Phố 0912288365. ( Miễn phí xem nhà, hỗ trợ pháp lý, cùng hàng nghìn căn nhà đẹp giá tốt )
",18/09/2022,Tin thường,batdongsan_so_com_vn_1673800941.4866233, 30, 5, 5,
25 tỷ VNĐ,Đường KĐT Sài Đồng  phường Sài Đồng, 270m2, 15, 4,"            - LH: 0902159015- Hoàng Thùy Linh
",18/09/2022,Tin thường,batdongsan_so_com_vn_1673800943.1840785, 20, 4, 4,
"12,5 tỷ VNĐ",Hồ Tùng Mậu Mai Dịch Cầu Giấy Hà Nội, 64m2,, 7,"Bán CCMN ô tô đỗ ngay mặt phố Hồ Tùng Mậu 65m 7T chỉ 12.5 tỷNhà có vị trí cực kỳ hiếm đẹp. Ngõ nông, thông cách mặt phố Phạm Văn Đồng, Hồ Tùng Mậu vài bước chân. Mặt ngõ kinh doanh, cạnh bãi đỗ ô tô.+ Xung quanh là các trường đại học, nhu cầu thuê phòng lớn và luôn cháy phòng.+ Nhà xây dựng thiết kế hiện đại sang đẹp. Tầng 2 phòng khép kín, thang máy ngoại nhập.+ Tổng 12 phòng full nội thất, thoáng trước sau. Dòng tiền trên 50 triệu/ tháng, hiện đã full phòng, chỉ đợi chủ mới bàn giao.+ Pháp lý chuẩn, sổ đỏ chính chủ, giao dịch trong ngày.Liên hệ: Mrs Phượng 0974352054 - Tư vấn tận tâm, miễn phí 24/24h (zalo, Fb) , hỗ trợ tư vấn Pháp lý, vay vốn.",18/09/2022,Tin thường,batdongsan_so_com_vn_1673800944.5865538,, 10,,
"1,4 tỷ VNĐ",Đường Thái Thịnh phường Thịnh Quang, 73m2, 4, 1,"
    + Diện tích: 73m2.+ Nội thất: Tủ bếp, quạt trần, tủ quần áo, giường, sàn, trần thạch cao... Nội thất cơ bản nhà đã sửa rất đẹp.
",18/09/2022,Tin thường,batdongsan_so_com_vn_1673800946.1892667, 9, 3, 2,
"4,1 tỷ VNĐ",Đường Nhân Mỹ phường Mỹ Đình 1, 40m2, 3, 5,"
    Bán nhà riêng NHÂN MỸ NAM TỪ LIÊM OTO 100M 5Tx40M chỉ 4 tỷNhà ngay gần trung tâm hành chính phường MỸ ĐÌNH nên hưởng nhiều tiện ích, an linh tốtVới nối thiết kế hiện đại nhà luôn có anh sáng thoáng mátKhu vục MỸ ĐÌNH đang phát triển tốt đường Trần Hữu Dực kéo dài nối Phạm Hùng, MỄ TRÌ TRẦN HỮU DỰC xong giá trị nhà còn tăng Với rất nhiều nhà đẹp có giá từ 3 đến 30 tỷSổ đỏ săn sàng dao dịch ngayLH Trần Hảo 0845681666 để có giá tốt tư vấn xem nhà miễn phí 24/7. Luôn mang lại Giá Tri - Uy - Tín Niềm Tin tới khách hàng
",18/09/2022,Tin thường,batdongsan_so_com_vn_1673800947.4030197, 3, 4, 4,
"3,1 tỷ VNĐ",Trương Định - Hà Nội, 30m2,,,"+ Gia đình cần bán gấp mảnh đất đường Trương Định, vị trí đẹp, ngõ oto phi vèo vèo, thông tứ phía, trong khu dân cư dân trí, tiện ích đầy đủ. Kinh doanh sầm uất ngày đêm, tiện ích đầy đủ miễn bàn.. + Vị trí nằm ngay gần đoạn nút giao Tân Mai - Trương Định - Kim Đồng, an sinh tuyệt đỉnh ba bược chạy bộ ra hồ tập thể dục chả gì bằng. + Gần hồ Đền Lừ, hưởng trọn tiện ích xung quanh nhiều tòa chung cư. Xung quanh hàng xóm xây toàn phân lô, cán bộ về ở, dân trí cao  + Gần top trường Bách Khoa, Xây Dựng, Kinh Tế Quốc Dân,…. Con em đi học tiện chăm bề, chỉ vài bước ra mặt phố Trương Định kinh doanh sầm uất ngày đêm, tiện ích đầy đủ miễn bàn.  + Sổ đỏ giêng chính chủ, đã mua nhà mới nên cực kỳ thiện trí. Giá chỉ 3.1 tỷ có gia lộc cho khách hữu duyên. Chi tiết LH: Nhật Nhà Đất  0977194820 (Chuyên Nhà đất Thổ cư với nguồn hàng Hơn 6000 Căn Nhà  Lớn nhỏ Từ 1 – 100 Tỷ trên khắp địa bàn Hà Nội sẵn sàng giúp Khách hàng tìm được những căn nhà ưng ý nhất).Lưu ý:-Tận Tâm, Uy tín , Chuyên nghiệp cái Tâm và cái Tầm đặt lên hàng đầu.- Không kênh giá chủ nhà.- Miễn phí toàn bộ dịch vụ: Dẫn khách xem nhà, tư vấn pháp lý. ",17/09/2022,Tin thường,batdongsan_so_com_vn_1673800957.797487,,,,
28 tỷ VNĐ,Đường Khâm Thiên phường Trung Phụng, 56m2, 4, 7,"Chính chủ bán nhà MẶT PHỐ Khâm Thiên 56m2 x 7T, MT 4.1m, HẦM, THANG MÁY chỉ 28 tỷ. + Nhà MẶT PHỐ, gần chợ dân sinh, công viên Thống Nhất, gần tuyến phố Lê Duẩn, Yết Kiêu, Nguyễn Du, Trần Bình Trọng, Xã Đàn, Ô Chợ Dừa....+ Nhà xây mới tinh, kiên cố, khung cột bê tông chắc chắn, có HẦM + THANG MÁY, các tầng đều có vệ sinh khép kín.+ Sổ đỏ vuông vắn, đẹp, NỞ HẬU chính chủ,  chủ thiện chí, sẵn sàng giao dịch bất cứ khi nào.+ Liên hệ: Phú Khang, 0966037496 (Kho hàng phong phú đa dạng)Zalo: 0966037496",17/09/2022,Tin thường,batdongsan_so_com_vn_1673800958.865628, 1, 7, 7,
"4,4 tỷ VNĐ","176 Định Công Hoàng Mai, HN", 98.6m2,,,"Bán nhà chung cư Sky Central tầng 25 địa chỉ số 176 phố Định Công, Phường Định Công, Quận Hoàng Mai, Hà Nội. Diện tích thông thuỷ 98.6 m2, hướng ban công đông nam, hướng cửa chính nam, view đường Giải Phóng, rất thoáng mát, buổi tối rất chill. Khu chung cư mới đẹp có nhiều tiện ích như bể bơi bốn mùa, phòng tập gym, sân chơi trẻ em, siêu thị, trường mầm non, nhà hàng, quán cà phê… Nhà gồm 3 phòng ngủ, 2 nhà vệ sinh,1 phòng bếp và 1 phòng khách tách riêng. Nhà có đầy đủ nội thất, đã có lốt để ô tô. Khu chung cư ở trung tâm, gần bệnh viện Bạch Mai, bệnh viện bưu điện, gần nhiều trường đại học…   Giá bán nhận về: 4.4 tỷ Liên hệ chính chủ: Mr.Lộc: 0988.429.795 hoặc Mrs.Lý: 0985.986.088",17/09/2022,Tin thường,batdongsan_so_com_vn_1673800960.2369592,, 3, 2, Nam
10 tỷ VNĐ,Đường Quốc lộ 5 phường Trâu Quỳ, 100m2, 5,,"⚡ĐẦU TƯ EUROWINDOW TWIN PARKS NGAY BÂY GIỜ ĐỂ KHÔNG FOMO TRONG TIẾC NUỐI ⚡ ⚜️ Mảnh đất vàng hiếm có với vị thế “ ngũ cận – lục tiện” Eurowindow Twin Parks đang trở thành cực hút dòng tiền siêu nóng thị trường phía Đông Hà Nội.  🏤 Nhất cận thị: Tọa lạc tại trung tâm hành chính mới của Gia Lâm, gần kề các đại đô thị lớn Vinhomes Ocean Park, Ecopark..., dự án sở hữu vị trí tâm điểm giao thoa, kết nối giao thương mạnh mẽ với nội thành và các tỉnh lân cận;  👨‍👩‍👧‍👦Nhị cận lân: Gần kề cộng đồng tinh hoa của các đại đô thị hiện đại,mang đến chất sống văn minh, đẳng cấp;  💧 Tam cận giang: Gần sông Hồng, sông Đuống, bao quanh bởi hệ thống hồ điều hòa 29 ha, tạo nên địa thế phong thủy vượng khí dồi dào;  🛤 Tứ cận lộ: Kề cận hàng loạt tuyến đường đang ngày càng hoàn thiện, kiện toàn: QL1, QL3, QL5, cao tốc HN- HP...; 💫Ngũ cận điền: Gia Lâm quy hoạch trở thành trung tâm giao thương, đô thị cửa ngõ tạo nhiều việc làm và động lực phát triển kinh tế. ✨ Đồng thời, địa thế “lục tiện” : Tiện kết nối – Tiện trải nghiệm – Tiện làm việc – Tiện kinh doanh – Tiện chăm sóc sức khỏe – Tiện giáo dục trẻ thơ với vô vàn tiện ích nội khu và ngoại khu đa dạng, Eurowindow Twin Parks được đánh giá là thỏi nam châm hút “bão” đầu tư, mở ra khởi nguyên phát triển của thị trường khu Đông. ✨ Với dư địa tăng giá không giới hạn, sở hữu Eurowindow Twin Parks là sở hữu “mỏ kim cương” không đáy, là mẻ lưới bội thu dành cho các nhà đầu tư có tầm nhìn thông thái. 📥 Liên hệ ngay để sở hữu những căn biệt thự - liền kề đáng giá nhất ‼️ ---------------------------------------- 🔮Eurowindow Twin Parks   Của hiếm thành Đông- Không ngừng sinh lợi 🔺Đơn vị phân phối chính thức: Đất Xanh Miền Bắc",17/09/2022,Tin thường,batdongsan_so_com_vn_1673800961.4576936,,,,
7 tỷ VNĐ,Láng, 46m2, 4, 5,"+ Vị trí đắc địa, ô tô qua nhà, mặt ngõ thông rộng, ở, kinh doanh đỉnh. Thông sang Thịnh Quang, Tây Sơn, Thái Thịnh.+ Bãi xe ô tô cách 20m, cách Ngã Tư Sở gần 200m, gần TTTM Royal City, trường học các Cấp.+ Giá: Nhỉnh 7 Tỷ.+ Sổ đỏ vuông đẹp, pháp lý chuẩn, sẵn sàng dao dịch.  LH: Em Hoan, 0925088355, nhiệt tình, vui vẻ dẫn khách, miễn phí xem nhà 24/7.",17/09/2022,Tin thường,batdongsan_so_com_vn_1673800962.5796924,,,,
"4,222 tỷ VNĐ",Đường Đa Tốn  phường Đa Tốn, 78m2,,,"Cần Bán Nhanh  Đất thổ cư thôn KHOAN TẾ Đường Nhựa ô tô vào tận nơi DT: 78,2m2. Đường nhựa, cách 1 nhà mặt đường đôi vỉa hè .Vị trí tương đối đẹp, giá nét.  Ngõ Nông , Thông Thẳng Ra Chợ Bún Gần trường tiểu học, cấp1 ,  2 , Trường mầm non  Giao thông đi lại vô cùng thuận lợi. Vị trí trung tâm cử thị trấn Xã Đa TốnSổ đó cất két sẵn sàng giao dịch Ngay  Liên Hệ Chú Đoàn để xem đất ",17/09/2022,Tin thường,batdongsan_so_com_vn_1673800963.7844696,,,,
"3,8 tỷ VNĐ",Đường Mỹ Đình phường Mỹ Đình 2, 51m2, 4, 4,"CHỈ 3,8 TỶ CÓ NGAY NHÀ MỸ ĐÌNH 51M2 4 TẦNG + Vị trí: Ngõ phố đông đúc nhôn nhịp, gần hồ thoáng mát. + Nhà dân xây chắc chắn. Hiện tại 3 mặt thoáng + Thiết kế 4 tầng -        Tầng 3: 1 Phòng ngủrộng có thể chia đôi đã đi đường điện chờ sẵn thiết bị. -: Trần Quả"",serif;="""" background:="""" white;="""" color:="""" black;="""" line-height:="""" 107%'ng="""" th="""" spanspan="""" 107%'="""" c="""">  ·        "",serif;="""" background:="""" white;="""" color:="""" black;="""" line-height:="""" 107%'tư="""" vấn="""" miễn="""" phí.="""" span="""" p="""" class=""MsoListParagraphCxSpLastSPAN"" new="""" roman""'="""" spanspan="""" 107%'="""">Gặp trực tiếp chủ nhà. ",17/09/2022,Tin thường,batdongsan_so_com_vn_1673800964.982265, 2, 2, 3,
