price,address,Diện tích,Mặt tiền,Lộ giới,Số tầng,Details,Ngày đăng,Loại tin,id,Số phòng ngủ,Số toilet,Hướng
"6,8 tỷ VNĐ",đường Phạm Văn Đồng, 50m2, 4, 2, 7,"CHUNG CƯ MINI 11 PHÒNG KHÉP KÍN, ĐỦ ĐỒ, ĐANG KÍN PHÒNG + S = 50m2, 7 tầng, mặt tiền 4m, giá 6.8 tỷ + ĐC: Đường Phạm Văn Đồng, Cầu Giấy. Vị trí vàng, gần ngã tư Hồ Tùng Mậu, Cầu Giấy, Phạm Hùng. Khu vực tập trung các trường cao đẳng, đại học lớn: Đại học Thương mại, Đại học Ngoại ngữ, Cao đẳng Du lịch, Đại học Điện lực, Đại học Quốc gia, Cao đẳng Cơ điện, Đại học Sư phạm,… Thiết kế 7 tầng, 11 phòng khép kín, đủ đồ, chủ mới khai thác ngay, dòng tiền cao và ổn định. * Sổ đỏ đẹp, chủ nhà thiện chí. * Liên hệ em Bình để xem nhà miễn phí, không tiếp môi giới.",15/09/2022,Tin thường,batdongsan_so_com_vn_1673801758.0303104,,,
"4,65 tỷ VNĐ",Tự Khoát Ngũ Hiệp HN, 61m2,,,,"+ Khu đát phân lô bàn cờ, vỉa hè rộng,  ô tô tránh, văn phòng hoặc ở đều tuyệt. + Khu dân trí cao, thanh bình, tiện ích trung tâm không thiếu thứ gì, ĐƯỜNG, TRƯỜNG, TRẠM + Cơ sở hạ tầng đồng bộ, giao thông thuận tiện. Tiện ích ngập tràn. + Nhà C4 mới xây,ở tốt hoặc đập đi xây mới 5 tầng thang máy, gara Ô Tô đẹp long lanh + Sổ đỏ chính chủ, sang tên nhanh gọn. ",15/09/2022,Tin thường,batdongsan_so_com_vn_1673801759.3149078,,,
"4,5 tỷ VNĐ","Tam Hiệp, Văn Điển HN", 45m2,,,,"+ Nhà mặt Phố 2 Tầng, Kinh doanh đa dạng + Nhà khu vực phát triển thần tốc, gần chợ đầu mối Tam Hiệp, Đường 7m, vỉa hè 3m, trước cửa công viên, Trường học các cấp đi bộ + 3m vỉa hè vào là 20m2 đất lưu không, cả dãy phố đều xây 5-6 tầng, sau nhà ngõ rộng 3m, tiện ích vô vàn.",15/09/2022,Tin thường,batdongsan_so_com_vn_1673801761.5459387,,,
"4,4 tỷ VNĐ",Đường Cầu Giấy phường Dịch Vọng, 40m2, 3, 2, 4,"
    NHÀ ĐẸP - 2 THOÁNG - 4 NGỦ - NGÕ 3M - TRUNG TÂM - HIẾM - BAY NHANH - KHÁCH XEM MANG LUÔN TIỀN.Cầu Giấy 36/40T2m2, 4 tầng, mặt tiền 3.4m, 4.4 Tỷ Cầu Giấy  Khu vực: Cầu Giấy Mô tả chi tiếtT1: Phòng khách, bếp, wc.T2,3: Mỗi tầng 2 phòng, wc.T4: Phòng thờ, sân phơi.Nhà thoáng mát, xe bác gác vào tận cửa, khu dân trí cao, yên tĩnh.+ Vị trí dẹp gần công viên Cầu Giấy: Cách đường Nguyễn Văn Huyên 100m.",15/09/2022,Tin thường,batdongsan_so_com_vn_1673801763.266336, 4, 4,
"11,3 tỷ VNĐ",Đường Âu Cơ phường Nhật Tân, 150m2, 8, 3, 3," CẦN BÁN, GIÁ CỰC TỐT - BIỆT THỰ SÂN VƯỜN - ÔTÔ ĐỖ SÂN   Chính chủ gửi bán gấp căn Biệt thự sân vườn phố Âu Cơ, Tây Hồ. Nằm trong khu vực nhiều tiện ích Vip nhất Thủ Đô, phố đi bộ Trịnh Công Sơn, CVN Hồ Tây, thung lũng Hoa.  Nhà xây khoảng 50m2 còn lại là sân vườn trên tổng Dt 150m2, xung quanh nhà trồng Hoa Lan cùng nhiều loại cây không khí mát mẻ.  Nhà 3 tầng, 4 ngủ lâu năm, khách mua về  thiết kế tổng thể lại toàn bộ đảm bảo cuộc sống như mơ.    - Pháp lý : Sổ đỏ chính chủ không lỗi phong thủy, giao dịch ngay  - Giá bán : 11,3 tỷ ( Thương lượng nhiệt tình, miễn trung gian)  - Liên hệ : Em Cường, Chuyên gia tư vấn Bđs, tư vấn miễn phí thủ tục pháp lý giúp khách mua nhà ưng ý.",15/09/2022,Tin thường,batdongsan_so_com_vn_1673801765.0316145, 4, 3,
"21,5 tỷ VNĐ",Đường Võng Thị phường Thụy Khuê, 92m2, 5, 3, 8,"Cam kết hình ảnh thật thông số thật , môi giới uy tín trung thục -  NHÀ MỚI ĐẸP - THIẾT KẾ HOÀN MỸ - 8 TẦNG THANG MÁY - 2 THOÁNG VĨNH VIỄN - KHÁCH THUÊ FULL PHÒNG  - DOANH THU CỰC KHỦNG 110TR/THÁNG ( 1,3TY/nắm ) giá thực tế +VỊ TRÍ thuộc ngõ 50 Võng Thị cực đẹp tầng 7, 8 là phong cảnh Hồ Tây lộng gió cùng những bữa tiệc BBQ ngoài trời mà khách Tây cực thích khi thuê trọ ở đây +Phòng đẹp thiết kế nội thất toàn đồ xịn full setup đầy đủ chỉ việc mang dép đến ở + Ngõ 50 Võng thị chỉ cần 100m là ra mặt phố Trích Sài, gần trường THCS Văn Thái ,  bãi đỗ xe ngày đêm ở đầu ngõ cách nhà 15m  Nhà có tổng diện tích 92m2  Mặt tiền 5m Giá chỉ 21,5 tỷ ( có thể thương lượng ) cực hợp lý so với giá đất và vật liệu xây dựng ngày càng tăng . Đặc biệt khi mà nhà nước sắp xiết chặt quản lý nhà đất khi sở hữu căn nhà thứ 2 thì việc sớm sở hữu 1 căn nhà cho ra dòng tiền và lợi nhuận lớn là vô cùng cần thiết  liên hệ 0774134888 để biết thêm chi tiết : Trung Tuấn chuyên môi giới nhà mặt phố . dòng tiền  - Bán nhà ngõ 45 Võng Thị 96m2 lô góc x5 tầng mặt tiền 9m giá 22 tỷ  tại Hồ Tây - Bán nhà ngõ 45 Võng Thị 190m2  x3 tầng mặt tiền 16m giá 68 tỷ  tại Hồ Tây - Bán nhà ngõ 45 Võng Thị 105m2 x9 tầng 20PN mặt tiền 6,3m giá 55 tỷ  tại Hồ Tây - Bán nhà mặt phố Võng Thị 63m2 x7 tầng mặt tiền 6m giá 43 tỷ  tại Hồ Tây - Bán nhà mặt phố  Võng Thị 219m2 x8 tầng mặt tiền 13m giá 90 tỷ  tại Hồ Tây",15/09/2022,Tin thường,batdongsan_so_com_vn_1673801766.5116541, 13, 13,
6 tỷ VNĐ,Đường Nguyễn Lương Bằng phường Nam Đồng, 45m2, 5, 4, 5," Thiết kế cực đẹp, hiện đại, trước nhà sáng thoáng, có sân để xe riêng
Tầng 3: 2 phòng ngủ, vệ sinh. Sổ đỏ chính chủ, cất két.  Tùng Thổ Cư – 0973661066",15/09/2022,Tin thường,batdongsan_so_com_vn_1673801768.1402993, 4, 4,
"16,5 tỷ VNĐ",Đường Lạc Long Quân phường Bưởi, 75m2, 6, 2, 8,"Chính chủ gửi bán Tòa nhà Căn Hộ dịch vụ cho thuê Cao Cấp tại Lạc Long Quân, khu Võng Thị sát Hồ Tây cực đẹp, được xây trên mảnh đất có 1 không 2, nhà 3 mặt thoáng, các phòng đều tràn ngập ánh sáng tự nhiên. Khu vực dân trí cao, giao thông đi lại thuận lợi, kinh doanh đuổi không hết khách.  Nhà được thiết kế dạng căn hộ Cao Cấp dành cho các gia đình trẻ, các bạn thích sống tự lập. Chủ nhà cẩn thận đến từng chi tiết, đã đầu tư Full nội thất, điều hòa, nóng lạnh, bếp từ cao cấp cho tất cả các căn. Hệ thống Phòng cháy chữa cháy đã được kiểm định. Khách mua chỉ việc kinh doanh, có thể cho đơn vị thứ 3 thuê toàn bộ chỉ việc thu tiền.   Doanh thu thừa sức trên 900tr/ năm.  - Pháp lý : Sổ đỏ chính chủ vuông đẹp, không lỗi phong thủy, giao dịch ngay.  - Giá bán : 16,5 tỷ ( Có gia lộc)  - Liên hệ : Em Cường, Chuyên gia tư vấn Bđs, tư vấn miễn phí thủ tục pháp lý giúp khách mua nhà ưng ý.",14/09/2022,Tin thường,batdongsan_so_com_vn_1673801769.8871362, 15, 16,
2 tỷ VNĐ,Xã Đàn, 20m2,,, 4,"+ Nhà nằm ở vị trí trung tâm Quận Đống Đa, vài bước ra đường lớn, bạt ngàn tiện ích, đi đâu cũng tiện, vài bước ra phố Xã Đàn. Đằng sau nhà có ngõ đi nên rất thoáng sáng.+ Chủ xây tâm huyết, đủ công năng cho 1 gia đình nhỏ hoặc vợ chồng mới cưới lập nghiệp.+ Mảnh đất ở rất có lộc, hiện chủ đang ở vì lí do chuyển công tác nên đành phải bán đi.+ Tầng 1: PK + Bếp + WC+ Tầng 2: 1PN + WC + Tầng 3: 1PN + WC + Tầng 4: Thờ + Sân phơi+ Sổ đỏ đẹp, nở hậu. Sẵn sàng giao dịch.+ Giá chào 2 tỷ (có thương lượng).+ Liên hệ ngay: 0354526316 Em Thế Anh (hỗ trợ xem nhà, tư vấn pháp lý, vay vốn ngân hàng, sang tên sổ đỏ).",14/09/2022,Tin thường,batdongsan_so_com_vn_1673801771.4130912, 2,,
"2,02 tỷ VNĐ",Đê La Thành, 21m2,,, 3,"- Vị trí trung tâm giao thông thuận tiện.- Ngõ thông, trước nhà rộng 3m- Gần chợ, trường học các cấp, ... tiện ích k thiếu thứ gì.- Nhà dân xây khung cột bên tông chắc chắn:- Thiết kế 3 tầng 1 tum:+ Tầng 1: để xe + bếp + wc+ Tầng 2: Phòng ngủ + wc.+ Tầng 3: phòng ngủ + wc(để máy giặt + ban công phơi đồ)+ Tầng tum+ Sổ đỏ đẹp, nở hậu. Sẵn sàng giao dịch.+ Giá chào 2.02 tỷ (có thương lượng).+ Liên hệ ngay: 0354526316 Em Thế Anh (hỗ trợ xem nhà, tư vấn pháp lý, vay vốn ngân hàng, sang tên sổ đỏ).",14/09/2022,Tin thường,batdongsan_so_com_vn_1673801772.5629766,,,
4 tỷ VNĐ,Hạ Đình, 38m2,,, 5,"1 NHÀ RA Ô TÔ TRÁNH, Phố Hạ Đình, Thanh Xuân, 38m2, 5 Tầng, 4 Tỷ.+ Vị trí nhà đẹp, gần trường học Cấp 1,2 Hạ Đình, gần Hồ, chợ, TTTM, bãi xe ô tô 30m.+ Đường rộng thông thoáng, cách đường lớn 60m, thông sang Khương Đình, Nguyễn Xiển, Nguyễn Trãi.+ Khu vực hiếm nhà bán, khu dân trí cao, an ninh tốt, rất đáng sống.+ Sổ đỏ vuông đẹp, pháp lý chuẩn, sẵn sàng dao dịch.    LH: Em Hoan, 0925088355, chuyên Thổ cư Thanh Xuân, Đống Đa, miễn phí xem nhà 24/7.",14/09/2022,Tin thường,batdongsan_so_com_vn_1673801774.014459,,,
4 tỷ VNĐ,Đường Tôn Đức Thắng phường Hàng Bột, 45m2,, 4,,"+ Liên hệ: Mr Vượng – 912949598. Chuyên môi giới Bất Động Sản Đống đa,Tận tâm, Uy tín KHÁCH HÀNG ĐƯỢC TRỰC TIẾP GẶP CHỦ NHÀ",14/09/2022,Tin thường,batdongsan_so_com_vn_1673801775.4585955,,,
4 tỷ VNĐ,Cự Lộc, 38m2,,, 5,"Nhà đẹp, ở ngay Phố Cự Lộc, Thanh Xuân 38m2, 5 Tầng, MT 3.8m, THOÁNG TRƯỚC SAU, Nhỉnh 4 Tỷ.+ Vị trí nhà đẹp, gần Ngã Tư Sở, Royal City, trường học các Cấp, bãi xe ô tô 30m.+ 30m ra mặt Phố Cự Lộc, 60m ra đường Nguyễn Trãi. Đường rộng thoáng thông sang Nguyễn Trãi, Quan Nhân, Chính Kinh.+ Sổ đỏ vuông đẹp, pháp lý chuẩn, sẵn sàng dao dịch.    LH: Em Hoan, 0925088355, chuyên Thổ cư Thanh Xuân, Đống Đa, miễn phí xem nhà 24/7.",14/09/2022,Tin thường,batdongsan_so_com_vn_1673801776.7327435,,,
"13,2 tỷ VNĐ","Trần Duy Hưng, Trung Hòa", 58m2,,, 7,"+ Nhà 7 tầng mới hoàn thiện , cách phố vài chục m , khu vục nhu cầu nhà ở , nhà cho thuê luôn ở mức rất cao trong khu vực.  + Thiết kế đẹp, nội thất đầu tư tỉ mỉ , chất lượng hoàn thiện từ cửa , tủ bếp , wc , điện nước được đầu tư kỹ lưỡng.  - Tầng 1,2,3 thông sàn - Tầng 4,5 : 4PN rộng.- Tầng 6 : phòng thờ , khách- Tầng 7 : sân phơi , phòng thờ - Thang máy lên tận tầng 7. + Các nhà xung quanh cho thuê 1 phòng tầm 7-8tr/tháng. Mua về kết hợp nhiều mục đích , vừa cho thuê vừa ở hoăcn cho thuê cả nhà....+ Sổ đỏ đẹp. Sẵn sàng giao dịch.+ Giá chào 13.2 tỷ (có thương lượng).+ Liên hệ ngay: 0968.627.597 Em Thế Anh (hỗ trợ xem nhà, tư vấn pháp lý, vay vốn ngân hàng, sang tên sổ đỏ).",14/09/2022,Tin thường,batdongsan_so_com_vn_1673801778.2676377, 4,,
"3,2 tỷ VNĐ",Mạc Thị Bưởi - Hà Nội, 50m2,,,,"Vị trí chả thể nào đẹp hơn sát ngày tòa nhà Hòa Bình khu phân lô dân trí cao nhà hai mặt ngõ cực kỳ thoáng đãngĐúng vài bước là ra mặt phố lớn Mạc Thị Bưởi ,sát nách Time City, Hòa Bình  tận dụng mọi tiện ích……thuận tiện di chuyển  trường đại học lớn như Xây Dựng, Bách Khoa ,Kinh tế quốc dân, Công Nghiệp, Kinh tế ……hoặc đến các khu vực trung tâm giải trí khác như Bờ Hồ, Tây Hồ,…. Cực kỳ dễ dàng tiện lợi. Ngõ thoáng mát, rộng,. Nhà thoáng chan hòa ánh nắng, cực đã mắt, là một lơi lý tướng để sinh sống, an cư, Hàng xóm xung quanh toàn giảng viêng các trường đại học lân cận cực kỳ thân thiện dễ gần.Giá chào 3.2 tỷ,có thương lượng chủ nhà có tuổi cực vì nhu cầu tài trính nên mới phải bán đi nên cực kỳ thiện trí với khách nhiệt tình Chi tiết LH: em Nhật 0977194820 (Chuyên Nhà đất Thổ cư).Lưu ý:-Tận Tâm, Uy tín , Chuyên nghiệp cái Tâm và cái Tầm đặt lên hàng đầu- Không kênh giá chủ nhà- Miễn phí toàn bộ dịch vụ: Dẫn khách xem nhà, tư vấn pháp lý  ",14/09/2022,Tin thường,batdongsan_so_com_vn_1673801779.69386,,,
45 tỷ VNĐ,Ngụy Như Kon Tum Thanh Xuân Hà Nội, 85m2, 9,, 7,"- Diện tích 85m2 x7 tầng thang máy.  Mặt tiền 9.2m  Giá bán 45 tỷ ( có thương lượng )  - Nhà nằm vị trí cực đẹp, lô góc, hai mặt ngõ ô tô, khu vực kinh doanh sầm uất - Thiết kế 7 tầng thang máy, khung cột chắc chắn, đẹp lộng lẫy.  1 hầm và 6 nổi thông sàn kinh doanh.  - Giao thông thuận tiện Lê Văn Lương, Khuất Duy Tiến, Ngụy Như Kon Tum, Nguyễn Huy Tưởng, Vũ Trọng Phụng.  - Sổ đỏ đẹp như hoa hậu, sẵn sàng giao dịch. ACE có nhu cầu liên hệ với em để được tư vấn.  Miễn ( TG Quảng Cáo ) ",14/09/2022,Tin thường,batdongsan_so_com_vn_1673801780.9954476, 5, 5,
"15,5 tỷ VNĐ",Trung Kính, 56m2,,, 6,"+ Phố VIP Trung Kính ngay ngã tư Mạc Thái Tổ, Hạ Yên Quyết... mặt tiền lý tưởng 5.5m+ Ngõ nông ô tô tránh ở VIP hoặc kinh doanh VP đều tuyệt.+ Khu dân trí cao, phân lô cán bộ cấp cao tập trung nhiều văn phòng, nhà hàng, người nước ngoài.+ Nhà đẹp. Kết cấu xây dựng kiên cố 6 tầng có chỗ cải tạo có thể lắp thang máy.+ Nhà có mặt thoáng phía sau vĩnh viễn mở cửa sổ ra hút gió phòng nào cũng thoáng tràn ngập ánh sáng tự nhiên.+ Sổ đỏ đẹp. Sẵn sàng giao dịch.+ Giá chào 15.5 tỷ (có thương lượng).+ Liên hệ ngay: 0968.627.597 Em Thế Anh (hỗ trợ xem nhà, tư vấn pháp lý, vay vốn ngân hàng, sang tên sổ đỏ).",14/09/2022,Tin thường,batdongsan_so_com_vn_1673801782.0924606, 5,,
"3,2 tỷ VNĐ","Nguyễn Trãi, Thanh Xuân, Hà Nội", 30m2, 8,, 5,"+ Bán Nhà Phố Nguyễn Trãi, Quận Thanh xuân, lô góc 2 thoáng siêu đẹp. khu vực toàn công chức ở, an ninh tốt, dân trí cao. Chỉ 10 phút ra Royal city và Pico. + Chủ nhà xây tâm huyết, thiết kế đẹp, ánh sáng ngập tràn, nội thất đầy đủ. Cần bán để sang nước ngoài ở với con. + Nhà 5 tầng mới đẹp, vài bước ra phố. Gần các đường như Nguyễn Tuân, Nguyễn Xiển, Đường Láng, Trường Chinh, Hạ Đình, Vũ Trọng Phụng, Khương Đình,…và nhiều trường Đại Học. Giá chỉ 3.2 tỷ. + Sổ đỏ cất két, sẵn sàng giao dịch. + Liên hệ; 0911303899 - Mr Quân. Tư vấn miễn phí 24/24.",14/09/2022,Tin thường,batdongsan_so_com_vn_1673801783.2747378, 3, 3,
4 tỷ VNĐ,"hoàng mai, hà nội", 45m2,,,,"4Bán nhà Hoàng Mai, Phố Giáp Bát, 45m, 4t, mt6,5, 4tỷ.+ Ô tô lùi gần nhà, đi bộ vài bước chân ô tô tránh xe máy, gần trường mần non cấp 1,2, gần chợ.+ Nhà thết kế phù hợp cho 2,3 thế hệ.+ Cách bến xe Giáp Bát 2 phút đi xe, Gần Giải Phóng, Kim Đồng, Tam Trinh, Tân Mai, Hoàng Mai, trường Đại Học Kinh Tế Quốc Dân Xây Dựng, Bách khoa, Bệnh viện Bạch Mai.+ Sổ đỏ chính chủ sẵn sàng giao dịch.+ Lh: 0346363362 : Phú Gia chuyên nhà phố Hà Nội",14/09/2022,Tin thường,batdongsan_so_com_vn_1673801789.1590493,,,
"2,95 tỷ VNĐ",Tổ 6 Kiến Hưng hà Đông 33, 33m2, 3, 9, 4,"Chủ cần bán nhà riêng tại Tổ 6 Đa Sỹ Hà Đông 33m 4 tầng 4 ngủ giá 2.95 tỷ- Nhà nằm khu dân trí cao an ninh tốt, gần trường các câp, chợ, siêu thì, y tế, ủy ban... xung quanh tiện ích không thiếu gì.- Nhà được thiết kế 4 tầng với đầy đủ công năng.+Tầng 1:  Phòng khách, vs, bếp+Tầng 2,3: Mỗi tầng 2 ngủ + 1 vs+ Tầng tum: Sân phơi + DT: 33/37m2+ MT: 3.70m-  Sổ đẹp như tờ A4, pháp lý chuẩn.- Hướng: Tây Nam- Giá: 2.95 tỷ.- Goi ngay cho Nguyên Anh :0819508701 để biết thêm thông tin chi tiết và xem nhà miễn phí.33",14/09/2022,Tin thường,batdongsan_so_com_vn_1673801790.328875, 4, 3, Tây nam
