price,address,Diện tích,Mặt tiền,Lộ giới,Số tầng,Số phòng ngủ,Details,Ngày đăng,Loại tin,id,Số toilet
"7,4 tỷ VNĐ",Đường Cự Lộc phường Hạ Đình, 35m2, 5, 10, 5, 4,"ị trí nhà cực đẹp, cách mặt phố Vũ Hữu vài bước chân. tâm huyết+dân trí cao + ",14/09/2022,Tin thường,batdongsan_so_com_vn_1673801909.779125,
"5,55 tỷ VNĐ","Linh Đường, Ngọc hồi HN", 53m2,,,,,"+ Nhà cực đẹp, hiếm, lô góc 3 thoáng, kinh doanh đa dạng, ô tô vào nhà, ngõ to xe tải, thông từ Ngọc Hồi sang Linh Đàm, đi đường nào vào nhà cũng tiện lợi + Nhà 4 tầng 4 ngủ, khách, bếp, p thờ, sân phơi, đầy đủ công năng + Tiện ích ngập tràn, giao thông thuận lợi, trường học các cấp 123 đi bộ, Trung tâm thương mại, Aeon đang khởi công, gần hồ Linh Đàm, thể dục trong lành + Sổ đỏ cất két giao dịch ngay ",14/09/2022,Tin thường,batdongsan_so_com_vn_1673801910.9280505,
"12,45 tỷ VNĐ",35 Trần Quốc Hoàn, 42m2, 4,, 6, 8,"TRẦN QUỐC HOÀN - PHÂN LÔ VIP CẦU GIẤY, Ô TÔ – VĂN PHÒNG - AN SINH, 6 TẦNG 42M2 – 12.45 TỶ - Ngõ phân lô, ô tô chạy vòng quanh, đằng sau Đại Học Ngoại Ngữ - Đại Học Quốc Gia Hà Nội. Đông sinh viên, kinh doanh đỉnh, cho thuê làm VP cũng cực tốt. - Nhà 6 tầng, còn đẹp, mới sử dụng được vài năm. Thiết kế hiện đại. Thoáng trước sau. Chi tiết: Tầng 1 : để xe hoặc làm Văn phòng. Tầng 2 3 4 5 mỗi tầng 2 phòng. Tầng 6 phòng thờ - sân phơi. - Sổ đỏ đẹp, chính chủ, sẵn sàng giao dịch. Chủ thiện chí + Liên hệ: K.S Phương – 0918120568 để được tư vấn về ngôi nhà và gặp chủ đàm phán trực tiếp",14/09/2022,Tin thường,batdongsan_so_com_vn_1673801911.9712615, 6
"4,9 tỷ VNĐ",Đường An Trai phường Vân Canh, 63m2, 5,,,,"- Thông tin "",serif;="""" background:="""" white;="""" color:="""" black;="""" line-height:="""" 107%;="""" mso-ansi-language:="""" vi'lô="""" đất="""" spanspanroboto="""" 107%'br="""" spanspan="""" vi'="""">+ diện tích: 63m2 "",serif;="""" color:="""" black;="""" line-height:="""" 107%;="""" mso-ansi-language:="""" vi'+="""" mặt="""" tiền="""" 5.25m="""" span="""" p="""" class=""MsoNormalSPAN"" vi'+Đã="""" có="""" sổ="""" đỏ="""" chỉnh="""" chủ,="""" lô="""" đất="""" vuông="""" vắn="""" phong="""" thủy="""" cực="""" đẹp="""" background:="""" white;="""" 107%'="""">(Cam kết thông tin rao bán đều là sản phẩm có thật).  (Thành).",14/09/2022,Tin thường,batdongsan_so_com_vn_1673801913.3157074,
"3,94 tỷ VNĐ","Đường Cổ Linh , Phường Thạch Bàn, Long Biên, Hà Nội", 41m2, 4,, 5,,"CỰC HIẾM ! Bán 1 Căn Nhà Đường Cổ Linh, Long Biên 41m2, 5T Ô Tô Đỗ Cửa, chỉ 3,94 tỷ ( 0965 722 358) T1 : Phòng khách, bếp, wc T2,3,4 : Phòng ngủ, wc T5 : Phòng thờ, sân phơi. + Nhà xây mới, thiết kế hiện đại, xây dựng chắc chắn. xung quanh nhà chợ, trường học cấp 1, 2 và các tổ hợp dịch vụ sầm uất kinh doanh ngày đêm. + Từ nhà thuận tiện đi các hướng như ra đường Cổ Linh, Thạch Bàn, Chợ Đồng Dinh, TTTM Aoen Mall Long Biên, Cầu Vĩnh Tuy chỉ vài phút.. + Sổ đẹp pháp lý rõ ràng, sẵn sàng giao dịch.",14/09/2022,Tin thường,batdongsan_so_com_vn_1673801914.3180246,
"3,333333 tỷ VNĐ",Đường Nguyễn Lương Bằng phường Quang Trung, 47m2, 4, 6, 4,,"Chính chủ chuyển nơi ở thuận tiện đi làm, cần bán nhà riêng phố Nguyễn Lương Bằng, phường QuangTrung, quận Đống Đa: 47m2, 3 ngủ, vài bước ra phố, nhà đẹp ở ngay. + Nhà ngay Xã Đàn, trung tâm quận Đống Đa, tiếp giáp phốlớn: Ô Chợ Dừa,Xã Đàn, Tôn Đức Thắng, Khâm Thiên… Ngay gần chợ , siêu thị to nhỏ, trường học các cấp, tiện ích không thiếu thứ gì. + Nhà xây khung cột, tầng 1 phòng 1 WC, các phòng có cửa sổ thoáng. + Sổ đỏ nét, giao dịch ngay. + Giá chào: 3.3 tỷ, có gia lộc nhẹ.: 0828137789, để xem nhà ngay.
",14/09/2022,Tin thường,batdongsan_so_com_vn_1673801915.5218492,
"5,35 tỷ VNĐ",Đường Bùi Xương Trạch phường Khương Đình, 40m2, 3, 1, 6, 6,"Chủ nhiều nhà không ở hết, nay cần bán nhà riêng phố Bùi Xương Trạch, phường Khương Đình, quận Thanh Xuân: 40m2*6 tầng, 4 ngủ, ngõ thông, ô tô đỗ cửa, kinh doanh cực đỉnh.+ Vị trí trung tâm quận Thanh Xuân, giáp ranh quận Hoàng Mai. Tiếp giáp phố lớn: Khương Đình, Khương Trung, Vũ Tông Phan, Kim Giang, Thượng Đình,… Gần Mầm Non, THCS và Tiểu học Khương Đình. Nhà cách ô tô tránh 5m, ngõ thông vòng quanh, có thể kinh doanh nhỏ hoặc cho thuê đều đẹp, khu đông dân cư làm gì cũng dễ.+ Nhà mới, thiết kế cơ bản đầy đủ công năng Phòng khách, bếp, phòng thờ, sân phơi và 6 phòng ngủ khép kín. + Sổ đỏ nét, giao dịch ngay.Liên hệ ngay em Đức, để được tư vấn xem nhà miễn phí.",14/09/2022,Tin thường,batdongsan_so_com_vn_1673801916.6338775, 3
"1,05 tỷ VNĐ",Đường Tỉnh Lộ 35 phường Minh Phú, 80m2, 5,,,,"Bán lô đất đẹp 80m2 Bìa làng phú hạminh phú, view đồng, đường 4m. -Mặt tiền 5,1m -Nở hậu 5,15m -Đường trước đất 4m ô tô tải vào tận đất -200 ra trục chính đi thanh trí, 400m ra đường tỉnh lộ 35 -khu dân cư đông đúc tiềm năng phát triển. -1km ra ủy ban xã và các trường học lân cận -Mà giá chỉ 13,x tr/m2 ( rẻ nhất nhì làng Phú Hạ ) * LH ngay e Lịch:  để xem đất. CẢM ƠN ANH CHỊ ĐÃ XEM TIN ĐĂNG.",14/09/2022,Tin thường,batdongsan_so_com_vn_1673801918.6115842,
"6,5 tỷ VNĐ",Đường Hào Nam phường Ô Chợ Dừa, 40m2, 4, 10, 4, 4,"Bán Sổ Đỏ 6.5Tỷ Tặng Nhà Siêu Xinh. Mặt Tiền 4m , Nội Thất Châu Âu Trung Tâm Quận Đống Đa. Cách Phố 20m.  Diện tích 40m vuông. 4 tầng mỗi tầng 2 phòng. Nội thất Châu Âu. Ô tô đỗ gần. khu vực kinh doanh tấp nập. Hào Nam, Hoàng Cầu, Tôn Đức Thắng, Đê La Thành. Gần Trường Nhạc. Gọi ngay để xem nhà 24/24 Tùng Thổ Cư - 0973661066",14/09/2022,Tin thường,batdongsan_so_com_vn_1673801919.6857107, 5
"4,5 tỷ VNĐ","Vạn Phúc, Hà Đông", 32m2, 4, 3, 5, 3,"Nhà Đẹp, Căn Góc, Vạn Phúc – Hà Đông, Ở Luôn, Ngõ Ô Tô 4 Chỗ, DT 32m2 x 5T Chỉ 4.5 Tỷ. Vị trí: Nhà nằm trong khu phân lô cán bộ công ty Dệt Len, Ngõ rộng ô tô 4 chỗ đỗ cửa, xung quanh tiện ích không thiếu gì, gần trường mầm non,Hoa Mai,tiểu học Vạn Phúc, Vạn Bảo gần chợ, khu dân trí cao, an ninh tốt. Thiết kế: Nhà xây 5 tầng bê tông cốt thép chắc chắn. + Tầng 1: Khách + bếp +WC cầu thang cuối. + Tầng 2,3,4: Mỗi tầng 1 phòng ngủ khép kín. + Tầng 5: Phòng thờ + Sân Phơi rộng. Pháp Lý: Sổ đỏ chính chủ giao dịch luôn. Giá bán: 4.5 tỷ ( Có thương lượng ). Liên hệ trực tiếp 24/7 để đi xem nhà miễn phí.                                                                                                                                                                           - Mr Luyện thổ cư: 0911779569 - Chuyên Nhà đất Thổ cư các phân khúc từ 1 tỷ đến trên 100 tỷ.  “TRAO GỬI NIỀM TIN_ NHẬN LẠI YÊU THƯƠNG”",14/09/2022,Tin thường,batdongsan_so_com_vn_1673801920.8845031, 4
8 tỷ VNĐ,Đường Quan Nhân phường Nhân Chính, 63m2, 5, 1, 5, 4,"
    Mặt ngõ rộng 3m, mặt tiền rộng khách mua ở hay kinh doanh văn phòng đều đẹp. Nhà thiết kế theo phong cách mới châu âu có đầy đủ tiện ích từ bên trong và khu vực xung quanh bên ngoài. Nhà diện tích 63M2 mặt tiền rộng 5,8m xây 5 tầng
",14/09/2022,Tin thường,batdongsan_so_com_vn_1673801922.0753171, 4
10 tỷ VNĐ,Thái Hà, 50m2,,, 7,,"Bán nhà Siêu Phẩm Phố Thái Hà, Đống Đa 50m2, 7 Tầng THANG MÁY, Ô TÔ tránh, KINH D0ANH bất chấp, Nhỉnh 10 Tỷ.+ Trung tâm Phố Thái Hà - Đống Đa, tiện ích bạt ngàn. Thông sang Thái Thịnh, Yên Lãng, Tây Sơn.+ Khu vực hiếm nhà bán, khu dân trí cao. Đường thông rộng, cách mặt Phố 80m, phù hợp mọi mặt hàng kinh doanh.+ Sổ đỏ vuông đẹp, pháp lý chuẩn, sẵn sàng dao dịch.    LH: Em Hoan, 0925088355, chuyên Thổ cư Thanh Xuân, Đống Đa, miễn phí xem nhà 24/7.",14/09/2022,Tin thường,batdongsan_so_com_vn_1673801923.0985796,
"4,75 tỷ VNĐ",Hà Trì - Hà Cầu - Hà Đông, 33m2,,, 5, 4,"BÁN NHÀ HÀ TRÌ - NGÕ THÔNG - Ô TÔ - 2 THOÁNG - KINH DOANH - 33M2*5T - 4.75 TỶ+ Vị trí: Trung tâm quận Hà Đông, gần mặt phố Hà Trì, Kiến Hưng, Bà Triệu, Lê Lợi, Tô Hiệu...+ Xung quanh rất nhiều tiện ích như trường học các cấp, gần chợ Hà Đông, bệnh viện, bể bơi...+ Nhà 2 mặt thoáng trước sau, ngõ thông, ô tô con qua nhà, có thể để ở và kinh doanh spa, cắt tóc, online, văn phòng...+ Nhà thiết kế 5 tầng, 1 tum. Tầng 1 thiết kế thông sàn kinh doanh.+ Chủ nhà trẻ tuổi, làm ăn có lộc nên chuyển nhà to hơn. Sàn bằng gỗ nhập khẩu. Chủ để lại nội thất cho khách thiện chí.+ Sổ đỏ vuông đét - công chứng trong ngày.+ Giá chỉ: 4.75 tỷ + Liên hệ: Mrs Nhung - nhà đẹp Hà Đông: 0944.795.382 để được tư vấn",14/09/2022,Tin thường,batdongsan_so_com_vn_1673801924.0111387, 3
"7,2 tỷ VNĐ","Đường Trương Định, Phường Trương Định", 52m2, 4, 2, 5, 4,"Nhà mới, 5 tầng, thang máy, kinh doanh đỉnh.Thiết kế hiện đại, đầy đủ công năng.Tầng 1 thông sàn, kinh doanh các mặt hàng, tổng 4 ngủ, phòng thờ, sân phơi.Diện tích: 52m, Sổ đỏ chính chủ.Giá chào: 7.2 tỷ, có thương lượng.Phố Trương định thông sang Bạch Mai, Minh Khai, Nguyễn an Ninh, Nguyễn Đức Cảnh, Tân mai..Khu trung tâm giao thông rất thuận tiện, ngập tràn tiện ích.Gần các trường đại học lớn như Bách Khoa, Xây Dựng, Kinh Tế Quốc Dân...Gần Bệnh viện Bạch Mai, Việt Pháp, Tai Mũi họng TW...Anh chị em quan tâm vui lòng liên hệ em.♡ Tel: 0825920555.♡ Zalo, sms, fb....",14/09/2022,Tin thường,batdongsan_so_com_vn_1673801925.4084003, 4
,Đường Bát Khối phường Thạch Bàn, 79m2, 6, 9, 4, 6,"
    Vị trí trung tâm phường Thạch Bàn, giao thông thuận tiện di chuyển vào trung tâm thành phố và các tỉnh miền bắc.Sổ sách đầy đủ, liên hệ: 0977790353
",14/09/2022,Tin thường,batdongsan_so_com_vn_1673801926.5922914,
"6,5 tỷ VNĐ",Đường Hoàng Ngân phường Nhân Chính, 40m2, 5, 6, 5, 6,"+ Vị trí ĐẸP, HIẾM, khu đất QUAN LỘC. - Yên tĩnh, dân trí cao, lô góc 3 mặt thoáng. Mở được cả 2 cửa đi.  Tầng 2, 3, 4: Tổng 6PN, vs giữa.  + LH: Hoàng Bắc,",14/09/2022,Tin thường,batdongsan_so_com_vn_1673801927.6515048, 5
"7,2 tỷ VNĐ","Quan Nhân, Nhân Chính, Thanh Xuân, Hà Nội", 53m2, 4, 3, 5, 6,"Mới Đẹp, Ở Luôn, Quan Nhân, Thanh Xuân, Lô Góc, Thoáng 2 Mặt DT 53m2 x 5T, Chỉ 7.2 Tỷ. Vị trí: Ngôi nhà nằm trung tâm sầm uất nhất nhì Quận Thanh Xuân, gần trường ĐH lớn như ĐHQG HN, ĐH KHOA HỌC TỰ NHIÊN, xung quanh tiện ích không thiếu gì, khu dân trí cao, an ninh tốt, nhà lô góc nên rất thoáng đẹp. Bao bọc xung quanh là các khu đô thị như Royal City, IMPEgaden Vũ Trọng Phụng. Thiết Kế: Nhà xây 5 tầng chủ xây chắc chắn, mới đẹp. + T1 phòng khách, bếp +WC. + T2,3,4 mỗi tầng 2 phòng ngủ rộng+ WC. + T5 phòng thờ, khu phơi đồ. Pháp lý: Sổ đỏ chính chủ sẵn sàng giao dịch Giá bán: 7.2 tỷ ( có thương lượng) Liên hệ trực tiếp 24/7 để đi xem nhà miễn phí.                                                                                                                                                                           - Mr Luyện thổ cư: 0911779569 - Chuyên Nhà đất Thổ cư các phân khúc từ 1 tỷ đến trên 100 tỷ.  “TRAO GỬI NIỀM TIN_ NHẬN LẠI YÊU THƯƠNG”",16/08/2022,Tin thường,batdongsan_so_com_vn_1673801933.3638551, 4
"5,2 tỷ VNĐ","Nguyễn Trãi, Thanh Xuân, Hà Nội", 45m2, 3, 3, 4, 4,"Trung Tâm Thanh Xuân,Ở Luôn, Căn Góc, Ba Gác Phi, Nội Thất, DT 45m2 x4T,Chỉ 5.2 Tỷ Vị trí: Nhà nằm trung tâm quận Thanh Xuân, Ngõ thông vài bước chân ra đường chính Nguyễn Trãi, di chuyển các ngả thuận lợi, gần các trường Đại học như Xã Hội Nhân Văn, Khoa Học Tự Nhiên, đường trước nhà xe 3gác phi ầm ầm. Chủ nhà tặng toàn bộ nội thất chỉ việc mang vali tới ở. Thiết Kế: Nhà 4 tầng đẹp lung linh. + T1 phòng khách, bếp +WC. + Nhà thiết kế 4 phòng ngủ + Phòng thờ + Sân Phơi. Pháp lý: Sổ đỏ chính chủ sẵn sàng giao dịch Giá bán: 5.2 tỷ ( có thương lượng) Liên hệ trực tiếp 24/7 để đi xem nhà miễn phí.                                                                                                                                                                           - Mr Luyện thổ cư: 0911779569 - Chuyên Nhà đất Thổ cư các phân khúc từ 1 tỷ đến trên 100 tỷ.  “TRAO GỬI NIỀM TIN_ NHẬN LẠI YÊU THƯƠNG”",17/08/2022,Tin thường,batdongsan_so_com_vn_1673801934.6664634, 3
"4,5 tỷ VNĐ","Ngõ 61 Vạn Phúc, Hà Đông", 32m2, 4, 3, 5, 3,"Nhà Đẹp, Căn Góc, Vạn Phúc – Hà Đông, Ở Luôn, Ngõ Ô Tô 4 Chỗ, DT 32m2 x 5T Chỉ 4.5 Tỷ. Vị trí: Nhà nằm trong khu phân lô cán bộ công ty Dệt Len, Ngõ rộng ô tô 4 chỗ đỗ cửa, xung quanh tiện ích không thiếu gì, gần trường mầm non,Hoa Mai,tiểu học Vạn Phúc, Vạn Bảo gần chợ, khu dân trí cao, an ninh tốt. Thiết kế: Nhà xây 5 tầng bê tông cốt thép chắc chắn. + Tầng 1: Khách + bếp +WC cầu thang cuối. + Tầng 2,3,4: Mỗi tầng 1 phòng ngủ khép kín. + Tầng 5: Phòng thờ + Sân Phơi rộng. Pháp Lý: Sổ đỏ chính chủ giao dịch luôn. Giá bán: 4.5 tỷ ( Có thương lượng ). Liên hệ trực tiếp 24/7 để đi xem nhà miễn phí.                                                                                                                                                                           - Mr Luyện thổ cư: 0911779569 - Chuyên Nhà đất Thổ cư các phân khúc từ 1 tỷ đến trên 100 tỷ.  “TRAO GỬI NIỀM TIN_ NHẬN LẠI YÊU THƯƠNG”",14/09/2022,Tin thường,batdongsan_so_com_vn_1673801943.975629, 4
