price,address,Diện tích,Hướng,Mặt tiền,Lộ giới,Số tầng,Số phòng ngủ,Số toilet,Details,Ngày đăng,Loại tin,id
,18 Nghi Tàm, 91m2, Tây nam, 6, 10, 4, 10, 10,"Bán nhà mặt tiền 18 Nghi Tàm ( đang cho thuê KD khách Sạn ) MT 6m , DT 91m2 , 4 tầng , 10 phòng . có nguồn thu nhập ổn định , view nhìn ra Hồ Tây , Đường Thanh Niên . sổ đỏ đầy đủ , 19tỷ500triệu . LH chủ nhà : Minh : 0946718986 Miễn TG làm phiền . ",12/09/2022,Tin thường,batdongsan_so_com_vn_1673802470.2408724
"3,7 tỷ VNĐ",Đường Đàm Quang Trung phường Long Biên, 35m2,, 45, 4, 4, 3, 3,"+ Nhà xây mới, ngõ ô tô thông các ngả, ô tô đỗ cửa, vào nhà, mặt tiền rộng 4,5m ô tô vào nhà thoải mái. Xe di vào nhà theo nhiều hướng, từ Đàm Quang Trung, Cổ Linh, Bát khối đều được. + Lô goc thoáng sáng, nhà xây độc lập 1 căn không lo chung tường, chung móng, khung cột bê tông lên thêm tầng thoải mái. + Tầng 1 gara ô tô, khách, bếp. Không muốn để xe trong nhà có thể gửi ở chân cầu Vĩnh Tuy cách nhà trăm m. Các tầng trên thông sàn làm phòng ngủ rộng, vệ sinh khép kín từng tầng. Ba mặt thoáng view cực đẹp. + Nhà đã lắp đặt full nội thất kể cả giường tủ hiện đại, chỉ việc mang quần áo về ở thôi ạ. + Sổ đỏ chính chủ, vuông vắn, không lỗi phong thủy, không vướng quy hoạch. Liên hệ anh Hoan 1978 để mở cửa. ",12/09/2022,Tin thường,batdongsan_so_com_vn_1673802471.9333444
"6,6 tỷ VNĐ",Đường Bùi Xương Trạch phường Khương Đình, 50m2,, 4, 4, 4, 4, 4,"
    
Ô TÔ 7 CHỖ ĐỖ CỬA, VÀI BƯỚC Ô TÔ TRÁNH - NHÀ ĐẸP Ở NGAY - 2 THOÁNG - NGÕ THÔNG - YÊN TĨNH AN SINH ĐỈNH TẠI BÙI XƯƠNG TRẠCH, THANH XUÂN.
 
+ Diện tích: 50m, MT 4m.
+ Giá chào: 6,6 tỷ có TL.

Mô tả: 
+ Nhà vị trí đẹp ngõ ô tô 7 chỗ vào đỗ cửa cách đường ô tô tránh vài bước chân. Ngõ đẹp nhất nhì phố Bùi Xương Trạch thông sang Vũ Tông Phan. Hàng xóm dân trí cao, an ninh tốt, ở cực thích. 
+ Khu vực xung quanh rất nhiều tiện ích gần Hồ, gần chợ, trường học các cấp, bệnh viện, giao thông đi lại thuận tiện. 
+ Nhà dân tự xây được 4 năm rất giữ gìn còn rất mới khách mua về ở luôn. Đằng sau có khe thoáng nên phòng nào cũng có cửa sổ sáng thoáng.
+ Thiết kế mỗi tầng 2 phòng rộng rãi. 
+ Sổ đỏ phân lô vuông vắn. 
+ Liên hệ Ms Hương 0928077333 để được xem nhà 24/7.
",12/09/2022,Tin thường,batdongsan_so_com_vn_1673802474.5603435
"3,35 tỷ VNĐ",Đường Hoàng Liệt phường Đại Kim, 35m2,,, 2, 5, 4, 3,"CẦN BÁN GẤP NHÀ HOÀNG LIỆT, LINH ĐÀM,HOÀNG MAI Diện tích: 35m x 5 tầng,mặt tiền 3.3m2  Ngõ rộng,nông,thoáng,khu vực hàng xóm thân thiện,an ninh tốt,gần các tiện ích + Hiện nay tôi đang cần tiền cần bán gấp căn nhà này. Nhà tự xây kiên cố, chắc chắn, xem thích liền. Có giầy tờ đầy đủ, không tranh chấp, sân thượng rộng rãi. Thích hợp hộ gia đình, thiết kế sang trọng đầy đủ công năng. Trung tâm TM và mua sắm kế bên.  + Vị trí thuận lợi di chuyển mọi hướng, không kẹt xe, đường thoáng hưởng trọn tiện ích KĐT kiểu mẫu Tây Nam Linh Đàm.  + Cách chợ 150m, hồ gió mát 100m, trường MN, cấp 1,2 chỉ 500m. gần bến xe Giáp Bát, Nước Ngầm, cao tốc. Khu phức hợp thể thao đa năng bóng Hoàng Mai như bơi lội, tenis, Gym, bóng đá…  + Đặc biệt vị trí này được đánh giá an toàn, an ninh được quản lý chặt chẽ hiếm xảy ra tệ nạn xã hội.  + Liên hệ Mr Thái để được xem nhà trực tiếp (miễn trung gian môi giới) CAM KẾT THÔNG TIN THẬT HÌNH ẢNH THẬT",12/09/2022,Tin thường,batdongsan_so_com_vn_1673802476.4658978
11 tỷ VNĐ,Đường Kim Đồng phường Giáp Bát, 68m2,, 6, 1, 4, 4, 3," - Diện tích 68 m2 - Mặt Tiền ; 6 m - Nhà xây 4Tầng - 4 phòng ngủ  - Đường:7.m, thuận lợi cho ô tô đi lại, đường phân lô bàn cờ thông qua 158 Giáp Bát, 19 Kim Đồng.  + Vị trí đắc địa, nhà phân lô ô tô tránh, vỉa hè, kinh doanh hoặc cho thuê văn phòng cực đỉnh. Ngõ rộng rất gần phố chợ Giáp Bát kinh doanh sầm uất ngày đêm. Khu vực dân trí cao, an sinh tuyệt vời.  + Thiết kế : Nhà 4 tầng + Tầng 1: Thông sàn đang làm phòng dạy học + WC + 1 phòng nhỏ  + Tầng 2,3: 2 phòng ngủ ( 1 phòng lớn và 1 phòng vừa) + WC chung  + Tầng 4: 1 phòng ngủ + sân phơi đồ.  - Sổ đỏ chính chủ, nở hậu siêu đẹp, sẵn sàng giao dịch.  - Giá bán:12 tỷ ( Giá sẽ có gia lộc cho khách hàng thiện chí!! )  - Nếu quan tâm, hãy liên hệ ngay để Mr Tung 0978683258 được tư vấn cho AC chi tiết hơn. ",12/09/2022,Tin thường,batdongsan_so_com_vn_1673802478.1204364
"4,7 tỷ VNĐ",LONG BIEN 2 LONG BIÊN, 20m2,,,,,,,"CHỦ MÓT BÁN MẶT PHỐ KINH DOANH SIÊU ĐỈNH PHỐ LONG BIÊN 2 QUẬN LONG BIÊN - Mặt phố ĐƯỜNG 15M, chấp các loại KINH DOANH.- Khu dân cư đông đúc gần MIPEC, HỒ GƯƠM, CHỢ TRƯỜNG vây quanh. Chuyên môi giới nhà đất Long Biên với nhiều năm kinh nghiệm.- Cam kết: TƯ VẤN, XEM NHÀ MIỄN PHÍ.- KHÁCH HÀNG TRỰC TIẾP ĐÀM PHÁN VỚI CHỦ.- UY TÍN - TẬN TÂM - CHUYÊN NGHIỆP.",12/09/2022,Tin thường,batdongsan_so_com_vn_1673802479.4458897
"5,05 tỷ VNĐ",Đường Trần Quốc Vượng phường Dịch Vọng Hậu, -1m2,, 5, 3, 6, 4, 5,"
    Bán nhà đẹp như khách sạn lô góc thang máy TRẦN QUỐC VƯỢNG 6TxMT5M Nhà đẹp như khách sạn luôn, thang máy lô góc nên rất thoáng Vị trí nhà rất thuận tiện ở đi lại, gần nhiều trường học lớn SƯ PHẠM, ĐẠI HỌC QUỐC GIA Ngõ 78 DUY TÂN quy hoạch xong nối ngõ 181 XUÂN THUỶ thì nhà còn tăng giáVới rất nhiều nhà đẹp có giá từ 3 đến 30 tỷSổ đỏ săn sàng dao dịch ngayLH Trần Hảo 0845681666 để có giá tốt tư vấn xem nhà miễn phí 24/7. Luôn mang lại Giá Tri - Uy - Tín Niềm Tin tới khách hàng",12/09/2022,Tin thường,batdongsan_so_com_vn_1673802481.107448
9 tỷ VNĐ,Đường Hoàng Quốc Việt phường nghĩa đô, 72m2,, 5, 4, 5, 6,,"
    + Nhà chủ tự xây nên rất cẩn thận và tỉ mỉ từng chi tiết, chủ ở rất giữ gìn, khách về chỉ việc ở luôn.+ Nhà 2 thoáng nên các phòng sinh khí mát mẻ mùa hè, ô tô đỗ cổng ngày đêm.+ Nhà thuộc vị trí hiếm nhà bán ở Hoàng Quốc Việt, giao các tuyến phố như: Võ Chí Công, Bưởi, Lạc Long Quân, Phạm Văn Đồng, Cầu Giấy... giao thông có tuyến phố đi lại thuận tiện, tiện ích xung không thiếu gì.+ Sổ đỏ chính chủ, giao dịch ngay.+ Giá 9 tỷ, có thương lượng với khách thiện chí.+ Liên hệ: Em Hương  Chuyên nhà đẹp Cầu Giấy
",12/09/2022,Tin thường,batdongsan_so_com_vn_1673802482.5057049
2 tỷ VNĐ,Đường Thạch Bàn phường Thạch Bàn, 45m2,, 4, 5, 3, 3, 3,""",="""" segoeuipc,="""" ""san="""" francisco"",="""" ""helvetica="""" neue"",="""" helvetica,="""" ""lucida="""" grande"",="""" roboto,="""" ubuntu,="""" tahoma,="""" ""microsoft="""" sans="""" serif"",="""" arial,="""" sans-serif;="""" white-space:="""" pre-wrap;="""" word-spacing:="""" 0px;="""" text-transform:="""" none;="""" font-weight:="""" 400;="""" color:="""" rgb(0,26,51);="""" font-style:="""" normal;="""" orphans:="""" 2;="""" widows:="""" letter-spacing:="""" background-color:="""" rgb(255,255,255);="""" text-indent:="""" user-select:="""" text;="""" font-variant-ligatures:="""" font-variant-caps:="""" -webkit-text-stroke-width:="""" text-decoration-style:="""" initial;="""" text-decoration-color:="""" initial'bán="""" nhà="""" thạch="""" bàn="""" long="""" biên="""" 45m2="""" ngõ="""" thông="""" ô="""" tô="""" đỗ="""" cửa-đầu="""" tư-dòng="""" tiền="""" nhỉnh="""" 2="""" tỷ.="""" span="""" p="""" pspan="""" initial'-="""" vị="""" trí="""" cách="""" tránh="""" chỉ="""" 3="""" bước,="""" 7="""" chỗ="""" tránh,="""" kết="""" nối="""" nguyễn="""" văn="""" linh,="""" thời="""" trung,="""" bàn,="""" ngọc="""" trì…="""" initial'="""">- Khu vực dân trí cao, vài phút ra TTTM Aeon mall Long Biên, chợ Đồng Dinh, Hồ Ben, trường học các cấp mầm non, 1, 2, 3 Thạch Bàn, tiện ích không thiếu thứ gì.  "",="""" segoeuipc,="""" ""san="""" francisco"",="""" ""helvetica="""" neue"",="""" helvetica,="""" ""lucida="""" grande"",="""" roboto,="""" ubuntu,="""" tahoma,="""" ""microsoft="""" sans="""" serif"",="""" arial,="""" sans-serif;="""" white-space:="""" pre-wrap;="""" word-spacing:="""" 0px;="""" text-transform:="""" none;="""" font-weight:="""" 400;="""" color:="""" rgb(0,26,51);="""" font-style:="""" normal;="""" orphans:="""" 2;="""" widows:="""" letter-spacing:="""" background-color:="""" rgb(255,255,255);="""" text-indent:="""" user-select:="""" text;="""" font-variant-ligatures:="""" font-variant-caps:="""" -webkit-text-stroke-width:="""" text-decoration-style:="""" initial;="""" text-decoration-color:="""" initial'-="""" hình="""" thửa="""" vuông="""" đẹp,="""" nở="""" hậu.="""" span="""" p="""" pspan="""" quy="""" hoạch="""" kéo="""" dài="""" đường="""" nguyễn="""" thời="""" trung="""" cách="""" nhà="""" rất="""" gần,="""" và="""" đang="""" triển="""" khai="""" đến="""" phường="""" năm="""" 2023="""" sẽ="""" hoàn="""" thành,="""" tương="""" lai="""" đột="""" phá="""" tăng="""" giá.="""" initial'="""">- Nhà khách mua về ở luôn, hoặc cho thuê dòng tiền đều.  ",12/09/2022,Tin thường,batdongsan_so_com_vn_1673802484.1572871
9 tỷ VNĐ,Đường Ngọc Lâm phường Ngọc Lâm, 50m2,, 4, 25, 4, 4, 3,"- Giao thông vô cùng thuận tiện kết nối các tuyến phố chính: Bồ Đề, Ngọc Lâm, Nguyễn Văn Cừ, Hồng Tiến, Lâm Hạ, Hoàng Như Tiếp... ",12/09/2022,Tin thường,batdongsan_so_com_vn_1673802485.4628341
"12,5 tỷ VNĐ",Nguyễn Văn Huyên, 56m2,,,, 6, 6,,"THOÁNG TRƯỚC VĨNH VIỄN- 3 BƯỚC RA PHỐ-  NGÕ THÔNG- TRUNG TÂM CẦU GIẤY + Siêu hót 6 tầng ngõ thông ô tô vào nhà, trước nhà vô cùng thoáng mát, nhà cách phố bãi gửi xe chỉ vài bước chân, khu vực trung tâm quận Cầu Giấy, an ninh tốt dân trí cao, gần công viên, trường học các cấp, các trường ĐH lớn, khu vực hành chính quận đi lại thuận tiện  + Nhà diện tích 56m xây 6 tầng, 6 phòng ngủ vệ sinh khép kín, nhà đã hoàn công đầy đủ, nội thất đầy đủ xịn xò, chủ tặng lại toàn bộ bội thất hiện có+ Tầng 1: gara và bếp+ Tầng 2: khách và phòng tắm Master ( chủ làm phòng tắm xông hơi trị giá 300 triệu )+ Tầng 3,4,5: mỗi tầng chia làm 2 phòng ngủ vệ sinh khép kín+ Tầng 6: phòng thờ sân phơi+ Sổ đỏ đẹp, sẵn sàng giao dịch.+ Giá chào 12.5 tỷ (có thương lượng).+ Liên hệ ngay: 0968627597 Em Thế Anh (hỗ trợ xem nhà, tư vấn pháp lý, vay vốn ngân hàng, sang tên sổ đỏ).",11/09/2022,Tin thường,batdongsan_so_com_vn_1673802487.0914462
"17,17 tỷ VNĐ",Xuân Phương, 130m2,, 10,,,,,"CẦN BÁN NHÀ BIỆT THỰ KDT SINH THÁI XUÂN PHƯƠNG 130M Mặt 10m+ Vị trí đẹp: Không gian Sống xanh sạch đẹp.-    Trung tâm trong tương lai gần, đang phát triển nhanh như giá xăng.-    Xung quanh tiện ích đầy đủ, các Trường Đại Học, Trung Học.. , KDT, Chung cư Lớn, Bến xe Mỹ Đình, Tuyến đường chính lớn Xuân Phương, Trịnh Văn Bô...+ Tiện ích: -    Đường đôi 40m , nhiều cây xanh công viên hồ điều hòa-    Không gian yên tĩnh, xanh sạch đẹp , không khí trong lành, không khói bụi.+ Giá: thương lượng. Sổ vuông như gạch, sang tên nhanh gọn+ Có nhu cầu thực sự, thiện trí xem nhà Liện hệ Mr Đức 0898839292",09/06/2022,Tin thường,batdongsan_so_com_vn_1673802488.53259
5 tỷ VNĐ,Xuân phương, 50m2,, 4,,,,,"BÁN NHÀ XUÂN PHƯƠNG 50M  Ô TÔ TRÁNH NHỈNH 5 TỶ Vị trí gần trung tâm đang phát triển nhanh như giá xăng. Đường thông các ngả rất thuận tiện . Gần các trường Đại học Công Nghiệp Hà Nội, Đại Học Mỏ Địa Chất, Đại Học Thương Mại, C.Đ FPT. Trung học. Tiểu học.. Gần đường Xuân Phương, Trịnh Văn Bô, vài phút ra bến xe mỹ đình, vào trung tâm thành phố. Gần chợ, tiện ích xung quanh đầy đủ.. Sổ đầy đủ giấy tờ, sang tên nhanh gọn Giá thương lượng Có nhu cầu thực sự, thiện trí xem nhà liên hệ Anh Đức 0898839292",09/06/2022,Tin thường,batdongsan_so_com_vn_1673802493.9202461
14 tỷ VNĐ,MỄ TRÌ, 190m2,, 11,,,,,"BÁN NHÀ  MỄ TRÌ NAM TỪ LIÊM 190M 14 TỶ Gia đình chuyển vào Sài Gòn cần bán nhà sân trên vườn dưới, đào ao thả cá được. Đường vào rộng thoáng, thông các ngả đường Phạm Hùng, Mễ trì, Đồng Me Sổ chính chủ đầy đủ, cất giữ cẩn thận, sang tên ngay. Giá thương lượng Thiễn trí, có nhu cầu thự sự  gọi cho tôi Mr Đức 0898839292",08/06/2022,Tin thường,batdongsan_so_com_vn_1673802495.4247155
,AN KHÁNH, 9m2,,,,,,,"BÁN NHÀ AN KHÁNH HOÀI ĐỨC 88M MẶT 12M NHỈNH 3 TỶ Khu vực đang phát triển nhanh như giá xăng Vị trí trung tâm trong tương lai Gần đại lộ thăng long, Vincom Mega Mall, KDT an khánh. Nhà tự xây tâm huyết  giá thương lượngThiện trí xem nhà gọi cho tôi Mr Đức 0898839292",08/06/2022,Tin thường,batdongsan_so_com_vn_1673802496.800034
"12,21 tỷ VNĐ",LÊ ĐỨC THỌ, 59m2,, 6,, 7,,,"BÁN TÒA NHÀ VĂN PHÒNG LÊ ĐỨC THỌ 7 TẦNG MẶT 6M THANG MÁY Ô TÔ NHỈNH 12 TỶThiết kế hiện đại, sang trọng, có gara, thông sàn.Khu trung tâm phát triển, xung quanh là các Trường Đại học lớn, Đại Học Thương Mại, Đại Học Quốc Gia, Đại Học Sư Phạm, Bến xe Mỹ Đình..Thích hợp làm văn phòng, công ty, Spa..Sổ đẹp, pháp lý sạch sẽ, sang tên nhanh gọnGiá: Thương lượngCó nhu cầu, thiện trí xem nhà liên hệ : Anh Đức 0898839292",07/06/2022,Tin thường,batdongsan_so_com_vn_1673802498.643104
"8,18 tỷ VNĐ",thiên hiền, 65m2,, 7,,,,,"BÁN NHÀ PHỐ THIÊN HIỀN MỸ ĐÌNH 65M MẶT 7m5 Ô TÔ KINH DOANH TỐT  Nhỉnh 8 tỷ + Vị trí rất đẹp: Ô tô đỗ cửa. Rất Gần Các Trường Đại Học học Cao đẳng lớn, Đại Học Thương Mại, Đại Học Quốc gia, Đại Học Sư Phạm.. Đường vành đai 3, Bến Xe Mỹ Đình, vài phút vào đến Trung tâm thành phố Tiện ích xung quanh đầy đủ. Giao thông tuận lợi. Khu vực Sầm uất, Đông dân cư, phát triển rất manh. + Tiện ích:  Đường thông thoáng,Kinh doanh cho thuê, Sửa sang lại làm Nhà nghỉ, văn phòng, CCMN rất tốt. + Giá: Thương lượng, Sổ đẹp pháp lý sạch, sang tên nhanh gọn. Thiện trí , Có nhu cầu thực sự xem nhà Liên hệ Đức Thổ Cư HN 0898839292",07/06/2022,Tin thường,batdongsan_so_com_vn_1673802500.9090433
"14,14 tỷ VNĐ",mễ trì thượng, 85m2,, 9,, 9,,,"Bán Nhà CCMN Mễ Trì Nam Từ Liêm 85m 9T DT 100tr 1th Thang máy Nhỉnh 14 tỷ + Thiết kế thông minh đầy đủ công năng. Nhà mới Chắc chắn, Sẵn sử dụng. Nhu cầu thuê trọ rất cao, Đông Sinh viên, Công nhân viên.. Rất Gần Các Trường Đại Học học Cao đẳng lớn, Đại Học Thương Mại, Đại Học Quốc gia, Đại Học Sư Phạm.. Đại lộ Thăng Long, Bến Xe Mỹ Đình, Bệnh Viện Hồng Ngọc vài phút vào đến Trung tâm thành phố Tiện ích xung quanh đầy đủ. Giao thông tuận lợi. Sổ Vuông đẹp, sẵn sàng về với chủ mới. + Có nhu cầu thực sự, thiện trí xem, nhà tư vấn + Liên hệ: Đức Thổ Cư HN 0898839292.",06/06/2022,Tin thường,batdongsan_so_com_vn_1673802504.0037968
"5,2 tỷ VNĐ",Dịch vọng hậu, 80m2,, 6,, 5,,,"BÁN NHÀ TRẦN QUỐC VƯỢNG CẦU GIẤY 80M MẶT 6M NHỈNH 5 TỶ+ Vị trí:Trung tâm quận Cầu giấy, tiện ích đầy đủ.Gần các trường Đại Học lơn như Đại Học Quốc Gia, Đại Học Sư Phạm, Học Viện Báo trí Tuyên truyền, Đại Học Thương Mại.. Gần chợ Sinh viên, Bến xe Mỹ Đình, các tuyến đường chính lớn, Xuân Thủy, Cầu Giấy, Phạm Văn Đồng, Phạm Hùng...+ Khu vực phát triển mạnh, Sầm uất, dân trí cao, An sinh tốt..+ Có nhu cầu thực sự, thiện trí xem nhà.+ Giá thương lượng.+ Liên hệ: Đức Thổ Cư CG 0898839292.",06/06/2022,Tin thường,batdongsan_so_com_vn_1673802505.3232677
"5,9 tỷ VNĐ",Dương Khuê, 50m2,, 6,,,,,"BÁN NHÀ CCMN DƯƠNG KHUÊ 5T Mặt 6m DT 50tr 1th Nhỉnh 5 tỷ + Vị trí rất đẹp: Ô tô vỉa hè, Tiện ích xung quanh đầy đủ. + Gần Các trường Đại học Cao đẳng lớn, Đại Học Thương Mại, Đại Học Quốc gia, Đại Học Sư Phạm.. Gần bến xe Mỹ Đình. + Khu vực đông dân cư, sinh viên, nhu cầu thuê rất cao. + Giá: thương lượng + Có nhu cầu thiện trí xem nhà tư vấn Liên hệ Đức Thổ Cư HN 0898839292",05/06/2022,Tin thường,batdongsan_so_com_vn_1673802507.286016
