price,address,Diện tích,Details,Ngày đăng,Loại tin,id,Số tầng,Mặt tiền,Số phòng ngủ,Số toilet,Lộ giới
"5,5 tỷ VNĐ","Pháp Vân, Ngọc Hồi HN", 36m2,"+ Nhà đẹp mới coong 5 tầng, nở hậu , trước sau 2 mặt thoáng, kinh doanh tốt + t1 kinh doanh hoặc để xe ô tô + bếp, wc + T2 p khách rộng, t 2-3 có 4p ngủ, t5 p thờ, sân phơi, công năng đầy đủ + Sổ cất két giao dịch ngay",08/09/2022,Tin thường,batdongsan_so_com_vn_1673803410.0473971,,,,,
"5,5 tỷ VNĐ","hoàng mai, hà nội", 75m2,"7Bán nhà Hoàng Mai, Phố Tân Mai, 75m, 5t, 5,5 tỷ.+ Nhà mới, ngõ thông, 5M oto tránh kinh doanh, 6 ngủ đầy đủ công năng, hai mặt thoáng vĩnh viễn.+ Gần Giải Phóng, Kim Đồng, Tam Trinh, Trương Định, Hoàng Mai, trường Đại Học Kinh Tế Quốc Dân Xây Dựng, Bách khoa, Bến Xe Giáp Bát, Bệnh viện Bạch Mai, hưởng trọn tiện ích của các chung cư lân cận.+ Sổ đỏ chính chủ sẵn sàng giao dịch.Lh: 0346363362 : Phú Gia chuyên nhà phố Hà Nội.",08/09/2022,Tin thường,batdongsan_so_com_vn_1673803412.0330648,,,,,
24 tỷ VNĐ,Hoàng Hoa Thám, 86m2,"Cần bán nhà mặt phố Hoàng Hoa Thám, Ba Đình Diện tích 86m,nhà 1 tầng cũ bán đất,mặt tiền 5.70m Đoạn nhà mình đẹp nhất dãy phố, vỉa hè trước nhà rộng thênh thang.Phố ô tô 2 chiều, kinh doanh ngày đêm, hiện đang cho thuê vui tầng 1 là 20tr/tháng Nhà 1 tầng cũ phù hợp khách mua về xây dựng kinh doanh tuyệt vời Sổ đỏ chính chủ,giao dịch ngay Giá 24 tỷ có thương lượng Liện hệ : Tùng BĐS 0981 669 144 - Chuyên nhà đất thổ cư Hà Nội",08/09/2022,Tin thường,batdongsan_so_com_vn_1673803413.2598224,,,,,
"7,8 tỷ VNĐ",Khương Đình Thanh Xuân Hà Nội, 45m2,"LÔ GÓC THANG MÁY Ô TÔ KINH DOANH PHỐ KHƯƠNG ĐÌNH TX 45M 6T MT 5.4 CHỈ 7.8 TỶVị trí nhà 6 tầng lô góc 2 mặt thoáng vĩnh viễn, cầu thang máy mới đẹp long lanh,  Kinh doanh, văn phòng cực tốt+ Thiết kế thang máy nhập khẩu xịn xò cực đẹp, đẳng cấp, cầu thang bộ tay vịn gỗ, thiết kế tất cả mỗi tầng 1 phòng (thông sàn) + vệ sinh đẹp long lanh. Tầng 1: Phòng khách + vệ sinh đẹp.- Tầng 2, 3, 4, 5: Mỗi tầng 1 phòng ngủ đẹp hiện đại + vệ sinh- Tầng 6: Phòng Thờ + sân phơi.+ Giá chào: 7.8 tỷ (Có thương lượng)+ Sổ đỏ chính chủ vuông đẹp, sẵn sang giao dịch.Liên hệ: Mrs Phượng 0974352054 - Tư vấn tận tâm, miễn phí 24/24h (zalo, Fb) , hỗ trợ tư vấn Pháp lý, vay vốn.",08/09/2022,Tin thường,batdongsan_so_com_vn_1673803414.5573497, 6,,,,
9 tỷ VNĐ,phúc la, 52m2,"Bán Nhà, Xa La. Hà Đông. Ô Tô Kinh Doanh 52m2 x 6 tầng. Mặt Tiền 4.1m Giá 9 Tỷ.   MẶT PHỐ - KINH DOANH SẦM UẤT – Ô TÔ ĐỖ NGÀY ĐÊM  + Nhà mặt phố Xa La cách đường Phùng Hưng vài chục mét, giao với các đường Trần Phú, Nguyễn Trãi, Ngã Tư Sở, Quang Trung, Cen Cô 5, Ngả đi các hướng nội thành và các tỉnh lân cận rất thuận tiện. + Nhà gần các trường đại học lớn như; Đại Học Kiến Trúc, Bưu Chính Viễn Thông, gần Trung Tâm Thương mại Roal Anl CiTy, Bệnh Viện 103, Viện Bỏng, Học Viện Quân Y, gần Siêu Thị BigC Hồ Gươm, Siêu Thị Coopmax Hà Đông, Chợ Hà Đông, Huyện Uỷ Hà Đông, cũng như rất nhiều dịch vụ xung quanh đa dạng và phong phú các loại hình vui chơi giải trí khác. Giao thông thuận tiện, an sinh đỉnh, an ninh an toàn. + Nhà nằm trên khu phố sầm uất và rất tấp lập của Hà Đông, buôn bán, kinh doanh, hàng ăn, spa, văn phòng và các loại hình dịch vụ rất đa dạng và phát triển.  + Nhà thiết kế 6 tầng:                                                                                                          - - - Tầng 1: Phòng khách, Bếp, wc  - Tầng 2,3,4,5: Mỗi tầng 2 phòng ngủ và wc - Tầng 6 : Phòng thờ, sân phơi. + Nhà xây dựng bê tông cốt thép rất chắc chắn, nhà mới đẹp chủ mới về chỉ việc ở.  Sổ đỏ chính chủ, cất két sẵn sàng giao dịch.   LH: E KHÁNH: 0984568179 ",08/09/2022,Tin thường,batdongsan_so_com_vn_1673803416.3645153, 6, 4, 8, 5,
"6,5 tỷ VNĐ",cầu giấy hà nội, 66m2,"+ Bán Nhà Phố Trung Kính, Quận Cầu Giấy- Kinh Doanh 66m 3tầng giá 6.5Tỷ. Giao với các phố; Trần Duy Hưng, Nguyễn Ngọc Vũ, Trung Hòa, Trần Thánh Tông, Nguyễn Khang… + Ngõ thông rộng ô tô đỗ cửa, cho thuê văn phòng, kinh doanh nhà nghỉ,  dòng tiền tốt mỗi tháng thu về từ 30 đến 35 triệu. + Chủ bán để sang nước ngoài định cư với con, căn nhà rất có lộc không lỗi phong thủy. + Sổ đỏ cất két, sẵn sàng giao dịch. + Liên hệ; 0911303899 - Mr Quân. Tư vấn miễn phí 24/24.",08/09/2022,Tin thường,batdongsan_so_com_vn_1673803417.843565,,,,,
"12,8 tỷ VNĐ",Trần Quốc Hoàn, 41m2,"Cần bán nhà phân lô ngõ 201 Trần Quốc Hoàn,Cầu GiấyDiện tích 41m x 6 tầng,mặt tiền 4m Nhà đẹp nằm trung khu phân lô của ĐH Ngoại Ngữ.Ngõ rộng ô tô 7 chỗ vào nhà, kinh doanh, văn phòngNhà thiết kế phong cách hiện đại,nhà gần như mới khách mua về ở được ngaySổ đỏ chính chủ,giao dịch ngayGiá 12.8 tỷ có thương lượng Liện hệ : Tùng BĐS 0981 669 144 - Chuyên nhà đất thổ cư Hà Nội ",08/09/2022,Tin thường,batdongsan_so_com_vn_1673803419.4592755,,,,,
"7,1 tỷ VNĐ",văn quán, 56m2,"Bán Nhà, Chiến Thắng. Hà Đông. Ô Tô Kinh Doanh 56m2 x 5 tầng. Mặt Tiền 4.2m Giá 7.1 Tỷ.    PHÂN LÔ - KINH DOANH SẦM UẤT – Ô TÔ ĐỖ NGÀY ĐÊM – VỈA HÈ RỘNG  + Nhà phân lô, cách đường Chiến Thắng vài bước chân, giao với các đường Trần Phú, Nguyễn Trãi, Ngã Tư Sở, Quang Trung, Ngả đi các hướng nội thành và các tỉnh lân cận rất thuận tiện. + Nhà gần các trường đại học lớn như; Đại Học Kiến Trúc, Bưu Chính Viễn Thông, Học Viện An Ninh, gần Trung Tâm Thương mại Roal Anl CiTy, Bệnh Viện 103, gần Siêu Thị BigC Hồ Gươm, Siêu Thị Coopmax Hà Đông, Chợ Phùng Khoang, cách Hồ Văn Quán vài trăm mét, cũng như rất nhiều dịch vụ xung quanh đa dạng và phong phú các loại hình vui chơi giải trí khác. Giao thông thuận tiện, an sinh đỉnh, an ninh an toàn. + Nhà nằm trên khu phố sầm uất và rất tấp lập của Hà Đông, buôn bán, kinh doanh, hàng ăn, spa, văn phòng và các loại hình dịch vụ rất đa dạng.  + Nhà thiết kế 5 tầng:                                                                                                          - - - Tầng 1: Phòng khách, Bếp, wc  - Tầng 2,3,4: Mỗi tầng 2 phòng ngủ và wc - Tầng 5 : Phòng thờ, sân phơi. + Nhà xây dựng chắc chắn, kiên cố. Chủ thiện chí bán để mau biệt thự.  Sổ đỏ chính chủ, cất két sẵn sàng giao dịch.   LH: E KHÁNH: 0984568179 ",08/09/2022,Tin thường,batdongsan_so_com_vn_1673803420.794711, 5,, 6, 4,
"3,5 tỷ VNĐ",Đường Thượng Thanh phường Thượng Thanh, 47m2," Gia đình cần bán nhanh mảnh đất đẹp nhất phường Thượng Thanh + Diện tích 47m, mặt tiền 3,6m  + Đường trước nhà rộng 3,5m, thông thoáng, ô tô vào đất  + Cách 20m ra đường ô tô tránh nhau thoải mái + Đường thông mọi ngả, đi từ Lý Sơn hay Thượng Thanh đều vào được + Cách Big C Long Biên vài trăm m, sang Phố Cổ chỉ 10 - 15 phút xe máy  + Xung quanh có nhiều khu chung cư cao cấp, công viên công cộng phục vụ cho mọi người + Dân cư sầm uất, đa dạng các loại hình dịch vụ, trường học, chợ, siêu thị chỉ cần đi bộ cũng đến + Sổ đỏ chính chủ Giá bán : 3,5 tỷ ( Có thương lượng ). Liên hệ : 0373968926 ( Miễn trung gian ).",08/09/2022,Tin thường,batdongsan_so_com_vn_1673803422.1470935,, 3,,,
"4,2 tỷ VNĐ",Đường Tây Sơn phường Quang Trung, 50m2,"+ phân lô, ô tô quân đội đẹp nhất phố Tây Sơn, vô cùng thoáng mát, dân trí cao, an ninh tốt.Nhà thiết kế bê tông cốt thép vô cùng chắc chắn, ở ngay.- Tầng 1: Phòng khách, bếp, vệ sinh.- Tầng 2,3,4: Mỗi tầng 1 phòng vệ sinh khép kín.- Tầng 5: Phòng thờ, sân phơi.+ Sổ đỏ phân lô nở hậu siêu đẹp+ Sổ đỏ, chính chủ, sang tên nhanh.",08/09/2022,Tin thường,batdongsan_so_com_vn_1673803423.4396353, 4, 5, 3, 4, 15
"12,2 tỷ VNĐ",135 Trường Chinh, 34m2,"MẶT ĐƯỜNG TRƯỜNG CHINH – ĐỐNG ĐA, 5 TẦNG MẶT TIỀN 8M, 2 MẶT PHỐ - VỈA HÈ, 12.2 TỶ+ Vị trí vip, 2 mặt phố, vỉa hè rộng, kinh doanh vô địch… + Khu vực trung tâm 3 quận: Đống Đa – Thanh Xuân – Hai Bà Trưng, thuận tiện di chuyển đường Giải Phóng, Nguyễn Trãi, đường Láng, Lê Trọng Tấn, đại học Y …. - Diện tích tầng 1 – 34m2. Từ tầng 2 đua ra 2 phía rỗng rãi. Chủ đang cho người quen thuê để kinh doanh với giá ưu đãi 35tr/tháng. Khách mua chủ lấy lại nhà hoặc khách tiếp tục cho thuê tuỳ ý.  - Sổ đỏ chính chủ, sẵn sàng giao dịch + Liên hệ: K.S Phương – 0918120568 để được tư vấn về ngôi nhà và gặp chủ đàm phán trực tiếp",08/09/2022,Tin thường,batdongsan_so_com_vn_1673803424.835901, 5, 8, 4, 4,
"4,2 tỷ VNĐ",Đường Tây Sơn phường Quang Trung, 50m2,"+ phân lô, ô tô quân đội đẹp nhất phố Tây Sơn, vô cùng thoáng mát, dân trí cao, an ninh tốt.Nhà thiết kế bê tông cốt thép vô cùng chắc chắn, ở ngay.- Tầng 1: Phòng khách, bếp, vệ sinh.- Tầng 2,3,4: Mỗi tầng 1 phòng vệ sinh khép kín.- Tầng 5: Phòng thờ, sân phơi.+ Sổ đỏ phân lô nở hậu siêu đẹp+ Sổ đỏ, chính chủ, sang tên nhanh.",08/09/2022,Tin thường,batdongsan_so_com_vn_1673803426.542335, 4, 5, 3, 4, 15
12 tỷ VNĐ,Lê Hồng Phong- Hà Đông, 58m2,"Bán nhà mặt phố Lê Hồng Phong, Hà Đông, kinh doanh 58mx 5T hơn 12 tỷ Bán nhà mặt phố kinh đô thời trang Lê Hồng Phong, Hà Đông, diện tích lớn 58m với 5 tầng đẹp có ô chờ thang máy, vỉa hè rộng trung tâm gần sân bóng và trường học. Vị trí đắc địa gần các toà chung cư, dân cư, trường học. Phù hợp tất cả loại hình kinh doanh: thời trang, spa, siêu thị, phòng khám, quán ăn, café, hoa quả, hiệu thuốc, điện tử điện lạnh, văn phòng phẩm,… Giao thông thuận lợi trục chính đi các phố Tô qua qua Bà Triệu cắt Lê Lợi sang Nhuệ Giang ra Trưng Nhị vào Hoàng Hoa Thám vài bước ra Quang Trung. Sổ vuông đẹp sẵn sàng giao dịch. Giá: 12 tỷ ( gia lộc). Liên hệ : Huyền Hà Đông ( 0363703491- 0965472910) - Chuyên gia nhà Thổ Cư tư vấn hàng nghìn ngôi nhà tiết kiệm THỜI GIAN- CÔNG SỨC- TIỀN BẠC. Hỗ trợ 24/7 và tư vấn pháp lý, vay vốn.",08/09/2022,Tin thường,batdongsan_so_com_vn_1673803427.8598907, 5,,,,
12 tỷ VNĐ,Trưng Nhị- Hà Đông, 58m2,"Bán nhà mặt phố Trưng Nhị, Hà Đông 58mx5T kinh doanh hơn 12 tỷ Bán nhà mặt phố vip Trưng Nhị, Hà Đông, ô chờ thang máy diện tích rộng 58m thiết kế 5 tầng hiện đại, thông các tuyến phố sầm uất bao quanh chợ lớn Hà Đông Lê Lợi ra Hoàng Hoa Thám cắt ngang Nguyễn Trãi sang Tô Hiệu qua Bà Triệu. Phù hợp kinh doanh các loại hình: Thời trang, siêu thị, café, quán ăn, điện tử điện lạnh, hiệu thuốc, văn phòng phẩm, hoa quả, phòng khám, spa, tóc, … Sổ vuông đẹp sẵn sàng giao dịch. Giá: 12 tỷ ( gia lộc). Liên hệ : Huyền Hà Đông ( 0363703491- 0965472910) - Chuyên gia nhà Thổ Cư tư vấn hàng nghìn ngôi nhà tiết kiệm THỜI GIAN- CÔNG SỨC- TIỀN BẠC. Hỗ trợ 24/7 và tư vấn pháp lý, vay vốn.",08/09/2022,Tin thường,batdongsan_so_com_vn_1673803430.8830125, 5,,,,
"3,35 tỷ VNĐ",La Khê- Hà Đông, 40m2,"Bán nhà La Khê, Hà Đông 40mx4 tầng, 2 mặt thoáng ở ngay hơn 3 tỷ - Vị trí: Nhà phố La Khê gần chợ Bông Đỏ, diện tích 40m thiết kế 4 tầng hiện đại ,2 mặt thoáng vĩnh viễn các phòng ngập tràn ánh sáng, chỉ việc đến ở. - Giao thông vô cùng thuận lợi thông các phố Quang Trung sang Lê Trọng Tấn qua Ngô Thì Nhậm sang Hoàng Đôn Hoà hàng xóm Ngô Quyền. - Tiện ích: Gần siêu thị Metro, Quận uỷ và nhà thi đấu, ngân hàng, trường học, bệnh viện,…. Nằm trong khu dân cư toàn cán bộ rất văn minh, an ninh tuyệt đối. - Sổ đỏ vuông, sẵn sàng giao dịch. - Giá chỉ có 3.35 tỷ ( có gia lộc). - Liên hệ : Huyền Hà Đông ( 0363703491- 0965472910)- Chuyên gia nhà Thổ Cư tư vấn hàng nghìn ngôi nhà tiết kiệm THỜI GIAN- CÔNG SỨC- TIỀN BẠC. Hỗ trợ 24/7 và tư vấn pháp lý, vay vốn.",08/09/2022,Tin thường,batdongsan_so_com_vn_1673803432.3745956, 4,,,,
"3,35 tỷ VNĐ",Hà Trì- Hà Đông, 40m2,"Bán nhà Hà Cầu, Hà Đông 40mx4T ngõ nông 2 mặt thoáng hơn 3 tỷ + Bán nhà riêng Hà Trì, Hà Đông, diện tích 40m với 4 tầng mới hiện đại, nhà 2 mặt thoáng vĩnh viễn, dân xây chắc chắn chỉ việc đến ở. + Nhà bán thông các phố Đa Sỹ sang Lê Lợi cắt Bà Triệu gần Tô Hiệu sang Lê Hồng Phong hàng xóm Đa Sỹ gần bệnh viện lớn Quân y 103, viện Bỏng Quốc Gia. + Tiện ích nhiều trường học các cấp, chợ, ngân hàng, siêu thị khu vực trung tâm bậc nhất Quận. + Sổ đỏ vuông sẵn sàng giao dịch. + Giá chỉ 3.35 tỷ ( có gia lộc). -Liên hệ : Huyền Hà Đông ( 0363703491- 0965472910)- Chuyên gia nhà Thổ Cư tư vấn hàng nghìn ngôi nhà tiết kiệm THỜI GIAN- CÔNG SỨC- TIỀN BẠC. Hỗ trợ 24/7 và tư vấn pháp lý, vay vốn.",08/09/2022,Tin thường,batdongsan_so_com_vn_1673803433.799415, 4,,,,
11 tỷ VNĐ,"Trâu Quỳ, Gia Lâm, hà Nội", 42m2,"Cần Bán Nhanh 42m2 Đất Mặt Phố Thành Trung, Tt Trâu QUỳ, Gia Lâm Kinh Doanh Sầm Uất  DT: 42m2. MT: 4m Hậu 4m Đường trước đất 30m. Vẻ hè rộng, kinh doanh tốt nhất. Mặt phố đông đúc, giao thông tấp nập.  Đường trung tâm kinh tế của Gia Lâm. Đất có sẵn sổ đỏ, sẵn sàng giao dịch Gần ngay Học viện nông nghiệp, gần Khu đô thị 31ha. Gần Uỷ Ban…  Hotlinie: 0399 643 640 gặp Công để xem đất #congbdsgialam #trâu_quỳ #gialam",08/09/2022,Tin thường,batdongsan_so_com_vn_1673803435.1488671,, 4,,,
"1,3 tỷ VNĐ",Đường Quốc lộ 3 phường Nguyên Khê, 56m2,"RẺ NHẤT NGUYÊN KHÊ - ĐÔNG ANH  - Diện tích: 56.5m - Mặt tiền: 4.2m - Dài: 13.3m - Đường gần 3m ô tô vào đến đất.  - Cách đường QL3 200m, cách đường Võ Nguyên Giáp 1,5km. - Cách chợ Lắp Ghép 700m, cách bệnh viện Bắc Thăng Long 1km. - Cam kết đất không tranh chấp, không vướng quy hoạch, sổ đỏ sẵn sàng giao dịch.  LH Mr Huy: 0979.696.848",08/09/2022,Tin thường,batdongsan_so_com_vn_1673803436.7675376,, 4,,,
63 tỷ VNĐ,Nguyễn Khắc Nhu Ba Đình Hà Nội, 172m2," - Diện tích đất 172m2, Mt 7.5m Giá bán 63 tỷ ( có thương lượng ) - mảnh đất nằm ở vị trí cực đẹp, khu vực kinh doanh sầm uất. - Giao thông thuận tiện di chuyển các tuyến phố lân cận như phố Hàng Than, Hàng Bún, Phạm Hồng Thái, Nguyễn Trường Tộ, Quán Thánh, Yên Ninh, Cửa Bắc, Nguyễn Thi Phương, Phố Cổ, Hồ Tây, Hồ Gươm - Nhà lâu năm chủ xác định bán đất.Khách mua về phù hợp xây toà building, căn hộ apartment, nhà hàng, coffee! - Sổ đỏ đẹp, sẵn sàng giao dịch.  - ACE Có nhu cầu liên hệ với em để được tư vấn! ",08/09/2022,Tin thường,batdongsan_so_com_vn_1673803438.5816832,, 7,,,
"5,1 tỷ VNĐ",Đường Lạc Long Quân phường Bưởi, 35m2,"CỰC HIẾM NHÀ ĐẸP TÂY HỒ - DT35M2X5TẦNG - Ô TÔ - NGÕ THÔNG - KINH DOANH - NHỈNH 5TỶ 0976106636 Vị trí đắc địa, nhà cách mặt phố 20m, ngõ thông Võng Thị, Thụy Khuê, ô tô dừng đỗ ngày đêm. Gần trường học các cấp, an sinh cực đỉnh. Khu vực giao thông thuận tiện, chủ nhà quan chức, gia đình con cái thành đạt, cực kỳ có lộc, chủ để lại toàn bộ nội thất. Thiết kế 5 tầng hiện đại. Tầng 1: Khách + Bếp + Để xe. Tầng 2,3,4: Mỗi tầng 1 phòng. Tầng 5: Sân phơi. Pháp lý: Sổ đỏ chính chủ, giao dịch ngay. Giá chào: Nhỉnh 5 tỷ. Liên hệ: Mr Vượng thổ cư Tây Hồ để được tư vấn và xem nhà miễn phí. 0976106636",08/09/2022,Tin thường,batdongsan_so_com_vn_1673803440.0467632, 5, 3, 3, 3, 3
