price,address,Diện tích,Mặt tiền,Lộ giới,Số tầng,Số phòng ngủ,Số toilet,Details,Ngày đăng,Loại tin,id
"5,6 tỷ VNĐ",Đường Tân Mai phường Tân Mai, -1m2, 3, 4, 5, 3, 4,"Nhà Tân Mai-Hoàng Mai Ô TÔ - KINH DOANH - NGÕ THÔNG - Nhà Mới -Nhà Thông Sàn  -Giá: 5,5 tỷ -5 tầng -Thông Sàn -Kinh doanh sầm uất -Vị Trí: 100m ra THPT Trương Định, Gần Hồ Nguyễn Chính",07/09/2022,Tin thường,batdongsan_so_com_vn_1673803610.8229125
"18,5 tỷ VNĐ",Đường Nguyễn Lương Bằng phường Ô Chợ Dừa, 54m2, 5, 30, 4, 6,,"+ Chính chủ cần bán nhà Mặt Phố Nguyễn Lương Bằng, Vỉa Hè Rộng 5 m Đường Trước Nhà Rộng 30m diện tính nhà 54 m2 x4 tầng giá 18,5 tỷ  + Phố Nguyễn Lương Bằng cùng Tây Sơn, Tôn Đức Thắng nằm trên trục xuyên tâm nổi tiếng của Thủ Đô nối liền cửa ngõ Hà Đông với trung tâm chính trị Ba Đình, Hồ Tây thắng cảnh, thông thương cực kỳ thuận tiện.+ Nhà vị trí đẹp nhất phố, quy hoạch ổn định, vỉa hè rộng, mới xây được vài năm còn rất mới, thiết kế 4 tầng bán thông sàn, mỗi tầng gồm sàn lớn kinh doanh và 1 phòng nhỏ rất thuận tiện vừa ở vừa làm văn phòng hay kinh doanh đỉnh.+ Sổ đỏ đẹp, chính chủ, sẵn sàng giao dịch.+ LH:Hoàng Bắc chuyên nhà đất Hà Nội, dẫn khách xem nhà và Tư vấn miễn phí 24/7",07/09/2022,Tin thường,batdongsan_so_com_vn_1673803612.68712
"6,2 tỷ VNĐ",Cự Lộc, 46m2, 4,, 5,,,"1 NHÀ RA Phố Cự Lộc, Thanh Xuân 46m2, 5 Tầng, MT 4.3m, Ô TÔ qua nhà, Giá 6.2 Tỷ.+ Vị trí đẹp nhất Phố, gần Royal City, trường học, chợ, bãi xe ô tô 20m.+ Ngõ rộng thông thoáng, khu dân trí cao, an ninh tốt rất đáng sống.+ Sổ đỏ vuông đẹp, pháp lý chuẩn, sẵn sàng dao dịch.   LH: Em Hoan, 0925088355, chuyên Thổ cư Thanh Xuân, Đống Đa, miễn phí xem nhà 24/7.",07/09/2022,Tin thường,batdongsan_so_com_vn_1673803614.4334822
"3,95 tỷ VNĐ",Đường Khương Đình phường Hạ Đình, 38m2, 3, 1, 4, 4, 3,"+ Nhà nằm trong khu vực có nhiều trường đại học, an ninh tốt, gần Royal city, Ngã Tư Sở với giao thông thuận tiện, tiện ích vô vàn. + Dự án đường 2.5 đi qua thì nhà mình ra mặt đường. Tương lai vô cùng giá trị. “Mua bất động sản không chỉ là cách tốt nhất, cách nhanh nhất, cách an toàn nhất mà còn là cách duy nhất để trở nên giàu có.”",07/09/2022,Tin thường,batdongsan_so_com_vn_1673803615.7340288
"18,5 tỷ VNĐ",Đường Nguyễn Lương Bằng phường Ô Chợ Dừa, 54m2, 5, 30, 4, 6,,"+ Chính chủ cần bán nhà Mặt Phố Nguyễn Lương Bằng, Vỉa Hè Rộng 5 m Đường Trước Nhà Rộng 30m diện tính nhà 54 m2 x4 tầng giá 18,5 tỷ  + Phố Nguyễn Lương Bằng cùng Tây Sơn, Tôn Đức Thắng nằm trên trục xuyên tâm nổi tiếng của Thủ Đô nối liền cửa ngõ Hà Đông với trung tâm chính trị Ba Đình, Hồ Tây thắng cảnh, thông thương cực kỳ thuận tiện.+ Nhà vị trí đẹp nhất phố, quy hoạch ổn định, vỉa hè rộng, mới xây được vài năm còn rất mới, thiết kế 4 tầng bán thông sàn, mỗi tầng gồm sàn lớn kinh doanh và 1 phòng nhỏ rất thuận tiện vừa ở vừa làm văn phòng hay kinh doanh đỉnh.+ Sổ đỏ đẹp, chính chủ, sẵn sàng giao dịch.+ LH:Hoàng Bắc chuyên nhà đất Hà Nội, dẫn khách xem nhà và Tư vấn miễn phí 24/7",07/09/2022,Tin thường,batdongsan_so_com_vn_1673803617.056491
3 tỷ VNĐ,Đường Gốc đề phường Minh khai, 33m2,, 1,,,,"Chủ cần bán gấp căn 30m2, 5T mới koong , đầy đủ nội thất cơ bản, nhỉnh 3 tỷ. Nhà chủ xây rất có tâm, chọn thiết kế từng viên gạch,khung cột chắc chắn, nhà cầu thang ốp gỗ nhập, sàn gỗ cao cấp. Nhà bếp hiện đại tiết kiệm diện tích tối đa.  Khu gốc đề tập chung đông dân cư, với Các Trường ĐH chỉ mất vài phút đi xe. ngõ thông giao thương thuận tiện. Ngõ ba gác tránh, mà giá cực ưu đãi , căn hieemd có tại khu vực ở thời điểm hiện tại. Chủ nhà thiện trí bán thương lượng giá cả trực tiếp với chủ. Sổ đỏ vuông vắn sẵn sàng giao dịch. LH: Ngọc Bé 0962753326 để được tư vấn hỗ trợ xem nhà hoàn toàn miễn phí.",07/09/2022,Tin thường,batdongsan_so_com_vn_1673803618.262266
"6,5 tỷ VNĐ","hạ đình, thanh xuân, hà nội.", 66m2,,, 3, 3, 2,"+ Nhà Phố Hạ Đình, Quận Thanh Xuân- Kinh Doanh-Ô Tô Đỗ Cửa. 66m2, 3Tầng 6.5Tỷ. Giao với các đường; Nguyễn Trãi, Nguyễn Xiển, Nguyễn Tuân, Vũ Trọng Phụng, Khương Đình,… Ngõ thông thoáng ô tô vào nhà, mở cửa hàng kinh doanh hoặc làm nhà nghỉ, dòng tiền cực tốt, khu vực sầm uất. Chỉ vài bước ra bờ sông Tô Lịch. + Chủ nhà bán để sang nước ngoài định cư với con, khách mua về ở ngay. Phù hợp cho gia đình 4 đến 5 người ở. Di chuyển 5 phút ra Star Gaden, 10 phút đến Royal City, trong đó có nhiều khu vui chơi và cơ chế hưởng thụ dẳng cấp. + Sổ đỏ cất két, sẵn sàng giao dịch. + Liên hệ; 0911303899 - Mr Quân. Tư vấn miễn phí 24/24.",07/09/2022,Tin thường,batdongsan_so_com_vn_1673803619.9059246
"5,7 tỷ VNĐ",Đường Ngọc Thụy phường Ngọc Thụy, 30m2, 3, 4, 5, 3, 4,"
    
Bán nhà tái định cư Ngọc Thụy 30m2, 5 tầng, giá 5.7 tỷ, khu vực đáng sống của Long Biên
 
+ Vị trí nhà thuộc khu phần lô ô tô, hưởng trọn vẹn tiện ích, an sinh đỉnh, khu vực đáng sống của Long Biên
+ Nhà thoáng vĩnh viễn gần công viên, trường Việt Pháp, khu Khai Sơn, trường mầm non, cấp 1,2 Ngọc Thuỵ
+ Nhà thiết kế 5 tầng, đầy đủ nội thất, khách chỉ việc dọn về ở ngay
+ Sổ đỏ cắt két, sẵn sàng giao dịch 

Liên hệ Thuỷ 0981671094 / 0986892255 để sở hữu căn nhà mơ ước quanh khu vực Long Biên
",07/09/2022,Tin thường,batdongsan_so_com_vn_1673803621.3461144
"7,9 tỷ VNĐ",Phố Quan Nhân, 69m2, 6,, 5, 5, 5,"Cần bán gấp nhà phố Quan Nhân, Thanh Xuân + Nhà mới xây vài năm, đẹp, chắc chắn. - Thiết kế nhà: 69m2 mặt tiền 6m + Tầng 1: Thông sàn – Kinh doanh + Tầng 2: Phòng khách + bếp. + Tầng 3: 2 PN khép kín. + Tầng 4: 2 PN, WC, + Tầng 5: Phòng thờ, sân phơi, trồng hoa. + Vị trí quá đỉnh, ngõ rộng ô tô tránh, kinh doanh, văn phòng, phòng khám, Spa đều đắt khách. Giá bán 7.9tỷ (có thương lượng) Liên hệ: 0961771396 ",07/09/2022,Tin thường,batdongsan_so_com_vn_1673803622.962841
"4,9 tỷ VNĐ",Lê Trọng Tấn- Hà Đông, 40m2,,, 5,,,"Bán nhà Lê Trọng Tấn, Hà Đông 40mx5T lô góc kinh doanh ô tô hơn 4 tỷ + Nhà phố Lê Trọng Tấn, Hà Đông, diện tích rộng 40m thiết kế 5 tầng lô góc thoáng sáng các phòng. Phù hợp kinh doanh đa dạng: Spa, hiệu thuốc, phòng khám, quán ăn, café,…gần trường chợ, khu dân cư qua lại tấp nập ngày đêm. + Vị trí đắc địa kinh doanh đỉnh cao, giao thông thuận tiện gần Quang Trung cắt ngang Văn Phú qua Dương Nội gần La Khê thông Phan Đình Giót. - Sổ đỏ vuông, sẵn sàng giao dịch. -  Giá: 4.9 tỷ ( có gia lộc). - Liên hệ : Huyền Hà Đông ( 0363703491- 0965472910) - Chuyên gia nhà Thổ Cư tư vấn hàng nghìn ngôi nhà tiết kiệm THỜI GIAN- CÔNG SỨC- TIỀN BẠC. Hỗ trợ 24/7 và tư vấn pháp lý, vay vốn.",07/09/2022,Tin thường,batdongsan_so_com_vn_1673803624.877193
"4,9 tỷ VNĐ",Quang Trung- Hà Đông, 41m2,,, 5,,,"Bán nhà Quang Trung, Hà Đông 41mx5T lô góc kinh doanh ô tô hơn 4 tỷ Bán nhà riêng Quang Trung, Hà Đông, diện tích rộng 41m thiết kế 5 tầng lô góc cực đẹp hiện đại thoáng sáng, ô tô cạnh khu dân cư và trường học gần chợ. Nhà bán phù hợp kinh doanh nhiều loại hình: Spa, hiệu thuốc, phòng khám, quán ăn, café,…Giao thông trục chính đi các phố Lê Trọng tấn cắt Văn Phú qua Hoàng Đôn Hoà sang Ngô Thì Nhậm lên Phan Đình Giót ra Hà Cầu. Chủ nhà thành đạt bán trong tháng 8 dương để mở rộng kinh doanh. Sổ đỏ vuông sẵn sàng giao dịch. Giá chỉ 4.9 tỷ ( có gia lộc). Liên hệ : Huyền Hà Đông ( 0363703491- 0965472910)- Chuyên gia nhà Thổ Cư tư vấn hàng nghìn ngôi nhà tiết kiệm THỜI GIAN- CÔNG SỨC- TIỀN BẠC. Hỗ trợ 24/7 và tư vấn pháp lý, vay vốn. ",07/09/2022,Tin thường,batdongsan_so_com_vn_1673803626.3832552
12 tỷ VNĐ,Bà Triệu- Hà Đông, 57m2,,, 5,,,"Bán nhà mặt phố Bà Triệu Hà Đông kinh doanh 57mx5T hơn 12 tỷ Bán nhà mặt phố sầm uất bậc nhất Bà Triệu , Hà Đông, diện tích lớn 57m với thiết kế hiện đại kinh doanh 5 tầng mới, ô chờ thang máy. Phù hợp kinh doanh các loại hình: Phòng khám, spa, tóc, thời trang, siêu thị, café, quán ăn, điện tử điện lạnh, hiệu thuốc, văn phòng phẩm, hoa quả,… Giao thông trục chính sang Tô Hiệu sang Hà Cầu cắt Lê Lợi qua Lê Hồng Phong gần Văn Quán cạnh Nhuệ Giang vài bước ra Quang Trung. Sổ vuông đẹp sẵn sàng giao dịch. Giá: 12 tỷ ( gia lộc). Liên hệ : Huyền Hà Đông ( 0363703491- 0965472910) - Chuyên gia nhà Thổ Cư tư vấn hàng nghìn ngôi nhà tiết kiệm THỜI GIAN- CÔNG SỨC- TIỀN BẠC. Hỗ trợ 24/7 và tư vấn pháp lý, vay vốn.",07/09/2022,Tin thường,batdongsan_so_com_vn_1673803627.8563218
12 tỷ VNĐ,Tô Hiệu- Hà Đông, 57m2,,, 5,,,"Bán nhà mặt phố Tô Hiệu, Hà Đông, 57mx 5T kinh doanh hơn 12 tỷ Bán nhà đẹp mặt phố sầm uất Tô Hiệu , Hà Đông gần chợ, diện tích rộng 57m thiết kế 5 tầng siêu đẹp kinh doanh có ô chờ thang máy, vỉa hè rộng đường trước nhà ô tô tránh thông muôn nơi. Vị trí đắc địa gần các toà chung cư, dân cư, trường học, công viên. Phù hợp tất cả loại hình kinh doanh: Spa, siêu thị, phòng khám, quán ăn, thời trang, café, hoa quả, hiệu thuốc, điện tử điện lạnh, văn phòng phẩm,… Giao thông thuận lợi trục chính đi các phố Bà Triệu cắt Lê Lợi qua Lê Hồng Phong gần Hoàng Hoa Thám đến Trưng Nhị sang Nhuệ Giang qua Văn Quán. Sổ vuông đẹp sẵn sàng giao dịch. Giá: 12 tỷ ( gia lộc). Liên hệ : Huyền Hà Đông ( 0363703491- 0965472910) - Chuyên gia nhà Thổ Cư tư vấn hàng nghìn ngôi nhà tiết kiệm THỜI GIAN- CÔNG SỨC- TIỀN BẠC. Hỗ trợ 24/7 và tư vấn pháp lý, vay vốn.",07/09/2022,Tin thường,batdongsan_so_com_vn_1673803629.3373525
"12,5 tỷ VNĐ",Đường Ngọc Thụy phường Ngọc Thụy, 100m2, 10, 1, 3, 6, 4,"n bán nhà ngỵng mt 10 m giá 12.5 t+Anh em Khai Sầng quế Việt Pháp Ngỵn tiđ, ếi ồn, gố cổ. ng 1: Phòng khách + Bủầ + 3 VS Khép kín ng 3: 2 Phòng Ngơổ đỏ ở nhà, sẵn sàng sang tênệ đượ tr
",07/09/2022,Tin thường,batdongsan_so_com_vn_1673803630.5381389
5 tỷ VNĐ,Nguyễn Ngọc Nại, 37m2,,, 6,,,"1 NHÀ RA Ô TÔ TRÁNH, Phố Nguyễn Ngọc Nại, Thanh Xuân, 37m2, 6 Tầng, Nhỉnh 5 Tỷ.+ Trung tâm Quận Thanh Xuân, tiện ích xung quanh không thiếu gì.+ Ngõ rộng thoáng, thông sang Khương Trung, Tô Vĩnh Diện, Vương Thừa Vũ.+ Sổ đỏ vuông đẹp, pháp lý chuẩn, sẵn sàng dao dịch.   LH: Em Hoan, 0925088355, chuyên Thổ cư Thanh Xuân, Đống Đa, miễn phí xem nhà 24/7.",07/09/2022,Tin thường,batdongsan_so_com_vn_1673803631.7977686
"3,85 tỷ VNĐ",Đường Lê Đức Thọ phường Mỹ Đình 2, 36m2, 5, 3, 5, 4, 4,"
    Bán nhà mới 5TxMT5M LÊ ĐỨC THỌ MỸ ĐÌNH CHỈ 3.85 TỶNhà ngõ nông cánh oto 50M chỉ việc ở Trung tâm MỸ ĐÌNH phát triển tôt tiện ích nhiều công viên Hồ Điêu Hoà  nhiều trường công, tưGiao thông thuận tiện bến xe MỸ ĐÌNH đi kháp ngảSổ đỏ pháp lý chuẩn sẵn sàng giao dịchVới rất nhiều nhà đẹp có giá từ 3 đến 30 tỷLH Trần Hảo 0845681666 để có giá tốt tư vấn xem nhà miễn phí 24/7. Luôn mang lại Giá Tri - Uy - Tín Niềm Tin tới khách hàng
",07/09/2022,Tin thường,batdongsan_so_com_vn_1673803632.919769
"3,3 tỷ VNĐ",Mậu Lương - Kiến Hưng - Hà Đông, 33m2,,, 5, 3, 3,"NHÀ HIẾM TẠI MẬU LƯƠNG - Ô TÔ QUA NHÀ - NGÕ THÔNG - CÁCH PHỐ 50M2 - NHÀ 35M*5T - GIÁ CHỈ 3.6 TỶ+ Vị trí nhà cực đẹp, cách mặt phố Mậu Lương 50m2, vài bước chân ra gần hồ, cách chợ Mậu lương, sân bóng, trường Mầm non chỉ khoảng 100m. Gần chỗ để ô tô.+ Ngõ trước nhà ô tô chạy qua, ngõ thông các ngả, phù hợp ở và kinh doanh nhỏ lẻ.+ Nhà thiết kế 5 tầng, tầng 1 thông sàn, mỗi tầng 1 phòng ngủ cực rộng. Đầy đủ công năng sử dụng.+ Nhà phân lô vuông vắn - Sổ đỏ chính chủ - công chứng trong ngày.+ Giá chỉ: 3.6 tỷ (có thương lượng)+ Liên hệ: Mrs Nhung - nhà đẹp Hà Đông: 0944.795.382 để được tư vấn.",07/09/2022,Tin thường,batdongsan_so_com_vn_1673803634.5374413
"5,35 tỷ VNĐ","Giap Bat, Hoàng Mai HN", 50m2,,,,,,"+ Nhà xây mới cứng, 4 TẦNG, chất lượng, oto đỗ cửa. Thiết kế hiện đại.Khách đến là dừng bồ kết ngay + Tầng 1 phòng khách, bếp, vệ sinh. giữa có khe thoáng.Sáng + Tầng 2,3 mỗi tầng 2 phòng ngủ. 2 phòng wc. +Các tầng có ban công view + Tầng 4 phòng thờ sân cây cảnh rộng rãi. + Cửa gỗ chính và thông phòng, ngoài cửa nhôm PMA kính dán an toàn chất lượng vô cùng. ",07/09/2022,Tin thường,batdongsan_so_com_vn_1673803636.069384
"3,95 tỷ VNĐ","Bát Khối, Long Biên HN", 30m2,,,,,,"+ Vị trí nhà ngay cạnh công viên điều hoà, Trường cấp 1-2 Long Biên¸gần nhà Thờ cổ đi lễ rất gần, cùng rất nhiều tiện ích. Ô tô đỗ cổng. + Ngõ Bát Khối ô tô phóng vèo vèo, thông sang Khu Công viên di chuyển tiện lợi. + Thiết kế: + Tầng 1 phòng khách, bếp, wc. + Tầng 2: phòng khách. + Tầng 3,4: 1 ngủ rộng + wc. + Tầng 5: phòng thờ + sân cảnh. +Sổ đỏ chính chủ, giao dịch ngay",07/09/2022,Tin thường,batdongsan_so_com_vn_1673803637.4476552
14 tỷ VNĐ,Trung Yên Trung Hòa Cầu Giấy Hà Nội, 50m2,,,,,,"- Chính chủ cần bán gấp nhà phân lô Trung Yên chuyển đổi mục đích mua Biệt Thự - VỈA HÈ MIÊN MAN - Ô TÔ TRÁNH - KINH DOANH VIP BẬC NHẤT. - Vị trí view toàn cây xanh thoáng mát, xung quanh hưởng trọn tiện ích của các tòa Văn Phòng, Chung Cư cao tầng... chỉ vài m ra Phố...rất phù hợp cho kinh doanh Văn Phòng Công Ty. - Diện tích 50m, 5 tầng, nhà Dân xây chắc chắn để ở, thiết kế bố trí hợp lý giữa các Phòng, cầu thang giữa. - Sổ đỏ pháp lý chính chủ, sẵn sàng giao dịch. - Giá 14 tỷ ( CÓ THƯƠNG LƯỢNG CHO KHÁCH THIỆN CHÍ MUA) - Chủ đang cần bán gấp trong tháng 9 căn nhà phân lô Trung Yên - Phường Trung Hòa - Quận Cầu Giấy. - Anh Chị Khách Hàng liên hệ Em My 083417.66.88 để được tư vấn hỗ trợ và mua giá tốt nhất ạ.",07/09/2022,Tin thường,batdongsan_so_com_vn_1673803638.6175256
