price,address,Diện tích,Mặt tiền,Lộ giới,Số tầng,Số phòng ngủ,Số toilet,Details,Ngày đăng,Loại tin,id
"4,7 tỷ VNĐ","Cự Lộc, hà nội.", 60m2, 5, 10, 4, 4, 3,"+ Bán Nhà Phố Cự Lộc, Quận Thanh Xuân- Ngõ Thông Rộng-Kinh Danh. 60m2 4Tầng 4.7Tỷ. Giao với các đường Quân Nhân, Chính Kinh, Vũ Trọng Phụng, Nguyễn Trãi…Ngõ thông thoáng 3 gác phi. Chỉ vài bước ra bờ sông Tô Lịch. Khu vực có nhiều cán bộ ở, an ninh cực tốt. Gần nhiều trường Đại Học như; Khoa Học Tự Nhiên, Thủy Lợi, Công Đoàn… + Chủ nhà xây tâm huyết để ở, bán để sang nước ngoài định cư với con, khách mua về ở ngay. Phù hợp cho gia đình 4 đến 5 người ở. Di chuyển 5 phút Pico, 6 phút đến Royal City, trong đó có nhiều khu vui chơi và cơ chế hưởng thụ dẳng cấp. + Sổ đỏ chính chủ, đảm bảo pháp lý, sẵn sàng giao dịch. + Liên hệ; 0911303899 - Mr Quân. Tư vấn miễn phí 24/24.",02/09/2022,Tin thường,batdongsan_so_com_vn_1673804650.2914352
"8,3 tỷ VNĐ",Chiến Thắng- Hà Đông, 54m2,,, 5,,,"Bán nhà Chiến Thắng, Hà Đông, kinh doanh ô tô 54mx5T hơn 8 tỷ Siêu phẩm nhà đẹp Chiến Thắng, Văn Quán diện tích rộng 54m thiết kế 5 tầng hiện đại vừa ở kết hợp kinh doanh hoặc làm văn phòng quá đẹp. Xung quanh nhà nhiều trường đại học lớn, các toà nhà văn phong các chung cư cao tầng tiềm năng kinh doanh đa dạng các loại hình: Spa, tóc, nail, phòng khám, quán ăn, thời trang,… Giao thông trục chính sang Văn Quán đối diện Trần Phú Lên Thanh Xuân sang Nam Từ Liêm rất gần cạnh Nguyễn Văn Lộc. Sổ đỏ vuông sẵn sàng giao dịch. Giá chỉ 8.3 ( có gia lộc). Liên hệ : Huyền Hà Đông ( 0363703491- 0965472910)- Chuyên gia nhà Thổ Cư tư vấn hàng nghìn ngôi nhà tiết kiệm THỜI GIAN- CÔNG SỨC- TIỀN BẠC. Hỗ trợ 24/7 và tư vấn pháp lý, vay vốn.",02/09/2022,Tin thường,batdongsan_so_com_vn_1673804651.861237
"8,3 tỷ VNĐ",Đại An- Hà Đông, 54m2,,, 5,,,"Bán nhà mặt phố Đại An, Hà Đông, 54mx5T ô tô kinh doanh hơn 8 tỷ Chính chủ bán nhà mặt phố Đại An trung tâm Quận Hà Đông, nhà đẹp xây 5 tầng chắc chắn diện tích rộng 54m, ô tô vào nhà thoải mái, phù hợp kinh doanh đa dạng các loại hình. Tiện ích xung quanh ngập tràn nhiều trường đại học, toà nhà văn phòng, chung cư tiềm năng kinh doanh đa dạng các loại hình. Giao thông thuận lợi giáp Trần Phú thông Văn Quán đối diện Thanh Bình lên Ao Sen qua Nguyễn Văn Lộc sang Nguyễn văn Trỗi lên Thanh Xuân. Sổ đỏ vuông sẵn sàng giao dịch. Giá chỉ 8.3 ( có gia lộc). Liên hệ : Huyền Hà Đông ( 0363703491- 0965472910)- Chuyên gia nhà Thổ Cư tư vấn hàng nghìn ngôi nhà tiết kiệm THỜI GIAN- CÔNG SỨC- TIỀN BẠC. Hỗ trợ 24/7 và tư vấn pháp lý, vay vốn.",02/09/2022,Tin thường,batdongsan_so_com_vn_1673804653.478909
"3,55 tỷ VNĐ",Văn Phú- Hà Đông, 37m2,,, 5,,,"Hơn 3 tỷ nhà Văn Phú, Hà Đông, ô tô, ngõ thông, 37mx5 tầng ở ngay - Vị trí: Nhà phố Văn Phú diện tích rộng 37m thiết kế hiện đại 5 tầng thoáng sáng, ngõ nông gần phố, ô tô đỗ, nội thất đầy đủ chỉ việc xách vali đến ở. - Giao thông vô cùng thuận lợi đối diện Lê Trọng Tấn xuôi xuống Dương Nội hàng xóm Văn La thông Hoàng Đôn Hoà ra Quang Trung. - Tiện ích: Gần siêu thị Metro, ngân hàng, trường đại học, bệnh viện,…. Hưởng trọn tiện ích khu đô thị Văn Phú. - Sổ đỏ vuông, sẵn sàng giao dịch. - Giá chỉ có 3.55 tỷ ( có gia lộc). - Liên hệ : Huyền Hà Đông ( 0363703491- 0965472910)- Chuyên gia nhà Thổ Cư tư vấn hàng nghìn ngôi nhà tiết kiệm THỜI GIAN- CÔNG SỨC- TIỀN BẠC. Hỗ trợ 24/7 và tư vấn pháp lý, vay vốn.",02/09/2022,Tin thường,batdongsan_so_com_vn_1673804654.8771722
"4,9 tỷ VNĐ",Phan Đình Giót- Hà Đông, 37m2,,, 5,,,"Bán nhà Phan Đình Giót, Hà Đông 37mx5T ô tô KD lô góc hơn 4 tỷ + Bán nhà gần chợ Bông Đỏ, Hà Đông, diện tích 37m thiết kế 5 tầng lô góc thoáng sáng lô góc ô tô dừng đỗ, thông muôn nơi thuận tiện kinh doanh. Bán kính xung quanh nhà trường học, chợ, dân cư tấp nập ngày đêm. + Nhà bán thông thương các phố Ngô Thì Nhậm sang Ngô Quyền qua Lê Trọng Tấn đối diện Hoàng Ôn Hoà xuống Văn Phú. + Chủ nhà cần tiền mở rộng kinh doanh nên bán gấp trong tháng 8. + Sổ đỏ vuông sẵn sàng giao dịch. + Giá chỉ 4.9 tỷ ( có gia lộc). -Liên hệ : Huyền Hà Đông ( 0363703491- 0965472910)- Chuyên gia nhà Thổ Cư tư vấn hàng nghìn ngôi nhà tiết kiệm THỜI GIAN- CÔNG SỨC- TIỀN BẠC. Hỗ trợ 24/7 và tư vấn pháp lý, vay vốn.",02/09/2022,Tin thường,batdongsan_so_com_vn_1673804656.2734342
"2,95 tỷ VNĐ",Đường ngõ quỳnh phường Quỳnh Lôi, 30m2,, 2, 4, 3, 3,"+ Ngõ Quỳnh, thuộc quận Hai Bà Trưng, vị trí đẹp, trước nhà cực thoáng, ô tô đỗ cửa, thông các ngả + Nhà gần trường học các cấp, bệnh viện Thanh Nhàn, ngõ thông tư tung, sang phố Chùa Quỳnh, Bạch Mai, Hồng Mai,minh Khai ng và 1 gác xép, tủy ăình 2 thệ + Tặng lại nội thất + Liên hệ Mr Nhượng, 0979-210-257, chuyên gia tư vấn, hỗ trợ pháp lý, hợp đồng,mua bán ký gửi BDDS tại các quận Đống Đa, Hai Bà Trưng, Hoàng Mai + Miễn Phí 100% với khách mua ",02/09/2022,Tin thường,batdongsan_so_com_vn_1673804661.9024625
"6,3 tỷ VNĐ",Đường Thiên Hiền phường Mỹ Đình, 68m2, 4, 3, 5, 5, 4,"
    Bán nhà PHỐ oto vào nhà 2 thoáng trươsc sau 68MxMT4.8M THIÊN HIỀN NTL hơn 6 tỷNhà gần trung tâm khu đô thị MỸ ĐÌNH, MỄ TRÌ sung quanh khu vuc còn rất nhiều nhà từ 4 tỷ cho đên 10 tỷNhà hai thoàng trươc sau nên rất thông thoáng, nhiều ánh sáng tự nhiênKhu vực dân trí cao an sinh tôtSổ đỏ săn sàng dao dịch ngayLH Trần Hảo 0845681666 để có giá tốt tư vấn xem nhà miễn phí 24/7. Luôn mang lại Giá Tri - Uy - Tín Niềm Tin tới khách hàng
",02/09/2022,Tin thường,batdongsan_so_com_vn_1673804663.108225
32 tỷ VNĐ,Đường Lạc Long Quân phường Bưởi, 85m2, 5, 15, 1, 1, 1,"Nhà hướng Tây, mặt phố Lạc Long Quân.Sổ đỏ 85m, mặt tiền 5.1m, nhà nở hậu.Đoạn gần Võng Thị, khu đông dân cư, gần Hồ Tây.Hiện trạng sẵn nhà cấp 4, phù hợp khách mua đầu tư xây dựng, cảo tạo theo mục đích sử dụng- Vị trí nhà thoáng đẹp nằm ở trung tâm của quận Tây Hồ, tiện ích xung quanh không thiếu thứ gì, gần trường học, chợ, siêu thị Vinmart, không khí trong lành, thoáng đãng- Đường rộng 2 chiều oto tránh nhau, dân cư đông đúc, nườm nượp người qua lại, dễ dàng kinh doanh nhiều loại hình* SĐCC, sang tên nhanh chóngGiá bán 32 tỷ, có thương lượng. Miễn TG, MG làm phiền. ",02/09/2022,Tin thường,batdongsan_so_com_vn_1673804664.761841
"3,5 tỷ VNĐ","Xuân Phương, Nam Từ Liêm", 60m2, 4,,,,,"BÁN NHÀ XUÂN PHƯƠNG 5 TẦNG, 60M2. CHỦ TẶNG NỘI THẤT, 3.5 TỶ. Bán nhà xuân phương 5 tầng, 60m2. chủ tặng nội thất, 3.5 tỷ. - Nhà chủ mới xây, KCBT chắc chắn. - Ngõ rộng, thông dễ dàng di chuyển. - Chủ cần bán gấp để trả nợ giúp con giá. - Liên hệ em Tuấn để xem nhà và gặp chủ 24/7: 0389001010   ",02/09/2022,Tin thường,batdongsan_so_com_vn_1673804666.011457
"3,5 tỷ VNĐ",Đường Xuân Phương phường Xuân Phương, 60m2,, 2, 4,,,"BÁN NHÀ XUÂN PHƯƠNG 5 TẦNG, 60M2. CHỦ TẶNG NỘI THẤT, 3.5 TỶ. Bán nhà xuân phương 5 tầng, 60m2. chủ tặng nội thất, 3.5 tỷ. - Nhà chủ mới xây, KCBT chắc chắn. - Ngõ rộng, thông dễ dàng di chuyển. - Chủ cần bán gấp để trả nợ giúp con giá. - Liên hệ em Tuấn để xem nhà và gặp chủ 24/7: 0389001010   ",02/09/2022,Tin thường,batdongsan_so_com_vn_1673804667.1194923
"3,5 tỷ VNĐ",Đường Xuân Phương phường Xuân Phương, 60m2,, 2, 4,,,"BÁN NHÀ XUÂN PHƯƠNG 5 TẦNG, 60M2. CHỦ TẶNG NỘI THẤT, 3.5 TỶ. Bán nhà xuân phương 5 tầng, 60m2. chủ tặng nội thất, 3.5 tỷ. - Nhà chủ mới xây, KCBT chắc chắn. - Ngõ rộng, thông dễ dàng di chuyển. - Chủ cần bán gấp để trả nợ giúp con giá. - Liên hệ em Tuấn để xem nhà và gặp chủ 24/7: 0389001010   ",02/09/2022,Tin thường,batdongsan_so_com_vn_1673804668.6005309
"10,5 tỷ VNĐ",Đặng Thùy Trâm Nghĩa Tân Cầu Giấy Hà Nội, 48m2,,,,,,"BÁN NHÀ PHÂN LÔ GARA Ô TÔ PHỐ ĐẶNG THÙY TRÂM CG 48M 5T CHỈ 10.5 TỶPHÂN LÔ CÁN BỘ NHIỆT ĐỚI VIỆT NGA - GARA Ô TÔ - NHÀ MỚI ĐẸP LONG LANH - GẦN PHỐ - Ở VÍP - KD VP ĐỈNH. + Vị trí đẹp, thoáng, cách mp vài bước chân, thông bàn cờ, ô tô vù vù, thông Đặng Thuỳ Trâm - Hoàng Quốc Việt - Phạm Tuấn Tài.+ Phân lô cán bộ TT Nhiệt đới Việt Nga, dân trí cao, an sinh đỉnh, tiện ích vây quanh, quy hoạch yên tâm. - T1: Gara ô tô hoặc kinh doanh, bếp, wc. - T2,3,4: Tầng hai phòng, cầu thang và wc giữa. - T5: Phòng thờ, sân phơi. + + Sổ đỏ phân lô vuông như tờ A4, sẵn sàng giao dịch. Liên hệ: Mrs Phượng 0974352054 - Tư vấn tận tâm, miễn phí 24/24h (zalo, Fb) , hỗ trợ tư vấn Pháp lý, vay vốn.",02/09/2022,Tin thường,batdongsan_so_com_vn_1673804670.520395
"2,4 tỷ VNĐ",Phúc Lợi, 36m2, 3,,,,,"+ Vị trí đối diện Vincom Long Biên, khu chung cư Vinhome harmony, ngay trường C1 Lê Quý Đôn, Mầm non Phúc lợi, C2 Phúc Lợi, chợ, siêu thị, tiện ích đủ đầy + Ngõ ô tô qua đất, thửa đất cách phố Phúc Lợi chưa tới 80m, gần oto tránh , đường thông…. + Thửa đất phù hợp mua xây ở, mua giữ tiền…. - Sổ đỏ chính chủ, chờ giao dịch. - Lh em Trác: 0965492571 (xem nhà và tư vấn miễn phí)   ",02/09/2022,Tin thường,batdongsan_so_com_vn_1673804672.4003649
"3,8 tỷ VNĐ",Đường Thụy Khuê phường Thụy Khuê, 16m2, 2, 8, 4, 3, 3,"Bán nhà Tây Hồ MP Thụy Khuê 16m2, 4 tầng, Mtiền 2.5m giá 3.8 tỷ, KD Tốt >>> GỌI NGAY: 0904.768.468 – 0969.694.778 (Call or Zalo) cho Mr Phong bất cứ lúc nào: Xem nhà, tư vấn pháp lý MIỄN PHÍ <<< ",02/09/2022,Tin thường,batdongsan_so_com_vn_1673804673.534331
6 tỷ VNĐ,Đường Nguyễn Văn Cừ phường Thạch Bàn, 50m2, 4, 6, 6, 7, 4,"Nhà Đẹp 6 Tầng Thang Máy Phường Thạch Bàn, GaRa Ôtô, Kinh Doanh, 60m2, Hơn 6 Tỷ. + Nhà năm vị trí trung tâm Phường Thạch Bàn, Quận Long Biên, kết nối nhiều tuyến phố Thạch Bàn, Cổ Linh, cách TTTM Aeon, Cầu Vĩnh Tuy 2 phút đi xe, tiện ích xung quanh đầy đủ gần Trường học cấp 1, 2, 3, Chợ Thạch Bàn. + Nhà chủ tự xây rất chắc chắn thiết kế 6 Tầng Thang Máy cầu thang giữa mổi tầng hai phòng, không gian rộng thoáng, khách mua chỉ việc xách va li về ở. Sổ đỏ chính chủ vuông vắn sẵn sàng giao dịch Liên Hệ. Để được hỗ trợ tư vấn mua nhà đất miễn phí 24h. Chuyên nhà đất thổ cư Long Biên, nhà mặt phố Nguyễn Văn Cừ, nhà mặt phố Ngọc Lâm, mặt phố Ngô Gia Tự, mặt phố Lâm Hạ, mặt phố Bồ Đề, mặt phố Ngọc Thụy, mặt phố Đàm Quang Trung, Hoa Lâm, Đức Giang, Vũ Đức Thận,",02/09/2022,Tin thường,batdongsan_so_com_vn_1673804674.7101858
"2,9 tỷ VNĐ",x4/16 Hoàng Nhu Tiếp, 41m2, 3,, 1, 1, 1,"Bán Nhà Hoàng Như Tiếp - Long Biên - VỊ TRÍ ĐẮC ĐỊA - NGÕ THÔNG* Mô tả :+ Vị trí trung tâm Long Biên, cách mặt phố Hồng Tiến 30m, trước nhà để ô tô thoải mái, kinh doanh, nơi đáng sống nhất Long Biên. + Tiện ích đầy đủ không thiếu thứ gì, gần trường học các cấp, trường quốc tế Wellspring, bệnh viện Tâm Anh, bệnh viện Bắc Hà.+ Khu vực dân trí cao, hàng xóm thân thiện.+ Sổ đỏ hoa hậu chính chủ sẵn sàng giao dịch.+ Chuyên mua bán nhà đất, vui lòng liên hệ : TRẦN QUYẾT BĐS LONG BIÊN, điện thoại/ Zalo: 0374148382.",02/09/2022,Tin thường,batdongsan_so_com_vn_1673804675.870083
"4,25 tỷ VNĐ",Khương Hạ Khương Đình Thanh Xuân Hà Nội, 49m2,,,,,,"BÁN NHÀ PHỐ KHƯƠNG HẠ THANH XUÂN 49m2 4T CHỈ 4.2 TỶLÔ GÓC 3 MẶT THOÁNG NHÀ ĐẸP Ở NGAY – GIÁ YÊU THƯƠNGVị trí nhà trong ngõ 3 gác, tiện ích xung quanh đầy đủ.+ Thiết kế: Thoáng trước sau, giếng trời từ tầng 1 đến tận tum. + Tầng 1: Sân để xe, phòng khách, bếp, wc.  + Tầng 2, 3: Mỗi tầng 2 phòng ngủ rộng, wc ( tổng có 4 phòng ngủ )  + Tầng 4 : Phòng thờ và sân phơi.LH: Mrs Phượng 0974352054  để được tư vân, xem và chọn nhà hoàn toàn miễn phí.",02/09/2022,Tin thường,batdongsan_so_com_vn_1673804677.5216646
"2,95 tỷ VNĐ",Đường Phúc Lợi phường Phúc Lợi, 40m2, 4, 4, 5, 4, 4,""",="""" ""segoe="""" ui"",="""" helvetica,="""" arial,="""" sans-serif;="""" width:="""" 16px;="""" vertical-align:="""" middle;="""" white-space:="""" pre-wrap;="""" word-spacing:="""" 0px;="""" text-transform:="""" none;="""" font-weight:="""" 400;="""" color:="""" rgb(5,5,5);="""" font-style:="""" normal;="""" text-align:="""" left;="""" orphans:="""" 2;="""" widows:="""" margin:="""" 0px="""" 1px;="""" display:="""" inline-flex;="""" letter-spacing:="""" background-color:="""" rgb(228,230,235);="""" text-indent:="""" font-variant-ligatures:="""" font-variant-caps:="""" -webkit-text-stroke-width:="""" text-decoration-thickness:="""" initial;="""" text-decoration-style:="""" text-decoration-color:="""" initial'="""" spanspan="""">"",="""" ""segoe="""" ui"",="""" helvetica,="""" arial,="""" sans-serif;="""" width:="""" 16px;="""" vertical-align:="""" middle;="""" white-space:="""" pre-wrap;="""" word-spacing:="""" 0px;="""" text-transform:="""" none;="""" font-weight:="""" 400;="""" color:="""" rgb(5,5,5);="""" font-style:="""" normal;="""" text-align:="""" left;="""" orphans:="""" 2;="""" widows:="""" margin:="""" 0px="""" 1px;="""" display:="""" inline-flex;="""" letter-spacing:="""" background-color:="""" rgb(228,230,235);="""" text-indent:="""" font-variant-ligatures:="""" font-variant-caps:="""" -webkit-text-stroke-width:="""" text-decoration-thickness:="""" initial;="""" text-decoration-style:="""" text-decoration-color:="""" initial'="""" spanspansegoe="""" float:="""" inline="""" !important;="""" diện="""" tích="""" 31m2="""" ,="""" nhà="""" 5="""" tầng,="""" mặt="""" tiền="""" 3m5,="""" giá="""" chào="""" mới="""" 3,15="""" tỷ.="""" spanspan="""">"",="""" ""segoe="""" ui"",="""" helvetica,="""" arial,="""" sans-serif;="""" width:="""" 16px;="""" vertical-align:="""" middle;="""" white-space:="""" pre-wrap;="""" word-spacing:="""" 0px;="""" text-transform:="""" none;="""" font-weight:="""" 400;="""" color:="""" rgb(5,5,5);="""" font-style:="""" normal;="""" text-align:="""" left;="""" orphans:="""" 2;="""" widows:="""" margin:="""" 0px="""" 1px;="""" display:="""" inline-flex;="""" letter-spacing:="""" background-color:="""" rgb(228,230,235);="""" text-indent:="""" font-variant-ligatures:="""" font-variant-caps:="""" -webkit-text-stroke-width:="""" text-decoration-thickness:="""" initial;="""" text-decoration-style:="""" text-decoration-color:="""" initial'="""" spanspan="""" spanspansegoe="""" float:="""" inline="""" !important;=""""> -mặt tiền to, ô tô đỗ nhà 20m. -dân trí cao, văn minh. -cận kề VINHOME RIVERSIDE. -gần trường học ,gần chợ. "",="""" ""segoe="""" ui"",="""" helvetica,="""" arial,="""" sans-serif;="""" width:="""" 16px;="""" vertical-align:="""" middle;="""" white-space:="""" pre-wrap;="""" word-spacing:="""" 0px;="""" text-transform:="""" none;="""" font-weight:="""" 400;="""" color:="""" rgb(5,5,5);="""" font-style:="""" normal;="""" text-align:="""" left;="""" orphans:="""" 2;="""" widows:="""" margin:="""" 0px="""" 1px;="""" display:="""" inline-flex;="""" letter-spacing:="""" background-color:="""" rgb(228,230,235);="""" text-indent:="""" font-variant-ligatures:="""" font-variant-caps:="""" -webkit-text-stroke-width:="""" text-decoration-thickness:="""" initial;="""" text-decoration-style:="""" text-decoration-color:="""" initial'="""" spanspan="""" spanspansegoe="""" float:="""" inline="""" !important;=""""> ",02/09/2022,Tin thường,batdongsan_so_com_vn_1673804679.0695243
"30,5 tỷ VNĐ",Vũ Tông Phan Thanh Xuân Hà Nội, 109m2,,, 9, 10, 10," - DIỆN TÍCH 109M2 X9 TẦNG THANG MÁY.  GIÁ CHÀO 30.5 TỶ ( CTL )   - Vị trí đẹp đẳng cấp , 1 mặt phố 2 mặt ngõ, 3 mặt thoáng vĩnh viễn. Lợi thế sử dụng 2 vỉa hè. Kinh doanh sầm uất ngày đêm. - Nhà thiết kế 9 tầng thang máy.+ Tầng 1: Gara.+ Tầng 2: Lễ tân+ phòng khách + phòng ngủ.+ Tầng: 3, 4, 5, 6, 7: Mỗi tầng 4 phòng khép kín.+ Tầng 8: 2 Phòng lớn khép kín.+ Tầng 9: Sân phơi, ban công tiểu cảnh. - Hiện tại chủ đang cho thuê cả toà nhà 80 triệu/tháng. - Sổ đẹp vuông đẹp sẵn sàng giao dịch ngay.Liên hệ với em để được tư vấnMiễn ( TG Quảng Cáo )",02/09/2022,Tin thường,batdongsan_so_com_vn_1673804681.7972264
"3,4 tỷ VNĐ",Đa Sỹ- Kiến Hưng - Hà Đông, 60m2,,,,,,"Nhà cực hiếm! Bán nhà 60m2 - 2 tầng - an sinh đỉnh tại Kiến Hưng - Hà Đông+ Nhà nằm trong khu vực trung tâm phát triển, gần UBND phường Kiến Hưng, Gần trường tiểu học, THCS phường Kiến Hưng...+ Diện tích rộng 60m2, thiết kế 2 tầng. Nhà dân xây chắc chắn, có thể lên thêm tầng để tăng công năng sử dụng.+ Nhà thiết kế tổng có 3 phòng ngủ, đầy đủ công năng sử dụng+ Ngõ trước nhà thoáng, khu vực an ninh tốt, dân trí cao.+ Sổ đỏ chính chủ+ Giá chỉ: 3.4 tỷ+ Liên hệ: Mrs Nhung - nhà đẹp Hà Đông: 0944.795.382 để được tư vấn.",02/09/2022,Tin thường,batdongsan_so_com_vn_1673804684.6396296
