price,address,Diện tích,Mặt tiền,Details,Ngày đăng,Loại tin,id,Hướng,Lộ giới,Số tầng,Số phòng ngủ,Số toilet
105 triệu VNĐ,Đường Phú Tàng phường Bắc Phú, 64m2, 4,"Một Bước chân ngàn tiện ích.ĐỐI DIỆN KHU CÔNG NGHIỆP NỘI BÀI -> Khu vực làng công nhân, kinh doanh hàng quán sầm uất nhất sóc sơn - Diện tích : 83.7m2 + TẠI : XUÂN BÁCH - QUANG TIẾN - SÓC SƠN - HÀ NỘI .+ Vị trí mảnh đất đẹp - Mặt bìa làng đường rộng 5m ô tô tránh nhau, view ra cánh đồng rất thoáng mát- Cách chợ xuân bách 100m, gần trường học các cấp.- Cách sân bay Nội Bài 10 phút.- Khu vực tiện ích đầy đủ, giao thông thuận tiện, là lô đất tiềm năng đầu tư, ở lâu dài.- Sổ sách pháp lý rõ ràng - giao dịch ngay trong ngày+ Giá : 1.6 tỷ bao sổ chi phí sang tên đổi chủ",18/08/2022,Tin thường,batdongsan_so_com_vn_1673807876.2505357,,,,,
"4,7 tỷ VNĐ","Ngô Thì Sỹ, Vạn Phúc, Hà Đông", 38m2, 4,"Mới Đẹp, Ở Luôn, Ngô Thì Sỹ – Hà Đông, Ngõ 3 Gác phi, Căn Góc, DT 38m2 x 4T. Chỉ 4.7 Tỷ.Vị trí: Nhà khu trung tâm Hà Đông, Ngõ rộng ô tô tránh cách nhà 50m, Ngõ thông tứ tung xung quanh tiện ích không thiếu gì, gần trường mầm non, tiểu học Vạn Phúc,  gần chợ, khu dân trí cao, an ninh tốt.Thiết kế: Nhà xây 4 tầng bê tông cốt thép chắc chắn, với 4 phòng ngủ, 3 phòng vệ sinh.+ Tầng 1 Phòng Khách, bếp +WC.+ Tầng 2,3 mỗi tầng 2 phòng ngủ + WC.+ Tầng 4 thiết kế phòng thờ + Sân Phơi .+ Pháp Lý: Sổ đỏ chính chủ, sẵn sàng giao dịch.+ Giá bán: 4.7 tỷ ( Có thương lượng ).Liên hệ trực tiếp 24/7 để đi xem nhà miễn phí.    - Mr Luyện thổ cư: 0911779569- Chuyên Nhà đất Thổ cư các phân khúc từ 1 tỷ đến 100 tỷ. “TRAO GỬI NIỀM TIN_ NHẬN LẠI YÊU THƯƠNG”",18/08/2022,Tin thường,batdongsan_so_com_vn_1673807877.8083673, Đông nam, 3, 4, 4, 3
"2,3 tỷ VNĐ",Đường Đại Mỗ phường Tây Mỗ, 52m2, 4,- Hướng Đông Nam - Có thể kinh doanh hoặc cho thuê rất nhanh  - LH0912785252 để thỏa thuận ,18/08/2022,Tin thường,batdongsan_so_com_vn_1673807879.427232,, 50, 3, 1, 1
"17,5 tỷ VNĐ",cầu giấy hà nội, 106m2,,"Cần bán gấp nhà Trung Kính 106m2 x 6 tầng - Ô tô tránh nhau - Kinh doanh đỉnh 17,5 tỷ.Diện tích 106m2 x 6 tầng.Khu vực dân cư dân trí cao, giao thông cực kỳ thuận tiện.Nhà phù hợp ở hoặc kinh doanh văn phòng, spa, phòng khám... Đều đẹp.Sổ đỏ vuông vắn đẹp.Giá bán 17.5 tỷ có thương lượng.LH: 088 65 68 625",18/08/2022,Tin thường,batdongsan_so_com_vn_1673807880.7197723,,,,,
"4,7 tỷ VNĐ","Ngô Thì Sỹ, Vạn Phúc, Hà Đông", 38m2, 4,"Mới Đẹp, Ở Luôn, Ngô Thì Sỹ – Hà Đông, Ngõ 3 Gác phi, Căn Góc, DT 38m2 x 4T. Chỉ 4.7 Tỷ. Vị trí: Nhà khu trung tâm Hà Đông, Ngõ rộng ô tô tránh cách nhà 50m, Ngõ thông tứ tung xung quanh tiện ích không thiếu gì, gần trường mầm non, tiểu học Vạn Phúc,  gần chợ, khu dân trí cao, an ninh tốt. Thiết kế: Nhà xây 4 tầng bê tông cốt thép chắc chắn, với 4 phòng ngủ, 3 phòng vệ sinh. + Tầng 1 Phòng Khách, bếp +WC. + Tầng 2,3 mỗi tầng 2 phòng ngủ + WC. + Tầng 4 thiết kế phòng thờ + Sân Phơi . + Pháp Lý: Sổ đỏ chính chủ, sẵn sàng giao dịch. + Giá bán: 4.7 tỷ ( Có thương lượng ). Liên hệ trực tiếp 24/7 để đi xem nhà miễn phí.                                                                                                                                                          - Mr Luyện thổ cư: 0911779569 - Chuyên Nhà đất Thổ cư các phân khúc từ 1 tỷ đến trên 100 tỷ.  “TRAO GỬI NIỀM TIN_ NHẬN LẠI YÊU THƯƠNG”",18/08/2022,Tin thường,batdongsan_so_com_vn_1673807882.016306, Đông nam, 3, 4, 4, 3
"7,3 tỷ VNĐ",Đường Hồ Tùng Mậu phường Phú Diễn, 67m2, 4,"
    CHUNG CƯ MINI 7 PHÒNG KHÉP KÍN FULL ĐỒ - 5 PHÒNG ĐÔI - 2 PHÒNG ĐƠN - DÒNG TIỀN GẦN NỬA TỶ/ NĂM.
Chính chủ cần bán nhà CCMN Hồ Tùng Mậu 67m2 x 4 tầng, mặt tiền 4m, giá 7,3 tỉ
- Vị trí nhà nằm ngay sát Vinhomes Gardenia, khu đô thị Mỹ Đình, đối diện Goldmark City, giao cắt Hàm Nghi, Nguyễn Cơ Thạch, Nguyễn Đổng Chi - mỏ vàng trong làng cho thuê căn hộ cao cấp.
- Ngõ rộng nông ba gác vào tận nhà. Ngõ chính thông Nguyền Đổng Chi, Hàm Nghi, rất rộng.
- Diện tích ~ 70m2 và mặt tiền hơn 4 mét thông số vàng, diện tích xây từ tầng 1 khoảng 60m2, quá lý tưởng cho căn chung cư mini tầng - 7 phòng khép kín (5 đôi 2 đơn), dòng tiền 35 triệu/ 1 tháng,
- Nhà có 2 lớp cổng cực an toàn, hệ thống camera, khoá vân tay xịn sò.
- Sổ đỏ chính chủ, phân lô nở hậu
",18/08/2022,Tin thường,batdongsan_so_com_vn_1673807883.6708786,, 2, 4, 7, 7
"1,15 tỷ VNĐ",Đường Trần Quý Cáp phường Khâm Thiên, 55m2, 2,"Giá bán: 1,15 tỷ ",18/08/2022,Tin thường,batdongsan_so_com_vn_1673807885.0322363,, 5, 1, 2, 1
"4,5 tỷ VNĐ",Đường Phố Trạm phường Long Biên, 60m2, 4,"NHÀ ĐẸP DÂN XÂY  KHU PHỐ TRẠM: MẶT NGÕ Ô TÔ, GẦN PHỐ, MẶT TIỀN RỘNG + Nhà nằm ngay trên mặt ngõ phố Trạm, Ô tô vào nhà, chạy thông qua nhà thoải mái. + nhà cách mặt phố Trạm chỉ 200m, 500m đến chân cầu Trần Hưng Đạo quy hoạch, di chuyển cực thuận tiện, Tương lai cực sáng+ hiện trạng có nhà 3 tầng xây kiên cố với 3 phòng ngủ, chủ mới về chỉ cần vôi ve qua là đẹp long lanh + Diện tích 60m2 mặt tiền 4,5m cực đẹp để xây tòa nhà 5 tầng có gara ô tô+ giá rao bán: 4,6 tỷ còn thương lượng - mức giá khó tìm được căn thứ 2 Chi tiết xin liên hệ: Vũ Tuấn - chuyên bđs thổ cư, biệt thự, nhà phố Long Biên...theo số..   0399.o.27.o.11.o.14.o",18/08/2022,Tin thường,batdongsan_so_com_vn_1673807886.3308237,, 4, 3, 3, 3
"2,715 tỷ VNĐ",Đường Thụy Lâm phường Xuân Nộn, 86m2, 4,"
    Bán 86,2m giá đầu tư F0 cho anh chị Đường Yên, Xuân Nộn, Đông AnhMặt tiền và Hậu: 4,50mĐường trước đất gần 4.50m oto tránhGiá Công Khai : 31,5tr/m Cách 500m Đến Trường Cấp 1+2Cách 200m ( Dự Án)Khu Công Nghiệp Đông AnhCách 500m đến UBNN xã Xuân Nộn, TTYT Xuân NộnDi chuyển 600m Đến Xí NGhiệp Nước Sach Đông AnhĐi 700m Đến Chợ Kim ( 1 trong những chợ chủ lực của huyện)800m Đến Viện Bắc Thăng Long( Viện Than Ba) Bv Tuyến Đầu Của HuyệnPháp Lí Rõ Ràng, Sẵn Sàng Giao DịchLiên hê: 0353073021 em Lợi
",18/08/2022,Tin thường,batdongsan_so_com_vn_1673807887.800476,,,,,
"5,4 tỷ VNĐ",Đường Khương Đình phường Khương Đình, 54m2, 5,"Nhà xây chắc chắn, cách ô tô 2 bước chân, rộng rãi mát mẻ. Công năng nhà đầy đủ, T2, T3 4 phòng ngủ, t4 phòng thờ sân phơi rộng rãi. Bạn nên trồng thêm rau sạch đảm bảo bữa ăn gia đình. Gần hồ không khí mát mẻ thuận tiện TDTT. Tiện ích rất nhiều bởi gần khu TTTM và Chung cư lớn. SỔ ĐỎ CHÍNH CHỦ",18/08/2022,Tin thường,batdongsan_so_com_vn_1673807889.087036,, 3, 4, 4, 3
6 tỷ VNĐ,Đường Đào Tấn phường Ngọc Khánh, 50m2, 4,""",="""" segoeuipc,="""" ""san="""" francisco"",="""" ""helvetica="""" neue"",="""" helvetica,="""" ""lucida="""" grande"",="""" roboto,="""" ubuntu,="""" tahoma,="""" ""microsoft="""" sans="""" serif"",="""" arial,="""" sans-serif;="""" white-space:="""" pre-wrap;="""" word-spacing:="""" 0px;="""" text-transform:="""" none;="""" font-weight:="""" 400;="""" color:="""" rgb(0,26,51);="""" font-style:="""" normal;="""" orphans:="""" 2;="""" widows:="""" letter-spacing:="""" background-color:="""" rgb(229,239,255);="""" text-indent:="""" font-variant-ligatures:="""" font-variant-caps:="""" -webkit-text-stroke-width:="""" text-decoration-thickness:="""" initial;="""" text-decoration-style:="""" text-decoration-color:="""" user-select:="""" text'bán="""" nhà="""" phố="""" Đào="""" tấn="""" ngõ="""" oto="""" 50m2="""" 5t="""" mt4.5m="""" 6tỷ="""" ba="""" Đình="""" span="""" p="""" pspan="""" text'siÊu="""" phẨm="""" lÊn="""" sÓng="""" -="""" lÔ="""" gÓc="""" 2="""" mẶt="""" tiỀn="""" ngÕ="""" thÔng="""" tỨ="""" phÍa="""" nhÀ="""" mỚi="""" Ở="""" ngay="""" lÕi="""" trung="""" tÂm="""" thoÁng="""" sÁng="""" text'="""">- Chủ bán cần bán gấp đầu tháng 8, chuyển vào Sài Gòn với gia đình"",="""" segoeuipc,="""" ""san="""" francisco"",="""" ""helvetica="""" neue"",="""" helvetica,="""" ""lucida="""" grande"",="""" roboto,="""" ubuntu,="""" tahoma,="""" ""microsoft="""" sans="""" serif"",="""" arial,="""" sans-serif;="""" white-space:="""" pre-wrap;="""" word-spacing:="""" 0px;="""" text-transform:="""" none;="""" font-weight:="""" 400;="""" color:="""" rgb(0,26,51);="""" font-style:="""" normal;="""" orphans:="""" 2;="""" widows:="""" letter-spacing:="""" background-color:="""" rgb(229,239,255);="""" text-indent:="""" font-variant-ligatures:="""" font-variant-caps:="""" -webkit-text-stroke-width:="""" text-decoration-thickness:="""" initial;="""" text-decoration-style:="""" text-decoration-color:="""" user-select:="""" text'br-="""" nhà="""" lô="""" góc,="""" 2="""" mặt="""" tiền,="""" không="""" có="""" gì="""" ngoài="""" ánh="""" sáng="""" và="""" gió="""" trời="""" tự="""" nhiên="""" span="""" p="""" pspan="""" text'-="""" thiết="""" kế="""" tầng="""" 1,2,3="""" thông="""" sàn,="""" 4="""" là="""" phòng="""" ngủ="""" ,="""" 5="""" thờ,="""" sân="""" phơi="""" rộng="""" text'="""">- ",18/08/2022,Tin thường,batdongsan_so_com_vn_1673807890.2718632,, 4, 5, 4, 4
4 tỷ VNĐ,Đường Phú Mỹ phường Mỹ Đình 2, 50m2, 4,"
    Giá sập sàn Phố Phú Mỹ Nam Từ Liêm 50M nhỉnh 4 tỷ gửi oto200M LH 0845681666Nhà Mỹ Đình Nam Từ Liêm  gần nhiêu đường lớn như Phạm Hùng, Thiên Hiền, Mễ Tri, Lê Quang Đạo, Lê Quang Đạo, Hàm Nghi.Nhà dân xây chắc chắn nhiêu ngủ thoáng mát.Vị trí nhà nhiều tiên ích siêu thị chợ Trường cấp 1, 2, 3 Mỹ Đình, cấp 3 Trí Đức Trần Quốc Tuấn, công viên Hồ Điều Hoà, Bể Bơi Quốc Gia.Pháp lý sổ đỏ sẵn sàng giao dịch ngay.LH Trần Hảo 0845681666 để có giá tốt tư vấn xem nhà miễn phí 24/7.Luôn mang lại Giá Tri - Uy - Tín Niềm Tin tới khách hàng
",18/08/2022,Tin thường,batdongsan_so_com_vn_1673807891.5963206,, 2, 4, 3, 3
,Đường Lĩnh Nam phường Lĩnh Nam, 3000m2, 100,"Siêu Hiếm! Lô đất toạ lạc tại mặt đường vành đai 3 với diện tích 3000m2 mặt tiền 100m, lô góc ba mặt thoáng. - Vỉa hè đá bóng xe ba chân đỗ thoải mái. - Pháp lý: Sổ 50 năm, phù hợp xây nhà xưởng, toà nhà chung cư, Trung Tâm Thương Mại. - Cách bến xe nước ngầm chỉ 2km, rất thuận tiện di chuyển đi các tỉnh lộ phía Đông. -Diện tích 3000m2, Mặt Tiền 100m. - Giá chào 115 tỷ, Có thương lượng) - Gọi ngay em Tấn Thương Lượng Trực Tiếp Với Chủ.",18/08/2022,Tin thường,batdongsan_so_com_vn_1673807892.8629317,, 1,,,
"4,3 tỷ VNĐ",Đường Hạ Đình phường Hạ Đình, 43m2, 3,"
    + Bán nhà ngõ phố Hạ đình, Thanh Xuân, Hà Nội,  ngõ to cách phố Hạ đình vài bước chân. Gần các trường đại học: Trường đại học Khoa học xã hội và Nhân văn, Đại học Công nghệ giao thông vận tải, Đại học Hà Nội, Học viện Công nghệ bưu chính viễn thông, tiện ích ngập tràn:  bệnh viện, trường học, công viên, siêu thị không thiếu thứ gì.+ Nhà 3 tầng, 43m2 mới tinh, dân trí tốt. Nhà thông thương với Nguyễn Trãi, Khương đình, Kim Giang, Nguyễn Xiển+ Chủ nhà xây để ở, xây tâm huyết + Sổ đỏ chính chủ, pháp lý chuẩn, cất két sẵn sàng giao dịch.+ Cam kết: Không thu bất cứ loại phí gì kể cả giao dịch thành công.+ Giá: 4.3 tỷ (có thương lượng với khách thiện chí).+ Miễn tiếp trung gian và môi giới.+ Liên hệ Mr Ngọc nhiệt tình, tận tâm để đi xem nhà ngay 0936244984.
",18/08/2022,Tin thường,batdongsan_so_com_vn_1673807894.2138178,, 4, 3,,
"4,04 tỷ VNĐ",Tái định cư gđ1 - Trâu Quỳ - Gia Lâm - Hà Nội, 40m2, 3," - Chính chủ gửi bán thửa đất 40m2 tại khu tái định cư giãn dân thị trấn Trâu Quỳ - Gia Lâm – Hà Nội. - Thửa đất vuông vắn mặt tiền rộng 3.16m đường trước đất 11m vỉa hè 3m View thoáng vài bước chân ran ngay đường 22m Nguyễn Mậu Tài và hồ điều hòa. - Giao thông vô cùng thuận tiện đi Lý Thánh Tông, Nguyễn Khiêm Ích, Ngô Xuân Quảng, Cửu Việt, Thành Trung,...tiện ích xung quanh vô cùng đầy đủ: bệnh viện, trường học từ cấp mẫu giáo đến đại học ,trung tâm hành chính các cấp,.... - Nằm trong vùng lõi phát triển kinh tế của thị trấn và huyện Gia Lâm tiềm năng tăng giá và thanh khoản cực tốt, xung quanh là các dự án nhà ở thương mại giá đã khá cao như: Sông Hồng, Hải Phát, Euro Window, Metropolitan,... - Sổ đỏ chính chủ ,giá cực tốt rẻ nhất khu vực chỉ 101tr/m2. Liên hệ xem đất và biết thêm thông tin chi tiết E.Nhật: 0982852808, 0948584888.",18/08/2022,Tin thường,batdongsan_so_com_vn_1673807895.7657063, Tây nam, 12,,,
"2,9 tỷ VNĐ",Đường Đông Ngạc phường Đông Ngạc, 51m2, 5,"+ Vị trí quá đẹp, đầu Đông Ngạc thông Kẻ Vẽ Tân Xuân, ngay trường Tiểu học Đông Ngạc. + Vài bước chân ra mặt phố ô tô tránh, đi lại thuận tiện ngõ thông các ngả phố Đông Ngạc Kẻ Vẽ, Tân Xuân. Khu dân cư văn minh lịch sự, dân trí cao, tiện ích xung quanh đầy đủ. + Cách đường Phạm Văn Đồng, An Dương Vương, Thụy Phương, Hoàng Tăng Bí, Bệnh viện Nam Thăng Long... 1km.  Bán kính 3 km gồm các trường đại học: Đại học Tài nguyên và Môi trường, Đại học Mỏ, Đại học Y tế Công Cộng, Học viện Tài chính... + Sổ đỏ, pháp lý chuẩn sẵn sàng giao dịch.",18/08/2022,Tin thường,batdongsan_so_com_vn_1673807898.8159142,,,,,
"5,2 tỷ VNĐ","Đa Sỹ, Hà Đông, Hà Nội.", 40m2, 5," # Bán nhà quận Hà Đông phường Kiến Hưng đường Đa Sỹ, LH: Tình Nhà Đất 0983858722. + Chính chủ cần tiền bán gấp nhà Đa Sỹ. DT 40/45mT2, 4T, MT 5m, nhà xây chắc, ô tô đỗ cửa, ô tô vào nhà, 5m ra ô tô tránh, giá nhỉnh xíu 5 tỷ. + Vị trí trung tâm: Khu dân trí cao, an ninh tốt, tiện chợ, gần trường học, bệnh viện, trung tâm mua sắm (  Chợ Lớn Hà Đông, Sân Vận Động Hà Đông, Siêu Thị Melinh Plaza, Viện 103 ). + Nhà thiết kế cơ bản gồm: 4 phòng ngủ rộng, 3 ws, phòng khách, bếp, phòng ăn, phòng thờ, sân phơi, nội thất đầy đủ về ở ngay. + Sổ đỏ vuông đẹp chính chủ, sẵn sàng giao dịch. # HotLine: 0983858722 Tình Nhà Đất quận Hà Đông – Hà Nội ( uy tín, tận tâm, nhiệt tình, tư vẫn, hỗ trợ 24/7 ).",18/08/2022,Tin thường,batdongsan_so_com_vn_1673807902.2365608,, 5, 4, 4,
"11,6 tỷ VNĐ","Cầu Giấy, Hà Nội", 50m2,,"Chủ nhà xây tâm huyết ở được 1 năm, hiện đã mua nhà trong khu liền kề nên chuyển nhượng lại+ Phố Phùng Chí Kiên toàn các quan chức sinh sống, đầu phố là Tràng An Complex cực vip, hàng xóm xung quanh dân trí cao, an sinh đỉnh. + Nhà cách mặt phố khoảng 50m, ô tô 7 chỗ vào nhà. + Diện tích 50m2, 7 tầng thang máy, MT 4.2m- Tầng 1: gara ô tô, chủ nhà hiện đang kinh doanh tại nhà. - Tầng 2: phòng khách- Tầng 3,4: 4 phòng ngủ khép kín- Tầng 5: bếp, phòng ăn- Tầng 6: phòng thờ, sân tập thể dục- Tầng 7: sân chill cực đẹp. + Tặng toàn bộ nội thất, chỉ mang đi những đồ kỉ niệm. + Giá 11.6 tỷ+ Sđcc vuông vắn phân lôLiên hệ: Thành 0986763000",18/08/2022,Tin thường,batdongsan_so_com_vn_1673807903.8014328,,,,,
"3,7 tỷ VNĐ",hoàng mai hà nội, 52m2,,"5+Nằm ở vị trí trung tâm, Giáp Giải Phóng, Tam Trinh, Tân Mai, bx Giáp Bát, Hưởng trọn tiện ích cc Magarin, Hòa Phát, k35, đi bộ ra Hồ Đền Lừ, 10 phút ra time city, gần trường dh Kinh Tế, Bách khoa, Xây Dựng, bv Bạch Mai.+Nhà còn mới đẹp khách mua về ở ngay, chủ tự xây để ở chắc chắn, nhà đẹp phù hợp cho hộ gia đình, móng có thể nên 3,4 tầng.+Sổ đỏ chính chủ đảm bảo pháp lí, sẵn sàng giao dịch0346363362 : Phú Gia chuyên nhà phố Hà Nội.+kho hàng phong phú đa dạng trên địa bàn.+hỗ trợ khách hàng sang tên ,công chứng, hỗ trợ vay vốn ngân hàng …Trân trọng !",18/08/2022,Tin thường,batdongsan_so_com_vn_1673807905.2346709,,,,,
"9,6 tỷ VNĐ",Đường Nguyễn Văn Cừ phường Gia Thụy, 75m2, 7,  - Sổ đỏ vuông vắn để két giao dịch ngay. ,18/08/2022,Tin thường,batdongsan_so_com_vn_1673807906.4794464,, 4, 3, 3, 3
