price,address,Diện tích,Số tầng,Details,Ngày đăng,Loại tin,id,Mặt tiền,Lộ giới,Số phòng ngủ,Số toilet,Hướng
6 tỷ VNĐ,Tô Vĩnh Diện, 50m2, 5,"+ Trung tâm Phố Tô Vĩnh Diện, Quận Thanh Xuân, Vài phút ra Ngã Tư Sở, gần chợ, trường học, TTTM. Thông sang Vương Thừa Vũ, Hoàng Văn Thái, Nguyễn Ngọc Nại. + Ô tô qua nhà, khu dân trí cao, an ninh tốt rất đáng sống. + Thiết kế nhà hiện đại, nội thất nhập khẩu, chủ tặng lại hết cho khách. + Sổ đỏ vuông đẹp, pháp lý chuẩn, sẵn sàng dao dịch. LH: Em Hoan, 0925088355, chuyên thổ cư Thanh Xuân, Đống Đa với nguồn nhà hơn 13 000 căn, miễn phí xem nhà 24/7.",15/08/2022,Tin thường,batdongsan_so_com_vn_1673808645.7876515,,,,,
36 tỷ VNĐ,Đường Đoàn Khuê phường Việt Hưng, 220m2, 5,"Chủ nhà cần bán gấp biệt thự siêu vip KĐT Việt Hưng với bể bơi tầng thượng.+ Biệt thự nằm trong khu vip nhất của KĐT Việt Hưng với nhiều tiện ích tốt nhất của cả KĐT.+ Ngay sát nhà là công viên cây xanh và Trung tâm TDTT.+ Bên cạnh KĐT Vinhomes Riverside danh tiếng.+ KĐT Việt Hưng là KĐT mở, nên công năng sử dụng đa dạng: Ở an ninh an toàn, làm văn phòng công ty đẳng cấp.+ Biệt thự thiết kế 5 tầng, nội ngoại thất Nhập khẩu, toàn bộ bằng gỗ tự nhiên chất lượng.Tầng 1: Sân vườn, phòng khách, phòng sinh hoạt chung, 1 phòng ngủ cho bảo vệ hoặc giúp việc, bể cá KOI.Tầng 2: Thiết kế 1 phòng khách lớn kết hợp phòng đọc sách, 1 phòng Master rộng, 1 phòng nhỏ thay đồ.Tầng 3: Thiết kế 3 phòng, 1 phòng lớn và 2 phòng nhỏ khép kín.Tầng 4: Bếp, phòng ăn rộng và 1 phòng ngủ.Tầng 5: Bể bơi, khu ngoài trời, phòng tắm và thay đồ.+ Sổ đỏ chính chủ, pháp lý chuẩn sẵn sàng giao dịch Chi tiết xin liên hệ: Vũ Tuấn - chuyên bđs thổ cư, biệt thự, nhà phố Long Biên...theo số..   0399.o.27.o.11.o.14.o",15/08/2022,Tin thường,batdongsan_so_com_vn_1673808647.373409, 8, 21, 5, 5,
"4,5 tỷ VNĐ",Ngõ 22 Dương Lâm, 33m2, 5,"Trung Tâm Văn  Quán - Ngõ  Thông - KD Nhỏ - Ô TÔ Lùi Cửa - Nhà Đẹp ở  Ngay Nhà Dương Lâm Văn Quán Hà Đông 33m  5 tầng mặt tiền 3.8 m giá  4.5 tỷ (còn thương lượng).Ngõ 22 là ngõ chợ tấp nập, con ngõ đẹp nhất phố Dương Lâm. Nhà bán sát mặt ngõ luôn. Nhà nằm vị trí đẹp, gần UBND phường Văn Quán, gần chợ, trường học các cấp chỉ trong bán kính 250m. trung tâm mọi tiện ích. Ngõ thông tứ phía sang ngõ 197, 217, 181 Trần Phú, gần bãi ô tô. Gần ga tàu trên cao, hồ Văn Quán, BigC Hà Đông, viện 103, Bỏng, K Tân Triều,…Vị trí có thể kinh doanh Spa, tạp hoá,…Ô tô tận cửa, ba gác chạy ầm ầm.Thiết kế hiện đại:Tầng 1: Khách, bếp, WCTầng 2,3,4: Mỗi tầng 01 phòng ngủ, WCTầng 5: Phòng thờ, sân phơiSổ đỏ vuông đẹp sẵn sàng giao dịch.Anh chị em liên hệ trực tiếp cho Nguyên Anh: 0819508701 để biết thêm chi tiết.",15/08/2022,Tin thường,batdongsan_so_com_vn_1673808648.637028, 3, 8, 3, 4,
"7,5 tỷ VNĐ",la khê, 50m2, 5,"Bán Nhà, Phan Đình Giót . Hà Đông. Ô Tô Kinh Doanh 50m2 x 5 tầng. Mặt Tiền 4.3m Giá 7.5 Tỷ.    MẶT PHỐ - KINH DOANH SẦM UẤT – TIỆN ÍCH NGẬP TRÀN  + Nhà mặt phố Phan Đình Giót, giao với các đường Quang Trung , Lê Trọng Tấn, Trần Phú, Ngã Tư Sở, Ngả đi các hướng nội thành và các tỉnh lân cận rất thuận tiện. + Nhà gần trường học các cấp, gần Bệnh Đa Khoa Hà Đông, gần ga tàu điện trên cao,, bến xe Yên Nghĩa, gần Trung Tâm Thương Mại AON, Siêu Thị MêTro Hà Đông, Thiên Đường Bảo Sơn. Cách Uỷ Ban Nhân Dân và Công An Phường La Khê vài chục mét, hàng xoma Pack CiTy cũng như rất nhiều dịch vụ xung quanh đa dạng và phong phú các loại hình vui chơi giải trí khác. Giao thông thuận tiện, an ninh an toàn. + Nhà nằm trên khu phố sầm uất nhất khu vực Hà Đông, Nhà mặt phố, kinh doanh, văn phòng các loại hình dịch vụ rất đa dạng.  + Nhà thiết kế 5 tầng:                                                                                                          - - - Tầng 1: Phòng khách, Bếp, wc  - Tầng 2,3,4: Mỗi tầng 2 phòng ngủ và wc - Tầng54 : Phòng thờ, sân phơi. + Nhà khung cột bê tông chắc chắn.  Sổ đỏ chính chủ, sẵn sàng giao dịch.   LH: E KHÁNH: 0984568179 ",15/08/2022,Tin thường,batdongsan_so_com_vn_1673808649.8677363, 4,, 6, 4,
"7,55 tỷ VNĐ","vĩnh tuy , hai bà trưng", 86m2, 3,"+ MẶT NGÕ CONTAINER QUA CỬA - SÁT ĐH KINH CÔNG - ĐẦU TƯ CHIA LÔ 2 CĂN QUÁ TUYỆT + Ngõ Vĩnh Tuy ngay khu đô thị Times City đi lên từ Minh Khai, ô tô tránh vỉa hè, kinh doanh. + Nhà rất gần Cổng trường Đại học Kinh doanh Công nghệ, kinh doanh quán nét và bi a tấp nập + Xung quanh đều là Tòa nhà cho sinh viên thuê, quán ăn, cà phê, internet, ngập tràn ,tiện ích không thiếu thứ gì. + phù hợp với chia 2 căn hoặc xây tòa nhà dòng tiền hay văn phòng, quán cơm, quán nước, + nhà cũ sác định bán đất nên không có gì mô tả nhiều.+ Sổ đỏ vuông đẹp, sẵn sàng giao dịch.+ AC quan tâm alo: 0911 206 189 hoặc 0845 790 555 Đỗ Hạnh thanks ACquan tâm",15/08/2022,Tin thường,batdongsan_so_com_vn_1673808651.177235, 6,, 4, 5,
"3,25 tỷ VNĐ",Đường Đại Khang phường Hữu Hòa, 42m2, 5,"
    DT 42m2 x4 tầng,mới,đẹp,ở luônTuyến đường Hữu Lê đang được mở rộng và chỉnh trang lại.+ T1: Để xe + bếp + WC.+ T4: Phòng thờ + sân phơi.
",15/08/2022,Tin thường,batdongsan_so_com_vn_1673808652.472806,, 2, 4, 4,
300 triệu VNĐ/m2,Quận Cầu Giấy, 38m2,,"NHÀ ĐẸP Ở NGAY PHẠM TUẤN TÀI 38M2*6, PHÂN LÔ Ô TÔ VÀO NHÀ NHỈNH 11 TỶ.0962745289+ Vị trí trung tâm Quận Cầu Giấy.KHU PHÂN LÔ vỉa hè, ô tô tránh.Tiện ích miễn bàn.+ Cực hiếm có 102 ,nhà chủ tự xây chắc chắn,mặt tiền thoáng vĩnh viễn, ở sướng, cho thuê văn phòng. ô tô dừng đỗ ngày đêm thoải mái, an ninh dân trí cao.+ Sổ đỏ vuông nét chính chủ sẵn sàng giao dịch.+ Giá:Thỏa thuận.Liên hệ: Anh Đoàn - 0962745289.+ Chuyên nhà đất – Đất thổ cư Hà Nội.+ Nhiệt tình vui vẻ, dẫn khách xem nhà miễn phí. Tư vấn pháp lý, thủ tục sang tên nhanh gọn.+ Tư vấn 24/7. ",15/08/2022,Tin thường,batdongsan_so_com_vn_1673808653.7338665,,,,,
6 tỷ VNĐ,Hoang Văn Thái, 48m2, 5,"Bán gấp nhà Phố Hoàng Văn Thái, Thanh Xuân 48m2x5T, Ô TÔ qua, Nhỉnh 6 Tỷ. + Trung tâm Quận Thanh Xuân, gần chợ, trường học, TTTM. Thông sang Vương Thừa Vũ, Tô Vĩnh Diện, Cù Chính Lan. + Ô tô qua nhà, nhà thuộc khu phân lô Quân đội, dân trí cao, an ninh đảm bảo. + Thiết kế nhà hiện đại, nội thất nhập khẩu, chủ tặng lại hết cho khách. + Sổ đỏ vuông vắn, pháp lý chuẩn, sẵn sàng dao dịch. LH: Em Hoan, 0925088355, chuyên thổ cư Thanh Xuân, Đống Đa với nguồn nhà hơn 13 000 căn, miễn phí xem nhà 24/7.",15/08/2022,Tin thường,batdongsan_so_com_vn_1673808658.3836143,,,,,
"15,9 tỷ VNĐ",Đường Mỗ Lao phường Mộ Lao, 90m2, 7,"
    + Vị trí trung tâm Mỗ Lao mặt ngõ Thanh Bình thông sang khu đô thị Mỗ Lao giao thông vô cùng thuận lợi , ô tô tránh,dừng đỗ trước nhà+ Nhà 7 tầng 18 phòng khép kín cho thuê đầy đủ nội thất ,điều hòa ..,đang cho thuê full dòng tiền 70 triệu /tháng+ khu vực cho thuê luôn kín phòng, gần với các trường ĐH Kiến Trúc, HV An Ninh,Ngoại Ngữ, Bưu Chính Viễn Thông, YHCT…+ sổ đỏ vuông đẹp chính chủ + giá chào 15,9tỷ(có thương lượng)+ Gọi ngay Em Hương có rất nhiều các CCMN các khu vực cần thanh khoản gấp, uy tín chất lượng
",15/08/2022,Tin thường,batdongsan_so_com_vn_1673808660.877487, 6, 6, 18, 18,
4 tỷ VNĐ,"Đường Trần Phú, Quận Hà Đông", 40m2, 5,"Chủ nhà xây dựng tâm huyết để ở, giờ làm ăn có lộc đã mua nhà to hơn nên cần bán căn nhà Trần Phú – Hà Đông Nhà ngay sau khu hành chính Hà Tây cũ, rất có lộc vệ công danh.    + Diện tích gần 40 m2, thiết kế 5 tầng    +  Thiết kế: 01 khách + 01 bếp + 05 WC + 4 PN - Tầng nào cũng có ban công rộng rãi khoảng 10m2. - Nhà 3 mặt thoáng nên phía nào cũng có cửa sổ đón gió. - Nhà full nội thất, mới, chỉ cần xách vali đến ở.    + Ngõ trước nhà rộng cỡ 4m, ngõ thông. Khu vực an ninh tốt, dân trí cao.    + Nhà đi bộ ra hồ Văn Quán, ngõ thông ra các trục đường lớn Trần Phú, Nguyễn Khuyến, đường 19/5.     + Sổ đỏ chính chủ, pháp lý sạch sẽ.",15/08/2022,Tin thường,batdongsan_so_com_vn_1673808662.0813577, 6,, 5,, Tây nam
"6,8 tỷ VNĐ",xã Ngũ Hiệp, 67m2,,"+ Bán nhà Ngũ Hiệp, Thanh Trì, Hà Nội+ Nhà nằm trên khu vực đắc địa, nối với KĐT Tứ Hiệp. Ô tô tránh, nhà phù hợp kinh doanh: hàng ăn, nhà nghỉ, cà phê… + Chủ bán nhà xác định bán đất tặng nhà 2 tầng cải tạo kinh doanh bình thường.+ Sổ đỏ chính chủ sẵn sàng giao dịch.+ Nhà có thông số đẹp, nở hậu, cách đường Ngọc Hồi chỉ 45m, VietinBank Thanh Trì 80m, Đường Quang Lai 100m, Tecco Skyville Tower chỉ 150m, giao thông thuận tiện. ",15/08/2022,Tin thường,batdongsan_so_com_vn_1673808663.5683815,,,,,
"4,95 tỷ VNĐ",xã Ngọc Hồi, 41m2,,"+ Bán đất tặng nhà Ngọc Hồi, Thanh Trì, Hà Nội+ Ô tô đỗ cửa, vị trí đẹp, hiếm nhà bán, kinh doanh đa ngành. Nhà cũ chủ xác định bán đất. Chủ tặng lại hết đồ đạc bên trong nhà: 2 điều hoà, bàn, ghế …+ Nhà cách QL1A 5m, Cầu Văn Điển, Đường Nguyễn Bồ 30m, Trường Cao Đẳng Y Khoa Hà Nội 40m,  TTTM Thanh Trì 50m, Bệnh viện đa khoa Thanh Trì 200m,  Trường tiểu học thị trấn Văn Điển 300m…+ Sổ đỏ sẵn sàng giao dịch. Miễn TG. ",15/08/2022,Tin thường,batdongsan_so_com_vn_1673808664.6185713,,,,,
"3,7 tỷ VNĐ",Đường Minh Khai phường Mai Động, 52m2, 3,"Bán nhà phố Minh Khai, Hoàng Mai dưới 3 tỷ 700 triệu. Vị trí trung tâm Hoàng Mai, xung quanh tiện ích không thiếu gì, khu vực dân cư đông đúc, dân trí cao, an ninh đảm bảo, gần chợ, gần Times City, gần Bến xe Giáp Báp, Vinmec.Diện tích 52M2 – 3 tầng – 4 M mặt tiền – Có sân cổng rộng để xe - Nhỉnh 70 triệu/m2 – HIẾM  Sổ đỏ chính chủGiá cả thương lượng trực tiếp: Quân 0918186162Cám ơn!",14/08/2022,Tin thường,batdongsan_so_com_vn_1673808665.8532953, 4, 2, 3, 3,
4 tỷ VNĐ,Đồng Mạc - Hà Nội, 40m2,,"+ Phố Trần Khát Chân là một trong những trục trung tâm gắn với các tuyến phố huyết mạch như Phố Bà Triệu, phố Huế, Bạch Mai….. + Nhà nằm trong ngõ thuộc phố Trần Khát Chân, ô tô vào nhà thoải mái, ngõ thông khắp ngả cách đúng 1 nhà là ra mặt phố . + Từ nhà tới Hồ Hoàn Kiếm chỉ mất dăm phút, xung quanh nhà tiện ích ngập tràn, chỉ chạy bộ ra các trường đại học lớn Bách Khoa, Kinh Tế Quốc Dân, Xây Dựng, 3 phút ra bệnh viện bạch mai,... chợ dân sinh trường học các cấp đủ cả. +- Sổ đỏ chính chủ, pháp lý chuẩn, giao dịch ngay. Chủ đã lên đời nhà mới cực kỳ thiện trí giá trào 4 tỷ có ra lộc cho khách hữu duyên. Chi tiết LH: Nhật Nhà Đất  0977194820 (Chuyên Nhà đất Thổ cư với nguồn hàng Hơn 6000 Căn Nhà  Lớn nhỏ Từ 1 – 100 Tỷ trên khắp địa bàn Hà Nội luôn sẵn sàng giúp Khách hàng tìm được những căn nhà ưng ý nhất).Phương châm làm việc:-Tận Tâm, Uy tín , Chuyên nghiệp cái Tâm và cái Tầm đặt lên hàng đầu- Không kênh giá chủ nhà    - Miễn phí toàn bộ dịch vụ: Dẫn khách xem nhà, tư vấn pháp lý. ",14/08/2022,Tin thường,batdongsan_so_com_vn_1673808667.2206385,,,,,
"1,3 triệu VNĐ/m2",sóc sơn hà nội, 3750m2,,"Bán đất hồ Ban Tiện Sóc Sơn Hà Nội Diện tích 3750m2 Giá : 1,3 triệu/m2 Đất có view đẹp  ngắm hồ và thuận tiện làm homestay nghỉ dưỡng du lịch Liên hệ : A Thận:0971389666 ",14/08/2022,Tin thường,batdongsan_so_com_vn_1673808668.4493513,,,,,
5 tỷ VNĐ,Dịch Vọng Hậu, 60m2, 2,"- Chính chủ gửi bán lô đất tặng nhà 2 tầng cũ đang sử dụng diện tích 60m2, mặt tiền siêu rộng tại phố Dịch Vọng Hậu, Cầu Giấy, Hà Nội.- Lô đất hiện đang có nhà 2 tầng cũ đang sử dụng, mặt tiền hơn 4m . Nằm trên phố Dịch Vọng Hậu. - Xung quanh dân cư đông đúc tấp nập, kinh doanh đỉnh, gần các trường cấp 1, 2, 3 Dịch Vọng Hậu.- Cách khu đại học quốc gia, đại học sư phạm Hà Nội, Học viện Báo chí chỉ vài phút đi xe.- Giao thông vô cùng thuận tiện. Thích hợp xây chung cư mini...- Sổ đỏ chính chủ. + Giá bán 85tr/m2 có thượng lượng.+ Liên hệ ngay: 0354 526 316 Em Thế Anh (hỗ trợ xem nhà, tư vấn pháp lý, vay vốn ngân hàng, sang tên sổ đỏ).",14/08/2022,Tin thường,batdongsan_so_com_vn_1673808669.6670938,,, 2,,
"4,6 tỷ VNĐ",la khê hà đông hà nội, 52m2,,"Bán  đất thổ cư La Khê Hà Đông, Hà Nội Diện Tích:51,5m2 Mặt tiền:4m Đất nở hậu đường thông thoáng ô tô qua đất Giá :4,6 tỷ Liên hệ : A Thận:0971389666 ",14/08/2022,Tin thường,batdongsan_so_com_vn_1673808670.926723,,,,,
"2,35 tỷ VNĐ",hồng dương thanh oai hà đông hà nội, 73m2,,Bán đất đấu giá gốc kéo hồng dương thanh oai hà đông hà nội Diện tích 73m2 Mặt tiền 5m Giá 2 tỷ 350 Liên hệ : A Thận: 0971389666 ,14/08/2022,Tin thường,batdongsan_so_com_vn_1673808672.1943734,,,,,
"3,75 tỷ VNĐ",Ngõ 973 Quang trung  Yên Nghĩa, 45m2, 4,"Bán nhà Quang Trung Hà Đông 45m 4 tầng giá 3.75 tỷ lh: 0819508701 - Nhà nằm trong khu dân trí cao, an ninh tốt, hàng xóm thân thiện, hàng xóm với trạm đăng kiểm ô tô, nên rất phù hợp cho gia đình nào có ô tô đến thời hạn đi đăng kiểm sẽ không mất công đi xa.- Nhà cách bến xe Yên Nghĩa, bến tàu trên cao chưa đến 100m, rất tiện cho ace làm trên trung tâm phố với tầu trên cao di chuyển chỉ mất 15p vào trung tâm, gần trường các cấp, siêu thị... tiện ích bạt ngàn.- Ngõ trước nhà 2.5m ô tô lùi cửa nhà, cách ô tô tránh 10m, cách đường Quang Trung kéo dài 50m, giao thông vô cùng thuận tiện.- Nhà được thiết kế 4 tầng với đầy đủ công năng.+ Tầng 1: Khách, bếp, vs.+ Tầng 2,3: Tổng 4 ngủ, 2 vs.+ Tầng 4: Phòng thờ rộng kết hợp ngủ, sân phơi.- Sổ đỏ chính chủ, pháp lý chuẩn.- Ace liên hệ trực tiếp cho Nguyên Anh: 0819508701 để biết thêm chi tiêt.",14/08/2022,Tin thường,batdongsan_so_com_vn_1673808673.6873457, 4, 9, 4, 3, Đông nam
"10,5 tỷ VNĐ",tôn đức thắng, 80m2,,"Mô Tả Chính chủ cần bán nhà Tôn Đức Thắng, Đống Đa, gần các khu vực Khâm Thiên, Lê Duẩn, Đê LA Thành, Xã Đàn, Nguyễn Lương Bằng, Tây Sơn, Hoàng Cầu, Hào Nam,… Diện tích: 80m2 + Nhà diện tích rộng, xây lâu, khách mua về đập đi xây mới quá đẹp. + Vị trí gần khu trung tâm Hà Nội, nơi tập trung buôn bán sầm uất nhất của phố Tôn Đức Thắng. + Xung quanh nhà an ninh tốt, nhiều văn phòng, các chợ dân sinh xung quanh nhà, trường học quanh nhà đi học tiện. + Sổ đỏ chính chủ, giao dịch nhanh. + Giá: 10.5 tỷ ( có thương lượng) Liên hệ: Nghĩa – 0868181683 ( để được gặp chủ thương lượng trực tiếp) Miễn phí xem nhà – Nguồn hàng phong phú – Nhiệt tình tận tâm – Hỗ trợ 24/24h/7",14/08/2022,Tin thường,batdongsan_so_com_vn_1673808674.869185,,,,,
