price,address,Diện tích,Mặt tiền,Lộ giới,Số tầng,Số phòng ngủ,Số toilet,Details,Ngày đăng,Loại tin,id,Hướng
"8,5 tỷ VNĐ",Đường Ngô Gia Tự phường Đức Giang, 45m2, 4, 1, 4, 4, 3,"
    
Bán nhà Ngô Gia Tự mặt phố giá siêu hấp dẫn chỉ hơn 8 tỷ

Mô tả:
Vị trí nhà quá đẹp, mặt phố Ngô Gia Tự kinh doanh đa ngành nghề, văn phòng, tài chính ngân hàng....
 Nhà mặt phố, có lối đi riêng bên ngõ 494 Ngô Gia Tự. Quy hoạch ổn định nét.
 Nhà thiết kế 4 tầng, chủ vừa sơn sửa đẹp long lanh.
+ Tầng 1 : Thông sàn kinh doanh + gác lửng.
+ Tầng 2 + 3 : Mỗi tầng 2 phòng ngủ + wc.
+ Tầng 4 : Phòng thờ + sân phơi.
Sổ đỏ chính chủ giao dịch ngay.
 Nhà mặt phố, hàng hiếm có 1,0,2. Giá ngon nhất phố Ngô Gia Tự. 
",05/08/2022,Tin thường,batdongsan_so_com_vn_1673810463.3129797,
9 tỷ VNĐ,Đường Hoàng Cầu phường Ô CHỢ DỪA, 70m2,, 3,,,,""";="""" mso-font-kerning:="""" 18.0pt;="""" mso-bidi-font-family:="""" ""times="""" roman""'+="""" spanspan="""" background:="""" white;="""" color:="""" black'="""" bán="""" nhà="""" phố="""" hoàng="""" cầu,="""" trung="""" tâm="""" quận="""" Đống="""" Đa,="""" kết="""" nối="""" với="""" xã="""" đàn,="""" nguyễn="""" lương="""" bằng,…,="""" khu="""" vực="""" dân="""" trí="""" cao,="""" an="""" ninh="""" toàn.="""" span="""" p="""" class=""MsoNormalSPAN"" thuận="""" tiên="""" giao="""" thông,="""" sinh="""" hoạt="""" thường="""" ngày="""" của="""" gia="""" đình,="""" trường="""" học="""" các="""" cấp,="""" chợ,="""" siêu="""" thị,="""" bệnh="""" viện,span="""" spankhu="""" vui="""" chơi="""" giải="""" trí...,="""" #2a2e30;="""" letter-spacing:="""" 0.1pt;="""" line-height:="""" 107%;="""" mso-fareast-font-family:="""" roman""'="""">+ Vị trí nhà rất đẹp, thoáng , cách Hồ Hoàng cầu chỉ vài bước chân, Nhà 3 tầng cũ Chủ bán đất tặng nhà. + LH: Vượng - 0912949598. Bất Động Sản Đống đa, Còn 20 căn tương tự. + Sổ Đỏ Chính Chủ Sẵn sàng giao dịch. + Hỗ trợ tư vấn Pháp lý, Đàm Phán, 70% ngân hang.  ""times="""" new="""" roman"";="""" mso-font-kerning:="""" 18.0pt'#bannhathaiha#span="""" spanspan="""" span#bannhadongda#="""" span="""" p="""" class=""MsoNormalSPAN"" 18.0pt'#bannhatayson#span="""" span#bannhadelathanh#="""" 18.0pt'="""">#bannhaxadan##bannhadangtiendong#  ""times="""" new="""" roman"";="""" mso-font-kerning:="""" 18.0pt'#bannhatrungliet#span="""" spanspan="""" span#bannhathaithinh#="""" span="""" p="""" class=""MsoNormalSPAN"" 18.0pt'#bannhachuaboc#span="""" span#bannhatrungtu3="""" 18.0pt'="""">#bannhatonducthang##bannhavanchuong# ",05/08/2022,Tin thường,batdongsan_so_com_vn_1673810464.9515984,
"1,75 tỷ VNĐ","Tòa A, tầng 04 chung cư Tứ Hiệp Plaza, Thanh Trì, Hà Nội", 60.5m2,,,, 2, 2,"Căn hộ A Tứ hiệp Plaza Tên dự án : Tứ Hiệp PlazaTên chính thức : Chung cư Tứ Hiệp PlazaChủ đầu tư : Công ty CP Thương mại & Dịch vụ Tổng Hợp Vinh HạnhVị trí dự án : Xã Tứ Hiệp Huyện Thanh Trì Hà NộiDiện tích: 60,5 m2. Đã có sổ đỏThiết kế: 2 ngủ, 2wcHướng: cửa Tây Bắc, ban công Đông NamNội thất: tủ bếp, điều hòa, nóng lạnh, bếp từ, máy giặt, sofa,…….Giá: 1.720.000.000 đã bao gồm phí chuyển nhượng Pháp lý: sổ đỏ chính chủ Liên hệ: chính chủ: 0889999952",05/08/2022,Tin thường,batdongsan_so_com_vn_1673810469.9603992, Đông nam
"14,5 tỷ VNĐ",Hà Nội, 102m2,,,,,,"
    CẦN BÁN GẤP NHÀ CCMN MỸ ĐÌNH 102M 7T THANG MÁY NHỈNH 14 TỶ
+ Trung tâm Mỹ Đình, Đường ô tô thuận tiện, thông các ngả.
+ Gần các trục đường lớn, gần bến xe Mỹ Đình, Thiên Hền, Mỹ Đình, Lê Đức Thọ, Hồ Tùng Mậu, Các Trường Đại Học Thương Mại, ĐH Quốc Gia, ĐH Sư Phạm..
+ Tiện ích ngập tràn.
+ Thiết kế thông minh tiện lợi.
+ Giá Thỏa thuận
+ Sổ đẹp, , sang tên nhanh gọn
+ Thiện trí, xem nhà gọi em Trung Nhà Trọ 0812212525.
",05/08/2022,Tin thường,batdongsan_so_com_vn_1673810471.8070524,
"14,5 tỷ VNĐ",phú diễn, 110m2, 6, 5, 6,,,"CHUNG CƯ MINI, LÔ GÓC, MẶT NGÕ THÔNG KINH DOANH, THANG MÁY, Ô TÔ ĐỖ CỬA QUAY ĐẦU THOẢI MÁI, FULL NỘI THẤT S = 110m2, mặt tiền 6m, 6 tầng thang máy, giá 14.5 tỷ + Giao thông: Cầu Diễn, Hồ Tùng Mậu, Cầu Giấy, bến xe Mỹ Đình,… + Nhà 6 tầng, tổng 20 phòng cao cấp khép kín đủ đồ, cho thuê tháng 90tr, tầng 1 cho thuê 5tr/ tháng, tầng 6 cho lắp cột sóng 10tr/tháng, tiền dịch vụ, điện nước lời 10tr/ tháng ** Tổng doanh thu 115tr/ tháng + Sổ đỏ hoa hậu sẵn sàng giao dịch. Gọi ngay em Bình 0345752279 để xem nhà miễn phí.",05/08/2022,Tin thường,batdongsan_so_com_vn_1673810473.0976968,
"21,9 tỷ VNĐ",Đường Vương Thừa Vũ phường Khương Mai, 62m2, 4, 10, 4, 5, 3,"MẶT PHỐ VƯƠNG THỪA VŨ 62m2, 4 tầng, MT 4,3m. Ô TÔ TRÁNH - KINH DOANH ĐỈNH CAO - NHÀ ĐẸP TẶNG TOÀN BỘ NỘI THẤT XỊN SÒ CHỦ NHÀ KỲ CÔNG LÀM TỔNG CHI PHÍ HẾT 5 TỶ.

- Vị trí: 
+ Nhà bán vô cùng đẹp, nhà 2 mặt tiền, một mặt phố Vương Thừa Vũ kinh doanh nhộn nhịp, một mặt ngõ 2 ô tô tránh nhau thoải mái (Ngõ 2 Nguyễn Ngọc Nại), nhà ngay gần ngã tư Vương Thừa Vũ - Nguyễn Ngọc Nại, kinh doanh hay ở đều đỉnh của đỉnh.
- Đã có quy hoạch nối thông Vương Thừa Vũ với ngõ 211/249 Khương Trung, để chỉ cần đi bộ vài mét là dạo Đầm Hồng, thêm chút nữa là kết nối với Vành đai 2,5, 5p đi xe ra Ngã Tư Sở. 
- Giao thông thuận tiện, tiềm năng tăng giá cực lớn.
- Nhà thiết kế cực đẹp, chủ bỏ gần 5 tỷ chỉ để làm nội thất, hiện tại đang ở Biệt thự nên để lại toàn bộ NT cho khách mua.

+ Tầng 1 thông sàn đang cho thuê 30tr/tháng, có cầu thang đi riêng độc lập giữa người thuê và chủ nhà.

+ Tầng 2: Khách + ngủ + WC

+ Tầng 3: 02 ngủ + WC

+ Tầng 4: Bếp + sân phơi.
+ Giá 21,9 tỷ (có thương lượng)

- Sổ đỏ chính chủ, siêu đẹp, sẵn sàng sang tên.
- LH Hoàn 0966201234 chuyên Thổ HN để xem nhà.
",05/08/2022,Tin thường,batdongsan_so_com_vn_1673810474.2822216,
"4,9 tỷ VNĐ",Văn La- Hà Đông, 37m2,,, 5,,,"Nhà đẹp lô góc kinh doanh Văn La, Hà Đông 37m, 5 tầng ô tô hơn 4 tỷ Chính chủ bán nhà đẹp chỉ trong tháng 7 âm với 5 tầng rộng đẹp thoáng sáng lô góc, diện tích rộng, ngõ ô tô rất gần phố. Nhà to rộng lô góc lừng lững nhất khu vị trí giao thông thuận tiện đông đúc phù hợp kinh doanh nhiều loại hình: Spa, siêu thị, café, quán ăn, phòng khám,..gần trường học các cấp. Nhà trung tâm giáp Văn Phú gần Lê Trọng Tấn thuận tiện xuống Yên Nghĩa hay phố Xốm, vài bước ra Quang Trung. Sổ đỏ vuông, sẵn sàng giao dịch. Giá 4.9 tỷ ( có gia lộc). Liên hệ : Huyền Hà Đông ( 0363703491- 0965472910)- Cháu gái chủ nhà.",05/08/2022,Tin thường,batdongsan_so_com_vn_1673810475.4851024,
"4,7 tỷ VNĐ",Văn Phú- Hà Đông, 39m2,,, 5,,,"Nhỉnh 4 tỷ gần Văn Phú, Hà Đông ô tô lô góc kinh doanh 39m, 5 tầng Bán nhà giáp Khu đô thị Văn Phú, Hà Đông. Chủ nhà chuyển hướng kinh doanh cần bán nhà đẹp lô góc tuyệt đẹp, vị trí đắc địa diện tích 39m với thiết kế 5 tầng thoáng sáng đầy đủ công năng sử dụng, ngõ rộng ô tô gần phố. Nhà bán phù hợp nhiều loại hình kinh doanh đa dạng, dân cư đông đúc, nhiều trường học sầm uất ngày đêm: Spa, tạp hoá, quán ăn, phòng khám, café,… Giao thông đi lại thuận tiện gần Lê Trọng Tấn, thông văn La giáp Văn Phúc gần Trần Đăng Ninh vài bước ra Quang Trung. Sổ đỏ vuông, sẵn sàng giao dịch. Giá 4.7 tỷ ( có gia lộc). Liên hệ : Huyền Hà Đông ( 0363703491- 0965472910)- Chuyên gia nhà Thổ Cư tư vấn hàng nghìn ngôi nhà tiết kiệm THỜI GIAN- CÔNG SỨC- TIỀN BẠC. Hỗ trợ 24/7 và tư vấn pháp lý, vay vốn.",05/08/2022,Tin thường,batdongsan_so_com_vn_1673810476.7397473,
"4,7 tỷ VNĐ",Văn Phú- Hà Đông, 39m2,,, 5,,,"Nhỉnh 4 tỷ gần Văn Phú, Hà Đông ô tô lô góc kinh doanh 39m, 5 tầng Bán nhà giáp Khu đô thị Văn Phú, Hà Đông. Chủ nhà chuyển hướng kinh doanh cần bán nhà đẹp lô góc tuyệt đẹp, vị trí đắc địa diện tích 39m với thiết kế 5 tầng thoáng sáng đầy đủ công năng sử dụng, ngõ rộng ô tô gần phố. Nhà bán phù hợp nhiều loại hình kinh doanh đa dạng, dân cư đông đúc, nhiều trường học sầm uất ngày đêm: Spa, tạp hoá, quán ăn, phòng khám, café,… Giao thông đi lại thuận tiện gần Lê Trọng Tấn, thông văn La giáp Văn Phúc gần Trần Đăng Ninh vài bước ra Quang Trung. Sổ đỏ vuông, sẵn sàng giao dịch. Giá 4.7 tỷ ( có gia lộc). Liên hệ : Huyền Hà Đông ( 0363703491- 0965472910)- Chuyên gia nhà Thổ Cư tư vấn hàng nghìn ngôi nhà tiết kiệm THỜI GIAN- CÔNG SỨC- TIỀN BẠC. Hỗ trợ 24/7 và tư vấn pháp lý, vay vốn.",05/08/2022,Tin thường,batdongsan_so_com_vn_1673810478.0013714,
"4,9 tỷ VNĐ",Văn La- Hà Đông, 37m2,,, 5,,,"Nhà đẹp lô góc kinh doanh Văn La, Hà Đông 37m, 5 tầng ô tô hơn 4 tỷ Chính chủ bán nhà đẹp chỉ trong tháng 7 âm với 5 tầng rộng đẹp thoáng sáng lô góc, diện tích rộng, ngõ ô tô rất gần phố. Nhà to rộng lô góc lừng lững nhất khu vị trí giao thông thuận tiện đông đúc phù hợp kinh doanh nhiều loại hình: Spa, siêu thị, café, quán ăn, phòng khám,..gần trường học các cấp. Nhà trung tâm giáp Văn Phú gần Lê Trọng Tấn thuận tiện xuống Yên Nghĩa hay phố Xốm, vài bước ra Quang Trung. Sổ đỏ vuông, sẵn sàng giao dịch. Giá 4.9 tỷ ( có gia lộc). Liên hệ : Huyền Hà Đông ( 0363703491- 0965472910)- Cháu gái chủ nhà.",05/08/2022,Tin thường,batdongsan_so_com_vn_1673810479.2959082,
9 tỷ VNĐ,Đường Việt Hưng phường Việt Hưng, 68m2, 5, 8, 5, 5, 4,.Gia chủ tặng full nội thất.  Liên hệ ; Xuân Thủy 0971.879.199 chuyên bđs thổ cư Long Biên.  ,05/08/2022,Tin thường,batdongsan_so_com_vn_1673810480.6921718,
"2,7 tỷ VNĐ",36 Phạm Hùng, 72m2, 5,, 1, 2, 2,"+ Địa chỉ: 36 Phạm Hùng + Giao thông: Vành đai 3, bến xe Mỹ Đình, Cầu Giấy, Phạm Văn Đồng, Láng, Phạm Hùng, Mai Dịch, Hồ Tùng Mậu,… + Diện tích: 72m2, 2 ngủ, 2 vệ sinh, phòng khách, bếp, ban công. + Giá: 2.7 tỷ. + Hướng: Cửa chính Tây Bắc, ban công Đông Nam. + Đầy đủ nội thất, ở ngay. + Sổ đỏ chính chủ, lâu dài.. * Gọi ngay em Bình, 0345752279 để xem nhà, phải thật nhanh tay, nhà có thể bán trong một vài ngày!",05/08/2022,Tin thường,batdongsan_so_com_vn_1673810481.8969486,
"3,1 tỷ VNĐ",Đường Linh Quang A phường Văn Chương, 34m2, 4, 2, 4, 3, 3,,05/08/2022,Tin thường,batdongsan_so_com_vn_1673810483.157577,
4 tỷ VNĐ,Khương Trung, 35m2,,,,,,"PHÂN LÔ- Ô TÔ ĐỖ CỬA, Khương Trung, thanh Xuân, 35m, 5T, 4 tỷ. LH 0975124520. + Bán nhà phố Khương Trung, Thanh Xuân, trung tâm Ngã Tư Sở, thông ra Vương Thừa Vũ, gần Nguyễn Trãi, Khương Đình, ô tô đỗ đỗ cửa, ngõ thông, diện tích 35m2, 5 tầng, mặt tiền cực thoáng. + Vị trí đẹp, ngõ nông, cách mặt phố chỉ vài bước chân, ô tô đỗ cửa, giao thông vô cùng thuận tiện. Tiện ích đầy đủ, dân trí cao, an sinh cực tốt. + Nhà chủ tự xây dựng khung cột bê tông kiên cố chắc chắn, thiết kế hiện đại, nội thất đầy đủ công năng sử dụng, khách chỉ việc sách vali đến ở. + Sổ đỏ đẹp, sẵn sang giao dịch. * Liên hệ: Phùng Trang 0975124 520.",05/08/2022,Tin thường,batdongsan_so_com_vn_1673810484.4172397,
"7,5 tỷ VNĐ",Đường Bạch Đằng phường Chương Dương Độ, 35m2, 3, 1, 5, 5,,"c khu phân lô quân ột phẳp. Khu dân trí cao, hàng xóm toàn cán bứ hĩng riêng cừ Gỉi xe máy gện trung Đm cốn tích: Trong sệng 35m. Sắi phong thuặn 3,3m. + Nhà 4 tếi nên rế cương tđm nhản nhà. Công nửng trong nhà cền ích, nhiũa sđng và ánh sáng cđiạp tấTĐển, vng 2: Phòng khách, phòng ngệTủ sinh. ầ, 1 phòng ngơcó thượầ: Mr. Hùng- 0963906969.",05/08/2022,Tin thường,batdongsan_so_com_vn_1673810485.7287323,
"2,85 tỷ VNĐ",Đường Yên Hòa phường Yên Hòa, 26m2, 3, 4, 3, 3, 2,"
    
Bán nhà phố Yên Hòa Trung kính nhỉnh 2tỷ ngõ thông ôtô kinh doanh Cầu Giấy(1)

NHỎ TIỀN 3 NGỦ KINH DOANH - ÔTÔ 5 TẠ ĐỖ CỬA - ÔTÔ TRÁNH 20M

- Vị trí siêu đắc địa, tiếp giáp xung quanh vài bước là chợ trường sầm uất, khu vực hót nhất quận Cầu Giấy.
- Nhà dân xây KCBT chắc chắn mới đẹp ở luôn:
- Tầng 1: Kinh doanh, bếp wc.
- Tầng 2: 2 ngủ + wc.
- Tầng 3: Ngủ, sân phơi trước sau.
- Sổ đỏ chính chủ nở hậu đẹp, sẵn sàng giao dịch.
Chú ý: 
1. LH: A. Hoàng Anh 0934266313 (xem nhà miễn phí)
2. Link kho nhà đẹp: https://www.facebook.com/356939308270722
3. Hỗ trợ tài chính cho vay mua nhà đến 70% giá trị căn nhà, lãi suất thấp nhất thị trường.
4. ACE Môi giới kết hợp làm việc tại: https://www.facebook.com/108917115160629",05/08/2022,Tin thường,batdongsan_so_com_vn_1673810486.9405413,
"3,9 tỷ VNĐ",Đường Khương Đình phường Khương Đình, 36m2, 4, 3, 4, 4, 3,"CHÍNH CHỦ CẦN BÁN NHÀ PHỐ KHƯƠNG ĐÌNH THANH XUÂN , NHÀ ĐẸP Ở LUÔN, NGÕ THÔNG RỘNG, Ô TÔ ĐỖ CỔNG, NHÀ TỰ XÂY THIẾT KẾ ĐẸP, GẦN CHỢ TRƯỜNG HỌC  ++Tầng 1 Phòng khách+Bếp ++Tầng 2+3 Mỗi tầng 2 phòng ngủ ++ Tầng 4 Phòng thờ+ Sân phơi +++ SỔ ĐỎ CHÍNH CHỦ ++ LH;  0916 621 470",05/08/2022,Tin thường,batdongsan_so_com_vn_1673810488.3181853,
"5,25 tỷ VNĐ","Số 1 Tô Hiệu, Hà Đông", 34m2, 3, 11, 5, 5, 5,"- Toạ lạc trên con phố Vip Tô Hiệu, trung tâm quận Hà Đông với tiện ích bạt ngàn. - Vị trí nhà bán có thể đi bộ ra Chợ Hà Đông, Metro Hà Đông, Trung tâm hành chính quận Hà Đông… - Ngõ to như phố, ô tô dừng đỗ thoải mái. Ngõ thông với phố Lê Lai - Nhà lô góc với hai mặt tiền ôm trọn hai con đường, rất thoáng mát. - Phía trước là khu công cộng, ở hay kinh doanh đều thuận lợi. - Nhà chủ tự xây nên rất tâm huyết, khung BTCT chắc chắn, chủ mới về có thể ở luôn. - DT 34 m2 x 5T. - Giá 5,25 tỷ (có thương lượng). - Sổ đỏ vuông đét sắc nét, sẵn sàng giao dịch. - Liên hệ: Mr Tuấn nhà phố 0929.134.139 (miễn môi mới, trung gian). - Cam kết: Khách hàng không mất bất kỳ chi phí gì. Hỗ trợ vay ngân hàng, tư vấn pháp lý từ A - Z hoàn toàn miễn phí 24/7.",05/08/2022,Tin thường,batdongsan_so_com_vn_1673810489.6168616, Đông bắc
"6,5 tỷ VNĐ",Hoàng Đạo Thành, 48m2, 4,, 5,,,"+ Trung tâm Phố Hoàng Đạo Thành - Thanh Xuân, gần trường học Cấp 2,3 Kim Giang, chợ, siêu thị, gần Chung Cư Five Star.  + Vị trí đẹp, ô tô 7 chỗ qua nhà. Khu vực hiếm nhà bán, khu dân trí cao toàn cán bộ công an. Vừa ở và cho thuê kinh doanh đều được. + Nhà lô góc thoáng sáng, nội thất nhập khẩu, chủ tặng lại hết cho khách. + Sổ đỏ vuông đẹp, pháp lý chuẩn, sẵn sàng dao dịch. LH: Em Hoan, 0925088355, chuyên thổ cư Hà Nội, miễn phí xem nhà 24/7.",05/08/2022,Tin thường,batdongsan_so_com_vn_1673810491.1487648,
12 ngàn VNĐ,Đường  phường La Phù, 41m2, 4, 4, 4, 3, 3,"Vị trí đẹp ngõ thông ô tô chạy vèo vèo,xung quanh tiện ích ngập tràn . Xung quanh có trường c1,2,3 cách Aeon hà đông 500m. Cách công viên Thiên Đường Bảo Sơn 500 đại lộ Thăng Long 700 đi xe 15phut ra tới mỹ đình Nhà 4T thiết kế hiện đại 3 ngủ Sổ đẹpcất két sãn sàng giao dịch. Lh em Trang 0976387052 chuyên thổ cư nhà đẹp",05/08/2022,Tin thường,batdongsan_so_com_vn_1673810492.3624651,
