price,address,Diện tích,Details,Ngày đăng,Loại tin,id,Mặt tiền,Số tầng,Lộ giới,Số phòng ngủ,Số toilet
"15,65 tỷ VNĐ",Xuân thủy, 85m2,"CẦN BÁN CCMN CẦU GIẤY 85M 8T THANG MÁY Ô TÔ NHỈNH 15 TỶ + Trung tâm Cầu giấy nhiều trường Đại học lớn như: Đại học Quốc Gia, Sư Phạm, Thương Mại, Báo chí Tuyên truyền.. + Đường chính lớn Cầu giấy, Láng, Trần Thái Tông, Khúc Thừa Dụ, Nguyễn Văn Huyên... + Rất đông sinh viên, người đi làm, Công ty, Văn phòng.. + Giá thương lượng + Sổ đẹp sẵn sang tên, pháp lý sạch, Sang tên nhanh gọn. + Gọi Em Đức để chốt giá tốt. 0812212525",31/07/2022,Tin thường,batdongsan_so_com_vn_1673811464.967836,,,,,
5 tỷ VNĐ,Vạn Phúc- Hà Đông, 46m2,"Bán nhà Vạn Phúc, Hà Đông, 46m, mặt tiền 5m, ô tô, gần phố chỉ 5 tỷ Bán nhà riêng tại Vạn Phúc, Hà Đông vị trí trung tâm chỉ 5 tỷ có diện tích rộng 46m, các phòng thoáng sáng mát mẻ đầy đủ công năng sử dụng, mặt tiền siêu khủng, ngõ ô tô, cách phố vài bước chân, chỉ việc đến ở. Xung quanh nhà đầy đủ tiện ích: trường học, chợ, ngân hàng, siêu thị, bệnh viện, bưu điện. Hàng xóm hiền hoà, khu phố văn minh, ở rất sướng. Giao thông đi các phố ra Quang Trung, hàng xóm Ngô Quyền, Lên Văn Quán cắt ngang Mỗ Lao ra Phúc La. Chủ nhà cần tiền cho con đi du học cần bán nhanh trong tháng 7 âm. Sổ đỏ vuông, sẵn sàng giao dịch. Giá 5 tỷ ( có gia lộc). Liên hệ : Huyền Hà Đông ( 0363703491- 0965472910)- Cháu gái chủ nhà ( miễn trung gian, môi giới).",31/07/2022,Tin thường,batdongsan_so_com_vn_1673811466.6872356, 5,,,,
"5,1 tỷ VNĐ",Mỗ Lao- Hà Đông, 46m2,"Hơn 5 tỷ nhà Mỗ Lao, Hà Đông, 46m, 5 tầng, ô tô, ở ngay, 5m ra phố Bán nhà khu vực vip Mỗ Lao, Hà Đông. Nhà có vị trí đắc địa chỉ vài bước chân ra phố, dân xây đẹp vô cùng thoáng sáng, các phòng rộng, ngõ ô tô nông, chỉ việ đến ở. Giao thông tuyệt vời hàng xóm Văn Quán, cạnh Vạn Phúc thông Quang Trung đối diện Phúc La ra Trần Phú. Xung quanh đầy đủ tiện ích, hàng xóm văn minh, an ninh tuyệt đối. Sổ đỏ vuông, sẵn sàng giao dịch. Giá 5.1 tỷ ( có gia lộc). Liên hệ ngay em Huyền ( 0363703491- 0965472910). Sở hữu hơn 10.000 căn nhà đẹp trong khu vực phân khúc từ 3- 100 tỷ",31/07/2022,Tin thường,batdongsan_so_com_vn_1673811467.991247,, 5,,,
"5,1 tỷ VNĐ",Mỗ Lao- Hà Đông, 46m2,"Hơn 5 tỷ nhà Mỗ Lao, Hà Đông, 46m, 5 tầng, ô tô, ở ngay, 5m ra phố Bán nhà khu vực vip Mỗ Lao, Hà Đông. Nhà có vị trí đắc địa chỉ vài bước chân ra phố, dân xây đẹp vô cùng thoáng sáng, các phòng rộng, ngõ ô tô nông, chỉ việ đến ở. Giao thông tuyệt vời hàng xóm Văn Quán, cạnh Vạn Phúc thông Quang Trung đối diện Phúc La ra Trần Phú. Xung quanh đầy đủ tiện ích, hàng xóm văn minh, an ninh tuyệt đối. Sổ đỏ vuông, sẵn sàng giao dịch. Giá 5.1 tỷ ( có gia lộc). Liên hệ ngay em Huyền ( 0363703491- 0965472910). Sở hữu hơn 10.000 căn nhà đẹp trong khu vực phân khúc từ 3- 100 tỷ",31/07/2022,Tin thường,batdongsan_so_com_vn_1673811469.339599,, 5,,,
5 tỷ VNĐ,Vạn Phúc- Hà Đông, 46m2,"Bán nhà Vạn Phúc, Hà Đông, 46m, mặt tiền 5m, ô tô, gần phố chỉ 5 tỷ Bán nhà riêng tại Vạn Phúc, Hà Đông vị trí trung tâm chỉ 5 tỷ có diện tích rộng 46m, các phòng thoáng sáng mát mẻ đầy đủ công năng sử dụng, mặt tiền siêu khủng, ngõ ô tô, cách phố vài bước chân, chỉ việc đến ở. Xung quanh nhà đầy đủ tiện ích: trường học, chợ, ngân hàng, siêu thị, bệnh viện, bưu điện. Hàng xóm hiền hoà, khu phố văn minh, ở rất sướng. Giao thông đi các phố ra Quang Trung, hàng xóm Ngô Quyền, Lên Văn Quán cắt ngang Mỗ Lao ra Phúc La. Chủ nhà cần tiền cho con đi du học cần bán nhanh trong tháng 7 âm. Sổ đỏ vuông, sẵn sàng giao dịch. Giá 5 tỷ ( có gia lộc). Liên hệ : Huyền Hà Đông ( 0363703491- 0965472910)- Cháu gái chủ nhà ( miễn trung gian, môi giới). ",31/07/2022,Tin thường,batdongsan_so_com_vn_1673811470.4915168, 5,,,,
"3,6 tỷ VNĐ",Đường Vũ Tông Phan phường Khương Đình, 48m2,"Chủ cần bán gấp nhà phố Vũ Tông Phan – Ngã tư sở, diện tích 48m, 4 tầng, ngõ thông, rộng thoáng, thuận tiện đi lại. Vị trí: Cách ô tô tránh 30m, gần hồ, chợ, trường cấp 1, 2, 3. Mô tảTầng 1: phòng khách, để xe, bếp,wc. Pháp lý: sổ đỏ chính chủ ",31/07/2022,Tin thường,batdongsan_so_com_vn_1673811471.9037395, 3, 4, 2, 4, 4
"2,35 tỷ VNĐ",Đường Bát Khối phường Thạch Bàn, 32m2,"+ Vị trí. Nhà thuộc tổ 8 phường Thạch Bàn, + Thiết kế. Nhà dân tự xây để ở. Hiện có 3 tầng, 2 phòng ngủ có thể sử dụng được ngay hoặc xây thêm được 1,5 tầng nữa. Các tầng hiện tại đầy đủ trang thiết bị. ",31/07/2022,Tin thường,batdongsan_so_com_vn_1673811473.2856646, 4, 3, 2, 2,
"3,9 tỷ VNĐ","Tứ Hiệp, Thanh Trì HN", 45m2,"+ Vị trí nhà rất đẹp, ngõ ngay sát Trung tâm thương mại và bệnh viện đa khoa Thanh Trì, 2 mặt ngõ trước sau nhà ô tô ra vào thoải mái, gần mặt phố, mặt chợ, tiện ích đầy đủ. 10m ra đường ô tô tránh. + Nhà khung cột chắc chắn, mỗi tầng 2 phòng rộng, đang có sẵn 4 ngủ ở luôn, trước sau đều mở cửa thoáng. + Sổ vuông đẹp, giao dịch nhanh.",31/07/2022,Tin thường,batdongsan_so_com_vn_1673811474.7308452,,,,,
"3,8 tỷ VNĐ","Tứ Hiệp, Thanh Trì, HN", 56m2,"Nhà 5 tầng, 3 ngủ, sạch đẹp ở luôn, sân rộng, gần mặt phố to.  + Vị trí nhà rất đẹp, sát Trung tâm thương mại, bệnh viện đa khoa Thanh Trì, gần đường Ngọc Hồi, gần mặt phố, tiện ích đầy đủ. + Nhà khung cột còn chắc chắn, mỗi tầng 1 phòng rộng, đang có sẵn 3 ngủ, trước sau đều mở cửa. + Sân to rộng. + Sổ vuông đẹp, giao dịch ngay. ",31/07/2022,Tin thường,batdongsan_so_com_vn_1673811476.0383477,,,,,
"3,3 tỷ VNĐ","xuân đỉnh, bắc từ liêm", 59m2,"Xuân Đỉnh, giá sốc, 59m2, 3 tầng, 3.3 tỷ + Vị trí nằm ở phường Xuân Đỉnh, Bắc Từ Liêm, ngõ rộng thông thoáng, khu dân cư đông đúc, tiện ích xung quanh đầy đủ + Nhà 3 tầng dân tự xây, chắc chắn, khách mua về ở ngay, giá sốc nhà rộng + Chủ nhà thiện chí bán Sổ đỏ chính chủ, sẵn sàng giao dịch Lh Mr Tùng 0969541111( Chuyên Thổ Cư Hà Nội)",31/07/2022,Tin thường,batdongsan_so_com_vn_1673811477.223178,,,,,
"2,8 tỷ VNĐ","trần cung, cổ nhuế 1, bắc từ liêm", 35m2,"Trần Cung, giá rẻ, 30m2 x 3 tầng, giá 2.8 tỷ + Vị trí đẹp, nằm ở phường Cổ Nhuế 1, Bắc Từ Liêm, ngõ nông, đi lại thuận tiện, căn duy nhất có giá rẻ trong khu vực + Nhà 3 tầng dân tự xây, chắc chắn + Chủ nhà thiện chí bán Sổ đỏ chính chủ, sẵn sàng giao dịch Lh Mr Tùng 0969541111( Chuyên Thổ Cư Hà Nội)",31/07/2022,Tin thường,batdongsan_so_com_vn_1673811478.4449894,,,,,
"4,09 tỷ VNĐ",Đường Mỹ Đình phường Mỹ Đình 1, 32m2,"-         Tầng 2,3,4 mỗi tầng 1 ngủ. ",31/07/2022,Tin thường,batdongsan_so_com_vn_1673811479.669747, 3, 5, 2, 3, 4
9 tỷ VNĐ,"Giảng Võ, Giảng Võ, Ba Đình, Hà Nội.", 90m2,"Bán nhà Phố Giảng Võ, LÔ GÓC, KINH DOANH , 90M2, GIÁ nhỉnh 9 TỶ. + Nhà dân tự xây, thiết kế 4 tầng hiện đại, mt 6m. + Ngõ rộng, gần phố, gần bệnh viện, trường học, giao thông thuận tiện. + Nội thất gỗ thịt cực sang. + Sổ đỏ vuông vắn, sẵn sàng giao dịch! 0️⃣3️⃣5️⃣6️⃣5️⃣5️⃣1️⃣0️⃣9️⃣1️⃣   = 0️⃣9️⃣4️⃣4️⃣1️⃣8️⃣5️⃣3️⃣5️⃣4️⃣ Lh : Vân Anh – 0356551091 – 0944185354.",31/07/2022,Tin thường,batdongsan_so_com_vn_1673811480.76977, 6, 4,, 3, 3
11 tỷ VNĐ,Đường Văn Khê phường Phú La, 90m2,"Bán Nhà Tt Văn Phú 90m2 Ra Trục Chính Lacasta  Giá 11 TỷCần tiền nên muốn bán gấp nhà thuộc phố Văn Phú 90m2 5 tầng giá hiếm nhà đẹp , nhà đẹp phong cách hiện đại . vị trí cách đường Quang Trung 100m , trường học các cấp và siêu thị trong bán kính 500m. tiện ích đủ đầy , khu vực văn minh – hạ tầng hiện đai .Vị trí cực đẹp giá bán thiện trí.Nhà thiết kế đẹp : Tầng 1 : gara kinh doanh + bếp +WCTầng 2 ,3 : 4 ngủ + 4 phòng vệ sinh khép kín. Tầng 4 : phòng thờ + sân chơi + tiểu cảnh Sàn nhà và cửa toàn là gỗ Hương cao cấp, thiết bị vệ sinh nhập khẩu,…Sổ vuông đẹp, không lỗi gì , có thương lượng mạnh cho khách thiện chí.Liên hệ : e Giỏi để được tư vấn và mời đi xem nhà miễn phí ",31/07/2022,Tin thường,batdongsan_so_com_vn_1673811482.368491, 4, 5, 24, 4, 4
"5,45 tỷ VNĐ",Đường Phú Mỹ phường Phú Đô, 45m2,"Đất đẹp rẻ Phú Đô,  ""times="""" new="""" roman"";="""" mso-bidi-font-family:="""" ""segoe="""" ui="""" historic""'hàng="""" xóm="""" the="""" matrix="""" one="""" mỄ="""" trÌ="""" spanspan="""" 45m,="""" hơn="""" 5="""" tỷ="""" p="""" class=""MsoNormalSPAN"" historic""'span="""" spanliền="""" kề="""" vincom="""" tÂy="""" mỖ,="""" gold="""" max="""" cẦu="""" diỄn="""" span="""" historic""'="""">Đất ĐẸP rộng 40m đường XE TẢI tránh. View max thoáng ôm trọn SVĐ MỸ ĐÌNH  ""times="""" new="""" roman"";="""" mso-bidi-font-family:="""" ""segoe="""" ui="""" historic""'span="""" spanspan="""" spanvị="""" trí="""" đắc="""" địa="""" sầm="""" uất="""" ở="""" khu="""" tỪ="""" liÊm,="""" ngõ="""" thông="""" tứ="""" tung,="""" thuận="""" tiện="""" đi="""" lại="""" historic"";="""" mso-no-proof:="""" yes'="""" historic""'="""">  ""times="""" new="""" roman"";="""" mso-bidi-font-family:="""" ""segoe="""" ui="""" historic""'span="""" spantương="""" lai="""" ra="""" mặt="""" đường="""" lớn="""" rộng="""" 17m="""" span="""" p="""" class=""MsoNormalSPAN"" spanspan="""" spansổ="""" đỏ="""" chính="""" chủ.="""" roman"",serif;="""" lime'="""">Giá: hơn 5 tỷ "",serif;="""" background:="""" lime;="""" color:="""" #050505;="""" mso-highlight:="""" mso-fareast-font-family:="""" ""times="""" roman""'span="""" spanlh:="""" 0904548626="""" span="""" pspan="""" roman""'="""" p="""" class=""MsoNormalSPAN"" mso-bidi-font-family:="""" ""segoe="""" ui="""" historic""'="""">#phudo ""segoe="""" ui="""" historic""'="""" spanspan="""" class=""diy96o5hSPAN"" historic""'#metri="""" span="""">  ""segoe="""" ui="""" historic""'#mydinh="""" span="""" spanspan="""" background:="""" white;="""" historic""'="""" class=""diy96o5hSPAN"">#daimo ""segoe="""" ui="""" historic""'="""" spanspan="""" class=""diy96o5hSPAN"" historic""'#taymo="""" span="""">  ""segoe="""" ui="""" historic""'#tuliem="""" span="""" spanspan="""" background:="""" white;="""" historic""'="""" class=""diy96o5hSPAN"">#caudien ""segoe="""" ui="""" historic""'="""" spanspan="""" class=""diy96o5hSPAN"" historic""'#caugiay="""" span="""">  ""segoe="""" ui="""" historic""'#hadong="""" span="""" p="""" class=""MsoNormalSPAN"" historic""'#phúđô="""" spanspan="""" background:="""" white;="""" historic""'="""">  ""segoe="""" ui="""" historic""'#mễtrì="""" #mỹđình="""" #đạimỗ="""" #tâymỗ="""" span="""" spanspan="""" background:="""" white;="""" historic""'="""" class=""diy96o5hSPAN"">#từliêm ""segoe="""" ui="""" historic""'="""" spanspan="""" class=""diy96o5hSPAN"" historic""'#cầudiễn="""" span="""">  ""segoe="""" ui="""" historic""'#cầugiấy="""" span="""" spanspan="""" background:="""" white;="""" historic""'="""" class=""diy96o5hSPAN"">#hàđông ",31/07/2022,Tin thường,batdongsan_so_com_vn_1673811483.9532895, 4,,,,
"3,675 tỷ VNĐ",Đường Thôn 7 phường Phú Cát, 150m2,Diện tích 150m2Cạnh khu Đô Thị Phú Cát city ,31/07/2022,Tin thường,batdongsan_so_com_vn_1673811485.219042, 10,,,,
9 tỷ VNĐ,"Ngọc Khánh, Ngọc Khánh, Ba Đình, Hà Nội.", 91m2,"BIỆT THỰ CỔ TÍCH - LÔ GÓC 3 MẶT THOÁNG - MẶT NGÕ NGỌC KHÁNH, BA ĐÌNH. (ẢNH THẬT) + Diện tích 91m2, 4 tầng, mt 6m, Giá chào : 9.x Tỷ (x nhỏ xíu) + Vị trí nhà rất gần mặt phố. + Vài bước chân là ra ga đường sắt trên cao, chợ, bệnh viện, trường học,... + Dt sổ 91m2, dt xây dựng 72m2, phần còn lại làm sân vườn, khe thoáng. + Chủ nhà tự xây, có mời kiến trúc sư thiết kế giống như một toà tháp cổ tích. + Nội thất gỗ thịt sang – xịn – mịn. + Sổ đỏ vuông vắn, pháp lý rõ ràng. 0️⃣3️⃣5️⃣6️⃣5️⃣5️⃣1️⃣0️⃣9️⃣1️⃣   = 0️⃣9️⃣4️⃣4️⃣1️⃣8️⃣5️⃣3️⃣5️⃣4️⃣ Lh : Vân Anh – 0356551091 – 0944185354.",31/07/2022,Tin thường,batdongsan_so_com_vn_1673811486.4886456, 6, 4,, 3, 3
"4,5 tỷ VNĐ",đường hoàng quốc việt, 32m2,"Nhà hiếm ngõ 5 Hoàng Quốc Việt DT 32m2 x 5 tầng mt 3,8m giá nhỉnh 4 tỷ. NHÀ ĐẸP - 2 THOÁNG - GẦN SÁT OTO - TẶNG FULL NỘI THẤT XỊN XÒ. * Mô tả: Nhà mưa to không sợ ngâp lụt, tết nhất đi bộ ra chợ hoa sắm cây. + Vị tríquá đẹp, sát đường nguyễn đình hoàn nhà cách đường oto vài bước chân, giao thông thuận lợi, an ninh, dân trí tốt. + Thiết kế: - T1: PK + bếp - T2+3+4: mỗi tầng 1 PN + 1 WC - T5: phòng thờ + sân phơi. + Phía sau nhà còn 1 khoảng rãnh rộng, tầng 1 dùng để làm nơi sơ chế đồ sống, từ T2 trở lên mở cửa sổ thông thoáng trước sau. + Không gian sống yên tĩnh, sạch sẽ, mát mẻ. Trước nhà có sân cực rộng, gia đình thoải mái để xe khi có liên hoan, hội họp. + Sổ đỏ đẹp, chính chủ. + Chi Tiết Xin Liên Hệ Bùi Anh Thái. 1979 - 0987.862962.",31/07/2022,Tin thường,batdongsan_so_com_vn_1673811488.528864, 3, 5, 2, 3, 4
"3,75 tỷ VNĐ","Hà Trì 3, Hà Cầu, Hà Đông, Hà Nội", 36m2,"Bán nhà phố Hà Trì 3 Hà Đông 36m2 4T 3.75 tỷVị trí căn nhà cực đẹp, Ô tô đỗ cửa, có thể kinh doanh nhỏ.Khu vực  đầy đủ tiện ích như trường học, bệnh viện, chợ cách nhà vài bước chân.+ Nhà 4 tầng thiết kế vô cùng đẹp.- Tầng 1 phòng khách, bếp và vệ sinh.- Tầng 2, 3: mỗi tầng 02 phòng ngủ và wc.- Tầng 4: phòng thờ và sân phơi.+ Giá chào: 3.75 tỷ (Có thương lượng)+ Sổ đỏ chính chủ, sẵn sang giao dịch.Liên hệ: Mrs Phượng 0974352054 - Tư vấn tận tâm, miễn phí 24/24h (zalo, Fb) , hỗ trợ tư vấn Pháp lý, vay vốn.",31/07/2022,Tin thường,batdongsan_so_com_vn_1673811489.946073,,,,,
"32,9 tỷ VNĐ","trần khát chân, hai bà trưng", 262m2," - Trần Khát Chân 262 17 32.9 tỷ Hai Bà Trưng - BIỆT THỰ SÂN VƯỜN - LÔ GÓC 2 THOÁNG - Ô TÔ TRÁNH - KINH DOANH - Ở HOẶC CHIA LÔ  ĐỀU TUYỆT VỜI.+ Tọa lạc trong mặt ngõ thông tứ phía, thông ngõ 325 Kim Ngưu, ngõ 651 Minh Khai, đường trước nhà ô tô tránh đỗ, kinh doanh đa loại hình. + Biệt thự thiết kế 3 tầng chắc chắn, lô góc 2 thoáng.- Tầng 1: Sân vườn + Phòng khách + WC.- Tầng Lửng: Phòng ăn, bếp + 1 Phòng ngủ.- Tầng 2, 3: Mỗi tầng gồm 03 Phòng + WC.+ Sổ đỏ chính chủ, sẵn sàng giao dịch.** alo ; 0911-206-189... thanks",31/07/2022,Tin thường,batdongsan_so_com_vn_1673811491.7532392,,,,,
