price,address,Diện tích,Mặt tiền,Lộ giới,Details,Ngày đăng,Loại tin,id,Số tầng,Số phòng ngủ,Số toilet
"8,6 tỷ VNĐ",Thai Hà Phố, 50m2, 4, 4,"Tự tin khắp Hà Nội không có căn thứ 2 vừa ở vừa kinh doanh cực đỉnhChủ nhà cần tiền muốn thanh khoản nhanh về quê an hưởng tuổi gì chia tiền cho các con. Tầm tài chính này mà có nhà Mặt Phố quả là không tìm đâu ra căn thứ 2 cơ hội chỉ có 1+ Vị trí không thể đẹp hơn  PHỐ THÁI HÀ 1 trong các trung tâm của quận Đống Đa cũng như thành phố Hà Nội.+ Nhà nằm ở vị đắc địa gần ngã tư tấp nập …. . trước cửa nhà ô tô tránh nhau phi vèo vèo. + khu phân lô dành cho cán bộ VIP, Quân Đội ,….. vài phút là ra các Bệnh Viện lớn như Bạch Mai , sanh Pôn , Lưu lượng người qua nhà tấp nập kinh doanh đỉnh của đỉnh chả đâu bằngGiá chào 8,6 tỷ chủ nhà cực kỳ thiện trí +  thuận tiện giao thông…, Trường học các cấp, bệnh viên,siêu thị, vui chơi giải trí, thể thao….+ LH : Mr Vượng - 0912949598. Thổ Địa Đống đa, đang có 50 căn nhà, giá tương đương. Để được tư vấn, xem nhà hoàn toàn miễn phí, Sẵn sàng giao dịch, Hỗ trợ tư vấn Pháp lý, Đàm Phán.& Bank.",26/07/2022,Tin thường,batdongsan_so_com_vn_1673812327.286347,,,
"6,7 tỷ VNĐ",mỗ lao, 55m2, 4,,"Bán Nhà, Vạn Phúc, Hà Đông. Ô Tô Kinh Doanh 55m2 x 4 tầng. Mặt Tiền 4.5m Giá 6.77 Tỷ.     MẶT NGÕ -  KINH DOANH, VĂN PHÒNG – TIỆN ÍCH NGẬP TRÀN  + Nhà mặt ngõ cách đường Vạn Phúc vài bước chân, ngả đi các đường Quang Tung, Trần Phú, Lê Văn Lương Kéo Dài,Ngã Tư Sở, Vành Đai 3, đi nội thành và các tỉnh lân cận rất thuận tiện. + Nhà gần các trường Đại Học lớn như; Đại Học Kiến Trú, Học Viện Bưu Chính Viễn Thông, gần Huyện Uỷ Hà Đông, chợ Phùng Khoang, Siêu Thị BigC Hồ Gươm, Siêu Thị Coopmax, Trung Tâm Thương Mại Roal Anl CiTy, Bệnh Viện 103, viện Bỏng. Giao thông thuận tiện, an ninh an toàn, đầy đủ tiện ích xung quanh. + Nhà mặt ngõ kinh doanh, văn phòng đều thuận lợi, khu vực hiếm nhà bán.  + Nhà thiết kế 4 tầng:                                                                                                          - - - Tầng 1: Phòng khách, bếp, wc, - Tầng 2,3: Mỗi tầng 2 phòng ngủ và wc - Tầng 4 : Phòng thờ, sân phơi. + Nhà khung cột bê tông chắc chắn.  Sổ đỏ chính chủ, sẵn sàng giao dịch.   LH: E KHÁNH: 0984568179 ",26/07/2022,Tin thường,batdongsan_so_com_vn_1673812328.8431818, 4, 4, 3
"8,55 tỷ VNĐ",Đường Thái Hà phường Trung Liệt, 50m2,, 1,"+ 
",26/07/2022,Tin thường,batdongsan_so_com_vn_1673812330.2434356,,,
"8,55 tỷ VNĐ",Đường Thái Hà phường Trung Liệt, 50m2,, 1,"+ 
",26/07/2022,Tin thường,batdongsan_so_com_vn_1673812331.739582,,,
"3,2 tỷ VNĐ",Căn hộ cao cấp đầu tiên của tập đoàn Hưng Thịnh tại Hà Nội., 86m2,,,"Linh Đàm đã có chung cư cao cấp đây rồi.Giá đợt 1 từ 4x tr/m2.Mở bán đợt 1 - mua được là thắng!================Căn hộ cao cấp đầu tiên của tập đoàn Hưng Thịnh tại Hà Nội.Tập đoàn Hưng Thịnh có 3 năm liên tiếp từ 2019 - 2021 lọt top 10 CĐT uy tín nhất Việt Nam.Bề dày 20 năm kinh nghiệm BĐS với 100 dự án quỹ đất 4500 ha.================Vị trí vàng, ngàn kết nối:Dự án nằm trong khu dân trí cao, cộng đồng văn minh.1 Phút đến tiểu học Chu Văn An.4 Phút đến Cầu Dậu.7 - 10 Phút đến Trường điểm THCS, THPT.8 Phút đến CV Linh Đàm, Bắc Linh Đàm.10 Phút đến BX Giáp Bát, Nước Ngầm.7 - 15 Phút đến ĐH Thăng Long, Bách Khoa.BV Nội Tiết, BV K, BV 103 gần kề.Tiện ích nội khu chuẩn quốc tế:Hồ bơi, vườn dạo bộ, khu vui chơi trẻ em.Khu TDTT (tennis, bóng rổ, bơi... ).Khu BBQ ngoài trời.Khu TTTM, nhà trẻ, gym, spa...Hâm dể xe có hệ thống nâng.Phòng lánh nạn, an ninh đảm bảo 24/7.Làm việc trực tiếp với nhân viên tư vấn của Chủ Đầu Tư - Thông tin chính thống.Hỗ trợ vay đến 70% giá trị căn hộ, lãi suất 0% trong 24 tháng.Đóng giãn 15 đến 20 đợt - Mỗi đợt 3 đến 5%.Nhận giấy tờ pháp lý minh bạch, sổ hồng lâu dài.Vậy chung cư cao cấp Linh Đàm có gì đáng để mua?100% căn hộ có 2 logia đón nắng, gió và ánh sáng tự nhiên.Mật độ ""siêu thoáng 12 thang máy/tòa"".Full nội thất cơ bản.Không gian linh hoạt: 68m2; 76m2; 82m2; 98m2; 121m2; 147m2 (2 - 3 N).Với thiết kế hình chữ L giúp tất cả các căn hộ đều có mặt thoáng tự nhiên.Không gian mát mẻ quanh năm, không khí trong lành, mảng xanh tự nhiên vì gần hồ Linh Đàm.",26/07/2022,Tin thường,batdongsan_so_com_vn_1673812333.1368446,,,
"8,1 tỷ VNĐ",Đường Lê Quang Đạo phường Phú Đô, 67m2, 4,,"+ Ngõ 8 Lê Quang Đạo trải nhựa đẹp, to như phố, khu vực luôn khan hiếm nhà và những mảnh đất đẹp. + Giao thông thuận tiện, đi các ngả, đường  + Chủ đang cho thuê kinh doanh bên ngoài mặt đường, bên trong cho thuê phòng trọ. ",26/07/2022,Tin thường,batdongsan_so_com_vn_1673812336.4385939,,,
"3,3 tỷ VNĐ",Văn Phú- Hà Đông, 40m2,,,"Bán nhà Văn Phú, Hà Đông, 40m, 5 tầng, ô tô gần, ngõ thông thoáng, hơn 3 tỷ Chủ cần tiền cho con đi du học nên cần bán gấp nhà đẹp Văn Phú cực hiếm, thiết kế 5 tầng hiện đại, nội thất vip chỉ việc đến ở, diện tích rộng 40m, ngõ thông thoáng, vài bước ra ô tô, cách phố rất gần. Bán kính xung quanh nhà siêu thị Metro, hưởng trọn lợi ích Khu đô thị Văn Phú, trường học tư nhân đến quốc tế, siêu thị, ngân hàng, cạnh Quận uỷ. Khu vực dân trí cao, hàng xóm toàn cán bộ, ở rất văn minh, môi trường trong lành. Giao thông nối trục chính Quang Trung giao cắt Lê Trọng Tấn xuống Yên Nghĩa, thông Trần Đăng Ninh qua Lý Thường Kiệt. Sổ đỏ vuông, sẵn sàng giao dịch. Giá 3.3 tỷ ( có gia lộc). Liên hệ : Huyền Hà Đông ( 0363703491- 0965472910)- Chuyên gia nhà Thổ Cư tư vấn hàng nghìn ngôi nhà tiết kiệm THỜI GIAN- CÔNG SỨC- TIỀN BẠC. Hỗ trợ 24/7 và tư vấn pháp lý, vay vốn.",26/07/2022,Tin thường,batdongsan_so_com_vn_1673812340.319328, 5,,
"3,3 tỷ VNĐ",Hà Trì- Hà Đông, 40m2,,,"Bán nhà Hà Trì, Hà Đông, 40m, 5 tầng, ngõ thông, gần ô tô nhỉnh 3 tỷ Chủ nhà chuyển vào Sài Gòn sống cùng con cháu nên cần bán gấp căn nhà tâm huyết có diện tích lớn 40m, không gian thoáng đãng 5 tầng rộng đầy đủ công năng, nội thất Châu Âu hiện đại chỉ việc xách vali đến ở. Nhà rất gần trường học, cách chợ Hà Đông vài bước chân, quanh nhà siêu thị, ngân hàng, bệnh viện, chợ dân sinh không thiếu thứ gì. Hàng xóm văn minh vô cùng thân thiện, ở cực sướng. Giao thông nối các phố cổ Bà Triệu thông Lê Lợi qua Tô Hiệu, dọc lên Hoàng Hoa Thám, cắt ngang Lê Hồng Phong, cạnh các cơ quan hành chính của Quận, khu vực lõi trung tâm hiếm nhà bán. Sổ đỏ vuông, sẵn sàng giao dịch. Giá 3.3 tỷ ( có gia lộc). Liên hệ : Huyền Hà Đông ( 0363703491- 0965472910)- Chuyên gia nhà Thổ Cư tư vấn hàng nghìn ngôi nhà tiết kiệm THỜI GIAN- CÔNG SỨC- TIỀN BẠC. Hỗ trợ 24/7 và tư vấn pháp lý, vay vốn.",26/07/2022,Tin thường,batdongsan_so_com_vn_1673812341.8232698, 5,,
"12,3 tỷ VNĐ",Văn Quán- Hà Đông, 90m2,,," Bán nhà riêng Văn Quán, Hà Đông, 90m, 5 tầng, kinh doanh, vỉa hè, hơn 12 tỷ Cực hiếm nhà bán thuộc khu vực Vip Văn Quán, Hà Đông , vài bước ra mặt đường đôi Nguyễn Khuyến, vị trí đắc địa vỉa hè rộng, ô tô tránh, cạnh nhà là chung cư, trường học, công viên, dân cư đông đúc hiếm nhà bán. Nằm trong Khu đô thị Văn Phú nhà phù hợp kinh doanh đa dạng loại hình ở kết hợp văn phòng, quán ăn, spa, siêu thị, phòng khám quá đỉnh. Giao thông thuận lợi cạnh Nguyễn Khuyến ra Chiến Thắng, nối Quang Trung với Phúc La, chạy dọc Mỗ Lao xuống Vạn Phúc. Chủ nhà doanh nhân thành đạt đổi sang ở Biệ thự rộng hơn cần bán nhanh. Sổ đỏ vuông, sẵn sàng giao dịch. Giá 12.3 tỷ ( có gia lộc). Liên hệ : Huyền Hà Đông ( 0363703491- 0965472910)- Chuyên gia nhà Thổ Cư tư vấn hàng nghìn ngôi nhà tiết kiệm THỜI GIAN- CÔNG SỨC- TIỀN BẠC. Hỗ trợ 24/7 và tư vấn pháp lý, vay vốn.",26/07/2022,Tin thường,batdongsan_so_com_vn_1673812343.3212616, 5,,
"12,4 tỷ VNĐ",Văn Quán- Hà Đông, 90m2,,,"Nhỉnh 12 tỷ Văn Quán, Hà Đông, 90m, 5 tầng vỉa hè, kinh doanh sầm uất Tôi chính chủ bán nhà riêng nằm trong Khu đô thị Văn Quán, vị trí đắc địa thông số vàng 90m xây tâm huyết 5 tầng rộng đẹp ở kết hợp kinh doanh rất tuyệt, nhà có vỉa hè rộng, đường ô tô tránh. Nhà bán vài bước mặt đường đôi Nguyễn Khuyến, giá trị tăng cao gần chung cư, công viên , chợ Xanh. Kinh doanh sầm uất nhiều loại hình, duy nhất không có căn thứ 2 bán. Tôi mở rộng kinh doanh nên cần tiền đầu tư nhà xưởng, máy móc, cơ hội duy nhất cho khách đầu tư vào. Sổ đỏ vuông, sẵn sàng giao dịch. Giá 12.4 tỷ ( có gia lộc). Liên hệ : Huyền Hà Đông ( 0363703491- 0965472910)- Chuyên gia nhà Thổ Cư tư vấn hàng nghìn ngôi nhà tiết kiệm THỜI GIAN- CÔNG SỨC- TIỀN BẠC. Hỗ trợ 24/7 và tư vấn pháp lý, vay vốn. ",26/07/2022,Tin thường,batdongsan_so_com_vn_1673812344.567926, 5,,
4 tỷ VNĐ,Đường Trần Phú phường Yên Nghĩa, 50m2, 5,,"
    *Mô tả:+ Vị trí cực đẹp của khu B Yên Nghĩa, cách bến xe Yên Nghĩa chưa đầy  200m. Xung quanh tiện ích không thiếu thứ gì. Giao thông thuận tiện, bán đất tặng nhà cấp 4. Vỉa hè 3m hai bên, ô tô tránh dừng đỗ ngày đêm.+ Sổ đỏ vuông, sẵn giao dịch.+ Liên hệ: Em Trà 0983831788
",26/07/2022,Tin thường,batdongsan_so_com_vn_1673812345.8363147,,,
"12,4 tỷ VNĐ",Văn Quán- Hà Đông, 90m2,,,"Nhỉnh 12 tỷ Văn Quán, Hà Đông, 90m, 5 tầng vỉa hè, kinh doanh sầm uất Tôi chính chủ bán nhà riêng nằm trong Khu đô thị Văn Quán, vị trí đắc địa thông số vàng 90m xây tâm huyết 5 tầng rộng đẹp ở kết hợp kinh doanh rất tuyệt, nhà có vỉa hè rộng, đường ô tô tránh. Nhà bán vài bước mặt đường đôi Nguyễn Khuyến, giá trị tăng cao gần chung cư, công viên , chợ Xanh. Kinh doanh sầm uất nhiều loại hình, duy nhất không có căn thứ 2 bán. Tôi mở rộng kinh doanh nên cần tiền đầu tư nhà xưởng, máy móc, cơ hội duy nhất cho khách đầu tư vào. Sổ đỏ vuông, sẵn sàng giao dịch. Giá 12.4 tỷ ( có gia lộc). Liên hệ : Huyền Hà Đông ( 0363703491- 0965472910)- Chuyên gia nhà Thổ Cư tư vấn hàng nghìn ngôi nhà tiết kiệm THỜI GIAN- CÔNG SỨC- TIỀN BẠC. Hỗ trợ 24/7 và tư vấn pháp lý, vay vốn. ",26/07/2022,Tin thường,batdongsan_so_com_vn_1673812347.1916873, 5,,
"12,3 tỷ VNĐ","Văn Quán, Hà Đông", 90m2,,,"Bán nhà riêng Văn Quán, Hà Đông, 90m, 5 tầng, kinh doanh, vỉa hè, hơn 12 tỷ Cực hiếm nhà bán thuộc khu vực Vip Văn Quán, Hà Đông , vài bước ra mặt đường đôi Nguyễn Khuyến, vị trí đắc địa vỉa hè rộng, ô tô tránh, cạnh nhà là chung cư, trường học, công viên, dân cư đông đúc hiếm nhà bán. Nằm trong Khu đô thị Văn Phú nhà phù hợp kinh doanh đa dạng loại hình ở kết hợp văn phòng, quán ăn, spa, siêu thị, phòng khám quá đỉnh. Giao thông thuận lợi cạnh Nguyễn Khuyến ra Chiến Thắng, nối Quang Trung với Phúc La, chạy dọc Mỗ Lao xuống Vạn Phúc. Chủ nhà doanh nhân thành đạt đổi sang ở Biệ thự rộng hơn cần bán nhanh. Sổ đỏ vuông, sẵn sàng giao dịch. Giá 12.3 tỷ ( có gia lộc). Liên hệ : Huyền Hà Đông ( 0363703491- 0965472910)- Chuyên gia nhà Thổ Cư tư vấn hàng nghìn ngôi nhà tiết kiệm THỜI GIAN- CÔNG SỨC- TIỀN BẠC. Hỗ trợ 24/7 và tư vấn pháp lý, vay vốn.",26/07/2022,Tin thường,batdongsan_so_com_vn_1673812348.5837386, 5,,
"3,3 tỷ VNĐ",Hà Trì- Hà Đông, 40m2,,,"Bán nhà Hà Trì, Hà Đông, 40m, 5 tầng, ngõ thông, gần ô tô nhỉnh 3 tỷ Chủ nhà chuyển vào Sài Gòn sống cùng con cháu nên cần bán gấp căn nhà tâm huyết có diện tích lớn 40m, không gian thoáng đãng 5 tầng rộng đầy đủ công năng, nội thất Châu Âu hiện đại chỉ việc xách vali đến ở. Nhà rất gần trường học, cách chợ Hà Đông vài bước chân, quanh nhà siêu thị, ngân hàng, bệnh viện, chợ dân sinh không thiếu thứ gì. Hàng xóm văn minh vô cùng thân thiện, ở cực sướng. Giao thông nối các phố cổ Bà Triệu thông Lê Lợi qua Tô Hiệu, dọc lên Hoàng Hoa Thám, cắt ngang Lê Hồng Phong, cạnh các cơ quan hành chính của Quận, khu vực lõi trung tâm hiếm nhà bán. Sổ đỏ vuông, sẵn sàng giao dịch. Giá 3.3 tỷ ( có gia lộc). Liên hệ : Huyền Hà Đông ( 0363703491- 0965472910)- Chuyên gia nhà Thổ Cư tư vấn hàng nghìn ngôi nhà tiết kiệm THỜI GIAN- CÔNG SỨC- TIỀN BẠC. Hỗ trợ 24/7 và tư vấn pháp lý, vay vốn.",26/07/2022,Tin thường,batdongsan_so_com_vn_1673812350.0419095, 5,,
"3,3 tỷ VNĐ",Văn Phú- Hà Đông, 40m2,,,"Bán nhà Văn Phú, Hà Đông, 40m, 5 tầng, ô tô gần, ngõ thông thoáng, hơn 3 tỷ Chủ cần tiền cho con đi du học nên cần bán gấp nhà đẹp Văn Phú cực hiếm, thiết kế 5 tầng hiện đại, nội thất vip chỉ việc đến ở, diện tích rộng 40m, ngõ thông thoáng, vài bước ra ô tô, cách phố rất gần. Bán kính xung quanh nhà siêu thị Metro, hưởng trọn lợi ích Khu đô thị Văn Phú, trường học tư nhân đến quốc tế, siêu thị, ngân hàng, cạnh Quận uỷ. Khu vực dân trí cao, hàng xóm toàn cán bộ, ở rất văn minh, môi trường trong lành. Giao thông nối trục chính Quang Trung giao cắt Lê Trọng Tấn xuống Yên Nghĩa, thông Trần Đăng Ninh qua Lý Thường Kiệt. Sổ đỏ vuông, sẵn sàng giao dịch. Giá 3.3 tỷ ( có gia lộc). Liên hệ : Huyền Hà Đông ( 0363703491- 0965472910)- Chuyên gia nhà Thổ Cư tư vấn hàng nghìn ngôi nhà tiết kiệm THỜI GIAN- CÔNG SỨC- TIỀN BẠC. Hỗ trợ 24/7 và tư vấn pháp lý, vay vốn.",26/07/2022,Tin thường,batdongsan_so_com_vn_1673812351.6226866, 5,,
55 tỷ VNĐ,Đường Cổ Linh phường Long Biên, 489m2, 15, 10,"BIỆT THỰ CỔ TƯ ĐÌNH – CỔ LINH  4890M2 - VỊ TRÍ ĐẮC ĐỊA 55 TỶ - LONG BIÊNCách mặt phố Cổ Linh khoảng 62m đường trước bt 3 ô tô tránh nhau thoả mái Biệt thự 3 tầng do kỹ sư người Pháp thiết kế. Chủ nhà là người Pháp, vợ người Việt, nay cả nhà chuyển về Pháp sinh sống nên bán đi+ Ngay cạnh nhà là dự án chung cư cao cấp đang triển khai, tiện ích không thiếu thứ gì, đi vài bước ra Aeon Mall Long Biên. +Gần khu biệt thự Minh Tâm, Him lam...+ Khách mua để ở hoặc đầu tư phân lô bán hoặc xây toà Building để kinh doanh hoặc cho thuê thì hái ra tiền.+ Sổ đỏ phân lô vuông vắn đẹp hơn hoa hậu.Lh: Vũ Bình - chuyên nhà đất thổ cư Long Biên",26/07/2022,Tin thường,batdongsan_so_com_vn_1673812364.3128545, 3, 8, 5
"18,4 tỷ VNĐ",Đường Nguyễn Thị Định phường Trung Hòa, 68m2, 5, 6,"
    Anh chị có nhu cầu mua để giữ tiền, vừa ở vừa kinh doanh, cửa hàng thì đây là 1 sự lựa chọn tối ưu. Giá bán: 18.4 tỷ có thương lượng nhiều cho khách nhiệt tình.
",26/07/2022,Tin thường,batdongsan_so_com_vn_1673812365.6552625, 6, 4, 5
8 tỷ VNĐ,Thái Hà Đống Đa Hà Nội, 60m2, 7,,"Vị trí rất đẹp , trung tâm Đống Đa, phố Thái Hà kinh doanh sầm uất. Nhà 2 mặt ngõ thoáng sáng, ở sướng, Khu dân trí cao an ninh tốt hàng xóm thân thiện.Diện tích 60m2, mặt tiền 7m, nhà 6 tầng kiên cố, chủ xây tâm huyết, rất cẩn thận chủ mới về ở ngay, không lo sửa chữa.Tiện ích vô vàn, vài phút ra chợ Thái Hà, Trung tâm chăn sóc sức khoẻ Tài Thu, gần rất nhiều trường ĐH lớn như Học viện Ngân Hàng, ĐH Thuỷ Lợi, giao thương với các tuyến phố Chùa Bộc, Yên Lãng, Thái Thịnh, Trung Liệt, giao thông thuận lợi.Thiết kế: + Tầng 1: Thông sàn làm phòng khám.+ Tầng 2: Phòng khách lớn + Bếp + phụ.+ Tầng 3,4,5: 2 Phòng + phụ.+ Sân vườn, bàn trà, cafe có sẵn bếp để tiệc nhậu, tụ tập anh em bạn bè.+ Nhà mang đậm dấu ấn người trí thức Hà Nội. Chủ nhà bác sỹ, lịch sự mến khách.+ Sổ vuông đét giao dịch ngay. Giá 8 tỷ có ra lộc.Liên hệ tôi Tuấn Anh 0937651883 xem nhà trực tiếp. Miễn trung gian, Môi giới.",26/07/2022,Tin thường,batdongsan_so_com_vn_1673812367.7745922, 6, 6, 6
"4,3 tỷ VNĐ",Đường Cẩm Văn phường Láng Hạ, 45m2, 4, 2,"Bán nhà ĐẸP, dân xây đường Láng 45m2 5 tầng MT4m. 100m ra phố Láng. 4.3 tỷ  Vị trí: Khu vực đông dân cư, ngã 4 Cầu Giầy - Láng. Gần trường Đại học Giao thông vận tải. Nhà cách phố Láng chưa đến 100m.  Nhà dân xây ĐẸP, chắc chắn. Thiết kế đầy đủ công năng: Khách, bếp, ngủ, phòng thờ, sân phơi, vệ sinh...  Sổ: Đẹp, nở hậu.  LH: Ngọc Duyên.",26/07/2022,Tin thường,batdongsan_so_com_vn_1673812369.1997807, 5, 3, 4
