price,address,Diện tích,Mặt tiền,Lộ giới,Số tầng,Số phòng ngủ,Details,Ngày đăng,Loại tin,id,Số toilet
"7,6 tỷ VNĐ",Khương Hạ, 50m2, 4, 5, 4, 4," * Tài chính trên 7 tỷ không mua nhà này mua nhà nào ạ. Nhà Khương Hạ quận Thanh Xuân, 2 thoáng trước sau, thiết kế đẹp, ở thích, an sinh đỉnh. DT 50m, 4T, mt 4m, giá chỉ nhỉnh 7 tỷ. + Trước nhà có sân rộng lên nhà rất thoáng và thoải mãi để vài chục cái ô tô. + Nhà thiết kế, giếng giời, cầu thang giữa, mỗi tầng 2 phòng rộng, đầy đủ công năng. + Tặng full đồ nội thất cao cấp, chủ mới chỉ việc về ở ngay. + Có cột chờ lên thêm tầng, có thể thiết kế thêm thang máy, phù hợp ở, cho thuê hay làm văn phòng đều đỉnh. + Rất gần đường lớn, 20m ra mặt phố giao thông thuận tiện, tiện ích đủ đầy. + Sổ đỏ chính chủ, sẵn sàng giao dịch.  # nhanh tay LH: 0906113879 Tình nhà phố ( chuyên bán, nhận ký gửi nhà đất Thổ cư, có uy tín trong giới nhà đất quận Hà Đông – Hà Nội ).",21/07/2022,Tin thường,batdongsan_so_com_vn_1673813423.737511,
"4,35 tỷ VNĐ",Đường Cổ Linh phường Thạch Bàn, 40m2, 3, 4, 5, 4,"VỊ TRÍ CỰC KÌ HIẾM ! -RẺ HƠN THỊ TRƯỜNG-NHÀ ĐẸP-Ô TÔ VÀO NHÀ-KINH DOANH SẦM UẤT-KHÔNG LỖI PHONG THỦY Cần bán nhà Phố Cổ Linh,quận Long Biên Khu vực gần như không có căn thứ 2. +Giao thông thuận tiện ô tô tránh nhau đi các phố Thạch Bàn, Bát Khối,Tư Đình, Ngọc Trì vv +Tiện ích xung quanh tràn ngập không thiếu thứ gì. TTTM AEON, Bệnh viện TÂM ANH,Trường cấp 1,2 Thạch Bàn, Chợ Thạch Bàn +TIỀM NĂNG ĐẦU TƯ CỰC ĐỈNH- Ngay gần CẦU VĨNH TUY ,TRẦN HƯNG ĐẠO. +Giá RẺ HƠN THỊ TRƯỜNG. 4,35 tỷ Liên Hệ:  Mr Lâm. 0976262952",21/07/2022,Tin thường,batdongsan_so_com_vn_1673813425.053989, 5
"4,5 tỷ VNĐ","Long Biên, Hà Nội", 48m2, 3,, 5, 6,"Nhà nằm gần phố, gần chợ Ngọc Thụy, gần trường học trên địa bàn, 10m ô tô tránh - Tiện tích xung quanh không thiếu gì, đường mới trải nhựa, sạch sẽ. - Nhà chủ tự xây vẫn nguyên như mới, thiết kế hợp lý . Phù hợp khách mua vừa ở vừa cho thuê. Tầng 1: Phòng khách + Bếp+ WC. Tầng 2,3,4: Mỗi tầng 2 PN + WC giữa. Tầng 5: Phòng thờ+ Sân phơi. - Sổ đỏ phân lô , vuông như tờ A4, sẵn sàng giao dịch MR Khánh hỗ trợ xem nhà miễn phi và tư vấn tận tâm các thủ tục liên quan về nhà đât",21/07/2022,Tin thường,batdongsan_so_com_vn_1673813426.5071044, 4
5 tỷ VNĐ,Đường Ngọc Thụy phường Ngọc Thụy, 38m2, 3, 4, 5, 4,+ Vị trí cực đẹp lô góc 2 mặt thoáng ngõ Ôtô thông đường Hồng Tiến đang thi công. + Diện tích 38M2 trên sổ từ tầng 2 đến tầng 5 diện tích sàn 42m nhà dân tự xây tâm huyết.  ,21/07/2022,Tin thường,batdongsan_so_com_vn_1673813427.822012,
"6,95 tỷ VNĐ",Đường Xuân Thủy phường Dịch Vọng, 50m2, 6, 3, 5, 7,""",serif;="""" mso-ansi-language:="""" vi'bán="""" nhà="""" xuân="""" thủy,="""" 50m2,="""" 5t,="""" 6m,="""" 6.95="""" tỷ,="""" ô="""" tô,="""" kd,="""" cầu="""" giấy.="""" span="""" p="""" class=""MsoNormalSPAN"" vi'+="""" chủ="""" xác="""" định="""" bán="""" đất="""" tặng="""" nhà,="""" với="""" 5="""" tầng,="""" 7="""" phòng="""" ngủ="""" khép="""" kín.="""" vi'="""">+ Cả khu vực chỉ có một mình nhà mình có mặt tiền 6m. "",serif;="""" mso-ansi-language:="""" vi'+="""" trước="""" nhà="""" ô="""" tô="""" 4="""" chỗ="""" đỗ="""" cửa,="""" chạy="""" vòng="""" quanh="""" ngõ="""" phân="""" lô.="""" span="""" p="""" class=""MsoNormalSPAN"" với="""" mô="""" hình="""" kinh="""" doanh="""" đa="""" dạng="""" sầm="""" uất="""" ngày="""" đêm:="""" có="""" thể="""" cho="""" thuê,="""" văn="""" phòng,="""" sinh="""" viên="""" thuê="""" trọ...="""" vi'="""">+ Sổ đỏ vuông như tờ tiền, chủ làm ăn rất có lộc, chờ khách đến giao dịch.",21/07/2022,Tin thường,batdongsan_so_com_vn_1673813429.32499, 7
"6,6 tỷ VNĐ",Phố Nguyễn Trãi, 52m2, 4,, 4, 4,"NHÀ ĐẸP LUNG LINH - 2 THOÁNG - XEM TRONG LÀ THÍCH - NGÕ ĐẸP THOÁNG SÁNG, 30M Ô TÔ DỪNG ĐỖ - AN SINH ĐỈNH + Nguyễn Trãi – Thanh Xuân Trung – Thanh Xuân. + Diện tích 52m, nhà 4 tầng, mặt tiền 4m + Giá bán: 6.6 tỷ + Nhà vị trí đẹp ngõ thẳng thoáng sáng rất gần mặt phố Nguyễn Trãi, cách ô tô khoảng 30m gần chỗ gửi ô tô. + Khu vực an sinh đỉnh, an ninh rất tốt ngay đầu ngõ là chợ, công phường, trường mầm non. Xung quanh gần các trường Đại học, royal city, bệnh viện, TTTM, giao thông thuận tiện gần ngã tư sở, bến xe bus, gar tàu điện trên cao... + Nhà mới đẹp lung linh khách mua chỉ việc về ở, chủ rất tâm huyết tỉ mỉ từng góc cạnh, lên thêm tầng thoải mái. Thiết kế hợp lý mỗi tầng 2 phòng. + Sổ đỏ chính chủ, vuông vắn. + Liên hệ xem nhà: 0902083139  ",21/07/2022,Tin thường,batdongsan_so_com_vn_1673813431.0244458, 4
"1,8 tỷ VNĐ","Thôn Phú Hữu, Xã Phú Nghĩa, Chương Mỹ, HN", 80m2,,,,,"Bán Lô Đất Thôn Phú Hữu,Phú Nghĩa,Chương Mỹ,2 Mặt Ngõ Ô Tô  DT 80 m2. Chỉ 1,8 TỷVị Trí: Lô đất nằm tại Thôn Phú Hữu 2, khu dân cư đông đúc, hàng xóm thân thiện, gần trường mầm non, tiểu học Phú Nghĩa, gần chợ, cách QL 6 khoảng 300m, gần với khu công nghiệp Phú Nghĩa, có thể đầu tư xây nhà vừa ở, vừa cho công nhân thuê tạo thêm dòng tiền cũng rất tốt,Đường thông các ngả,tương lai mở rộng đường quốc lộ 6 giá trị lô đất sẽ tăng cao. Mặt tiền lô đất rộng ngõ Ô Tô tải tránh.Pháp lý; Sổ đỏ chính chủ sẵn sàng giao dịch.Liên hệ: Mr Luyện 0911779569 thổ cư để được xem đất miễn phí 24/7.“TRAO GỬI NIỀM TIN_ NHẬN LẠI YÊU THƯƠNG",21/07/2022,Tin thường,batdongsan_so_com_vn_1673813432.7044265,
10 tỷ VNĐ,"Phố Lê Trọng Tấn, Phường , Quận Thanh Xuân, Thành phố Hà Nội.", 44m2, 6,,,,"+ Vị trí sát mặt phố Lê Trọng Tấn, giao thông thuận lợi đi các ngả, tiếp giáp với hàng loạt các con phố Trường Chinh, Nguyễn Lân, Trịnh Đình Cửu ( Trần Hòa ) rất gần Hoàng Văn Thái, Trần Điền....+ Nhà chủ tâm huyết tự xây, khung cột bê tông chắc chắn, diện tích 44m2, mặt tiền hơn 6m.+ Sổ đỏ nở hậu, kinh doanh tốt ( con nhà chủ đang kinh doanh rất có lộc ).+ Chủ nhà hiền lành, tốt tính, học thức cao ( nguyên là giảng viên trường Đại học kinh tế quốc dân nay đã về hưu).+ Liên hệ : Phương Nam : 0386.702.912.",20/07/2022,Tin thường,batdongsan_so_com_vn_1673813434.1685255,
"5,85 tỷ VNĐ",Đường Chiến Thắng phường Văn Quán, 50m2, 3, 3, 4, 4,"Bán nhà Gấp Bộ công an Phố Chiến Thắng - KĐT Văn Quán - Hà Đông* Gần Học viện An Ninh, Bưu chính, Kiến trúc, Mật mã... +Diện tích 50m2 x 4 tầng +Mặt tiền gần 3.5m+Đường rộng 3m , ô tô đỗ cửa +Cách Ô tô tránh 10m - Cách phố 90m+Sổ đỏ chính chủ 45m2+Giá bán 5.85 tỷ  (Giá đất 105tr/m2. Cả nhà 133tr/m2)  *Đặc điểm: Nhà mới đẹp ở ngay, Dân xây bền chắc; Khu Cán bộ Chiến Thắng Dân trí cao không tưởng, Các ban ngành trọng yếu của Quốc Gia. Cô bác liên hệ: 09654.02.653 - Đức Anh để được tư vấn nhiệt tình đầy đủ, sớm chọn được ngôi nhà ưng ý nhất(Nhà thông tin thực. Một số ảnh chỉ để cho đẹp và mang tính minh họa)",20/07/2022,Tin thường,batdongsan_so_com_vn_1673813435.5827022, 4
"5,4 tỷ VNĐ",Đường Lạc Long Quân phường Nghĩa Đô, 38m2, 3, 6, 5, 4,"
    
Bán nhà đẹp 38m2 5tầng 5.4 tỷ ôtô đỗ cửa phố Lạc Long Quân Cầu Giấy 

5TỶ GARA Ô TÔ ,KHÔNG CÓ CĂN THỨ 2- NGÕ OTO - SỔ HOA HẬU - NHIỀU TIỆN ÍCH

Nhà nằm trong khu vực dân trí cao, gần chợ ngõ thông tứ tung, oto 4 chỗ cất trong nhà.
Nhà KCBT chắc chắn thiết kê hiện đại, thông sàn khép kín, vài thùng sơn là đẹp như mới.

Tầng 1 để xe phòng khách, bếp
Tầng 2, 3, 4 mỗi tầng 1 phòng ngủ + wc
Tầng 5 phòng thờ sân phơi.

Sổ đỏ 34m2 vuông vắn nở hậu sẵn sàng giao dịch, giá đầu tư siêu rẻ...
Chú ý: 
1. LH: A. Hoàng Anh 0934266313 (xem nhà miễn phí)
2. Link kho nhà đẹp: https://www.facebook.com/356939308270722
3. Hỗ trợ tài chính cho vay mua nhà đến 70% giá trị căn nhà, lãi suất thấp nhất thị trường.
4. ACE Môi giới kết hợp làm việc tại: https://www.facebook.com/108917115160629",20/07/2022,Tin thường,batdongsan_so_com_vn_1673813437.073748, 5
3 tỷ VNĐ,Đường Tân Thụy phường Phúc Đồng, 32m2, 3, 2, 5, 3,"Cần bán nhanh căn nhà đẹp tại phố Tân Thụy, Phúc Đồng, Long Biên Diện tích 32m, 5 tầng mới, đẹp chắc chắn Tầng 1 : Phòng khách, bếp, vs Tầng 2,3,4 : Phòng ngủ rộng, vs Tầng 5 : Phòng thờ, kho, sân phơi Nhà thiết kế đẹp, hiện đại, phù hợp với gia đình đông người Công trình xây dựng chắc chắn, ép cọc bê tông Ngõ 2,5 m cực thoáng, cách 6m ra đến đường thông ô tô đi lại Cách 100m ra đến đường Nguyễn Văn Linh Vài trăm m ra Big C Long Biên, Siêu thị AEON MALL Giá bán : 3 tỷ ( có thương lượng ). Liên hệ : Sơn : 0936362633",20/07/2022,Tin thường,batdongsan_so_com_vn_1673813438.6605048, 4
"3,1 tỷ VNĐ",Đại La - Hà Nội, 60m2,,,,,"-Tòa nhà tọa lạc trên ngõ phố  Đại La , Hai Bà Trưng, phố khang trang sạch đẹp, trung tâm Quận, giao thương thuận tiện, gần nhiều Trường học : như Bách Khoa ,Xây Dựng , Kinh Tế Quốc Dân ,Đại Học Y,…….., chợ,các bệnh viện lớn như Bạch Mai , Thanh Nhàn ,…….. các cửa hàng tiện ích, TTTM. -Diện tích gần 60 m2, chia 3 tầng, khung bê tông chắc chắn, có thể thêm tầng thoải mái., giá 3.1 tỷ có thương lượng. - Nhà vuông vắn rất đẹp , bố chí rất hợp lý Phòng khách, Bếp, Phòng ngủ, WC,…. Không gian yên tĩnh, rất phù hợp cho một tổ ấm gia đình. - Sổ đỏ chính chủ, pháp lý rõ ràng. - Do có nhu cầu cần bán gấp nên nhiệt tình bán với khách hàng sẵn tài chính và thiện chí mua, giá có thể thương lượng.Chi tiết LH: em Nhật 0977.194.820  (Chuyên Nhà đất Thổ cư).Lưu ý:- Không kênh giá chủ nhà- Miễn phí toàn bộ dịch vụ: Dẫn khách xem nhà, tư vấn pháp lý ",20/07/2022,Tin thường,batdongsan_so_com_vn_1673813440.1680484,
"4,6 tỷ VNĐ",Đường Hồ Tùng Mậu phường Cầu Diễn, 50m2, 5, 20, 4, 4,"
    - Nhà ở vị trí tuyệt đẹp, Trung tâm quận Nam Từ Liêm, xung quanh tiện ích đầy đủ.- Thiết kế lệch tầng, mỗi tầng 02 phòng ngủ, vệ sinh, cầu thang ở giữa.- Sổ đỏ chính chủ, sẵn sàng giao dịchLiên hệ: Mr. Cốc
",20/07/2022,Tin thường,batdongsan_so_com_vn_1673813441.6220334, 4
8 tỷ VNĐ,Đường Tây Mỗ phường Tây Mỗ, 90m2, 5, 1, 5, 4,"
    Diện tích: 90m2; xây 5 tầng, mặt tiền 5m- Nhà 2 mặt tiền, an sinh đỉnh cao, kinh doanh tốtVị trí siêu đẹp, trước cửa rộng thênh thang, ô tô dừng đỗ. Đối diện là tòa chung cư. Vừa ở vừa kinh doanh tuyệt vời- Thiết kế 5 tầng:+ Tầng 1: Gara + Bếp+ Tầng 2,3,4: Mỗi tầng 1 phòng ngủ rộng khép kín + 1 phòng ngủ riêng biệt+ Tầng 5: Phòng thờ, sân phơi- Sổ đỏ trong két, sẵn sàng giao dịchGiá: 8 tỷ
",20/07/2022,Tin thường,batdongsan_so_com_vn_1673813442.858766, 4
"9,99 tỷ VNĐ",80 Chùa Láng - Đống Đa, 61m2, 4,, 4, 4,"BÁN NHÀ CHÙA LÁNG – NGUYỄN CHÍ THANH, PHÂN LÔ Ô TÔ, 61M2 – 9.99 TỶ-    Bán nhà phố Chùa Láng – Nguyễn Chí Thanh. Nhà 4 tầng 61m2 mặt tiền 4.1m, hai mặt thoáng nên các phòng đều có ánh sáng tự nhiên-    Khu vực trung tâm quận Đống Đa, nằm giữa khu vực các tuyến đường Nguyễn Chí Thanh, đường Láng, Chùa Láng. Xung quanh là các trường Luật, Ngoại Thương, Ngoại Giao … -    Phù hợp để ở hoặc làm văn phòng, căn hộ cho thuê lúc nào cũng kín khách-    Thiện chí liên hệ tôi – K.S Phương - 0918120568 – để xem nhà và đàm phán giá.",20/07/2022,Tin thường,batdongsan_so_com_vn_1673813444.3641887, 4
"22,23 tỷ VNĐ",Hà Nội, 95m2,,,,,"
     BÁN SIÊU CCMN HOÀNG QUỐC VIỆT 95M 8T THANG MÁY 22 TỶ x
+ CẦN BÁN SIÊU PHẨM CCMN 95M 8T 20P DT 160Tr/Th
+ Phòng khép kín Nội thất đầu đủ
+ Liền kề các Trường Đại Học Quốc gia, Sư phạm, Ngoại ngữ, Học viện Báo trí Tuyên truyền.
+ Giao thông đường Hoàng Quốv Việt, PHạm Văn Đồng, Xuân Thủy.. Lên phố về quê đều rất tiện.
+ Sổ đẹp, pháp lý sạch, sang tên nhanh gọn.
+ Thiện trí xem nhà Gọi Em Đức Đầu Đất 0898839292.
",20/07/2022,Tin thường,batdongsan_so_com_vn_1673813445.569965,
"5,63 tỷ VNĐ",Đường Ngọc Thụy phường Ngọc Thụy, 40m2, 4, 5, 4, 4,"Nhà trong ngõ thẳng tắp to rộng, ô tô tránh, vào nhà, gần trường quốc tế Việt Pháp, Mipec Ngọc Lâm, sang Bờ Hồ, Phố Cổ chưa đến 10 phút  - Nhà Dân xây thiết kế sang trọng hiện đại có bản vẽ, GPXD đầy đủ, phòng nào cũng có ban côngthoáng đãng.  Tầng 1: Phòng Khách, bếp ăn.  Tầng 2,3: Tổng 4 phòng ngủ. Tầng4: Phòng thờ, Sân tiểu cảnh   - Hãy gọi ngay hoặc thêm zalo: 0357613689 Em Quyết NP để xem nhà và tư vấn miễn phí
",20/07/2022,Tin thường,batdongsan_so_com_vn_1673813446.7996762, 4
"3,5 tỷ VNĐ",Quan Nhân, 32m2,,,,,"Bán nhà Phố Quan Nhân, LÔ GÓC, 32m2, ngõ thông, gần ô tô, kinh doanh bất chấp, nhỉnh 3 tỷ. Lh 0975124520. + Bán nhà riêng Phố Quan Nhân, Thanh Xuân, diện tích 32m2, 6 tầng, mặt tiền 5m2, ngõ thông, gần ô tô, kinh doanh bất chấp. + Chủ đang xây dựng nhà 6 tầng, thang máy, xây đến đâu bán giá trị đến đó. Lô góc 2 thoáng vĩnh viễn đẹp vô cùng, trước nhà rộng đỗ được nhiều xe. + Khu vực yên tĩnh, thoáng mát, an sinh tuyệt vời, dân trí cao.+ Bán kính 2 đến 3 phút là tới trường Cấp 1, Cấp 2 Nhân Hòa - Nhân Chính, Chợ Quan Nhân,Cự Lộc, Royall City, Ngã Tư Sở…+ Thông  ra các tuyến phố Giáp Nhất, Cự Lộc, Nguyễn Trãi, Chính Kinh, Nhân Hòa, Vũ Trọng Phụng,… + Sổ đỏ chính chủ, chủ nhà thiện chí, sẵn sàng giao dịch. + Liên hệ xem nhà: Phùng Trang  0975 124 520.",20/07/2022,Tin thường,batdongsan_so_com_vn_1673813448.7283251,
,Hồ Tùng Mậu, 33m2,,,,,"Bán nhà Hồ Tùng Mậu, Cầu Giấy 5T,MT4,5M rẻ nhất khu vực, LH: 0845681666.Chủ nhà cần bán gấp để mua nhà to hơn ở với con,nên cần bán gấp trong tháng sáu.Nhà ở vị trí đẹp khu vực Cầu Giấy, hiếm nhà bán Giao thông thuận tiện đi lại đường thông khắp nơi,Gần nhiêu trường Đại hoc lớn, trường cấp 1, 2, 3, Bệnh viện dân trí cao, khu vực đáng sống.Pháp lý chuẩn giao dịch ngay Giá nhỉnh 4 tỷLH: Trần Hảo 0845681666, đê được tư vấn xem nhà miễn phí 24/7.Luôn mang lại Giá Tri-Uy Tin-Niềm Tin tới khách hàng. ",20/07/2022,Tin thường,batdongsan_so_com_vn_1673813450.0638392,
"8,8 tỷ VNĐ","Giải Phóng, Hoàng Liệt, Hoàng Mai", 62m2,,,,,"BÁN NHÀ GIẢI PHÓNG - LÔ GÓC - THANG MÁY - KINH DOANH – NHỈNH 8 TỶ Vị trí đẹp gần phố ngõ thông tứ tung, kinh doanh tiện ích xung quanh không thiếu thứ gì, gần bến xe Giáp Bát, bến xe Nước Ngầm, Linh Đàm, Ngọc Hồi, Trương Định, Kim Đồng, giao thông thuận tiện. Thiết kế: Tầng 1: phòng bếp, vệ sinh, Ga Ra ô tô. + Tầng 2: phòng khách, vệ sinh,1 phòng ngủ rộng. + Tầng 3,4,5 : mỗi tầng 2 phòng ngủ rộng, vệ sinh khép kín. + Tầng 6 : phòng thờ và sân phơi rộng. + Sổ đỏ chính chủ vuông vắn, sẵn sàng giao dịch ngay. + Liên hệ: Em Phượng: 0362368485 để được tư vấn và xem nhà miễn phí.",20/07/2022,Tin thường,batdongsan_so_com_vn_1673813451.3503988,
