price,address,Diện tích,Mặt tiền,Số tầng,Số phòng ngủ,Details,Ngày đăng,Loại tin,id,Lộ giới,Số toilet
11 tỷ VNĐ,"Long Biên, Hà Nội", 91m2, 4, 5, 5,"+ Nhà xây cực VIP, siêu đẹp, ở được vài năm trông vẫn còn như mới, khách mua về vào ở luôn. + Vị trí mặt ngõ kinh doanh, làm văn phòng, ô tô tránh nhau. + Khu vực đang phát triển cực nhanh, đường xá mở ra ầm ầm, cách một nhà ra đường 40m, giá đất tăng trong tương lai. + Thiết kế: - Tầng 1 Garage để 2 ô tô, phòng ngủ, vệ sinh. - Tầng 2: Phòng khách đẳng cấp, vệ sinh, bếp. - Tầng 3 : 2 ngủ + 2 vệ sinh. - Tầng 4: 1 ngủ, 1 thờ, 2 vệ sinh. - Tầng 5: 1 ngủ, sân phơi. + Pháp lý chuẩn, sổ đỏ vuông đẹp như hoa hậu Thế giới., sẵn sàng giao dịch ngay. ",11/07/2022,Tin thường,batdongsan_so_com_vn_1673815141.9293196,,
"5,32 tỷ VNĐ",Nguyễn KHánh Toàn, 60m2,,,,"BÁN NHÀ NGUYỄN KHÁNH TOÀN 60M MẶT 5M NHỈNH 5 TỶVị trí đẹp, trung tâm cầu giấy.Đường thông thoáng, Gần các Trường Đại Học Thủ Đô, ĐH Quốc Gia, Sư Phạm, Học viện Báo Chí Tuyên Truyền.Nhà tự xây chắc chắn sẵn ở, Kinh doanh.Sổ đẹp, pháp lý rõ ràng, sạch sẽ, sẵn sang tên nhanh gọn.Thiện trí xem nhà liên hệ Em Đức 0898839292.",11/07/2022,Tin thường,batdongsan_so_com_vn_1673815143.6318095,,
"5,32 tỷ VNĐ",Nguyễn KHánh Toàn, 60m2,,,,"BÁN NHÀ NGUYỄN KHÁNH TOÀN 60M MẶT 5M NHỈNH 5 TỶ Vị trí đẹp, trung tâm cầu giấy. Đường thông thoáng, Gần các Trường Đại Học Thủ Đô, ĐH Quốc Gia, Sư Phạm, Học viện Báo Chí Tuyên Truyền. Nhà tự xây chắc chắn sẵn ở, Kinh doanh. Sổ đẹp, pháp lý rõ ràng, sạch sẽ, sẵn sang tên nhanh gọn. Thiện trí xem nhà liên hệ Em Đức 0898839292.",11/07/2022,Tin thường,batdongsan_so_com_vn_1673815144.7189066,,
"10,5 tỷ VNĐ",Đường Đặng Văn Ngữ phường Nam Đồng, 65m2, 6, 4, 4,"Mô Tả + Diện tích rộng, 65m2 4 tầng mặt tiền 6.5m kinh doanh, ô tô vào nhà, ô chờ thang máy phố: ĐẶNG VĂN NGỮ. + Thiết kế tinh tế, hưởng chọn ánh sáng tự nhiên, khu vực tiện ích nhiều, gần Hồ, trung tâm hành chính của Quận. +  Gần phố, vỉa hè rộng, phù hợp vừa ở, vừa làm văn phòng, kinh doanh đa dạng. + Chủ có tuổi bán chia tài sản cho các con, thiện chí bán giá (cóThương lượng cho khách thiện chí ). Pháp lý sạch, sổ đỏ vuông đẹp, sẵn sàng giao dịch.  LH: Mr Kiên chuyên đất thổ cư, nhà mặt phố, uy tín chất lượng. ",11/07/2022,Tin thường,batdongsan_so_com_vn_1673815146.1969519, 3, 5
,Đường Thụy Khuê, 58m2,, 4,,"Bán Nhà Thụy Khuê, ngõ thông Hồ Tây, DT 58m2, 4 Tầng, Giá 4.2 tỷ.+ Ngõ ba gác, thông ra Hồ Tây, nhà cực gần phố, trước nhà rất thông thoáng.+ Mấy phút là tới Lăng Bác, Phố Cổ, Công viên Thủ Lệ, Công viên nước Hồ Tây...+ Gần các tuyến phố sầm uất như Hoàng Hoa Thám, Lạc Long Quân, Thanh Niên, Hoàng Quốc Việt, Trích Sài+ Chủ tự xây, nhà còn như mới, chỉ việc xách vali về ở.+ Chợ dân sinh gần nhà vô cùng tiện.+ Tha hồ hưởng thụ không khí mát mẻ từ Hồ Tây.+ Sổ vuông đẹp nét căng, pháp lý rõ ràng sẵn sàng sang tên ngay. Liên hệ: A Thuật Thổ Cư 0877883366 tư vấn, hỗ trợ miễn phí tất cả các dịch vụ liên quan BĐS.",11/07/2022,Tin thường,batdongsan_so_com_vn_1673815147.5465045,,
"7,9 tỷ VNĐ",Đường Văn Cao phường Vĩnh Phúc, 40m2, 8, 3, 4,""",serif'nhà="""" nằm="""" trong="""" ngõ="""" 2="""" ô="""" tô="""" tránh="""" nhau,="""" mặt="""" thoáng,="""" không="""" bị="""" quy="""" hoạch,="""" rất="""" thuận="""" tiện,="""" gần="""" hồ="""" tây="""" span="""" p="""" class=""MsoNormalSPAN"" roman"",serif;="""" background:="""" white;="""" mso-highlight:="""" white'nhà="""" vị="""" trí="""" vô="""" cùng="""" trước="""" nhà="""" thông="""" tứ="""" tung="""" ra="""" hoàng="""" hoa="""" thám,="""" Đội="""" cấn,="""" văn="""" cao,="""" liễu="""" giai,="""" trích="""" sài="""" spanspan="""" roman"",serif'="""">. "",serif;="""" background:="""" white;="""" mso-highlight:="""" white'nhà="""" thiết="""" kế="""" 3="""" tầng:="""" span="""" p="""" class=""MsoNormalSPAN"" color:="""" #050505;="""" mso-fareast-font-family:="""" ""times="""" roman"";="""" mso-fareast-language:="""" vi'+="""" spanspantimes="""" mso-ansi-language:="""" vi;="""" vi'="""">Tầng 1: Kinh doanh, phòng khách, bếp, wc. cNhà nằm vị trí vô cùng thuận tiện, ngõ trước nhà thông tứ tung ra Hoàng Hoa Thám, Đội Cấn, Văn Cao, Liễu Giai, Trích Sài. "",serif;="""" background:="""" white;="""" mso-highlight:="""" white'hàng="""" xóm="""" rất="""" thân="""" thiện,="""" dân="""" trí="""" cao,="""" thuận="""" tiện="""" di="""" chuyển="""" (chậm="""" 1="""" phát="""" bay="""" ngay).="""" span="""" p="""" class=""MsoNormalSPAN"" white'sổ="""" đỏ="""" vuông="""" đẹp,="""" giao="""" dịch="""" phút="""" mốt.="""" line-height:="""" 107%;="""" white'="""">& Bạn quan tâm đến BĐS dòng tiền? Hãy nhấc máy lên ngay Alô anh Tú (Bạn do dự người khác đã chốt cọc).",11/07/2022,Tin thường,batdongsan_so_com_vn_1673815148.722357, 5, 3
6 tỷ VNĐ,văn quán, 50m2, 4, 4, 4,"Bán Nhà, Chiến Thắng, Hà Đông. Ô Tô Kinh Doanh 50m2 x 4 tầng. Mặt Tiền 4m Giá 6 Tỷ.  NHÀ MẶT NGÕ – NHÀ Ở SIÊU ĐỈNH – KHU PHÂN LÔ – NHÀ MỚI ĐẸP LONG LANH  + Nhà mặt ngõ Chiến Thắng cách đường Trần Phú vài chục mét, Ngả đi các hướng Ngã Tư Sở, , Bến Xe Yên Nghĩa lên Hoà Bình nhà gần tuyến xe buýt, ga tàu điện trên cao, giao thông rất thuận tiện cho việc di chuyển đi các tỉnh khác. + Nhà gần trường học các cấp 1,2,3, Trường Ban Mai. gầnTrung Tâm Thương Mại Roal Anl CiTy, chợ đầu mối, siêu thị Bigc Hà Đông, Siêu Thị Coopmax, gần Đại Học Mật Mã, Đại Học Kiến Trúc, Bưu Chính Viễn Thông, bệnh viện 103, cách Hồ Văn Quán chỉ vài trăm mét. an sinh đỉnh, an ninh an toàn,kinh doanh sinh lời siêu đỉnh rất nhiều dịch vụ tiện ích xung quanh. Sinh sống siêu thuận lợi.  + Nhà thiết kế 4 tầng:                                                                                                          - Tầng 1: Phòng khách, bếp, wc, cầu thang giữa. - Tầng 2,3: Mỗi tầng 2 phòng ngủ và wc - Tầng 4: Phòng thờ và sân phơi. + Nhà chủ tâm huyết thiết kế, chuẩn từng mi li mét.  Sổ đỏ chính chủ, sẵn sàng giao dịch.   LH: E KHÁNH: 0984568179 ",11/07/2022,Tin thường,batdongsan_so_com_vn_1673815149.98498,, 3
"2,2 tỷ VNĐ",Đường Tôn Đức Thắng phường văn Chuong, 30m2,,,,"Bán Gấp Nhà VĂN CHƯƠNG, TÔN ĐỨC THẮNG, 4 tầng, chỉ 2.2 tỷ, S rộng, Xầm uất, có BANK  + Tầng 1: Phòng khách, bếp, wc. ",11/07/2022,Tin thường,batdongsan_so_com_vn_1673815151.3613086, 1,
"14,5 tỷ VNĐ",Phố Chùa Láng, 55m2,, 5, 4,"Chủ gửi bán căn nhà 5 tầng mặt phố tiện kinh doanh hoặc làm văn phòng. Hiện tại chủ đang kinh doanh thời trang tại nhà. Nhà nằm tại khu vực Phố Chùa Láng, Láng Thượng, Đống Đa - khu vực thuận tiện giao thông, nhiều tiện ích... - Thiết kế & Diện tích: Nhà 55m2, mặt tiền 4m, 5 tầng. - Nhà 2 mặt tiền, ngõ trước nhà xem ô tô tránh. Ngõ sau xe ba gác đỗ cửa - Tầng 1 làm Gara, kinh doanh hoặc tùy chủ mới về sử dụng - Tầng 2 phòng khách, wc - Tầng 3, 4 mỗi tầng 2 phòng ngủ, wc - Tầng 5 phòng thờ và sân phơi -  Nhà phù hợp an sinh, kết hợp kinh doanh, giữ tiền... Sổ đỏ đẹp, sẵn sàng giao dịch. Liên hệ Mr Chính 079 212 2918 xem + đặt cọc + mua  nhà ",11/07/2022,Tin thường,batdongsan_so_com_vn_1673815152.8777146,, 5
,Đường Cao Lỗ phường Đông Anh, 87m2,,,,"- Chính chủ gửi bán lô đất đấu giá X4 Tại Hậu Oai - Cao Lỗ - Đông Anh - HN. - Diện tích: 87m2. - Lô Góc 2 Mặt tiền đường rộng 8m khu kinh doanh sầm uất. - Cách 100m ra khu BỘ  ĐỘI TÊN LỬA  - Cách khu hành chính huyện 500m  - Cách bệnh viện - chợ Tó 300m  - Phù hợp đầu tư tích trữ , xây dựng đinh cư lâu dài, kinh doanh buôn bán sinh lời. - Gía: Thương lượng -A/c quan tâm liên hệ : 0978358719",11/07/2022,Tin thường,batdongsan_so_com_vn_1673815154.1592858,,
"4,5 tỷ VNĐ","Khương Đình, Thanh Xuân, Hà Nội.", 37m2, 3, 5, 4," * CC cần bán nhà trong ngõ, gần ô tô đỗ đường Khương Đình quận Thanh Xuân, khu dân trí, nhà tự xây chắc, thiết kế đẹp, có 4 phòng ngủ, đầy đủ công năng, về ở ngay, an sinh đỉnh. DT 37m, 5T, mt 3.5m, giá chỉ 4.5 tỷ. + Vị trí: yên tĩnh, thông thoáng, hạ tầng ổn định, an ninh tốt, về ở ngay, gần đường ô tô, gần Chung cư Five Star, gần trường C1,2... tiện ích đủ đầy, giao thông thuận tiện.  + Sổ đỏ đẹp chính chủ, sẵn sàng giao dịch.  # nhanh tay LH: 0906113879 Tình nhà phố ( chuyên bán, nhận ký gửi nhà đất Thổ cư, có uy tín trong giới nhà đất quận Hà Đông – Hà Nội ).",11/07/2022,Tin thường,batdongsan_so_com_vn_1673815155.5575533, 2,
"6,3 tỷ VNĐ","Khương Hạ , Thanh Xuân , Hà Nội", 45m2, 4, 5, 6,"_ Căn nhà nằm ở vị trí đẹp trên con phố Khương Hạ , rất gần phố chính , ngõ trước nhà rộng thoáng_ Diện tích 45m2 x5T , với thiết kế công năng đủ cho 1 gia đình 4 thế hệ , nhà chủ tự xây tâm huyết nên còn rất đẹp , chủ mới chỉ việc xách vali vào ở ngay _ Tiện ích xung quanh đầy đủ , gần chợ dân sinh , trường TH , THCS Nguyễn Trãi ..._ Sổ đỏ chính chủ , sẵn sàng giao dịch _ Giá bán 6,3 tỷ (140tr/m2)*** LH Mr Hiếu 0352620286 0932596286 ",11/07/2022,Tin thường,batdongsan_so_com_vn_1673815157.0435758, 3, 4
11 tỷ VNĐ,Quận Bắc Từ Liêm, 72m2,,,,"Cực Hiếm. Bán Đất tặng nhà Tân Xuân. DT 72m2, C4 MT 7,2m. Giá 11tỷ. LH 0962745289+ Vị trí đắc địa trung tâm Quận Bắc Từ Liêm. mặt phố to đùng cực hiếm.Tiện ích miễn bàn.+ Vị trí mặt phố, vỉa hè, kinh doanh bất chấp, giao thông thuận tiện, gần chợ, trường học các cấp, khu Ngoại Giao Đoàn, Phạm Văn Đồng, Hồ Tây, 5p ra công viên Hòa Bình, Mê Trô Thăng Long. Tiện ích ngập tràn+ Xây tòa nhà kinh doanh, văn phòng cho thuê dòng tiền khủng..+ Sổ đỏ chính chủ vuông vắn sẵn sàng giao dịch.+ Giá:Thỏa thuận.Liên hệ: Anh Đoàn - 0962745289.+ Chuyên nhà đất – Đất thổ cư Hà Nội.+ Nhiệt tình vui vẻ, dẫn khách xem nhà miễn phí. Tư vấn  pháp lý, thủ tục sang tên nhanh gọn. + Tư vấn 24/7.",11/07/2022,Tin thường,batdongsan_so_com_vn_1673815158.4557984,,
12 tỷ VNĐ,"Xuân La, Tây Hồ, Hà Nội", 60m2,,,,"RẺ NHẤT Tây Hồ-Đất đầu tư 60m2-Xuân La-chỉ 12 tỷ + Vị trí:  Đất tại Xuân La, Trung Tâm Tây Hồ, đi vài bước chân ra hồ Tây lộng gió, ngõ thông vỉa hè ô tô tránh, ngõ phân lô bàn cờ, hướng Đông Nam mát mẻ + Diện tích: 60m2, mặt tiền ~4m + Giá:12 tỷ (thương lượng) => Liên hệ chính chủ 0868266138 (Zalo Lê Thắm)  ",11/07/2022,Tin thường,batdongsan_so_com_vn_1673815159.8052294,,
,Bán nhà Lê Thanh Nghị - Trần Đại Nghĩa 110m 6T SĐCC 360tr/m, 110m2,,,,"Bán nhà Lê Thanh Nghị - Trần Đại Nghĩa 110m 6T SĐCC 360tr/m 110m 6T SĐCC 360tr/m giá mềm đối với khách hàng thiện chí mua và có khả năng thanh khoản tốtNhà nằm ở vị trí đắc địa, sát các trường đại học lớn như ĐH Thương Mại, ĐH Bách Khoa, ĐH Xây Dựng.Lô góc thoáng sáng, MT 6.6m.Hiện tại đang cho thuê mặt bằng kinh doanh, giá thuê 150tr/thángPhố nổi tiếng về các thương hiệu máy tính, nổi tiếng xưa và naySổ đỏ, pháp lí sạch, xem nhà và đàm phán chính chủ không qua trung gian. Liên hệ: Kim Hạnh 0946553655",11/07/2022,Tin thường,batdongsan_so_com_vn_1673815161.219446,,
"2,7 tỷ VNĐ","Ngọc Thụy, Long Biên, Hà Nội", 31m2,,,,"+ Long Biên1. 31m2- 2Tầng-MT 6.4- Giá 2.7Vị trí hàng xóm Mipec, gần cầu Long Biên. + Mặt tiền rộng thoáng. Ngõ thông từ hồ ra ngõ sau, đi được cả hai ngõ, gần Hồ Tai Trâu. +Gần trung tâm thành phố, rất nhiều tiện ích Nhà 2 tầng 2 ngủ chắc chắn.. +Sổ đỏ chính chủ sẵn sàng giao dich",11/07/2022,Tin thường,batdongsan_so_com_vn_1673815162.3760345,,
"5,2 tỷ VNĐ",Đường Văn Quán phường Văn Quán, 48m2, 3, 4, 4,"Nhà phân lô, 2 mặt ngõ ô tô. Tầng 1: Phòng khách, bếp, wc. Giấy tờ sổ đỏ chính chủ, pháp lý sạch sẽ. ",11/07/2022,Tin thường,batdongsan_so_com_vn_1673815164.6228178, 4, 3
"8,3 tỷ VNĐ","Văn Quán, Hà Đông, Hà Nội", 60m2, 4, 5, 4," * Bán nhà Văn Quán quận Hà Đông. nhà 2 mặt thoáng, xây chắc, thiết kế hiện đại, nội thất víp, công năng hoàn hảo, ô tô đỗ cửa, ở sướng, kinh doanh đỉnh. DT 60m, 5T, mt 4m, giá chỉ xíu 8 tỷ. + Vị Trí: đông đúc, thuận tiện, trước nhà ô tô dừng đỗ, phù hợp ở, kinh doanh: văn phòng, nal tóc, Spa, tạp hóa, hàng ăn...1 vài phút di chuyển ra đường Trần Phú, Nguyễn Khuyễn, 19/5, Phùng Hưng, vô cùng thuận lợi. + Sổ đỏ phân lô, pháp lý chuẩn, sẵn sàng giao dịch. * Nhanh tay LH: 0983858722 Tình nhà phố ( chuyên bán, nhận ký gửi nhà đất Thổ cư, có uy tín trong giới nhà đất quận Hà Đông – Hà Nội ).",11/07/2022,Tin thường,batdongsan_so_com_vn_1673815168.941307, 7,
"4,38 tỷ VNĐ",Đường Doãn Kế Thiện phường Mai Dịch, 30m2, 3, 5, 4,,11/07/2022,Tin thường,batdongsan_so_com_vn_1673815170.2363868, 3, 4
127 triệu VNĐ/m2,Phường Xuân Đỉnh, 40m2,,,,"Cực Hiếm. Bán nhà Xuân Đỉnh. DT: 40m2, 5 tầng, MT 4m. Giá 5.1 tỷ. LH 0962745289+ Vị trí đắc địa trung tâm Quận Bắc Từ Liêm.2 mặt ngõ trước sau thoáng sáng.Tiện ích miễn bàn.+ Vị trí mặt tiền đường, kinh doanh, gần ô tô,giao thông thuận tiện, gần chợ, trường học các cấp, khu Ngoại Giao Đoàn, 5p ra công viên Hòa Bình, tiện ích ngập tràn.+  Nhà thiết kế T1 Phòng khách+ bếp+ wc+ T 2,3,4 mỗi tầng 2 phòng ngủ+ wc + T5 Phòng thờ + sân phơi+ Sổ đỏ chính chủ vuông vắn sẵn sàng giao dịch.+ Giá:Thỏa thuận.Liên hệ: Anh Đoàn - 0962745289.+ Chuyên nhà đất – Đất thổ cư Hà Nội.+ Nhiệt tình vui vẻ, dẫn khách xem nhà miễn phí. Tư vấn  pháp lý, thủ tục sang tên nhanh gọn. + Tư vấn 24/7.",11/07/2022,Tin thường,batdongsan_so_com_vn_1673815171.4192219,,
