price,address,Diện tích,Số tầng,Số phòng ngủ,Details,Ngày đăng,Loại tin,id,Mặt tiền,Lộ giới,Số toilet,Hướng
"1,75 tỷ VNĐ","đường Độc Lập, Phường Cự Khối, quận Long Biên, Hà Nội", 40m2, 3, 2,"Bán Ngay Nhà Cự Khối, Long Biên 40m2, 3T chỉ 1,85 tỷ (ngõ thông, ô tô đỗ cửa)  Tầng 1 thiết kế Phòng khách, bếp, wc. Tầng 2 : Phòng ngủ, wc. Tầng 3 phòng ngủ, sân phơi..  + Nhà xây dựng chắc chắn, bố trí công năng sử dụng hợp lý, nhà thuộc ngõ Độc Lập của Phường Cự Khối, xung quanh gần chợ, trường học và các tổ hợp dịch vụ, xung quanh không xa kết nối các tuyến như UBND Phường Cự Khối, Bát Khối, Cầu Thanh Trì… + Lh gọi ngay Mr Tùng : 0965 722 358",11/12/2022,Tin thường,batdongsan_so_com_vn_1673783812.9300115,,,,
5 tỷ VNĐ,"Đường Bắc Cầu, Long Biên, Long Biên", 130m2, 3, 5,"Bán biệt thự ven sông Hồng, dt 130m, Mt 12m, giá hơn 5 tỷ. + Nhà 2 mặt phố, thuận thiện đi lại. + Đại sứ quán thuê cho Sếp. + View sông nguồn tiền ổn định. + Biệt thự 5 ngủ, 3 nhà wc. + Sổ đỏ đẹp, giao dịch ngay. + Liên hệ ngay không mất cơ hội sống cạng Thành Phố Ven Sông HÀN. LH:Giang Bất động sản: Chuyên thổ cư , Đất nền, Chung cư, Tư vấn phong thủy, Hỗ trợ ngân hàng. Hỗ trợ thiết kế nhà.  Tuyển dụng đào tạo Bất Động Sản chuyên nghiệp. Nhận mua bán, ký gửi nhà.2280/11360/126 #Ngocthuy #Nguyenvancu Telegram, Zalo: 0934035888 https://t.me/batdongsantc ",11/12/2022,Tin thường,batdongsan_so_com_vn_1673783814.2255828, 11, 10, 3,
35 tỷ VNĐ,"Đường Lâm Hạ, Bồ Đề, Long Biên", 120m2, 7, 6,"+ Toạ lạc vị trí đẹp nhất quận Long Biên, toàn biệt thự, văn phòng, nhà cao tầng. Tương lai cực giá trị, xung quanh nhà hàng, cửa hiệu vô vàn ... + Hàng xóm quan chức cấp cao, vỉa hè hai bên, ô tô dừng đỗ ngày đêm ... Kinh doanh, Văn Phòng đẹp miễn chê.+ Tổng diện tích 120m2, xây 7 tầng, an sinh đỉnh cao.+ Sổ đỏ phân lô, pháp lý chuẩn, giao dịch ngay.+ Giá bán: 35 tỷ.Liên hệ: Hoàng Duy (Duy Nhà Đẹp) – 0945950386 (miễn trung gian).",11/12/2022,Tin thường,batdongsan_so_com_vn_1673783815.2827172, 6, 9, 6,
6 tỷ VNĐ,"nam dư , linh nam , hoàng mai", 60m2, 1, 2,"Bán nhà   mặt phố Nam Dư , trần phú ,hoàng mai   DT  60m2 , nhà Lô Góc có 2 mặt tiền 5m và 12m hiện đang cho thuê ,nhà nằm vị trí giao thông thuận tiện  học  cách cầu thanh trì 500m , cách chợ 300m gần trường tiểu học , cấp 2 và cấp 3 hoàng mai  . vị trí nhà hai mặt phố đều kinh doanh rất tốt .  nhà rất phù hợp cho các bác đầu tư xây tòa văn phòng , khách sạn   , sổ đỏ chính chủ Giá :  6 tỷ  ( có thương lượng )",11/12/2022,Tin thường,batdongsan_so_com_vn_1673783816.1823103, 5, 35, 1, Tây nam
3 tỷ VNĐ,"Đường Ngô Gia Tự, Đức Giang, Long Biên", 31m2, 5, 3,"Bán nhà Ngô Gia Tự, Dt 31m, nhà 5 Tầng, Giá hơn 3 tỷ.+ Ngõ Ngô Gia Tự ngõ 2 ô tô tránh, ô tô 7 chỗ qua nhà.+ Đường trải nhựa đẹp, sạch sẽ, thoáng đãng.+ Khu vực dân trí cao, an ninh tốt, hàng xóm cực kì thân thiện.+ Chủ đầu tư có tiếng xây cẩn thận, bảo hành 2 năm.+ Thiết kế thông sàn, tổng 3 phòng khép kín, phòng thờ sân phơi tầng 5. LH:Giang Bất động sản: Chuyên thổ cư , Đất nền, Chung cư, Tư vấn phong thủy, Hỗ trợ ngân hàng. Hỗ trợ thiết kế nhà.  Tuyển dụng đào tạo Bất Động Sản chuyên nghiệp. Nhận mua bán, ký gửi nhà.2285/1148/1295 #Ngogiatu #Nguyenvancu Telegram, Zalo: 0934035888 ",11/12/2022,Tin thường,batdongsan_so_com_vn_1673783817.3412097, 4, 3, 4,
"4,5 tỷ VNĐ","Đường Quốc lộ 32, Kim Chung, Hoài Đức", 42m2, 3, 4,"
    Cực Hiếm,  Bán Nhà riêng Lai xá, Kim Chung, Hoài Đức, Ô tô, Kinh doanh, 45m 4 tầng chỉ 4,x tỷ
+ Giá người nhà, có TL ( x mầm non)
- Vị trí cực đỉnh, Kinh doanh, Cho thuê. Đang phát triển từng ngày.
- Đầu tư sinh lời, Nhà hàng, Khách sạn, Nhà nghỉ.
-Giao thông thuận tiện, Đường Quốc lộ 32, Đường TL 422, Đường vành đai 3.5, Bến xe Phùng, Bến xe Mỹ Đình,
- Tiện ích Xung quanh Trường học cấp 1,2,3, Đại Học Thành Đô, Đại Học Công Nghiệp HN, chợ, Y tế,
- Sổ Hoa Hậu CC, Sang tên nhanh gọn.
- Giá thương lượng. Thiện chí
Xem nhà gọi Mr Đức Nhà Đẹp 0898839292. Rất nhiều Nhà Đẹp phù hợp mọi nhu cầu Anh Chị Em nhé.
",11/12/2022,Tin thường,batdongsan_so_com_vn_1673783818.3146057, 5, 3, 2,
5 tỷ VNĐ,"Đường Giang Văn Minh, Kim Mã, Ba Đình", 60m2, 5, 4,"Chủ nhà đi nước ngoài bán gấp nhà Giang Văn Minh 60m, 5T, nhà đẹp ở luôn , giá 5 tỷ+ Nhà chủ xây rất tâm huyết còn mới, mỗi tầng 2 ngủ khép kín, thoáng, nội thất xịn.+ Nhà nằm mặt ngõ to rộng , khu vực sầm uất có thể kinh doanh, hàng xóm cán bộ, dân trí cao.+ Khu vực hiếm nhà bán, pháp lý đầy đủ ( giá thương lượng )LH : TRUNG 0896695659 ( Tư vấn hỗ trợ 24/7 ).",11/12/2022,Tin thường,batdongsan_so_com_vn_1673783819.2820175, 6, 4, 5,
"4,5 tỷ VNĐ","Đường Vạn Bảo, Kim Mã, Ba Đình", 56m2, 5, 4,"Chính chủ bán gấp nhà Vạn Bảo, Ba Đình, 56m x 5T, nhà đẹp ở luôn , giá 4.5 tỷ.+ Nhà chủ xây tâm huyết, đẹp, hiện đại, nội thất xịn, 3 ngủ khép kín, thoáng tự nhiên. + Nhà khu vực phố VIP ít nhà bán, ba bước ra phố, trường học , bệnh viện , chợ, TTTM quanh nhà. + Pháp lý đầy đủ sẵn sàng giao dịch.LH : TRUNG 0896695659 ( Tư vấn hỗ trợ 24/7 )",11/12/2022,Tin thường,batdongsan_so_com_vn_1673783820.5587256, 5, 4, 5,
"1,55 tỷ VNĐ","Đường Đại lộ Thăng Long, Vân Côn, Hoài Đức", 52m2, 3, 4,"
    CỰC HIẾM CÓ 1 0 2 Bán Nhà Quyết Tiến, Vân Côn, Hoài Đức 52m chỉ 1,x tỷ
+ Giá người nhà ( x mầm non)
- Vị trí đẹp, rộng thoáng, yên tĩnh.
- Gần các Trường Đại Học Đại Nam, Học viện Chính sách, .Khu vực phát triển nhiều Công ty, Doanh nghiệp..
- Sổ CC, pháp lý rõ ràng, sang tên nhanh gọn. Giá thương lượng
- Thông tin chi tiết liên hệ Mr Đức Nhà Đẹp. Rất nhiều Nhà Đất đẹp phù hợp mọi nhu cầu Anh Chị Em.
",11/12/2022,Tin thường,batdongsan_so_com_vn_1673783821.5909264, 5, 3, 2,
"3,83 tỷ VNĐ",La Khê- Hà Đông, 40m2, 4,,"Gia đình cần bán nhà trước Tết tại La Khê, Hà Đông 40mx4 tầng ô tô hơn 3 tỷ Nhà đẹp ở ngay đón Tết sum vầy tại La Khê, Hà Đông với 4 tầng hiện đại đầy đủ công năng sử dụng tổng 4 ngủ, nội thất Châu Âu hiện đại 40m ngõ ô tô thông cách phố rất gần. Nhà cạnh chợ Bông Đỏ rất thuận tiện ra ga La Khê, bến xe bus trường học các cấp. Giao thông thuận lợi giáp Ngô Thì Nhậm ra Quang Trung đối diện Ngô Quyền hàng xóm Văn Phú sang Lê Trọng Tấn. Sổ vuông sẵn sàng giao dịch. Giá: 3.83 tỷ ( gia lộc). Liên hệ : Huyền ( 0363703491- 0965472910) – Gặp trực tiếp chính chủ.",11/12/2022,Tin thường,batdongsan_so_com_vn_1673783822.8555412,,,,
"3,84 tỷ VNĐ",Ngô Quyền - Hà Đông, 40m2, 4,,"Nhà đẹp Ngô Quyền, Hà Đông 40mx4 tầng ô tô thông gần phố hơn 3 tỷ Căn nhà đẹp nhất Hà Đông tại Ngô Quyền phân khúc hơn 3 tỷ ở ngay, nội thất hiện đại 40m với 4 tầng thoáng sáng tổng 4 ngủ ở ngay. Vị trí đắc địa khu vực trung tâm hàng xóm toàn cán bộ ở tĩnh. Giao thông tiếp giáp Vạn Phúc gần Ngô Thì Nhậm ra Lê Trọng Tấn sang Tố Hữu thông Dương Nội. Gần bến xe, tàu điện. Chủ nhà chuyển nơi khác sống cùng gia đình cần bán nhanh trước Tết. Sổ vuông sẵn sàng giao dịch. Giá: 3.84 tỷ ( gia lộc). Liên hệ : Huyền ( 0363703491- 0965472910) – Gặp trực tiếp chính chủ.",11/12/2022,Tin thường,batdongsan_so_com_vn_1673783824.058326,,,,
"6,2 tỷ VNĐ",Kiến Hưng - Hà Đông, 60m2, 4,,"Bán nhà liền kề Kiến Hưng, Hà Đông 60mx4 tầng kinh doanh vỉa hè hơn 6 tỷ Nhà đẹp đầu tư sinh lời ngay liền kề Kiến Hưng, Hà Đông 4 tầng thoáng sáng trước sau diện tích lớn 6m vỉa hè kinh doanh văn phòng, giá tốt nhất khu vực. Nhà có đầy đủ tiện ích xung quanh gần trường học, sân bóng, ngân hàng, siêu thị, bến xe, bệnh viện không thiếu. Môi trường trong lành, dân cư tấp nập ngày đêm. Chủ nhà cần bán gấp chia tài sản cho các con, rất thiện chí bán nhanh trước Tết. Sổ vuông sẵn sàng giao dịch. Giá: 6.2 tỷ ( gia lộc). Liên hệ : Huyền ( 0363703491- 0965472910) – Gặp trực tiếp chính chủ.",11/12/2022,Tin thường,batdongsan_so_com_vn_1673783825.0716534,,,,
"6,25 tỷ VNĐ",Kiến Hưng - Hà Đông, 60m2,,,"Đấu giá Kiến Hưng, Hà Đông 60m, mặt tiền 5m vỉa hè kinh doanh hơn 6 tỷ Gia đình chuyển đi nơi khác sống cần bán gấp nhà Khu đấu giá Kiến Hưng, Hà Đông vị thể đẹp sống rất sướng có thể kết hợp kinh doanh văn phòng, diện tích 60m , mặt tiền rộng 5m đường ô tô thông vỉa hè rộng giá đầu tư. Nằm gần chợ, sân bóng, chung cư Mipec, ngân hàng, siêu thị, bệnh viện đầy đủ tiện ích của Khu đô thị. Giáp Văn Phú gần Phú Lương hàng xóm Thanhh Trì ra Đa Sỹ lên Xa La. Sổ vuông sẵn sàng giao dịch. Giá: 6.25 tỷ ( gia lộc). Liên hệ : Huyền ( 0363703491- 0965472910) – Gặp trực tiếp chính chủ. ",11/12/2022,Tin thường,batdongsan_so_com_vn_1673783826.2036238, 5,,,
"9,5 tỷ VNĐ","Đường Trần Khát Chân, Đống Mác, Hai Bà Trưng", 48m2, 5, 5,"Mô tả: + Siêu hiếm! Vị trí đắc địa gần thông ngã tư Trần Khát Chân - Lò Đúc - Kim Ngưu, giao thông thuận tiện, nhà mặt ngõ 2 xe oto tránh nhau thoải mái, Tiện kinh doanh. Làm văn phòng ...cực đỉnh + Nhà TT Quận Hai Bà gần phố cổ - Tiện ích thì vô vàn ( TTTM, Bệnh Viện, Nhiều trường ĐH, Công viên…. )  + Nhà thiết kế mang phong các hiện ( Châu Âu ) 5 tầng thang máy Zịn nhập khẩu, phòng nào cũng thoáng sáng quanh năm, nội thất nhập khẩu, công năng 5.0. + Pháp lý chuẩn, sổ đỏ đẹp (có thương lượng). + LH em Chiến: Chuyên - Đất/Nhà thổ cư - Xem/Mua miễn phí 24/7.",11/12/2022,Tin thường,batdongsan_so_com_vn_1673783827.1999588, 4, 20, 5,
8 tỷ VNĐ,"Đường Trần Đại Nghĩa, Đồng Tâm, Hai Bà Trưng", 72m2,,," Bán nhà trên phố Trần Đại Nghĩa, HBT, HN
 72m2 , MT 4m, ngõ thông, Ô tô qua.
 30m ra đường Trần Đại Nghĩa, lõi Hai Bà Trưng.
 Xây CCMN , toà nhà dịch vụ rất phù hợp.
 Rất HIẾM nhà bán, còn sót lại duy nhất.
 Kênh giữ tiền AN TOÀN, HIỆU SUẤT CAO, TRƯỜNG TỒN.

 TẤC ĐẤT, TẤC VÀNG",11/12/2022,Tin thường,batdongsan_so_com_vn_1673783828.3199642,, 4,,
"6,5 tỷ VNĐ","Đường Đào Tấn, Đội Cấn, Ba Đình", 45m2, 5, 4,"BÁN NHÀ NGUYỄN TRÍ THANH 45M 5 TẦNG Mat 5.7M 6.5 TỶ CỰC PHẨM ĐỐNG ĐA - LÔ GÓC - KINH DOANH ĐẸP - Ô TÔ ĐỖ CỬA - HÀNG HOT ĐỐNg ĐA - Nhà Đẹp, Ngõ rộng thoáng, thông tứ tung, Ô Tô Tránh nhau- Vị trí cực đỉnh, lõi Đống Đa, tiện ích bạt ngàn, ngay sau chợ Láng Hạ A,B. - Giá tốt,  nội thất đẹp, cầu thang cực rộng. Công năng đỉnh.- Nhà 5 tầng, khung cột chắc chắn, 3 mặt thoáng, sáng Sổ đỏ chính, sẵn giao dịch ngay",11/12/2022,Tin thường,batdongsan_so_com_vn_1673783829.2734199, 9, 3, 5,
,Trầm Lôngj, 80m2,,,"Tiện ích đầy đủ: trạm y tế Trầm Lộng, trường mẫu giáo, trường trung học, khu du lịch sinh thái, nhà văn hóa, cửa hàng tạp hóa trong bán kính 200m️ Gần trung tâm huyện Ứng Hoà️ Diện tích: 60 - 80m2 toàn bộ là đất ở lâu năm.️ Trục chính đường liên xã - Cách đường tỉnh lộ 426 chỉ 100m️ Mặt tiền 4 - 5,5m. Đường trước mặt rộng 4 - 6m️️ Làng nghề chẻ tăm hương, giày dép da, dệt may, sơn mài, tre đan, giang đan, guột tế, rèn, khảm trai…di tích cấp quốc gia và thành phố.️ Đất chính chủ - Giá bán F0 công khai niêm yết ( không qua trung gian)",11/12/2022,Tin thường,batdongsan_so_com_vn_1673783830.3156438,,,,
"19,5 tỷ VNĐ",phường mai dịch, 62m2,,,"NHÀ ĐẸP PHÂN LÔ DƯƠNG KHUÊ VỈA HÈ Ô TÔ TRÁNH KINH DOANH Ở SƯỚNG 0962745289+ DT. 62M2*5 TẦNG – MẶT TIỀN 5M. GIÁ 19.5 TỶ CẦU GIẤY. TIỆN ÍCH MIỄN BÀN.+ Vị trí cực đẹp khu phân lô ô tô tránh đỗ ngày đêm. Kinh doanh sầm uất trung tâm Quận Cầu Giấy.+ Giao thông đồng bộ, kết nối Hồ Tùng Mậu, Lê Đức Thọ, Hàm Nghi, Nguyễn Hoàng, Phạm Hùng...+ Sổ đỏ phân lô A4 cất két sẵn sàng giao dịch.+ Giá thương lượng.+ Liên hệ: Anh Đoàn - 0962745289.+ Chuyên nhà đất – Đất thổ cư Hà Nội.+ Nhiệt tình vui vẻ, dẫn khách xem nhà miễn phí. Tư vấn  pháp lý, sang tên thủ tục nhanh gọn.+ Tư vấn 24/7. ",11/12/2022,Tin thường,batdongsan_so_com_vn_1673783831.3478813,,,,
"6,3 tỷ VNĐ","Đường Thành Công, Quang Trung, Hà Đông", 40m2, 5, 4,"
    
+ Nhà đẹp giáp khu đô thị Ngô Thì Nhậm , Đồng Dưa.
+Vị trí đắc địa trung tâm phù hợp vừa ở vừa làm văn phòng.
+ Nhà gần trường học các cấp MN Ngô Thì Nhậm, tiểu học Đoàn Kết, Trần Đăng Ninh...
+Gần chợ Bông Đỏ, Chợ Vồ, gần Trung tâm TM Metro.
+ Giao thông thuận lợi vì được kết nối với phố Nguyễn Viết Xuân, Phan Đình Giót, Ngô Thì Nhậm dân cư đông đúc tấp nập khu đô thị văn minh đẳng cấp.
+ Nhà xây 4 tầng BTCT chịu lực, kiến trúc hiện đại, phòng ngủ có ánh sáng tự nhiên, rất thoáng. Pháp lý:
 Sổ đẹp chuẩn không một lỗi phong thủy giao dich ngay.
Liên hệ: Tôi Công Nhà TO 0931706698 để xem nhà MIỄN PHÍ.
",11/12/2022,Tin thường,batdongsan_so_com_vn_1673783832.7143075, 4, 3, 5,
"3,4 tỷ VNĐ","Đường Lê Trọng Tấn, La Khê, Hà Đông", 35m2, 5, 4,"+ Nhà gần ParkCity Hà Nội, và Giếng Sen, Bờ Hội, Ngô Đình Mẫn La Khê.


 
+Vài bước chân ra hồ La Khê, bể bơi, nhà văn hoá La Khê ở cực mát. Xung quanh khu phân lô đã đồng bộ hạ tầng, tiện ích Khu đô thị.

+ Nhà siêu đẹp, ô tô qua nhà, có bãi để ô tô đỗ ngày đêm cách 30m, ngõ trước mặt rộng thoáng, nông, chỉ vài bước chân ra mặt phố.
 + Chủ nhà xây cực kỳ tâm huyết bê tông cốt thép ép cọc.  + Nhà 5 tầng đẹp lung linh, thiết kế hiện đại, khách mua về chỉ xách đồ về ở +SĐCC, giao dịch ngay. Liên hệ: Tôi Công Nhà Đẹp 0931706698 để xem nhà MIỄN PHÍ.",11/12/2022,Tin thường,batdongsan_so_com_vn_1673783833.7834086, 3, 3, 5,
