price,address,Diện tích,Details,Ngày đăng,Loại tin,id,Mặt tiền,Lộ giới,Số tầng,Số phòng ngủ,Số toilet,Hướng
"3,1 tỷ VNĐ","HOÀNG NHƯ TIẾP, LONG BIÊN", 27m2,"- Chủ nhà chuyển sang nơi ở rộng hơn nên cần bán nhà tại phố Hoàng Như Tiếp. - Nhà phân lô có vị trí cực đẹp, cách 1 nhà ra phố, ô tô đỗ ngoài ngõ, thích hợp mua về để ở hoặc cho thuê. - Nhà xung quanh tiện ích vô vàn, gần chợ, gần nhiều trường học,TTTM Mipec Long Biên, bệnh viện Tâm Anh cách nhà 500m, gần bên xe Gia Lâm - Nhà cách trục đường chính Nguyễn Văn Cừ 200m, giao thương với thủ đô, giao nhiều tuyến phố như Nguyễn Sơn, Hồng Tiến. . - Tầng 1: phòng khách, bếp, wc. - Tầng 2: 1 phòng ngủ, wc. - Tầng 3: 1 phòng ngủ, thờ, sân phơi, wc. - Sổ đỏ chính chủ, sẵn sàng giao dịch. - Liên hệ xem nhà: PHƯƠNG QUỲNH - 0337594758",27/06/2022,Tin thường,batdongsan_so_com_vn_1673817605.6929834,,,,,,
"3,75 tỷ VNĐ","Bát Khối, Long Biên, Hà Nội", 50m2,"- Vị trí cực đỉnh, hướng nhà đẹp, phong thủy siêu tốt. - Gần chợ và các cửa hàng tiện lợi, đi ra TTTM Aeon Mall mất chưa đến 10' đi xe.- An sinh cực tốt, không gian yên tĩnh, không ồn ào, xung quanh có hồ, nhiều cây nên không khí rất mát mẻ và trong lành. - Đường xá, giao thông đi lại rất thuận tiện. - Với diện tính rộng 50m2, ngôi nhà được thiết kế hiện đại, sang xịn với 5 tầng và có đầy đủ nội thất tiện nghi. Có chỗ để oto cả ngày đêm ☎️Liên hệ ngay 0978600***. Em Thành Long Biên.- Tư vấn miễn phí, xem nhà miễn phí, hỗ trợ vay vốn ngân hàng, pháp lý, phong thủy, sang tên làm sổ,...",27/06/2022,Tin thường,batdongsan_so_com_vn_1673817607.3475585, 4, 4, 5, 4,,
"15,3 tỷ VNĐ",Đường Thái Hà phường Láng Hạ, 90m2,"
    -CHỈ VỚI HƠN 15 tỷ- BẤT CHẤP DÂN ĐẦU TƯ- THÁI HÀ 170 TRIỆU/ M2 X 90M2
-Gọi ngay e Quyên 0587998899 để xem nhà miễn phí.
Nhà mặt nghách to, ô tô vào nhà.
- Nằm giữa ngã tư THÁI HÀ và LÁNG HẠ.. vô cùng sầm uất... Ace e đến xem tận mắt mới thấy được giá trị của ngôi nhà và vị trí tiềm ẩn.
-Nhà 4 tầng chủ tự xây vô cùng chắc chắn,ấm cúng,khách về sửa thêm chút là không có gì phải bàn.
+ Mặt đường to,vỉa hè rộng, ô tô đỗ cửa.
- Mỗi tầng 1 phòng + 1 WC .
+ Tầng 1: Phòng bếp, ăn, để xe. Bếp âm, hút mùi.
+ Tầng 2: Phòng ngủ + WC.
+ Tầng 3: Phòng ngủ + WC. + Tầng 4: Phòng ngủ + tiểu cảnh.
+ Nhà thoáng ,sáng ,tiện ích ngập tràn gần nhiều TTTT, rạp chiếu phim, trường đại học....+ Gía 15.3 tỷ.- Sổ đẹp long lanh sẵn sàng giao dịch.
+ LH để được tư vấn trực tiếp e Quyên 0587998899.
",27/06/2022,Tin thường,batdongsan_so_com_vn_1673817608.6211498, 7, 3, 5, 7, 6,
"4,36 tỷ VNĐ",Đường Phạm Văn Đồng phường Cổ Nhuế 2, 42m2,"Mình cần bán nhà số 19 ngõ 394 Phạm Văn Đồng phường Cổ Nhuế 2 quận Bắc Từ Liêm Hà Nội. - Nhà mới thoáng đẹp- Nở Hậu- gần phố đi xe máy 5 giây là ra- ngõ rộng ba gác tránh xe máy - Nhà được hưởng 1 phần đất làm sân- 6 ngủ phù hợp với gia đình nhiều thế hệ. - Diện tích 42m2 chủ tự xây tâm huyết 5 tầng BTCT chắc chắn:   +Tầng 1 : sân, khách, bếp, phòng ăn, vệ sinh  +Tầng 2, 3, 4 : 2 ngủ, vệ sinh  +Tầng 5 : thờ, phơi - Quận Bắc Từ Liêm, đường Phạm Văn Đồng giao thông thuận lợi giao với đường Trần Cung tấp nập người qua lại, gần trường học và chợ Cổ Nhuế, khu vực mật độ dân sinh cao, tiện ích không thiếu thứ gì, hàng xóm thân thiện, an ninh cao. - Sổ đỏ chính chủ pháp lý sạch.  - Giá chỉ 4.36  tỷ có thương lượng  - Liên hệ: Mr Lâm 0975852161 – Miễn phí xem nhà tư vấn giá cả dịch vụ sang tên kiểm tra quy hoạch.",27/06/2022,Tin thường,batdongsan_so_com_vn_1673817609.9709365, 3, 3, 5, 6, 4,
6 tỷ VNĐ,Nhà tại Quận Hai Bà Trưng, 30m2," - Nhà 30m2 x 4,5 tầng , MT 4,5m - Nhà ở khu giao thông thuận tiện, gần các tuyến phố lớn : Đại Cồ Việt, Bà Triệu,Bạch Mai, .. - Gần VinCom Bà Triệu, Đại Học Bách Khoa, Bệnh Viện Bạch Mai, công viên Thống Nhất.. - Ô tô đỗ cửa, khu vực đông dân cư, kinh doanh cực tốt. - Nhà còn rất mới, thiết kế hiện đại, mua về ở ngay. - Tặng lại nội thất. - Sổ đỏ chính chủ, pháp lý đảm bảo sẵn sàng giao dịch.  Liên hệ: em Dũng 094.567.6597",27/06/2022,Tin thường,batdongsan_so_com_vn_1673817621.6945612,,,,,,
1 tỷ VNĐ,thái thịnh, 35m2,"bán đất tặng Nhà 3 tầng, SIÊU VIP, 35M2 PHỐ THÁI THỊNH, MẶT THOÁNG Vĩnh viễn, nhỉnh 1 tỷ. + Bán Nhà thái thịnh, đống đa, Đường thông với đường láng, tây sơn,láng hạ, Khu vực dân trí cao, an ninh an toàn. + Thuận Tiên Giao thông, Sinh Hoạt thường ngày của gia đình, Trường Học Các Cấp, Chợ, Siêu Thị, Bệnh viện,  Khu vui chơi giải trí..., + Quý Khách Quan Tâm, Để được tư vấn, xem nhà hoàn toàn miễn phí. + Liên hệ: Anh Vượng - 0912949598. Bất Động Sản Đống đa  Sổ Đỏ Chính Chủ Sẵn sàng giao dịch, Hỗ trợ tư vấn Pháp lý, Đàm Phán.",27/06/2022,Tin thường,batdongsan_so_com_vn_1673817622.7138338,,,,,,
"3,8 tỷ VNĐ","Hà Trì, Hà Đông, Hà Nội.", 57m2," * CC cần bán đất trong ngõ đường Hà Trì quận Hà Đông. DT 57m, mt 4.1m,  giá chỉ 3.8 tỷ. + Vị Trí: thoáng sach đẹp, yên tĩnh, an ninh tốt, an sinh đỉnh. Phù hợp xây mới ở, hoặc làm tòa CCMN thu dòng tiền khủng, thì đẹp quá. + Sổ đỏ vuông đẹp, sẵn sàng giao dịch. * Nhanh tay LH: 0983858722 Tình nhà phố ( chuyên mua, bán, nhận ký gửi có uy tín trong giới nhà đất quận Hà Đông – Hà Nội ). ",27/06/2022,Tin thường,batdongsan_so_com_vn_1673817624.8027146, 4, 2,,,,
"3,2 tỷ VNĐ",Đường Phương Canh phường Xuân Phương, 35m2,"-Nhà mới koong Xuân Phương - Từ Liêm 5 tầng, 6 ngủ đầy đủ công năng. - Ngõ rộng 3m rất thuận tiện, ô tô cách nhà 20m. Nhà đẹp giá quê chỉ 3.2 tỷ.
",27/06/2022,Tin thường,batdongsan_so_com_vn_1673817626.0513418, 4, 4, 5, 6, 4,
"4,4 tỷ VNĐ",Đường Quan Nhân phường Nhân Chính, 38m2,"
    - Mô tả:  Nhà thiết kế đẹp nội thất hiện đại, phòng nào cũng có cửa sổ.  , chuyên nhà đất thổ cư khắp Hà Nội từ 1 - 333 tỷ. Tôi phục vụ khách hàng với tiêu chí giúp người là giúp chính mình, quý chữ tín hơn vàng, vươn tới tầm cao mới. LH: Email: mingbnb19@gmail.com, hoặc các sản phẩm BĐS khác tại mingland86.com ",27/06/2022,Tin thường,batdongsan_so_com_vn_1673817627.50091, 4, 3, 4, 4, 6,
"5,85 tỷ VNĐ",Đường chiến thắng phường Văn Quán, 33m2,"diện tích 34ô có vỉa hè, dân trí cao, tiện ích vô biên. của. Giao thương nhiều phố lớn: Đô thị  ,Nguyễn Trãi , Ainh, kiến trúc , Đầy đủ   phòng 1 WC, cửa sổ từng phòng thoáng mát. + Giá chào:   : - Quận Hà Đông. 58  m2 x 5 tâng đường ô tô  ",27/06/2022,Tin thường,batdongsan_so_com_vn_1673817628.814396, 35, 1, 4, 3, 3,
"7,9 tỷ VNĐ","Khương Đình, Thanh Xuân, Hà Nội.", 78m2," * CC bán nhà Khương Đình quận Thanh Xuân. nhà đẹp, diện tích rộng, tự xây chắc, 3 thoáng, ngõ rộng ba gác tránh xe máy, thiết kế hợp lý, tổng 4 phòng ngủ khép kín, đầy đủ công năng. DT 78m, 4T, MT 4.5m, giá chỉ 7.9 tỷ. + Vị trí yên tĩnh, thuận tiện, gần nhiều trường học lớn nhỏ, gần hồ Hạ Đình vài bước chân ra mặt phố Khương Đình, giao thông thuận lợi. + Sổ vuông đỏ nở hậu đẹp, pháp lý chuẩn, sang tên nhanh. # nhanh tay LH: 0906113879 Tình nhà phố ( chuyên mua, bán, nhận ký gửi, có uy tín trong giới nhà đất quận Hà Đông – Hà Nội ).",27/06/2022,Tin thường,batdongsan_so_com_vn_1673817630.0032606,,,,,,
"11,5 tỷ VNĐ",ngõ phố Tân Mai, 58m2,"Bán nhà phân lô ngõ phố Tân Mai, Hoàng Mai.Hà Nội  DT 58m2x5T Thang máy, thoáng 2 mặt cực kỳ đẹp, ô tô vào nhà giá 11.5 tỷNhà xây mới móng bè, khung cột cách phố Tân Mai đúng 10m vừa ở, vừa kinh doanh DT 58m2x5T thang máy. thiết kế hiện đại bao gồm:T1 : Ga ra ô tô, bếp, vệ sinh phụ T2: phòng khách, phòng ngủ, vệ sinh giữa.T:3,4 mỗi tầng 2 phòng ngủ, vệ sinh từng tầng, .T5: phòng thờ sân phơi.Thiết kế theo phong cách hiện đại, công năng sử dụng vô cùng hợp lý, của cuốn, thang máy nhập khẩu, thiết bị vệ sinh cao cấp, sàn gỗ nhập khẩu Đức, cửa ra vào và tay vịn cầu thang làm bằng gỗ lim Nam phi, tủ bếp cao cấp,  phù hợp với mô hình vửa ở, vừa kinh doanh hoặc làm văn phòng công tyVị trí đắc địa cách phố đúng 10m sát chung cư Hòa Phát, gần Hồ Đền Lừ,khu an sinh tốt sổ đỏ chính chủ giá 11.5 tỷ có thương lượng liên hệ chị yến ĐT:0702138238",27/06/2022,Tin thường,batdongsan_so_com_vn_1673817631.338688, 4, 4, 5, 6, 4, Tây
"5,4 tỷ VNĐ",Đường Võ Chí Công phường Phú Thượng, 168m2,".- Diện tích khu đất: 26.978m2.- Chủ đầu tư: Tổng công ty đầu tư phát triển hạ tầng đô thị UDIC - Công ty TNHH một thành viên.- Vị trí: Lô đất CT04 KĐT Nam Thăng Long, Tây Hồ, Hà Nội (mặt đường Võ Chí Công).- Quy mô: 3 tòa A - B - C độ cao tương ứng 17 - 20 - 23 tầng.- Tổng số căn hộ: 408.Tháp A - Căn hộ 4 PN : 147m2Tháp C: 8 căn hộ/1 sàn - 4 thang máy.- Căn hộ 2 phòng ngủ: 84m2 - 85m2.- Căn hộ 3 phòng ngủ: 168m2. :- Bàn giao full nội thất liền tường: Cửa chính, cửa sổ, cửa logia, khóa từ 3 chức năng, đèn LED, điều hòa Trane, thiết bị bếp (tủ bếp trên, tủ bếp dưới, bếp từ + hút mùi Fagor, chậu rửa + vòi rửa Sơn Hà, bình nước nóng), thiết bị vệ sinh Kohler.* Chính sách ưu đãi.+ Hỗ trợ vay 70% lãi suất ưu đãi 0% lên đến 12 tháng.+ Chiết khấu tới 5% khi khách hàng không vay.+ Miễn 2 năm phí dịch vụ.LH phòng kinh doanh: 0984513909",27/06/2022,Tin thường,batdongsan_so_com_vn_1673817632.5545487, 24, 40, 20, 3, 2,
"4,35 tỷ VNĐ","giang văn minh , ba đình", 41m2,"Chính chủ bán nhà Giang Văn Minh Ba Đình 41m ,5T ,nhà đẹp . nhỉnh 4 tỷ+ NHà đẹp , xây kiên cố , thiết kế hợp lý , khách chỉ việc xách vali về ở.+ Trung tâm quân Ba đình , đi đâu cũng tiện, ngõ xe ba gác tránh , nhà ở yên tĩnh, thoáng,an sinh tốt .+ Sổ nở hậu , đẹp , sẵn sàng giao dịch.Xem nhà và tư vấn hỗ trợ miễn phí .Trung 0896695659",27/06/2022,Tin thường,batdongsan_so_com_vn_1673817633.9508128,,,,,,
"3,85 tỷ VNĐ",Đường Bát Khối phường Long Biên, 40m2,"
    Nhà 5 tầng, xây chắc chắn, nội thất đầy đủ, thiết kế hiện đại giá chỉ 3.85 tỷVị trí ngay cạnh công viên điều hòa Long Biên, ô tô đỗ cổng,ngõ thông tứ tungXung quanh tiện ích ngập tràn, ngay cạnh Aeon mall Long biên, cầu Vĩnh Tuy, QL5,trường học các cấpThiết kế 5 tầng,4 ngủ, phòng thờ, sân phơi rộng rãiSổ đỏ chính chủ, sẵn sàng giao dịchLiên hệ Ánh thổ cư
",27/06/2022,Tin thường,batdongsan_so_com_vn_1673817640.5849283,, 3, 5, 4, 4,
9 tỷ VNĐ,Đường Núi Trúc phường Cống Vị, 52m2,"Bán nhà Mặt phố Núi Trúc, Ba Đình , Giá nhỉnh 9 tỷ, 52mx4m. Nhà mặt ngõ Núi Trúc, kết nối dễ dàng tới các phố lớn tại các quận Ba Đình, Đống Đa, Cầu Giấy… Kim Mã, Giảng Võ, La Thành, Láng Hạ, Cát Linh, Nguyễn Thái Học … Cách Sân bay Nội Bài 15 phút.  Cách Hồ Hoàn Kiếm 7 phút. Đường trước mặt rộng 7m, oto tránh, Oto có thể để trước nhà. Diện tích nhà 52m, DT sử dụng: 250m, Mặt tiền 4m. Nhà không bị quy hoạch, sổ vuông vắn, dễ thanh khoản. Chủ cần tiền nên bán với giá nhỉnh 9 tỷ.",27/06/2022,Tin thường,batdongsan_so_com_vn_1673817641.6161108, 4, 7, 4, 4, 4,
1 tỷ VNĐ,thái Thịnh, 35m2,"bán đất tặng Nhà 3 tầng SIÊU VIP 35M2 PHỐ THÁI THỊNH, NGÕ RỘNG MẶT THOÁNG Vĩnh viễn. + Bán Nhà thái thịnh, đống đa, Đường thông với đường láng, tây sơn,láng hạ, Khu vực dân trí cao, an ninh an toàn. + Thuận Tiên Giao thông, Sinh Hoạt thường ngày của gia đình, Trường Học Các Cấp, Chợ, Siêu Thị, Bệnh viện,  Khu vui chơi giải trí..., + Quý Khách Quan Tâm, Để được tư vấn, xem nhà hoàn toàn miễn phí. + Liên hệ: Anh Vượng - 0912949598. Bất Động Sản Đống đa  Sổ Đỏ Chính Chủ Sẵn sàng giao dịch, Hỗ trợ tư vấn Pháp lý, Đàm Phán.",27/06/2022,Tin thường,batdongsan_so_com_vn_1673817642.6135085,,,,,,
"2,5 tỷ VNĐ",Đường VŨ TÔNG PHAN phường Thanh Xuân Trung, 40m2,Mô tả:+ Gia đình có việc cần bán gấp mảnh đất mặt phố Vũ Tông Phan thuộc phường Khương Đình. .+Liên hệ em Trung 0981869883 sẽ được tư vấn xem nhà miễn phĩ.,27/06/2022,Tin thường,batdongsan_so_com_vn_1673817643.8791943, 4, 3, 3, 3, 3,
"4,6 tỷ VNĐ",Nguyễn Khang cầu giấy, 28m2,"Bán nhà ngõ phố Nguyễn Khang Cầu Giấy DT 28m2/31m2T2 x 5 tầng mt 3.5m nhỉnh 4tỷ. TT CẦU GIẤY - NGÕ THÔNG - KINH DOANH NHỎ - 3 GÁC TRÁNH 2 CHIẾC - NHÀ ĐẸP - Ở LUÔN - TIỆN ÍCH NGẬP TRÀN - DÂN XÂY Mô tả: + Mặt ngõ Nguyễn Khang ô tô tránh, dừng đỗ ngày đêm thoải mái, kinh doanh cực kỳ sầm uốt, công năng tiện ích ngập tràn, không thiếu thứ gì, giao thông thuận tiện. + Vị trí đẹp gần với Phố Hoa Bằng, gần với các Trường Đại học lớn, nhà mình bán cách ô tô tránh 15m, nằm ở mặt nghách thẳng tắp, trước nhà ô tô lý thuyết. + Thiết kế hiện đại hợp lý 5 tầng đây đủ công năng, còn rất mới, chủ tự xây để ở nên khung cột chắc chắn, tỉ mỉ chi tiết. - T1: Phòng khách + Bếp. - T2,3,4: Mỗi tầng 1 phòng + Wc. - T5: Phòng thờ + Sân phơi. + Sổ đỏ đẹp, sẵn sàng giao dịch. + Chi Tiết Xin Liên Hệ Bùi Anh Thái. 1979 - 0987.862962.",27/06/2022,Tin thường,batdongsan_so_com_vn_1673817644.9293818, 3, 3, 5, 3, 4,
