price,address,Diện tích,Details,Ngày đăng,Loại tin,id,Mặt tiền,Lộ giới,Số tầng,Số phòng ngủ,Số toilet,Hướng
105 triệu VNĐ,"Km số 2, Đại lộ Thăng Long, phường Mễ Trì, quận Nam Từ Liêm, Hà Nội", 30m2,"Nhà ở Container tiết kiệm chi phí đào móng, rút ngắn thời gian thi công: không cần đến nhiều vật liệu xây dựng như: gạch, xi măng, sỏi, đá...như nhà xây thông thường, nhà container đã cắt bỏ được chi phí đào móng. Tuy không cần đào móng, nhưng bằng kỹ thuật máy móc hiện đại và tay nghề của đội ngũ sản xuất giàu kinh nghiệm, nhà container đã được xử lý trở nên chắc chắn và có khả năng chịu lực tốt. Từ giao diện là một khối hình hộp chữ nhật làm bằng thép, giờ đây container được thiết kế như một ngôi nhà có đầy đủ công năng (phòng ngủ, phòng khách, phòng bếp..) Nhà container có tính thẩm mỹ và độc đáo được dựng từ tôn dập sóng, phủ bên ngoài là lớp sơn bảo vệ. Mỗi màu sơn sẽ mang một sắc thái khác nhau và mỗi người sẽ có sự lựa chọn phù hợp theo tính cách, và theo mệnh. Để sở hữu một ngôi nhà container nổi bật và thể hiện sự khác biệt, hãy lên thiết kế một cách kỹ lưỡng và tìm đến đơn vị tư vấn uy tín.",17/06/2022,Tin thường,batdongsan_so_com_vn_1673819397.320524,,,,,,
"2,7 tỷ VNĐ",Bạch Mai - Hà Nội, 45m2,"Thuộc khu phân lô tập thể cho cán bộ cũ nên dân trí thì khỏi bàn. Vị trí thì đắc địa nhất nhì khu vực Hai Bà Trưng ngõ thông hè thoáng  vài bước là ra oto đỗ. Điện đường trường trạm san sát nhau, tiện ích trăm bề.Khu Hồng Mai – Bạch Mai tọa lạc trại vị trí trung tâm của Quận Hai Bà thuận tiện tỏa đi mọi ngả vài phút là ra Bờ Hồ, Tây Hồ, Time City….. cũng như sang các trường đại học lớn nhất nhì thành phố như Bách Khoa, Xây Dựng, Kinh Tế Quốc Dân…. Hoặc sang các bệnh viện lớn như Thanh Nhàn, Ung Bướu, Bạch Mai….     Ngôi  nhà kiên cố chắc chắn là tâm huyết bao năm thanh xuân của gia chủ, nắn nót đến từng viên gách đường vữa vẫn còn rất mới lung linh, giờ khách mua chỉ việc xách vali về ở luôn Gia chủ có tuổi con cái đều thành đạt, định chuyển lên chung cư cao cấp để đỡ khoản leo trèo. Giá 2.7 tỷ có thương lượng cho khách hữu duyên.Chi tiết LH: Nhật Nhà Đất  0977194820 (Chuyên Nhà đất Thổ cư với nguồn hàng Hơn 6000 Căn Nhà  Lớn nhỏ Từ 1 – 100 Tỷ trên khắp địa bàn Hà Nội sẵn sàng giúp Khách hàng tìm được những căn nhà ưng ý nhất).Lưu ý:-Tận Tâm, Uy tín , Chuyên nghiệp cái Tâm và cái Tầm đặt lên hàng đầu- Không kênh giá chủ nhà- Miễn phí toàn bộ dịch vụ: Dẫn khách xem nhà, tư vấn pháp lý ",17/06/2022,Tin thường,batdongsan_so_com_vn_1673819398.7048194,,,,,,
"3,2 tỷ VNĐ",Đường Trần Phú phường Quang Trung, 35m2,"- Hiện trạng nhà đã qua sử dụng, hiện tại đang cho sinh viên thuê full phòng  Bố trí: + T1: khách, bếp, wc.  Sổ đỏ nở hậu.
",17/06/2022,Tin thường,batdongsan_so_com_vn_1673819399.9420755, 3, 3, 5, 6, 4,
"2,6 tỷ VNĐ",Đường Vũ Xuân Thiều phường Phúc Lợi, 34m2,"+ Sổ đỏ chính chủ, giao dịch trong ngày. ",17/06/2022,Tin thường,batdongsan_so_com_vn_1673819401.2127264, 4, 5, 5, 5, 5,
"9,8 tỷ VNĐ",Đường Trần Quốc Hoàn phường Dịch Vọng Hậu, 36m2,"Nhà Phân Lô - Ô TÔ Vào nhà - Gần Phố - Kinh Doanh nhỏ. Giao thông cực kỳ thuận lợi, thông khắp mọi nơi. Tiếp giáp các trục đường : Phạm Văn Đồng, Xuân Thủy, Nguyễn Phong Sắc, Phan Văn Trường .v.v.... Hướng nào cung thuận tiện. Khu vực dân cư cực đông đúc, dân trí cao, nếp sống văn minh. rất gần trường học các cấp, Cao Đẳng , ĐH như ĐH Y Dược, ĐH Quốc Gia HN, ĐH NN...v.v....hành chính văn phòng. Xung quanh tiện ích ngập tràn, dân cư kinh doanh khá sầm uất. An ninh , an sinh xã hội cực kỳ đảm bảo. Nhà chủ xây cực tâm huyết, Khung cột chắc chắn. thiết kế khá hiện đại. DT 36m2 x 5T, MT 3.6m ( Tầng 2 đua ra thành 42m). Tầng 1 : Kinh Doanh (Gara ô tô) + Bếp, wc. Tầng 2 : Phòng khách + wc. Tầng 3, 4 Mỗi tầng 2 PN + wc. Tầng 5 : Phòng thờ , sân phơi. Pháp lý chuẩn , sổ sẵn sàng giao dịch ngay. Giá : 9.8 Tỷ ( thương lượng). Liên hệ ngay để được tư vấn, hướng dẫn xem nhà hoàn toàn miễn phí.",17/06/2022,Tin thường,batdongsan_so_com_vn_1673819402.5775282, 3, 4, 5, 4, 5,
4 tỷ VNĐ,Trần quang diệu, 44m2,"Bán nhà Trần Quang Diệu quận Đống Đa 44m X 4T ngõ 3m . Nhỉnh 4 tỷ+ Nhà đẹp về ở luôn , gần vườn hoa , an sinh tốt , tiện ích vô vàn+ Chủ nhà mới sửa , tặng toàn bộ nội thất gắn tường , Bếp đầu tư xịn+ sổ vuông chủ sẵn sàng giao dịchXem nhà và tư vấn hỗ trợ miễn phí .Trung 0896695659",17/06/2022,Tin thường,batdongsan_so_com_vn_1673819403.7533827,,,,,,
"5,6 tỷ VNĐ",Vương Thừa Vũ, 38m2,"+ Trung tâm Quận Thanh Xuân, tiện ích vô vàn.+ Vài phút ra Ngã Tư Sở, gần TTTM, Royal City, bệnh viện và chợ.+ Thiết kế nhà hiện đại, nội thất cao cấp, nhà đẹp như tranh, đầy đủ công năng sử dụng.+ Sổ đỏ vuông đẹp, pháp lý chuẩn, sang tên nhanh. LH: Mr Hoan, 0925088355, chuyên thổ cư Hà Nội với nguồn nhà hơn 13 000 căn nhà tại Hà Nội, miễn phí xem nhà 24/7.",17/06/2022,Tin thường,batdongsan_so_com_vn_1673819404.9262486, 4,, 5,,,
,ciputra tây hồ  hà nôi, 140m2,"BIỆT THỰ DUY NHẤT HỘI TỤ ĐỦ 6 YẾU TỐ “VÀNG MƯỜI” Nhất vị trí Trung tâm trong trung tâm. Ciputra có GIAO THÔNG hoàn hảo và MẬT ĐỘ CÂY XANH khổng lồ. Nguồn cung HIẾM . Giờ muốn có quỹ đất phát triển không gian RỘNG – XANH – TIỆN NGHI như Ciputra chỉ có di tới Mê Linh, Sóc Sơn… mà thôi. Nguồn cầu CAO Ai cũng muốn ở trung tâm, ai cũng muốn gần bờ hồ, ai cũng muốn có không gian sống trong lành, thoáng đoãng => Ai cũng muốn Ciputra. Giá thành VỪA TÚI Tìm đâu ra giá biệt thự nội đô, cạnh Hồ Tây mà giá chỉ 330tr/m2? Trong khi giá cùng phân khúc tại vành đai 3 cũng ở ngưỡng này và cao hơn? Hạ tầng tiếp tục NÂNG CẤP Đường Nguyễn Văn Huyên 8 làn cạnh dự án tiếp tục được nâng cấp, kết nối đa điểm. Đến thời điểm này, tại nội thành: - Sẽ không có BĐS nào thay thế được BT The Melody - Sẽ không có BĐS nào sở hữu nhiều giá trị đột phá như BT The Melody - BT The Melody là duy nhất về CHẤT LƯỢNG – GIÁ TRỊ - ĐỘ KHAN HIẾM",17/06/2022,Tin thường,batdongsan_so_com_vn_1673819406.1350155, 7, 7, 3, 4, 4,
"5,1 tỷ VNĐ",Đường Pháo Đài Láng phường Láng Thượng, 42m2,Cần bán nhà siêu đẹp phố Pháo Đài Láng – diện tích 42m² - 5 tầng –mặt tiền 4m – giá 5.1 tỷ. + Vị rí cực đẹp – cách mặt ngõ ô tô tránh chỉ vài chục mét – ngõ thông – trước nhà ba gác đỗ cửa. + Nhà xây 5 tầng – kiên cố chắc chắn – thiết kế hiện đại – 5 phòng ngủ - có thể cải tạo thêm. + Khu vực nhiều tiện ích – gần trường Đại Học Luật – Học Viện Phụ Nữ - Học Viện Hành Chính – Học Viện ngoại giao – Đại học Ngoại Thương.. gần các phố: Nguyễn Chí Thanh – Huỳnh Thúc Kháng – Láng – Chùa Láng – Trần Duy hưng… Sổ đỏ chính chủ - giao dịch ngay.  Liên hệ: Chú Tuấn 0914631816,17/06/2022,Tin thường,batdongsan_so_com_vn_1673819409.8762314, 4, 2, 5, 5, 1,
"3,2 tỷ VNĐ",Đường Nguyễn Văn Cừ phường Bồ Đề, 51m2,"
    

NHỈNH 3 TỎI - NGUYỄN VĂN CỪ - HAI THOÁNG - Ô TÔ ĐỖ CỬA.

+ Diện tích: Sổ 51m2, mặt tiền 5m, hiện đang là nhà cấp 4(vị trí đẹp nhất đường Nguyễn Văn Cừ hiện cách ngã tư Nguyễn Sơn 50m hướng về trung tâm Hà Nội. Vỉa hè rộng 6m gần chợ, trường học.+ MẢNH ĐẤT VƯỢNG KHÍ, HỘI TỤ DDUUR MỌI YẾU TỐ CẦN ĐỂ Ở ...?

",17/06/2022,Tin thường,batdongsan_so_com_vn_1673819412.063374, 5,,,,,
"1,987 tỷ VNĐ",Đường Tứ Hiệp phường Tứ Hiệp, 69m2,Quý khách có nhu cầu mua xin vui lòng liên hệ hotline CĐT 0966.790.444/0943.831.415 để đăng ký xem căn hộ và thương lượng giá cả. ,17/06/2022,Tin thường,batdongsan_so_com_vn_1673819413.220279, 8, 15, 1, 2, 2,
5 tỷ VNĐ,mai anh tuấn, 50m2,"Bán nhà Mai Anh Tuấn 50m X 5T ,MT 5m , ngõ rộng 3m . Nhỉnh 5 tỷ+ Chủ nhà xây tâm huyết nhà 5T móng ép cọc bê tông, lên tầng thoải mái + vị trí đẹp ba bước ra hồ Hoàng Cầu , ngõ to rộng , nhà 2 mặt thoáng . Thuận tiện đi các nơi + Pháp lý sạch , sổ đỏ sẵn sàng giao dịchXem nhà và tư vấn hỗ trợ miễn phí .Trung 0896695659",17/06/2022,Tin thường,batdongsan_so_com_vn_1673819414.1308944,,,,,,
"4,2 tỷ VNĐ",Phố Bùi Xương Trạch, 40m2,"+ Trung tâm Quận Thanh Xuân, tiện ích vô vàn.+ Vị trí nhà cách mặt phố chỉ vài bước chân, ngõ rộng đường trước nhà rộng thông thoáng.+ Nhà 2 mặt thoáng trước sau, Ô TÔ đỗ gần.+ Thiết kế nhà hiện đại, nội thất cao cấp, đầy đủ công năng sử dụng.+ Sổ đỏ vuông đẹp, pháp lý chuẩn, sang tên nhanh. LH: Mr Hoan, 0925088355, chuyên thổ cư Hà Nội với nguồn nhà hơn 13 000 căn nhà tại Hà Nội, miễn phí xem nhà 24/7.",17/06/2022,Tin thường,batdongsan_so_com_vn_1673819415.458342,,, 5,,,
"8,8 tỷ VNĐ",ngõ 211 Lò Đúc, 45m2,"Bán nhà ngã tư Lò Đúc, Trần Khát Chân, DT 45m2x7T từ tầng 2 là 55m2x6T thang máy cách phố 1 nhà giá 8.8 tỷ Nhà xây 6 tầng phong cách Châu Âu hai mặt thoáng trước .mặt sau View vườn hoa  rất đẹp! Thiết kế bao gồm: T1,2,3 thông sàn vệ sinh rộng. T4 1 phòng ngủ rộng, 1 phòng khách, 1vệ sinh. T5 phòng bếp, phòng ăn , vệ sinh sân vườn rộng. T6 phòng thờ, khu vườn cây và sân rộng có thể bố trí bàn ngồi uống cafeT7 sân thượng rộng có vườn cây bàn uống cafe.Nhà hoàn thiện cực đẹp các phòng đều bố trí vườn hoa, cây cảnh, không gian cực thoáng. Các phòng đều lát sàn gỗ, tay vịn cầu thang gỗ lim và đều đi đường dây điều hoà đầy đủ! Có thể vừa ở vừa làm văn phòng. Vị trí cách phố đúng 1 nhà giao thông rất thuận tiện gần bệnh viện trường học gần chung cư Sun grand city sổ đỏ chính chủ giá 8.8 tỷ có thương lượng!liên hệ chị Yến ĐT:0702138238",17/06/2022,Tin thường,batdongsan_so_com_vn_1673819416.6720958, 7, 3, 7, 4, 5, Tây bắc
"14,5 tỷ VNĐ",Đường Nguyễn Văn Cừ phường Gia Thụy, 55m2,"⚡⚡⚡ • Tầng 1: Thông sàn, gara ô tô. • Tầng 4: Chia 2 phòng sáng thoáng.  Diện tích: 55m, Giá 14.5 tỷ. Sổ đỏ chính chủ, pháp lý chuẩn, sẵn sàng giao dịch ngay.☎http://www.facebook.com/DangHoaBatDongSan
",17/06/2022,Tin thường,batdongsan_so_com_vn_1673819417.8998559, 5, 6, 5, 3, 5,
"2,6 tỷ VNĐ",Đường Định Công Hạ phường Định Công, 30m2,,17/06/2022,Tin thường,batdongsan_so_com_vn_1673819419.0388546, 3, 3, 5, 3, 4,
"2,8 tỷ VNĐ",Phố Lương Đình Của, 35m2,"Nhà hiếm ngõ phố Lương Đình Của, Đống Đa Diện tích 35m2 2 tầng mặt tiền 3.1m giá nhỉnh 2 tỷ + Nhà nằm vị trí trung tâm quận Đống Đa, ngõ ba gác thông kiểu phân lô, cách đường ô tô tránh chỉ 20m. THIẾT KẾ: + Tầng 1: Phòng khách, ngủ, bếp, vệ sinh. + Tầng 2: Phòng ngủ, sân phơi. PHÁP LÝ: + Sổ đỏ chính chủ, sẵn sàng giao dịch + Chi Tiết Xin Liên Hệ Bùi Anh Thái. 1979 - 0987. 862962.",17/06/2022,Tin thường,batdongsan_so_com_vn_1673819420.1389134, 3, 2, 2, 2, 1,
"4,2 tỷ VNĐ",Trung Kính - Yên Hòa - Cầu Giấy - Hà Nội, 48m2,"- BÁN NHÀ MỚI - THIẾT KẾ HIỆN ĐẠI - TRUNG KÍNH - CẦU GIẤY - GIÁ CHỈ 4.2 TỶ THƯƠNG LƯỢNG - Vị trí tuyệt vời, nhà nằm sát chợ Trung Kính, gần Trường Học Các Cấp, giao thông kết nối Láng, Nguyễn Khang, Trần Duy Hưng..- Thiết kế 5 tầng hiện đại, chủ tự xây khung cột chắc chắn, còn mới toanh, ngõ rộng sạch sẽ.* Mô tả : + Tầng 1 : Sân để xe, khách bếp, wc.+ Tầng 2 : 2 Phòng ngủ rộng + WC.+ Tầng 3 : 2 Phòng ngủ rộng + WC.+ Tầng 4 : 2 Phòng ngủ rộng + WC.+ Tầng 5 : Phòng thờ + sân giặt phơi.Liên hệ : - Nguyễn Tiến Hoàng - 0976817296 - Chuyên nhà đất thổ cư Hà Nội - tư vấn nhiệt tình vui vẻ 24/24.",17/06/2022,Tin thường,batdongsan_so_com_vn_1673819421.404527,,,,,,
"3,85 tỷ VNĐ",Bán nhà ngõ Đại la, 33m2,"Bán nhà ngõ phố Đại La, Hai Bà Trưng, gần ngã tư Trần Đại Nghĩa. Diện tích 33m2 x 5 tầng xây mới, giá 3,85 tỷ, xây dựng khung cột bê tông, móng bè chắc chắn. Nội thất cao cấp, chính hãng, trang trí ấm cúng bắt mắt, trần thạch cao, cửa chính 2 lớp, cửa thông phòng và tay vịn cầu thang làm bằng gỗ lim. - Thiết kế hiện đại bao gồm: - Tầng 1: Sân để xe. Phòng khách, vệ sinh, bếp ăn. - Tầng 2,3,4 Mỗi tầng 1 phòng ngủ rộng, 1WC. - Tầng 5: Phòng thờ, sân phơi. - Nhà nằm ở vị trí trung tâm quận HBT rất đắc địa, vô cùng thuận tiện, dân trí cao, an ninh tốt. + Chỉ vài trăm mét tới các trường ĐH: Bách Khoa, Kinh Tế, Xây Dựng+ Chỉ vài bước chân ra tới TTTM Chợ Mơ, Chợ Đồng Tâm, Siêu thị lớn Vinmart Đại La+ Chỉ gần 1 km tới bệnh viện Bạch Mai, Thanh Nhàn, Công viên Lê NinSĐCC, giá 3,85 tỷ (có thương lượng).liên hệ chị Yến ĐT:0702138238",17/06/2022,Tin thường,batdongsan_so_com_vn_1673819422.6162841, 4, 3, 5, 3, 4, Nam
"4,5 tỷ VNĐ","Quan Hoa, Cầu Giấy", 30m2,"- Nhà mới xây thiế kế cực đẹp- 5 tầng, phòng ngủ vệ sinh riêng.- Sổ đỏ pháp lý sạch.",17/06/2022,Tin thường,batdongsan_so_com_vn_1673819423.7871542,,,,,,
