price,address,Diện tích,Mặt tiền,Lộ giới,Số tầng,Số phòng ngủ,Số toilet,Details,Ngày đăng,Loại tin,id
"3,5 tỷ VNĐ",Đường Kim Giang phường Đại Kim, 40m2, 3, 2, 4, 4, 4," + Sổ đỏ chính chủ, vuông vắn, sẵn sang giao dịch.+ Giá 3.5 tỷ+ Liên hệ : Mr Lâm 0856400586 xem nhà Free “Miễn Môi giới, trung gian”",07/06/2022,Tin thường,batdongsan_so_com_vn_1673821278.0774894
"5,5 tỷ VNĐ",Đường Phan Đình Giót phường La Khê, 51m2, 5, 3, 5, 6, 6,"
    Nhà phân lô - thông số đẹp - ô tô dừng đỗ 20m - cách chợ bông đỏ 21m.- Nhà bán ngõ thông nằm ngay sát chợ Bông Đỏ ô tô dừng đỗ cách 20m.Liên hệ: Tôi công thổ cư Hà Đông 0931706698
",07/06/2022,Tin thường,batdongsan_so_com_vn_1673821279.2812698
,Đường Tả Thanh Oai phường Tả Thanh Oai, 32m2,,,,,,"Bán gấp 32m2 đất mặt ngõ tả thanh oai,mt 4,15m, từ đất ra trục đường chính 50m,khu vực đang hot nhất thanh trì,chính chủ mua định để xây dựng nhưng do hết tiền xây nhà nên cần bán gấp.Khu vực tiện ích xung quanh đầy đủ,sổ đỏ rõ ràng,giao dịch ngay. Vị trí nằm trong khu dân cư đông, cách đường trục chính Thượng Phúc 100m, cách khu đô thị Đại Thanh 3km, gần trường gần chợ...Mua để ở hoặc đầu tư giữ tiền cực tốt phù hợp với tài chính của nhiều người  ",07/06/2022,Tin thường,batdongsan_so_com_vn_1673821280.445155
2 tỷ VNĐ,Đường Tân Mai phường Tân Mai, 32m2, 4, 3, 3, 3, 3,"BÁN NHÀ TÂN MAI HOÀNG MAI NGÕ Ô TÔ 32mx3T MT4m NHỈNH 2 TỶ 0913648922 +Vị trí đắc địa cực đẹp tại Trung tâm quận Hoàng Mai,Ngõ rộng như phố ô tô tải tránh,thoáng,chắc chắn,An ninh tốt và cực kỳ yên tĩnh để nghỉ ngơi sau một ngày làm việc. +Thiết kế đẹp 3 tầng đầy đủ công năng sử dụng. +Chỉ 3 phút ra tới Công viên Hồ Đền Lừ tậptập thể dục thư giãn,Bơi lội các kiểu. +Gần Trường cấp 1,2,3,Chợ Đầu Mối Phía Nam, ,Bến xe Giáp Bát,Nước Ngầm rất thuận tiện đi lại. +Giá chỉ nhỉnh 2 tỷ( Có thương lượng) +Liên hệ em Hùng Nhiệt tình - Trách nhiệm -  Uy tín để được xem nhà mua nhà đẹp giá rẻ ưng ý. +Điện thoại:0913648922 Cảm ơn!",07/06/2022,Tin thường,batdongsan_so_com_vn_1673821281.4893641
"6,3 tỷ VNĐ","Phan Đình Giót, La Khê, Hà Đông, Hà Nội.", 37m2,, 4, 6, 4,," # Bán nhà Căn góc, Phan Đình Giót, Hà Đông. ô tô đỗ cửa, phù hợp vừa ở vừa kinh doanh, làm Văn phòng hay cho thuê đỉnh. DT 37/40, 6T giá chỉ 6.3 tỷ.  + Vị trí đắc địa, kinh doanh sầm uất tạị phố Phan Đình Giót phường La Khê quận Hà Đông.  + Gần Chợ Bông Đỏ, Đền Bia Bà, Trường THCS La Khê, cạnh KĐT Ngô Thì Nhậm trung tâm phố tiện ích.  + Giao thông di chuyển thuận lợi: Văn Phú, Lê Trọng Tấn, Tố Hữu, Ngô Quyền, Ngô Thì Nhậm, Nguyễn Viết Xuân, Quang Trung, Trần Phú...  + Hiện trạng mới 6T khung cột chắc, thiết kế đẹp, hiện đại, Cầu thang lệch, mỗi tầng 2 phòng rộng, đầy đủ công năng. ( T1 thông sàn kinh doanh ).  + Giá 6.3 tỷ Thương Lượng cần bán nhanh.  + Sổ vuông đỏ đẹp chính chủ, pháp lý chuẩn.  # HotLine: 0983858722 Tình nhà phố ( chuyên mua bán nhận ký gửi nhà, đất Thổ cư có uy tín trong giới nhà đất quận Hà Đông – Hà Nội ).",07/06/2022,Tin thường,batdongsan_so_com_vn_1673821282.6023843
"5,5 tỷ VNĐ",Đường Vương Thừa Vũ phường Thanh Xuân Trung, 43m2, 4, 4, 4, 4, 3,Bán nhà Vương Thừa Vũ Thanh Xuân - Nhà lô góc hai mặt thoáng vĩnh viễn thoáng mát  Khu phân lô cán bộ quân đội.vi trí đep yên tĩnh.dân trí cao khu vực gần chợ  thuận tiện mua bán nhiều tiện ích xung quanh  Vực gần trường học và chỗ để xe ô tô  Đường rộng xe ba gác vào tận nhà.giao thông thuận tiên Sổ đỏ đẹp vuông sẵn sàng giao dịch Liên hệ em TRUNG 0981869883 sẽ được tư vấn và xem nhà miễn phí!!!!,07/06/2022,Tin thường,batdongsan_so_com_vn_1673821283.6585584
"5,4 tỷ VNĐ",Vạn Phúc- Hà Đông, 46m2,,, 5,,,"Bán nhà Vạn Phúc, Hà Đông, 46m, 5 tầng, ngõ ô tô thông, dân xây Cần tền bán gấp nhà đẹp nằm ở vị trí đắc địa Vạn Phúc, Quận Hà Đông , thuộc trung tâm văn hoá- chính trị đặc biệt nổi tiếng với làng Lụa. Nhà xây khung cột chắc chắn với 5 tầng thoáng sáng, thiết kế hiện đại, các phòng rộng ngập tràn ánh sáng với giếng trời mát mẻ, nội thất xịn chỉ việc xách vali đến ở, ngõ ô tô rộng thông muôn nơi. Xung quanh nhà đầy đủ tiện ích: Ngân hàng, siêu thị, bệnh viện, bưu điện, công viên,…Giao thông thuộc trục chính di chuyển thuận lợi giáp văn Quán, hàng xóm yết Kiêu, thông sang Ngô Quyền, vài bước ra Quang Trung, cắt ngang Tố Hữu và phố Nguyễn Thanh Bình,… Sổ đỏ vuông, sẵn sàng giao dịch. Giá: 5.4 tỷ ( có gia lộc). Liên hệ : Huyền Hà Đông ( 0363703491- 0965472910)- Chuyên gia nhà Thổ cư tư vấn hàng nghìn ngôi nhà tiết kiệm THỜI GIAN- CÔNG SỨC- TIỀN BẠC. Hỗ trợ 24/7 và tư vấn pháp lý, vay vốn. ",07/06/2022,Tin thường,batdongsan_so_com_vn_1673821284.6618745
"5,4 tỷ VNĐ",Vạn Phúc- Hà Đông, 46m2,,, 5,,,"Bán nhà Vạn Phúc, Hà Đông, 46m, 5 tầng, ngõ ô tô thông, dân xây Cần tền bán gấp nhà đẹp nằm ở vị trí đắc địa Vạn Phúc, Quận Hà Đông , thuộc trung tâm văn hoá- chính trị đặc biệt nổi tiếng với làng Lụa. Nhà xây khung cột chắc chắn với 5 tầng thoáng sáng, thiết kế hiện đại, các phòng rộng ngập tràn ánh sáng với giếng trời mát mẻ, nội thất xịn chỉ việc xách vali đến ở, ngõ ô tô rộng thông muôn nơi. Xung quanh nhà đầy đủ tiện ích: Ngân hàng, siêu thị, bệnh viện, bưu điện, công viên,…Giao thông thuộc trục chính di chuyển thuận lợi giáp văn Quán, hàng xóm yết Kiêu, thông sang Ngô Quyền, vài bước ra Quang Trung, cắt ngang Tố Hữu và phố Nguyễn Thanh Bình,… Sổ đỏ vuông, sẵn sàng giao dịch. Giá: 5.4 tỷ ( có gia lộc). Liên hệ : Huyền Hà Đông ( 0363703491- 0965472910)- Chuyên gia nhà Thổ cư tư vấn hàng nghìn ngôi nhà tiết kiệm THỜI GIAN- CÔNG SỨC- TIỀN BẠC. Hỗ trợ 24/7 và tư vấn pháp lý, vay vốn.",07/06/2022,Tin thường,batdongsan_so_com_vn_1673821290.390411
"14,2 tỷ VNĐ","NGUYỄN VĂN CỪ,LONG BIÊN", 54m2,,,,,,"
    










CHỦ NHÀ CHUYỂN SANG VINHOME NÊN BÁN NHÀ LÔ GÓC CỰC ĐẸP, SANG- XỊN-MỊN
- Nhà đẹp nằm trên phố VIP Nguyễn Văn Cừ, ngõ ô tô tránh
- Mặt tiền rộng, kinh doanh, cho thuê, làm gara đều được
- Nhà mới xây, thiết kế cực xịn
- Gần trường học, chợ, TTTM, bệnh viện...
- Tầng 1: Gara, kinh doanh
- Tầng 2: phòng khách, bếp,nvs
- Tầng 3,4: phòng ngủ, nvs
- Tầng 5: Phòng thờ, sân phơi, bbq
SỔ ĐẸP NHƯ BAO DIÊM CẤT KÉT, GIAO DỊCH NGAY
LIÊN HỆ XEM NHÀ: PHƯƠNG QUỲNH - 0337594758



 




 


 



 



 




 



 


 





",06/06/2022,Tin thường,batdongsan_so_com_vn_1673821291.37679
"28,5 tỷ VNĐ","Nguyễn Văn Cừ, Long Biên", 90m2,,,,,,"- Chủ nhà chuyển về sống với con cái nên cần bán nhà tại mặt phố Nguyễn Văn Cừ, Long Biên. - Nhà có vị trí đắc địa, kinh doanh sầm uất ngày đêm, đa ngành nghề, ô tô đỗ cửa, 2 mặt tiền rộng thông thoáng – mặt ngõ nhìn ra Hồ sinh thái, vỉa hè rộng rãi kinh doanh tiện ích. - Giao thông thuận tiện, nằm ngay trên trục đường chính Nguyễn Văn Cừ, giao thương thủ đô, đường 2 chiều tiện ích, gần các phố Nguyễn Sơn, Ngọc Lâm, khu an sinh xã hội tốt. - Gần chợ Ngọc Lâm, Bến xe Gia Lâm ngay sau, ngân hàng, siêu thị, các trường c1, c3, bệnh viện Bắc Hà, Tâm Anh, sang TT Hà Nội 10 phút. - Hiện trạng nhà đang là Cấp 4, đang cho thuê kinh doanh thu nhập cao hàng tháng. - Sổ đỏ chính chủ, sẵn sàng giao dịch. - Liên hệ xem nhà: Phương Quỳnh - 0337594758",06/06/2022,Tin thường,batdongsan_so_com_vn_1673821292.334737
"5,5 tỷ VNĐ",Mỗ Lao- Hà Đông, 47m2,,, 5,,,"Siêu phẩm Mỗ Lao, Hà Đông, ô tô, 47mx5 tầng, ngõ thông, dân xây Do nhu cầu chuyển công tác vào Nam cần bán gấp nhà đẹp khu vực lõi trung tâm Mỗ Lao, Hà Đông. Nhà thiết kế hiện đại các phòng thoáng sáng đầy đủ công năng sử dụng với 5 tầng rộng đẹp, ngõ ô tô thông muôn nơi, gần phố rất hiếm nhà bán. Bán kính xung quanh nhà đầy đủ tiện ích: các trường Đại học, siêu thị, chợ, ngân hàng, khu vui chơi, bệnh viện, ..không thiếu thứ gì. Giao thông thuận lợi di chuyển các phố đối diện Văn Quán, hàng xóm Yết Kiêu, cắt ngang Phúc La, xuôi xuống Vạn Phúc vài bước ra Quang Trung Sổ đỏ vuông, sẵn sàng giao dịch. Giá: 5.5 tỷ ( có gia lộc). Liên hệ : Huyền Hà Đông ( 0363703491- 0965472910)- Chuyên gia nhà Thổ cư tư vấn hàng nghìn ngôi nhà tiết kiệm THỜI GIAN- CÔNG SỨC- TIỀN BẠC. Hỗ trợ 24/7 và tư vấn pháp lý, vay vốn.",06/06/2022,Tin thường,batdongsan_so_com_vn_1673821293.4168415
"5,5 tỷ VNĐ",Mỗ Lao- Hà Đông, 47m2,,, 5,,,"Siêu phẩm Mỗ Lao, Hà Đông, ô tô, 47mx5 tầng, ngõ thông, dân xây Do nhu cầu chuyển công tác vào Nam cần bán gấp nhà đẹp khu vực lõi trung tâm Mỗ Lao, Hà Đông. Nhà thiết kế hiện đại các phòng thoáng sáng đầy đủ công năng sử dụng với 5 tầng rộng đẹp, ngõ ô tô thông muôn nơi, gần phố rất hiếm nhà bán. Bán kính xung quanh nhà đầy đủ tiện ích: các trường Đại học, siêu thị, chợ, ngân hàng, khu vui chơi, bệnh viện, ..không thiếu thứ gì. Giao thông thuận lợi di chuyển các phố đối diện Văn Quán, hàng xóm Yết Kiêu, cắt ngang Phúc La, xuôi xuống Vạn Phúc vài bước ra Quang Trung Sổ đỏ vuông, sẵn sàng giao dịch. Giá: 5.5 tỷ ( có gia lộc). Liên hệ : Huyền Hà Đông ( 0363703491- 0965472910)- Chuyên gia nhà Thổ cư tư vấn hàng nghìn ngôi nhà tiết kiệm THỜI GIAN- CÔNG SỨC- TIỀN BẠC. Hỗ trợ 24/7 và tư vấn pháp lý, vay vốn.",06/06/2022,Tin thường,batdongsan_so_com_vn_1673821294.337462
"7,05 tỷ VNĐ",Đường Bồ Đề phường Bồ Đề, 62m2, 5, 4, 4, 4, 4,"Nhà dân xây cực kỳ chắc chắn, thiết kế hết sức hợp lý, trước nhà thoáng mát, ngõ thông rộng, ô tô chạy vòng quanh, xung quanh nhiều tiện ích. Liên hệ: Mr Liên 0372311369 (miễn trung gian, quáng cáo).",06/06/2022,Tin thường,batdongsan_so_com_vn_1673821295.361721
5 tỷ VNĐ,Phố Trường Chinh, 48m2, 4,, 5, 6,,"+Trung tâm Quận Đống Đa, tiện ích bạt ngàn.+Vị trí nhà cách đường lớn 80m, ngõ rộng đường trước nhà rộng 2.5m thông tứ tung.+Nhà mới đẹp, 5 tầng, 6 PN, nhà LÔ GÓC 3 mặt  thoáng nên phòng nào cũng có cửa sổ.+Sổ đỏ chính chủ, pháp lý chuẩn, sẵn sàng dao dịch. LH: Mr Hoan, 0925088355, chuyên thổ cư Hà Nội, miễn phí xem nhà 24/7.",06/06/2022,Tin thường,batdongsan_so_com_vn_1673821296.6941557
75 triệu VNĐ/m2,"Ngọc Mạch, Phương Canh, Nam Từ Liêm", 83m2, 4, 2,,,,"Mình có mảnh đất chính chủ 2 mặt thoáng , có thể chia đôi tại làng Ngọc Mạch, phường Phương canh, Nam Từ Liêm. Ngay sát khu đô thị An Lạc Green Symphony, khu dân cư đông đúc, xung quanh tiện ích đầy đủ. Giao thông thuận tiện, đường 70 mở rộng 60m chỉ 5 phút sang Mỹ Đình. Nay gia đình đang có việc cần giải quyết vì vậy đành phải bán em nó. - Diện tích : 83m2 ( 2 mặt chia đôi ) - Mặt tiền  : 4,60m x 4,60m - Sổ đỏ chính chủ  - Giá  : 7x/m2 có thương lượng Liên hệ : Mr Dũng 0825237636 zalo 0996839398",06/06/2022,Tin thường,batdongsan_so_com_vn_1673821297.8083456
"2,6 tỷ VNĐ",Đường  phường Đông La, 35m2,, 3, 3, 3, 3,"
    02 căn liền kề tại ngõ 58 đường Tự Lập đang thi công,nhà xây 4 tầng đã đổ mái tầng 2,bên e vẫn bán từ móng và hoàn thiện theo nhu cầu của khách hàng.-căn liền kề 01 diện tích mặt bằng 35m diện tích sử dụng 140m xây 3,5 tầng-căn liền kề 02 diện tích mặt bằng 30m,diện tích xây dựng 150m xây 4 tầngHoàn thiện nội thất cơ bản :tủ bếp,thiết bị vệ sinh...khu vực gần chợ,trường học,khu đất phân lô đấu giá X3,đường ngõ oto đỗ cửa,tiện kinh doanh,khu vực an ninh dân trí tốt.liên hệ:0913392989",06/06/2022,Tin thường,batdongsan_so_com_vn_1673821298.8954782
"4,5 tỷ VNĐ",thanh bình, 36m2, 4,, 5, 4, 4,"Bán Nhà, Thanh Bình, Hà Đông. Ô Tô Kinh Doanh 36m x 5 tầng. Mặt Tiền 4m. Giá 4.5 Tỷ.  MỚI KOONG - GẦN PHỐ TIỆN ÍCH BẠT NGÀN - KHU DÂN TRÍ CAO - NGÕ TRƯỚC NHÀ RỘNG THOÁNG - AN SINH ĐỈNH +CHỦ ĐỂ LẠI TOÀN BỘ NỘI THẤT MỚI + GỒM GIƯỜNG, TỦ, ĐIỀU HÒA , TI VI, TỦ LẠNH, MÁY GIẶT, QUẠT TRẦN ĐẸP, TỦ BẾP TRỊ GIÁ GẦN 200 TRIỆU  + Nhà cách đường Thanh Bình vài bước chân, giao thông thuận tiện. Gần các trường Đại Học lớn như Học Viện Bưu Chính Viễn Thông, Đại Học Kiến Trúc. Gần Viện 103, Viện Đa Khoa Hà Đông. Gần Siêu Thị Bigc Hồ Gươm, Siêu Thị Coopmax và rất nhiều tiện ích xung quanh. Mô tả: + Thiết kế: Nhà vừa xây mới koong khách mua chỉ việc xách vani về ở, nội thất đẹp, thiết kế hiện đại. * Tầng 1: Khách, bếp, Wc. * Tầng 2,3,4: Mỗi tầng 1 ngủ, Wc. * Tầng 5: Phòng thờ, sân phơi. + Vị trí: Nhà rất thoáng, ngõ rộng, khu dân trí cao, an sinh tốt, tiện ích xung quanh bạt nhàn ... + Sổ đỏ: Vuông vức, chính chủ, giao dịch phút mốt.   LH: E KHÁNH: 0984568179  ",06/06/2022,Tin thường,batdongsan_so_com_vn_1673821300.2269597
6 tỷ VNĐ,Ngã Tư Sở, 52m2, 5,, 5, 7,,"+Trung tâm Quận Đống Đa, tiện ích bạt ngàn.+Vị trí nhà cách đường lớn 70m, ngõ rộng đường trước nhà rộng 2.5m thông tứ tung.+Nhà mới đẹp, 5 tầng, 7 PN, nhà LÔ GÓC 3 mặt  thoáng nên phòng nào cũng có cửa sổ.+Sổ đỏ chính chủ, pháp lý chuẩn, sẵn sàng dao dịch. LH: Mr Hoan, 0925088355, chuyên thổ cư Hà Nội, miễn phí xem nhà 24/7.",06/06/2022,Tin thường,batdongsan_so_com_vn_1673821301.5284848
"28,5 tỷ VNĐ",Phố Trung Văn, 152m2, 9,, 5, 5, 5,"SIÊU HIẾM – BIỆT THỰ MẶT PHỐ ĐẸP NHẤT KĐT TRUNG VĂN  – KINH DOANH ĐẲNG CẤP – VỈA HÈ CÂY XANH + Chính chủ cần bán Biệt Thự Song Lập Trung Văn, KĐT Trung Văn, diện tích 152m², 5 tầng, mặt tiền rộng 9m giá 28.5 tỷ. + Vị trí tuyệt đẹp, đắc địa nhất KĐT, đường trước nhà ô tô 2 chiều dừng đỗ vô tư, rất thuận tiện vừa ở vừa kinh doanh hoặc cho thuê. + Xung quanh rất nhiều dự án lớn nhỏ đang hình thành với vô vàn tiện ích, tương lai giá trị còn tăng cao. + Phù hợp khách hàng mua ở thể hiện đẳng cấp, khách mua đầu tư giữ tiền, hoặc vừa ở vừa cho thuê, hiệu xuất kinh doanh rất cao. + Sổ đỏ chính chủ cất két, sẵn sàng giao dịch. + Giá 28.5 tỷ + Liên hệ xem nhà: 0902.083.139 ",06/06/2022,Tin thường,batdongsan_so_com_vn_1673821302.6474924
"5,2 tỷ VNĐ",Đường Cổ Linh phường Long Biên, 40m2, 4, 5, 5, 3, 4,"- Ngõ trước nhà thoáng, 2 ô tô tránh nhau, 3 phút lên cầu Vĩnh Tuy, dự án Cầu Trần Hưng Đạo hình thành tương lại sáng ngời Sổ đỏ chính chủ, pháp lý rõ ràng ",06/06/2022,Tin thường,batdongsan_so_com_vn_1673821303.8123763
