price,address,Diện tích,Mặt tiền,Số tầng,Số phòng ngủ,Details,Ngày đăng,Loại tin,id,Lộ giới,Số toilet
50 triệu VNĐ/m2,"Ngõ Chợ Khâm Thiên, Khâm Thiên, Đống Đa Hà Nội.", 60m2, 5, 3, 3,"
    + Bán nhà Ngõ chợ Khâm Thiên, diện tích 60m2, 3 tầng, mặt tiền 5m, nhà đẹp khách mua về ở ngay, nhỉnh 50tr/m2.
+ Vị trí nhà rất đẹp và gần, cách mặt ngõ chợ Khâm Thiên chỉ vài bước chân, gần mặt phố, trước nhà thoáng sáng, tiện ích xung quanh đầy đủ.
+ Thiết kế đầy đủ công năng, sân để xe riêng biệt, 3 phòng ngủ.
+ Sổ đỏ đẹp, sẵn sàng giao dịch.
+ Liên hệ xem nhà miễn phí 24/7: Dũng chuyên BDS thổ cư Hà Nội 0867502627.
",06/06/2022,Tin thường,batdongsan_so_com_vn_1673821368.6514785,,
"2,24 tỷ VNĐ",Đường Mỹ Nội phường Bắc Hồng, 54m2, 4,,,"Bán 54.6m2 đất Mỹ Nội Bắc Hồng đường thông 4.5m - Hơn 2 tỷ Diện tích 54.6m2 Mặt tiền 4.5m Đường ô tô tránh  Khổ đất siêu đẹp đường chuẩn bị trải nhựa
 Cách đường Võ Nguyên Giáp 390m, cách QL23B 990m  Bán đất Mỹ Nội cách chợ Vân Trì 1km buôn bán sầm uất top đầu Đông Anh
 Bán kính 300m là nhà hàng, siêu thị điện máy, trường học…tiện ích vô cùng đầy đủ
 Cách trung tâm hành chính Đông Anh 7p lái xe
 Chỉ 5p ra cầu Nhật Tân, 10p lên sân bay Nội Bài
 Xung quanh các dự án trọng điểm mọc lên như nấm
 

 Em Tùng 0979.090.313
– Tư vấn nhà đất Đông Anh miễn phí.
– Kiểm tra quy hoạch mới nhất giá rẻ.
– Hỗ trợ vay vốn ngân hàng
",06/06/2022,Tin thường,batdongsan_so_com_vn_1673821369.9549906,,
"5,7 tỷ VNĐ",Quan Hoa - Cầu Giấy - Hà Nội, 40m2,,,,"CHIẾN THẦN QUAN HOA - MỚI TINH - KINH DOANH ĐỈNH - NGÕ RỘNG THÔNG NÔNG.-Vị trí ngõ 225 Quan Hoa - Cầu Giấy - hưởng trọn tiện ích khu TT Cầu Giấy.- Giao thông thuận tiện ngõ thông nông rộng thoáng, kết nối với Nguyễn Khánh Toàn, Đường Bưởi, Láng...- Xung quanh, nhiều hộ hàng xóm kinh doanh nhộn nhịp sớm tối.- Thiết kế 5 tầng :Tầng 1 : Khác, bếp, để xe, cầu thang cuối.Tầng 2 : phòng khách rộng, hoặc làm phòng ngủ( tùy)Tầng 3 và 4 : Mỗi tầng 2 phòng, WC giưa.Tầng 5 : Phòng thờ và sân phơi.- Nhà đã có sẵn nội thất cơ bản, xem chắc chắn ưng.- Sổ vuông.Liên hệ để biết thêm nhiều thông tin hơn - 0976817296 - Nguyễn Tiến Hoàng - online 24/24.",06/06/2022,Tin thường,batdongsan_so_com_vn_1673821371.0111651,,
6 tỷ VNĐ,Phố Tây Sơn, 48m2, 5, 5, 6,"+Trung tâm Quận Đống Đa, 5 phút ra Ngã Tư Sở, gần siêu thị, bệnh viện, bãi gửi ô tô 20m.+Thiết kế nhà hiện đại, 5 tầng, 6 PN, ngõ rất rộng, nhà LÔ GÓC thoáng nên phòng nào cũng có cửa sổ.+Sổ đỏ chính chủ, pháp lý chuẩn, sẵn sàng dao dịch. LH: Mr Hoan, 0925088355, chuyên thổ cư Hà Nội, miễn phí xem nhà 24/7.",06/06/2022,Tin thường,batdongsan_so_com_vn_1673821372.2279117,,
5 tỷ VNĐ,Khương Đình - Thanh Xuân, 46m2, 4, 5, 6,"+Trung tâm Quận Thanh Xuân, 3 phút ra Ngã Tư Sở, gần trường học, bệnh viện và chợ Kim Giang.+Thiết kế nhà hiện đại, 5 tầng, 6 PN, ngõ rất rộng, nhà LÔ GÓC thoáng nên phòng nào cũng có cửa sổ.+Sổ đỏ chính chủ, pháp lý chuẩn, sẵn sàng dao dịch. LH: Mr Hoan, 0925088355, chuyên thổ cư Hà Nội, miễn phí xem nhà 24/7.",06/06/2022,Tin thường,batdongsan_so_com_vn_1673821375.618143,,
"2,5 tỷ VNĐ",Trần Đại Nghĩa - Hà Nội, 50m2,,,,"+ Nhà lão thành cách mạng xây kiên cố vững chắc như bàn thạch,+ Diện tích:45m2, 3 tầng + Vị trí nhà rất đẹp, cách đường oto 3 bước chân    +Nằm ở trung tâm quận Hai Bà Trưng thuận tiện đi lại tới các khu vực trung tâm trong thành phố như Bạch Mai, Giải Phóng , Trần Khát Chân ,Đại Cồ Việt……..+Khu dân trí cao của khu Hai Bà Trưng hang xóm toàn  giảng viên và giáo viên của các trường đại học lớn  giao thông thuận tiện sang các khu vực trung tâm như Bạch Mai , Giải Phóng , Đai Cồ Việt, Phố Huế,…..gần các trường đại học lớn Bách Khoa, Xây Dựng, Kinh tế quốc dân,+ Giá đẹp trong khu vực Hai Bà Trưng +sẵn sàng giao dịch + giá: 2.5 tỷ (có thương lượng). Chi tiết LH: Nhật Nhà Đất  0977194820 (Chuyên Nhà đất Thổ cư với nguồn hàng Hơn 6000 Căn Nhà  Lớn nhỏ Từ 1 – 100 Tỷ trên khắp địa bàn Hà Nội sẵn sàng giúp Khách hàng tìm được những căn nhà ưng ý nhất).Lưu ý:-Tận Tâm, Uy tín , Chuyên nghiệp cái Tâm và cái Tầm đặt lên hàng đầu- Không kênh giá chủ nhà- Miễn phí toàn bộ dịch vụ: Dẫn khách xem nhà, tư vấn pháp lý ",06/06/2022,Tin thường,batdongsan_so_com_vn_1673821378.5633292,,
50 ngàn VNĐ,Đường Phạm Hùng phường Mỹ Đình 2, 131m2,, 15, 4,"- Diện tích thông thủy: 131.2m2.- 3 logia. - Chiết khấu 6% khi thanh toán sớm 95% giá trị căn hộ.
",06/06/2022,Tin thường,batdongsan_so_com_vn_1673821379.671898, 1, 2
6 tỷ VNĐ,"YÊN LÃNG, ĐỐNG ĐA", 60m2,,,,"CHÍNH CHỦ BÁN NHÀ YÊN LÃNG, ĐỐNG ĐA, DIỆN TÍCH 60M2, 6 TẦNG, KINH DOANH. + Vị trí trung tâm ĐỐNG ĐA dân trí cao, gần chợ, trường học, bệnh viện, ngân hàng và giao thông thuận tiện. + Nhà 6 tầng cực đẹp mặt ngõ PHÂN LÔ thông rộng. Cách chỗ để ô tô chỉ vài bước chân. Nhà văn phòng tốt hoặc cho thuê khoảng 20 triệu/tháng. + Sổ đỏ chính chủ, pháp lý sạch. + Liên hệ em Thái để được tư vấn và hỗ trợ miễn phí. ",06/06/2022,Tin thường,batdongsan_so_com_vn_1673821380.7968686,,
,Hà Nội, 66m2,,,,"Khu phân lô văn phòng chính phủ, ô tô thang máy lô góc cực đỉnh. + Diện tích 66m2, 8 tầng thang máy, mặt tiền 6.2 m, trung tâm quận Ba Đình. + Nhà trang bị hệ thống điện thông minh, hệ thống tưới cây tự động. + Phố Vạn Phúc là phố VIP, kinh doanh sầm uất, sát công viên Thủ Lệ, Lotte và Đại sứ quán Nhật, Úc... + Nằm vị trí đắc địa gần các tuyến phố lớn như: Liễu Giai, Vạn Bảo, Phan Kế Bính, Nguyễn Chí Thanh, Nguyên Hồng, Huỳnh Thúc Kháng, Linh Lang, Kim Mã, Đội Cấn… + Đây là khu vực đáng sống nhất của quận Ba Đình, xung quanh toàn quan chức, an ninh tuyệt đối, an sinh tuyệt vời. + Sổ đỏ chính chủ giá chào chỉ 15 tỷ thương lượng mạnh tay.Liên hệ ngay miễn trung gian em Thanh: 0366 555 258.",06/06/2022,Tin thường,batdongsan_so_com_vn_1673821381.8152568,,
"4,712 tỷ VNĐ",Đường Liên Hà phường Đông Anh, 76m2, 5,,,"Gia đình em bán 76,25m2 đất đấu giá vip nhất xã Liên Hà Đông ANh giá đầu tư.LH 0979040629  -          Đường nhựa trước mặt 7m, vỉa hè 2,5m. -          Bán kính 500m2 là trung tâm hành chính xã,trường học các cấp 1,2,3. -
",06/06/2022,Tin thường,batdongsan_so_com_vn_1673821383.1646476,,
,"Đường Thiên Lộc, Vĩnh Lộc, Cổ Đông, Sơn Tây", 61m2,,,,"Lô góc mặt đường Thiên Lộc, Cổ Đông, Sơn Tây ngay sát QL21 và gần khu đô thị Thiên Mã.- Sẵn sổ đỏ, full thổ cư.- Điểm kết nối giữa 2 khu siêu đô thị vệ tinh Hoà Lạc và Sơn Tây.- Cách QL21 chỉ 200m.- Cách khu đô thị Thiên Mã chỉ 500m.- Cách sân golf, Di lịch Hồ Đồng Mô chỉ 900m.- Cách trục hồ Tây Ba Vì 1.5km.- Gần ngã 3 chợ Hoà Lạc.- Cách khu CNC cao 10p đi xe.- Tiếp giáp với QL21A dễ dàng kết nối trọng điểm trung tâm Hà Nội.Hạ tầng hoàn thiện:- Mặt tiền rộng từ 5~11m.- Diện tích từng lô chỉ từ 60~80m2.- Thế đất vuông vắn, nở hậu.- Đường nội khu 6m (2 ô tô tránh nhau thoải mái).- Hạ tầng đồng bộ (sẵn đường ống dẫn nước, đã kéo đường điện vào nội khu).- Sẵn hàng cây xanh trải khắp nội khu.* Hòa Lạc không chỉ là đất vàng, mà còn là tương lai.- Liên hệ 0978862329 Mr Hoàng",06/06/2022,Tin thường,batdongsan_so_com_vn_1673821384.4103534, 6,
"9,3 tỷ VNĐ",Đường Cầu Giấy phường Quan Hoa, 53m2, 12, 1, 1,"
    
HIẾM - MẶT ĐƯỜNG LỚN - MẶT TIỀN RỘNG - VỈA HÈ THÊNH THANG - KINH DOANH TỐT - CHO THUÊ GIÁ CAO

Vị trí đầu Đường Bưởi, view trọn ngã tư Cầu Giấy
Hiện trạng nhà C4 xác định bán đất, đang cho cửa hàng thuê 40tr/th.
Mặt tiền rộng kinh doanh đa loại hình.

Sổ đỏ chính chủ, giao dịch ngay
",06/06/2022,Tin thường,batdongsan_so_com_vn_1673821385.4954846, 1, 1
"2,65 tỷ VNĐ",Đường Đông Ngạc phường Đông Ngạc, 30m2, 5, 4, 3,"NHÀ MỚI ĐÔNG NGẠC 30M2 x 4 TẦNG - MẶT TIỀN > 5M - NGÕ  NÔNG Ô TÔ ĐỖ CỔNG - SÁT HỒ - XEM LUÔN THÌ KỊP  Đông Ngạc 30 m2, xây 4 tàng, mặt tiền 5.7 m. Giá chỉ 2.65 tỷ Mô tả:- Nhà xây cực đẹp, 4 tầng 3 ngủ, giá hời hiếm hot - Ngõ trước nhà rộng, ô tô nhỏ đỗ cổng khi cần - Vị trí đẹp sát hồ, gần trường, chợ, giao cắt Phạm Văn Đồng Tân Xuân Xuân Đỉnh Cổ Nhuế Kẻ Vẽ Thuỵ Phương An Dương Vương- 12 căn đã bay 11, còn 1 căn duy nhất, khách nhanh chân đến xem ngay mới kịp chiêm  ngưỡng,Liên hệ ngay Mr Cường 0974710465",06/06/2022,Tin thường,batdongsan_so_com_vn_1673821386.6483994, 3, 4
100 triệu VNĐ/m2,"Ngọc Khánh, Ba Đình", 35m2, 4, 4, 3," Mô tả: + Sổ đỏ cất két. + Ngõ trước nhà rộng, bagac đua thoải mái. Nhà cách phố ~60m, sát ngay khu Vincom Gallery cực đẹp, quy hoạch ra sát mặt phố.  + Khu ngõ yên tĩnh vô cùng, hàng xóm xung quanh toàn công chức, giáo viên. + Nhà xây 4 tầng vô cùng kiên cố, tầng 1 xây dựng 30m, từ tầng 2 được gần 36m. Khách mua lên thêm 2 tầng cực dễ. Tầng 1: Phòng khách, bếp, vệ sinh. Tầng 2,3: Phòng ngủ cực rộng, vệ sinh khép kín. Tầng 4: Phòng ngủ nhỏ, phòng thờ sân phơi.",06/06/2022,Tin thường,batdongsan_so_com_vn_1673821387.7684507,, 3
,Đường An Dương Vương phường Phú Thượng, 100m2,, 5, 7,"
    - Căn tầng 10 diện tích 130m2, 3 phòng ngủ, 1 khách, 1 bếp, 3 vệ sinh, 3 ban công view đẹp nhìn, Hồ Tây. Giá bán 23 triệu/m2.- Vị trí đắc địa cửa ngõ quốc tế, cách Hồ Tây chỉ 3p, nhiều tuyến đường huyết mạch Võ Chí Công, Nguyễn Văn Huyên kéo dài, kết nối nhiều dự án đẳng cấp như Ciputra - Tây Hồ Tây nơi đáng sống nhất Hà Nội.
",06/06/2022,Tin thường,batdongsan_so_com_vn_1673821388.8585358, 20, 2
"12,5 tỷ VNĐ","đường Ngô Thị Nhậm, phường Quang Trung", 50m2,, 7, 4,"Mô tả: + Bán nhà Ngô Thì Nhậm 50m2*7tầng thang máy,nhà đẹp tuyệt vời, sàn gỗ pơmu,+ Kinh doanh đỉnh của đỉnh, vị trí đắc địa làm gì cũng có tiền. + đường rộng ô tô tránh,ô tô dừng đỗ thoải mái,+ nhà nằm trung tâm lối khu chung cư Ngô Thì Nhậm với đường Quang Trung, chợ Bông đỏ La Khê, Phan Đình Giót, Ngô Quyền, + tiện ích xung quanh vô vàn không thiếu gì, trường cấp 1.2.3, bệnh viện,siêu thị,chợ…Chủ nhà xây dựng tâm huyết, sắt thép nhiều hơn quy định. Thiết kế hiện đại do KTS nổi tiếng làm.4 phòng ngủ…Chủ nhà rất nhiều Lộc,Đất vượng khí tài. Nay đã về hưu muốn ở căn BT Tây Hồ lên cần bán gấp.+ sổ đỏ vuông đẹp chính chủ sẵn sàng giao dịch. + giá 12,5tỷ (có thương lượng)+ Gọi ngay Mrs Hương  09,16,14,47,66,Chuyên bán và nhận ký gửi nhà đất thổ cư ",06/06/2022,Tin thường,batdongsan_so_com_vn_1673821390.1473262,,
100 triệu VNĐ/m2,Phường Mai Dịch Quận Cầu Giấy, 40m2,,,," Bán nhà Hồ Tùng Mậu. Nhà đẹp 40m2, 5 tầng, 20m ra đường Phạm Vă Đồng. Giá nhỉnh 4 tỷ.+ Nhà trung tâm Quận Cầu Giấy. 20m ra Phạm Văn Đồng thông Cầu Giấy, Phạm Hùng, Mỹ Đình và các tuyến phố nội đô.  Tiện ích miễn bàn + Nhà chủ xây cực kỳ chắc chắn tâm huyết, thoáng sáng trước sau, thiết kế T1 thông sàn + Bếp + wc, 4 phòng ngủ, nội thất xịn sò + phòng thờ và sân phơi đầy đủ công năng sử dụng,+Khu trung tâm nhiều Trường Đại Học tập trung sinh viên nội trú, kinh doanh buôn bán tấp nập+ Khu đân trí cao, an ninh tốt, tiện ích ngập tràn. + Sổ đỏ chính chủ sẵn sàng giao dịch. Giá:Thỏa thuận. Liên hệ: Anh Đoàn:0962745289. + Nhiệt tình vui vẻ, dẫn khách xem nhà miễn phí. Tư vấn pháp lý, sang tên thủ tục nhanh gọn. + Tư vấn 24/7.  ",06/06/2022,Tin thường,batdongsan_so_com_vn_1673821391.1486557,,
"1,034 tỷ VNĐ",Đường Quốc Lộ 3 phường Đông Xuân, 59m2, 4,,,"
    - Diện tích: 59.1m2.Tiện ích.- Dân cư đông đúc, thân thiện.
",06/06/2022,Tin thường,batdongsan_so_com_vn_1673821392.3314903,,
3 tỷ VNĐ,Đường Xa La phường Phúc La, 34m2, 3, 5, 3,"- Vị trí cực đẹp, cách 200m là bãi gửi ô tô, trước nhà ba gác tránh thoải mái, tương lai mở cửa sau của HV Quân Y thì kinh doanh buôn bán thoải mái - Mô tả: Nhà duy nhất xây 5 tầng bê tông trong cả khu, thiết kế cực đẹp, chủ để lại toàn bộ nội thất - Tầng 1: Phòng khách + bếp + wc. - Tầng 2,3,4: Mỗi tầng 01 PN + WC - Tầng 5: Phòng thờ + sân phơi. + Vị trí ngay cổng làng Xala rẽ phải, trước nhà Ba gác tránh, 50m ô tô vù vù, sau nhà là Học viện Quân y, an ninh tuyệt đối. + Chủ nhà công chức nhà nước rất hợp tác, ở có lộc, mới mua nhà to hơn nên cần thanh khoản. Anh chị em tự tin dẫn khách. + Sổ đỏ chính chủ sẵn sàng giao dịch. Liên hệ 0936206176
Xala - Hà Đông
",06/06/2022,Tin thường,batdongsan_so_com_vn_1673821393.3537943, 5, 3
130 triệu VNĐ/m2,"193 đường Phú Diễn, phường Phú Diễn quận Bắc Từ Liêm", 40m2, 5, 5, 6,"Bán nhà 5 tầng ô tô vào nhà 2 mặt tiền phường Phú Diễn quận Bắc Từ Liêm. Nhà mới xây đẹp từ ngoài vào trong, đường rộng thông thoáng giao thông thuận tiện. khu dân cư sầm uất, an ninh an toàn tiện ích đầy đủ gần chợ, hồ điều hòa gần các trường mầm non, cấp 1,2,3 đại học Tài Nguyên và Môi Trường. - Diện tích : 40m2 x 5 tầng    ( 1PK + 6PN + 1P. Thờ + 4WC ) - Mặt tiền : 5,5m - Đường trước mặt : 3,5m - Giá  : Nhỉnh 5 tỷ - Sổ đỏ chính chủ cất két Liên hệ : Mr Dũng 0825237636 zalo    0996839398  ",06/06/2022,Tin thường,batdongsan_so_com_vn_1673821394.4678223, 3, 4
