price,address,Diện tích,Mặt tiền,Lộ giới,Số tầng,Số phòng ngủ,Details,Ngày đăng,Loại tin,id,Số toilet,Hướng
"6,5 tỷ VNĐ","Nguyễn Khuyễn, Văn Quán, Hà Đông, Hà Nội.", 36m2, 4, 3, 5, 4," # Bán nhà riêng đường Nguyễn Khuyễn, Văn Quán, Hà Đông, Hà Nội. Nhà mới kính koong, đẹp không tỳ vết, Full trang thiết bị cao cấp, nội thất VIP, khu dân trí cao, ô tô 7 chỗ đỗ cửa, an ninh an sinh đỉnh. DT 33/36m, 5T giá chỉ 6.5 tỷ. + Vị Trí: thoáng đẹp, văn minh và đông đúc tại đường Nguyễn Khuyến phường Văn Quán. Sự hội tụ giữa 3 quận Hà Đông, Thanh Trì và Thanh Xuân lên rất sầm uất. + Tiện ích: nằm tại trung tâm KĐT Văn Quán cạnh KĐT Mỗ Lao xung quanh nhiều TTTM, Ngân hàng, khu vui chơi, nhà hàng, hồ điều hòa, trung tâm phố thật tiện ích. + Giao thông: di chuyển Nguyễn Khuyến, Chiến Thắng, 19/5, Phùng Hưng, Quang Trung, Vũ Trọng Khánh, Trần Phú, Nguyễn Trãi quận Thanh Xuân vô cùng thuận lợi. + Nhà mới kính koong 5T khung cột chắc, thiết kế hiện đại các phòng thoáng sáng, công năng đầy đủ, Chủ mới mua về chỉ việc đến ở. + Giá chỉ 6.5 tỷ. + Sổ vuông đỏ đẹp đi thi hoa hậu, sẵn sàng giao dịch. # HotLine: 0983858722 Tình nhà phố ( chuyên mua, bán, nhận ký gửi nhà đẹp, nhà phố, nhà tiềm năng, dòng tiền, có uy tín trong giới nhà đất quận Hà Đông – Hà Nội ).",30/05/2022,Tin thường,batdongsan_so_com_vn_1673822511.6843567,,
"20,5 tỷ VNĐ","đường chiến thắng, văn quán, Hà Đông, Hà Nội", 70m2, 4,, 6, 10,"*** cần bán gấp nhà mặt phố CHIẾN THẮNG, VĂN QUÁN, HÀ ĐÔNG, HÀ NỘI** nhà nằm trung tâm hà đông mặt tiền phố chiến tháng, với thiết kế 6 tầng thang máy nổi trội, kinh doanh bất chấp mọi loại hình dịch vụ, dòng tiền cực kì ổn định, rất phù hợp cho anh chị đầu tư giữ tiền sinh lơi .vv*** THIẾT KẾ TRÊN 70m2 1 sàn *6t*4m MT** T1; thông sàn ** T2+3+4+5+6 ; mỗi tầng 2 phòng cực rộng đẹp***sổ đỏ chính chủ đẹp xuất sắc như tờ A4 sẵn sàng chào đón chủ mới** giá ; 20.5 tỷ < sẵn sàng thương lượng với người thiện chí>** Anh Chị quan tâm alo zalo 0845790555 đỗ hạnh",30/05/2022,Tin thường,batdongsan_so_com_vn_1673822513.2072804, 10,
7 tỷ VNĐ,Đường Ngọc Lâm phường Ngọc Lâm, 46m2, 8, 6, 5, 3,"
    
Mô tả: 

+ Hình thức: 5 tầng 1 tum nhà như mới:

Tầng 1: Phòng khách, wc.
Tầng lửng: Bếp
Tầng 2,3,4: 3 Phòng ngủ + 3 wc khép kín
Tầng 5: Thờ, sân phơi. 

+ Vị trí: thuộc phố Ngọc Lâm. Dân trí cao, tiện ích xã hội dư thừa. Đường trước nhà rộng 2 ô tô tránh đỗ, trải nhựa sạch đẹp. Gần nhà nhiều dự án như Ga xe lửa Gia Lâm quy hoạch làm trung tâm Thương Mại do Vin Group đầu tư, cách 50m đã phê duyệt xây chung cư. Cách vườn hoa Ngọc Lâm 300m.

+ Sổ vuông đẹp, giao dịch ngay. Sổ 36m2, từ tầng 2 đua thành 46m2.
* Hỗ trợ vay vốn ngân hàng lên đến 80% giá trị tài sản.
* Cam kết ảnh thật, thông tin thật 100%.
+ Liên hệ ngay để được Tư Vấn và Xem nhà MIỄN PHÍ.
",30/05/2022,Tin thường,batdongsan_so_com_vn_1673822517.9458735, 4,
"1,2 ngàn VNĐ","Cổ Đông,Sơn Tây,Hà Nội", 60m2, 6, 7, 1, 1,"-QL21A là điểm kết nối giữa 3 vệ tinh Xuân Mai,Sóc Sơn,Hòa Lạc. Trong 3 vệ tinh thì Hòa Lạc có quy mô lớn và bài bản nhất-Đối diện là sân golf Đồng Mô,Đảo Đồng Mô-Cách ngã 4 Lục Quận chỉ 1km-Cách điểm du lịch tâm linh chùa Khai Nguyên chỉ 700m-Cách CNC và làng DHQG chỉ 5p đi xe-Ăn theo đc cả CNC,và làng DHQG thị xã Sơn Tây(đến năm 2024 sẽ lên thành phố)Liên hệ :0855216669/0387507522",30/05/2022,Tin thường,batdongsan_so_com_vn_1673822518.9491894, 1,
"4,3 tỷ VNĐ",Đường Hoàng Văn Thái phường Khương Trung, 52m2, 4, 2, 5, 4,"-Chủ đã mua nhà trên phố cho con cần  bán gấp nhà Hoàng Văn Thái ,ở luôn. - Diện tích 50m,mặt tiền 10m - Tiện ích ngập tràn từ chợ, trường học các cấp, bệnh viện, trung tâm mua sắm ..., giao thông thuận, an sinh đỉnh. - Thiết kế: 5 tầng, đầy đủ công năng sử dụng. -Chủ mới vào ở luôn. * Tầng 1: Khách, bếp, Wc. * Tầng 2,3,4: Mỗi tầng 1 phòng ngủ rộng , Wc . * Tầng 5: Phòng thờ, sân phơi. - Sổ đỏ: Chính chủ, sẵn sàng giao dịch. - Giá  4.3 tỷ -Liên hệ EM TRANG để được xem nhà và tư vấn miễn phí.",30/05/2022,Tin thường,batdongsan_so_com_vn_1673822520.1160684, 4,
"11,25 tỷ VNĐ",Khu đấu giá 31ha -Trâu Quỳ - Gia Lâm - Hà Nội, 90m2, 6, 11, 4, 4,"- Chính chủ cần tiền vào biệt thự Vinhomes Ocean Park 2 bán nhanh căn Shophouse Thuận An – Hải Phát tại khu đấu giá 31ha trung tâm thị trấn Trâu Quỳ - Gia Lâm – Hà Nội. - Tọa lạc tại vùng lõi phát triển của thị trấn và quận trong tương lai gần tập trung mọi tiện ích trong bán kính 500m không thiếu thứ gì: bệnh viện Gia Lâm, trường học các cấp từ mẫu giáo đến đại học, khối hành chính huyện, trung tâm giải trí nhà hàng café san sát,….. - Giao thông vô cùng thuận tiện quy hoạch đô thị phân lô bàn cờ, thuận tiện di chuyển khắp mọi nơi: Cửu Việt, Thành Trung, Ngô Xuân Quảng, Nguyễn Khiêm Ích,…..cạnh chung cư Blue Star, hồ điều hòa 9ha, UBND huyện,…dân cư đông đúc kinh doanh tấp nập ngày đêm. - Nhà xây kiên cố 3 tầng 1 tum thiết kế hiện đại phù hợp vừa ở vừa kinh doanh, đường trước nhà 11m vỉa hè rộng rãi, đã hoàn thiện mặt ngoài, có hố chờ thang máy,mặt tiền rộng 6m,… - Sổ đỏ chính chủ, pháp lý chuẩn thủ tục nhanh chóng dễ dàng, giá đầu tư 11.250 tỷ tốt nhất ở thời điểm hiện tại và rất hợp lý so với shophouse Sông Hồng, Euro Window, Metropolitan,…. Liên hệ xem nhà đất  và biết thêm thông tin chi tiết E.Nhật 0982852808, 0948584888",30/05/2022,Tin thường,batdongsan_so_com_vn_1673822521.182271, 4, Tây bắc
5 tỷ VNĐ,mỗ lao, 55m2, 4,, 4, 4,"+ Bán nhà. Phố Lụa, Hà Đông. Ô tô Kinh Doanh 55m2 x 4 tầng. mặt tiền 4.2m. Giá 5.98 tỷ.  TRUNG TÂM HÀ ĐÔNG - NGÕ THÔNG - 2 THOÁNG TRƯỚC SAU - NHÀ ĐẸP Ở NGAY  Mô tả: + Trung tâm Hà Đông, ngõ thông các ngả, trước nhà đường trải nhựa sạch sẽ, ngõ 3 gác tránh xe máy, tiện ích xung quanh ngập tràn. + Nhà gần đường Vạn Phúc giao với các đường Quang Trung, Tố Hữu, Đại Mỗ. Nhà gần siêu thị Bigc Hà Đông, chợ Hà Đông, Các trường Đại học lớn như Đại Học Kiến Trúc, Học Viện Bưu Chính Viễn Thông. Giaoa thông thuận tiện, an ninh an toàn. + Nhà chủ tự xây 4 tầng kiên cố chắc chắn, nhà 2 thoáng trước sau, phòng nào cũng có cửa sổ thoáng mát, khách mua chỉ việc xách vali đến ở ngay. Thiết kế 4 tầng: + Tầng 1: Sân để xe, phòng khách, bếp ăn. + Tầng 2,3: Mỗi tầng 2 phòng ngủ rộng và vệ sinh. + Tầng 4: Phòng thờ, sân phơi.   + Sổ đỏ vuông đẹp, sẵn sàng giao dịch,  LH: E KHÁNH: 0988960891  ",30/05/2022,Tin thường,batdongsan_so_com_vn_1673822522.275557, 3,
"2,45 tỷ VNĐ",Nghĩa Lộ- Yên Nghĩa, 35m2,,, 4, 4,"Mô tả: + Cần bán nhanh nhà Nghĩa Lộ-Yên Nghĩa 35m2*4tầng chỉ 2,xtỷ nhà đẹp tuyệt vời chỉ xách Vali về ở ngay + Cách 1 nhà ra mặt phố-ô tô qua- khu vực rất sầm uất , người qua lại tấp lập, nhưng nơi ở thì yên tĩnh,an ninh, an sinh tuyệt vời + các tiện ích xung quanh vô vàn thuận tiện cái gì cũng có chỉ vài bước chân ra tới chợ ,trường học + sổ đỏ vuông đẹp chính chủ sẵn sàng giao dịch + giá chào 2,45tỷ(có thương lượng)+ Gọi ngay Mrs Hương Chuyên bán và nhận ký gửi nhà đất thổ cư Hà Đông. ",30/05/2022,Tin thường,batdongsan_so_com_vn_1673822523.6129782,,
,"Thiên mã, Cổ Đông, Sơn Tây, Hà Nội", 65m2, 5, 10,,,"Giá chỉ hơn 900 ngay sát QL21, khu đô thị Thiên Mã.- Sẵn sổ đỏ, full thổ cư.- Điểm kết nối giữa 2 khu siêu đô thị vệ tinh Hoà Lạc và Sơn Tây.- Cách QL21 chỉ 200m.- Cách khu đô thị Thiên Mã chỉ 500m.- Cách sân golf, Di lịch Hồ Đồng Mô chỉ 900m.- Cách trục hồ Tây Ba Vì 1.5km.- Gần ngã 3 chợ Hoà Lạc.- Cách khu CNC cao 10p đi xe.- Tiếp giáp với QL21A dễ dàng kết nối trọng điểm trung tâm Hà Nội.Hạ tầng hoàn thiện:- Mặt tiền rộng từ 5~11m.- Diện tích từng lô chỉ từ 60~80m2.- Thế đất vuông vắn, nở hậu.- Đường nội khu 6m (2 ô tô tránh nhau thoải mái).- Hạ tầng đồng bộ (sẵn đường ống dẫn nước, đã kéo đường điện vào nội khu).- Sẵn hàng cây xanh trải khắp nội khu.* Hòa Lạc không chỉ là đất vàng, mà còn là tương lai.- Liên hệ 0978862329 Mr Hoàng",30/05/2022,Tin thường,batdongsan_so_com_vn_1673822525.1209874,,
"33,8 triệu VNĐ/m2","Đường Võ Chí Công, quận Tây Hồ, Hà Nội", 168.1m2,,,, 3,"
    
Bán căn hộ 3 phòng ngủ 168,1m Udic Westlake Tây Hồ .


Vị trí : Võ chí công , Tây Hồ , Hà nội.


Diện tích : 168,1m2


Thiết kế : 3 phòng ngủ, 2 Wc , cửa Đông Bắc, Ban công Tây Nam


Nội thất cơ bản chủ đầu tư ( như ảnh )


Tiện ích của CC Udic Westlake :


- Trung tâm thương mại, bể bơi 4 mùa, sân cộng đồng, bể bơi, gym, khu thể thao, khu vui chơi trẻ em ,khu thể chất ngoài trời,…


- Miễn 2 năm phí dịch vụ


Giá bán :5,7 tỷ


Liên hệ EM Vân Anh: 0977568223

",30/05/2022,Tin thường,batdongsan_so_com_vn_1673822526.5825477, 2, Đông bắc
"1,05 tỷ VNĐ","Xã Thuỷ Xuân Tiên, huyện Chương Mỹ, Hà nội", 60m2, 6, 6,,,"Chính chủ cần bán nhanh 60m2 nỏ hậu đất xã Thuỷ Xuân Tiên huyện Chương Mỹ Hà Nội giá chỉ 1 tỷ.- Diện tích 60m2 mặt tiền 6m phân lô quân đội. Đất vuông vắn ô tô tránh.- Thị trường mua bán nhà đất huyện Chương Mỹ Hà Nội đang thu hút nhiều vốn đầu tư trong và ngoài nước với nhiều trọng tâm phát triển kinh tế trong kđt vệ tinh Xuân Mai, đường tránh kết nối giao thông giữa quốc lộ 6 và quốc lộ 21A được trải nhựa Apphal.- Tiềm năng đất Chương Mỹ sẽ tạo đột phá trong đầu tư, phát triển hạ tầng kinh tế-xã hội.- Nằm cạnh dòng sông Bùi xanh mát hiền hoà, không khí trong lành. Là 1 nơi đáng sống ngay tại trung tâm xã Thuỷ Xuân Tiên huyện Chương Mỹ Hà Nội.- Chính chủ gửi bán. Không bán chênh.- Sổ đỏ chính chủ, pháp lý rõ ràng.Liên hệ ngay em Dương sđt: 0914450004.",30/05/2022,Tin thường,batdongsan_so_com_vn_1673822527.9070048,,
495 triệu VNĐ,0969272960, 55m2,,,,,"CHỈ VỚI 495TR SỞ HỮU CĂN HỘ 2PN+1 CAO CẤP với thiết kế tinh tế, thông minh, tối ưu công năng sử dụng. --- - LOẠI HÌNH CĂN HỘ ĐA DẠNG: Từ 1,3 Tỷ - Căn hộ Studio: 28 - 32m2 - Căn hộ 1PN+1 khu đa năng: 43m2 - Căn hộ 2PN+1 khu đa năng, 1WC: 55m2 - Căn hộ 2PN+1 khu đa năng, 2WC: 64m2 - Căn hộ 3PN, 2WC: 76m2 --- VỊ TRÍ ĐẮC ĐỊA - Nằm tại vị trí đẹp nhất trong KĐT VINHOMES SMART CITY TÂY MỖ - ĐẠI MỖ- HÀ NỘI - Tầm view hướng ra biển hồ trung tâm, hưởng trọn không khí mát lành. - Thiết kế tối ưu, các phòng ngủ đều có cửa sổ đón ánh sáng. - Thêm không gian + 1 giúp ra tăng số phòng ngủ hoặc phòng đọc sách. --- TIỆN ÍCH ĐẲNG CẤP - 3 đại công viên theo phong cách nghỉ dưỡng resort - TTTM Vincom Megamall lớn nhất hệ thống Vincom - Hệ thống máy tập gym ngoài trời lớn nhất Đông Nam Á: 1000 máy - Công viên BBQ với hơn 100 điểm nướng - Hệ thống trường học liên cấp từ công lập đến dân lập. --- CHÍNH SÁCH CỰC CHẤT: - Tổng chiết khấu lên tới 16% - Vay 80% miễn lãi 2 năm - Chỉ 10% ký ngay HĐMB - Miễn phí QLVH trong 5 năm đầu --- Liên hệ em Lâm tư vấn chọn căn : 0969272960",30/05/2022,Tin thường,batdongsan_so_com_vn_1673822529.2613828,,
"3,85 tỷ VNĐ",Đường Tân Triều phường Tân Triều, 30m2, 5, 2, 6, 4,"
    Tôi chính chủ bán nhà riêng tại Tân Triều Thanh Trì, MT 5.13m, Nhà xây 6 tầng, giá 3.85 tỷ, ô tô tránh 30m.Nhà đẹp, DT 30m2, 6 tầng, mặt tiền 5.13m, lô góc, ô tô tránh 30m.Mô tả:Vị trí đẹp bậc nhất Tân Triều.Gần sát bên 4-5 trường Đại học và Cao đẳng lớn nhỏ của thành phố, nhu cầu thuê ở cực lớn, luôn luôn kín phòng, tầm tiền nhỏ cực hiếm không có căn thứ 2 có vị trí và hiệu suất tương đương.Thiết kế 6 tầng, tổng 4 phòng.Tiềm năng tăng trưởng giá trị đất trong khu vực phát triển nhanh chóng theo thời gian.Sổ đỏ vuông đẹp sẵn sàng giao dịch.Giá 3.85 tỷ có thương lượng.Liên hệ em Huy 0364844886.
",30/05/2022,Tin thường,batdongsan_so_com_vn_1673822530.427884, 3,
"10,95 tỷ VNĐ",Yên Xá Tân Triều, 100m2, 5,, 8, 10,"Sốc ,rẻ nhất Yên Xã CCMN 100m2 8 tầng 24P KK giá 10.95 tỷ 800m2 sàn , 78 triệu/ tháng     Sốc ,rẻ nhất Yên Xã  Tân Triều  Sát KĐT Văn Quán CCMN 100m2 8 tầng 24P KK giá 10.9 tỷ 800m2 sàn , 78 triệu/ tháng chưa tính thêm tiền dịch vụ lên tầm 86 đến 100 triệu, Có tháng máy nhập khẩu đi 5 6 người -    Diện tích : gần 100m2 , 8 tầng  .-    Mặt tiền 4.6m , Hướng :  Thuộc tây tứ trạch  , đường trước nhà 3 m -    Nhà được thiết kế chuẩn cho hộ gia đình ở hay người đi làm ăn cư lập nghiệp , và sinh viên con nhà đại gia có điều kiện .-     Tầng 1 : Thông sàn để xe máy thoải mãi cho đủ số người ở , có cửa sổ thoáng ở sau  -    Tầng 2, tầng 3 đến tầng 8 : Mỗi tầng có 3 phòng cho thuê kép kín , full đồ dung , điều hòa nóng lạnh , giường tủ , đồng hồ điện nước , trần thạch cao -    Nhà xây dựng 8 tầng, thang máy nhập khẩu xịn ,khép kín, trang bị full nội thất , đang vận hành cho thuê kín phòng. Thu nhập hàng tháng lên tới 78 triệu/tháng. ô tô đỗ cách nhà 50m. -    Cách KĐT Văn Quán 300m , tổng cục 5 Tân Triều 150m, chợ Yên xã 180m , Bệnh Viện K , Viện 108 600m , Nhà gần nhiều trường đại học: Đại học An Ninh, Đại học Kiến trúc, Đại học Sư phạm Nghệ thuật TW, Đại học Hà Nội, Học viện mật mã, Học viện Y học cổ truyền, Học viện bưu chính viễn thông... tập trung nhiều sinh viên thuê trọ và thầy cô giáo -    Sổ đỏ chính chủ, hồ sơ bản vẽ kỹ thuật, giấy phép xây dựng đầy đủ. -    Giá bán 10.95 tỷ (có thương lượng và bao sang tên sổ, hỗ trợ vay vốn ngân hàng) -    Liên hệ để đi xem nhà và đàm phán trực tiếp chính chủ  0968608331",30/05/2022,Tin thường,batdongsan_so_com_vn_1673822531.6967132, 10, Tây bắc
18 tỷ VNĐ,Hà Nội, 79m2,,,,," - Chủ gửi bán nhà Đỗ Quang 79 m2 x 7 tầng, mặt tiền rộng 6.5m. Thiết kế mới đẹp, chắc chắn, nội thất thang máy hiện đại.Vị trí đắc địa đường ô tô tránh, vỉa hè rộng, hiếm nhà bán, an ninh dân trí cao.Kinh doanh văn phòng đỉnh, giao thông kết nối đi lại thuận tiện.Sổ đỏ chuẩn chính chủ.Giá chỉ 18 tỷ chủ thiện chí thương lượng nhiều. Quý khách vui lòng liên hệ ngay: 0366 555 258. ",30/05/2022,Tin thường,batdongsan_so_com_vn_1673822532.8293786,,
,Cầu Giấy, 51m2, 5,, 5,,"+ Chuyển nhà bán gấp nhà quận Cầu Giấy, S: 51m2, mặt tiền 5m, 5 tầng.+ Vị trí: Nằm trung tâm quận Cầu Giấy, gần nhiều trường Đại học, công viên, Bệnh viện, tiện ích đầy đủ.+ Nhà 5 tầng mới đẹp, để lại toàn bộ nội thất, điều hòa…+ sổ đỏ chính chủ.+ Liên hệ em Đức Anh để xem nhà - 0975517689",30/05/2022,Tin thường,batdongsan_so_com_vn_1673822533.922759,,
5 tỷ VNĐ,"THÁI THỊNH, DỐNG ĐA", 35m2,,,,,"GẤP GẤP: CHÍNH CHỦ BÁN NHÀ THÁI THỊNH, DT 35M2, MT 4,5M, NGÕ BA GÁC, Ô TÔ GẦN NHÀ. + Vị trí trung tâm ĐỐNG ĐA dân trí cao, gần chợ, trường học, bệnh viện, ngân hàng và giao thông thuận tiện. + Nhà 5 tầng, nội thất cực đẹp mặt ngõ nông rộng. Cách chỗ để ô tô chỉ vài bước chân. + Sổ đỏ chính chủ, pháp lý sạch. + Liên hệ em Thái để được tư vấn và hỗ trợ miễn phí.",30/05/2022,Tin thường,batdongsan_so_com_vn_1673822535.1375086,,
"4,7 tỷ VNĐ",Đường Phạm Văn Đồng phường Xuân Đỉnh, 40m2, 4, 2, 6, 4," + Nhà có vị trí rất gần phố, đi lại thuận tiện. Nhà xây được vài năm, như mới. Chủ thuê thiết kế nên nhà rất đẹp, hiện đại, đồ dùng thì xịn lắm luôn. chủ làm rất tâm huyết, xác định để ở. - T1: Khách, bếp, WC. - T6:. Tum, trồng rau....",30/05/2022,Tin thường,batdongsan_so_com_vn_1673822536.3866863, 5,
"1,95 tỷ VNĐ",Đường Tả Thanh Oai phường Tả Thanh Oai, 54m2, 3, 2, 4, 4,"
    Tôi chính chủ bán nhà riêng tại Tả Thanh Oai Thanh Trì, DT 54m2, Nhà xây 4 tầng 1.95 tỷ.Nhà cách ô tô tránh 15m, ngõ nông, nhà mới, thiết kế hiện đại,Khu vực an sinh tốt, nhà thiết kế hiện đại- nhà mình gần khu Đô thị Đại thanh và Khu đô thị linh Đàm tầm 20 phút đi xe.. tiện ích đầy đủ, giá đất Thanh trì đang lên, vì sắp lên Quận.Thiết kế- Tầng 1: bếp + khách- Tầng 2, 3: mỗi tầng 2 phòng- Tầng 4: phòng thờ, sân phơiSổ chính chủ sẵn sàng giao dịchGiá 1.95 tỷ có thương lượng.Liên hệ em Huy 0364844886 để được tư vấn và xem nhà.
",30/05/2022,Tin thường,batdongsan_so_com_vn_1673822539.2295434, 3,
"5,58 tỷ VNĐ",Đường Thái Hà phường Trung Liệt, 37m2,, 1, 4, 4,"
    - Bán nhà ngõ 117 Thái Hà vị trí trung tâm thuận tiện di chuyển.- Ngõ trước nhà thoáng rộng gần phố.- Nhà trang trí rất đẹp cho con trai nhưng lại không về quyết định cư tại nước ngoài lên bán.- Xung quanh rất nhiều tiện ích gần trường đại học Thủy Lọi, Công Đoàn...- Nhà thiết 4 tầng, tổng có 4pn.Tầng 1: pk+bếp.Tầng 2: 1phòng ngủ rộng.Tầng 3: 2pn.Tầng 4: 1pn + sân phơi rộng.- Sổ đỏ chính chủ giao dịch ngay.",30/05/2022,Tin thường,batdongsan_so_com_vn_1673822541.4750245, 1,
