price,address,Diện tích,Details,Ngày đăng,Loại tin,id,Mặt tiền,Số tầng,Số phòng ngủ,Số toilet,Lộ giới
"14,9 tỷ VNĐ","Nguyễn Sơn, Long Biên, Hà Nội", 100m2,"-Vị trí trung tâm phố Nguyễn Sơn, giao thông vô cùng thuận tiện,  đẹp nhất khu phân lô hàng không, lô góc siêu đẹp, ngõ thông oto vào tận nhà, mua đầu tư hay ở đều vô cùng hợp lý. -Đa dạng tiện ích, gần đường Nguyễn Văn Cừ, gần AEON Mall Long Biên, bệnh viện Tâm Anh, chợ... -Chủ nhà thân thiện dễ mến, muốn bán sớm cho khách mua có thiện chí, giá cả có thể thương lượng. -Lh: Hữu Thuận, 0976683183. Hỗ trợ xem nhà miễn phí.",19/05/2022,Tin thường,batdongsan_so_com_vn_1673824177.9992616,,,,,
"5,65 tỷ VNĐ",Khương Trung, 52m2,"+ Vị Trí: - Nhà mặt ngõ, thông tứ phía, thuận tiện vừa ở vừa kinh doanh, chủ tự xây tâm huyết, thoáng trước sau, phòng nào cũng có cửa sổ lấy sáng tự nhiên. - Khu vực đầy đủ tiện ích, gần trường học các cấp, gần chợ, dân trí cao, an ninh tốt. + Thiết kế: - Tầng 1: Phòng khách + bếp + wc. - Tầng 2,3,4: Mỗi tầng 2 phòng ngủ + wc. - Tầng 5: Sân phơi. + Sổ đỏ chính chủ, sẵn sàng giao dịch. - Giá: 5.65tỷ ( Còn thương lượng) miễn trung gian. + Lh: 0912918139 – Trần Anh ( Để được tư vấn và xem nhà miễn phí).",19/05/2022,Tin thường,batdongsan_so_com_vn_1673824179.2199943,,,,,
"2,6 tỷ VNĐ","Gia Thượng, Long Biên", 31m2,"+ Nằm khu vực Khai Sơn, Trường Pháp, gần hồ, hưởng mọi tiện ích xung quanh. + Trước nhà SH quay đầu, lát gạch đỏ sạch sẽ, trẻ con chơi đùa, hàng xóm tối lửa tắt đèn có nhau, cực đoàn kết. + Nhà tự xây vô cùng chắc chắn, nội thất rất đẹp, tầm tiền hiếm nhà bán - Tầng 1: Khách, bếp, bàn ăn. - Tầng 2,3: 1 phòng ngủ rộng + 1 vs. - Tầng 4: phòng thờ, sân phơi. + Sổ hồng polime, cất nhà sẵn sàng sang tên.",19/05/2022,Tin thường,batdongsan_so_com_vn_1673824180.343988, 3, 4,,,
4 tỷ VNĐ,CHCC Usilk City Tố Hữu Hà Đông Hà Nội, 165m2,"Cần bán căn hộ 4 ngủ tại chung cư UsilK-Tố Hữu- Hà Đông+ Diện tích: 165m2-4 ngủ-2 vệ sinh- 2 tắm-1 phòng làm việc, sân vườn, ban công rộng rãi. Số nhà đẹp,tầng đẹp+ Nội thất đầy đủ-chỉ việc vào ở+ Pháp lý rõ ràng sổ hồng cất két+ Cửa chính hướng Nam-ban công view Tố Hữu+ Tiện ích: Siêu thị, trung tâm thương mại, công viên thiên văn học, Aeon Mall Hà Đông, trường học, bệnh viện...*** Giá 4 tỷ*** Liên hệ: 0983417868",19/05/2022,Tin thường,batdongsan_so_com_vn_1673824181.522834,, 1, 4, 2,
"6,1 tỷ VNĐ",Phố Tô Vĩnh Diện, 38m2,"+ Vị trí đắc địa đẹp, vài bước chân là ra phố, ngõ nông, rộng thoáng lưu thông thuận tiện. + Nhà phân lô, thiết kế mới hiện đại, lô góc hai mặt thoáng sáng, khu vực an ninh tốt, dân trí cao, có rất nhiều tiện ích khác. + Thiết kế 5 tầng: - Tầng 1: Phòng khách + bếp + wc. - Tầng 2,3: Mỗi tầng 2 phòng + wc. - Tầng 4: Phòng ngủ + phòng thờ + sân phơi. - Tầng 5: Tum. - Sổ đỏ vuông vắn, pháp lý sạch, sẵn sàng giao dịch. - Giá: 6.1 tỷ (Còn thương lượng) miễn trung gian. + LH: 0912918139 – Trần Anh ( Để được tư vấn và xem nhà miễn phí).",19/05/2022,Tin thường,batdongsan_so_com_vn_1673824183.5148933,,,,,
"4,1 tỷ VNĐ",257 Giải Phóng- Phương Mai-Đống Đa- Hà Nội, 109m2,"Cần bán nhanh căn hộ 3PN tại chung cư Hòa Phát 257 Giải Phóng, Đống Đa, Hà Nội.- Diện tích: 108,7m2, 3 phòng ngủ, 2 nhà vệ sinh, 2 Logia.- Ban công hướng Bắc, cửa hướng Nam.- Vị trí: Khu trung tâm đắc địa, thuận tiện đi lại, gần Bệnh viện Bạch Mai, Tai mũi họng TW, Da liễu.- Giao thông: Kết nối các tuyến đường lớn Giải Phóng, bến xe Giáp Bát sở hữu hệ thống giao thông kết nối đắt giá của tương lai.- Đặc biệt gần các trường đại học lớn như Kinh Tế Quốc Dân, Bách Khoa, Xây Dựng...- Cơ sở hạ tầng đẹp hiện đại, rộng rãi. Nằm trong khu dân cư an ninh, yên tĩnh, gần chợ và các cửa hàng tiện lợi.- Nội thất: Đầy đủ, chỉ việc vào ở.- Sổ đỏ cất két.Liên hệ: 0983417868",19/05/2022,Tin thường,batdongsan_so_com_vn_1673824185.8190665,, 1, 3, 2,
"7,2 tỷ VNĐ","Chính chủ bán nhà 3 tầng ngõ 197 Trần Phú, Hà Đông, 7,2tỷ, 0393823225", 58m2,"Chính chủ bán nhà 3 tầng ngõ 197 Trần Phú, Hà Đông, 7,2tỷ, 0393823225 – ĐỊA CHỈ: Ngõ 197 – Trần Phú – Văn Quán – Hà Đông – TP Hà Nội.– DIỆN TÍCH: 58m2– Hướng ban công Đông – Nam– Do vợ chồng em chuyển về quê sinh sống nên đành phải bán lại căn nhà 3 tầng Văn Quán – Hà Đông nhà ở lộc phát.+ Nhà được 2 vợ chồng e chăm chút chọn từng vật liệu, màu gạch, màu gỗ, nên vô cùng tinh tế và hiện đại, nên chủ mới chỉ cần dọn vào ở thôi ạ!– Nhà mới đẹp thiết kế theo kiểu hiện đại gồm: 1 phòng khách, 1 phòng bếp, 3 phòng ngủ, 3 toilet, 1 phòng thờ, 1 ban công tầng 3.– Nội thất cực kỳ hiện đại. full toàn bô nội thất.– Xung quanh có nhiều tiện ích:+ Nhà cách Sở Tư Pháp 200m, cách BigC 800m, cách Khu đô thị Văn Quán 700m.– Đường rộng 4m, ngõ thông ra chợ.– Khu dân cư đông, dân trí cao, an ninh trật tự tốt, thuận tiện giao thông đi lại – GIÁ BÁN: 7,2 tỷ– KHÁCH CÓ NHU CẦU LIÊN HỆ SĐT: 0938371225 - 0393823225       http://www.sanbatdongsanviet.com.vn",19/05/2022,Tin thường,batdongsan_so_com_vn_1673824189.566108,,,,,
"6,65 tỷ VNĐ",Phố Bồ Đề - Phường Bồ Đề, 65m2,"PHỐ BỒ ĐỀ NHÀ PHÂN LÔ GARA Ô TÔ - KHU DÂN TRÍ CAO   DT 65M GIÁ BÁN 6.65 tỷ  GIAO THÔNG THUẬN TIỆN GẦN TRƯỜNG HỌC , BÊNH VIỆN , KHU VUI CHƠI  Mô tả: Tầng1: để xe + Khách + Bếp Tầng 2: 2 Phòng + 1 VS Giữa Tầng 3: 2 Phòng + 1 VS Giữa Tầng 4: 02 sân phơi Em Long : 0988073894  ",19/05/2022,Tin thường,batdongsan_so_com_vn_1673824190.938441,,,,,
"11,2 tỷ VNĐ","TU HOÀNG, NAM TỪ LIÊM, HN", 80m2,"+ CẦN BÁN NHÀ Vùng ngoại ô tôi có căn nhà tranh tuy bé nhưng thật xinh 80m phân lô 6 tầng Mt6,1 thang máy, ô tô tránh đỗ, vỉa hè rộng. + Vị trí đẹp: Trung tâm sầm uất trong tương lai gần. Kề bên nhiều trường Đại Học, ĐH Thành Đô, ĐH Công Nghiệp Hà Nội , + Địa điểm : Tiềm năng phát triển rất mạnh tương lai gần,Cho thuê, Đông Sinh viên, Công nhân. Học tập và làm việc + Tiện ích:Nhà Chủ tự xây mới chắc chắn, đẹp như Khách sạn.  Sẵn ở , Sạch sẽ yên tĩnh, Đường rộng Ô tô vào. Gần Đường 32, Đường Xuân Phương, Trịnh Văn Bô, Hồ Tùng Mậu.. +  Diện tích: 80m2  Sổ đỏ chính chủ, pháp lý sạch. Thủ tục nhanh gọn. + Giá Bán:  Thương Lượng Trực Tiếp Liên hệ: Đức Thổ Cư HN  0898839292 (Liên hệ để được tư vấn, xem nhà hoàn toàn miễn phí). Tôi đang có rất nhiều căn nhà với nhiều phân khúc khác nha",19/05/2022,Tin thường,batdongsan_so_com_vn_1673824192.017507, 6, 6, 5,,
17 tỷ VNĐ,Đường Đại Yên phường Ngọc Hà, 82m2,"+ Nhà cấp 4 cũ, xác định bán đất, khách mua nhà xây dựng tòa nhà 5,6,7 tầng thang mới với S đẹp 82m2, mặt tiền 5m thiết kế gì cũng hợp. + Liên hệ trực tiếp, hoặc add zalo để biết thêm thông tin.",13/05/2022,Tin thường,batdongsan_so_com_vn_1673824192.8562639, 5, 1, 1, 1, 10
"5,5 tỷ VNĐ",Đường Quan Thổ 1 phường Hàng Bột, 37m2,"+ Vị trí: nhà căn góc, trung tâm của Đống Đa, đi từ nhà ra mặt phố Tôn Đức Thắng hoặc Hào Nam chỉ mất 1 phút xe máy, 5p đến Lăng Bác, 10p lên Hồ Tây, lên phố cổ,… Tầng 1: Khách, bếp, để xe, vệ sinh ·      + Giá: 5.5 tỷ có thương lượng ",14/05/2022,Tin thường,batdongsan_so_com_vn_1673824193.9573202, 5, 5, 6, 4, 2
"19,5 tỷ VNĐ",Đường Đại La phường Trương Định, 49m2,"Chủ nhà cần bán nhà Mặt phố Đại La , Hai Bà Trưng, diện tích thực tế tầng 1 là 49m2, nhà 5 tầng mới, vỉa hè 2 bên đường rộng rãi, giá 19.5 tỷ. Phố Đại La là 1 đoạn của tuyến đường Vành đai 2, đây là 1 trong những tuyến đường huyết mạch của Hà Nội, nối tiếp Trường Chinh, Minh Khai đã quy hoạch xong, lòng đường 60m, 2 chiều, vỉa hè mỗi bên 6m. Nhà nằm ở vị trí đẹp, rất gần ngã tư Đại La, Minh Khai, Bạch Mai, Trương Định. Phố kinh doanh các Gần các BV lớn: Bạch Mai, Việt Nhật, Việt Pháp, BV Tai Mũi Họng Trung Ương ",17/05/2022,Tin thường,batdongsan_so_com_vn_1673824195.2069743, 4, 5, 4, 5, 40
20 triệu VNĐ,"Sen Trì, Bình Yên, Thạch Thất", 99.8m2,"
    Chính chủ cần tiền bán lô đất 99,8m2 phía sau trường cấp 2 Bình Yên,2 MT- Gần khu công nghệ cao Hoà Lạc- Gần chợ dân sinh- Gần UBND xã Bình Yên- Tuyến 2 tỉnh lộ 420 ( cách 420 100m)- 1,7 km là đến bệnh viện đa khoa Thạch Thất- Đường thông rộng ô tô đỗ cửaVào vốn đầu tư là lãi ngay tức thìLH Mr Hoàng add zalo để biết thêm thông tin và được hỗ trợ đi xem đất miễn phí
 
",19/05/2022,Tin thường,batdongsan_so_com_vn_1673824196.4326956, 5,,,, 5
"8,7 tỷ VNĐ","Đội Cấn, Ba Đình, Hà Nội.", 90m2," Bán nhà mặt ngõ Đội Cấn Ba Đình – 4 tầng – 90m2 – Chỉ 8.7 tỷ. VỊ TRÍ MẶT PHỐ ĐỘI CẤN – TRUNG TÂM QUẬN BA ĐÌNH. NHÀ 4 TẦNG – 90M2 – GIÁ CHƯA ĐẾN 100 TRIỆU/M2.+ Vị trí đẹp, hiếm nhà bán. Xung quanh tiện ích không thiếu gì.+ Vài bước ra mặt phố Đội Cấn.+ Để ở hoặc đầu tư đều đỉnh.+ Chủ nhiệt tình, thiện chí bán.+ Sổ vuông vắn, cực đẹp – pháp lý sạch sẽ - luôn sẵn sàng giao dịch.Khách quan tâm liên hệ Mr Đức: 0857619534. ",19/05/2022,Tin thường,batdongsan_so_com_vn_1673824197.4858792,, 4, 6,,
4 tỷ VNĐ,"Phường Hàng Bột, Đống Đa", 42m2,"CC cần bán nhà cực hiếm  Phố Khâm Thiên, Đống Đa, 42 m2, 5 tầng, MT 5m, nhỉnh 4 tỷ + Chính chủ cần bán nhà Phố Khâm Thiên, Đống Đa, nhà cực thoáng, vài bước ra ô tô đỗ, diện tích 42m2, mặt tiền 5m, nhà 5 tầng. + Nhà Trung tâm quận Đống Đa,  thông phố Tôn Đức Thắng, tiện lợi ra phố Khâm Thiên, ra ngã 5 Ô Chợ Dừa, đi đâu cũng tiện. + Gần chợ, siêu thị tiện ích, bệnh viện, hồ sinh thái, khu vui chơi, giải trí, thuận lợi kinh doanh online, cách trường học các cấp chỉ vài phút đi bộ. + Sổ đỏ đẹp, sẵn sàng giao dịch + Giá thoả thuận + Liên hệ Anh Minh, chuyên nhà đất thổ cư, Đống Đa, Thanh Xuân, sẵn sàng tư vấn miễn phí 24/7. ĐT: 0913 220 691. ",19/05/2022,Tin thường,batdongsan_so_com_vn_1673824198.6567464, 5, 5, 3, 4, 2
7 tỷ VNĐ,Kiến Hưng- Hà Đông, 60m2,"Bán nhà phân lô, vỉa hè, ô tô tránh, Kiến Hưng, Hà Đông, 60m, 5 tầng, dân xây Cần tiền cho con du học nước ngoài nên cần bán gấp nhà đẹp, có vỉa hè rộng kinh doanh, làm văn phòng hay ở rất tốt, đường trước nhà rộng ô tô tránh, thiết kế 5 tầng hiện đại đầy đủ công năng sử dụng. Xung quanh nhà đầy đủ tiện ích gần sân bóng, bể bơi, chợ dân sinh, siêu thị, ngân hàng, trường học các cấp., dân cư đông đúc kinh doanh sầm uất nhất khu vực. Cơ sở hạ tầng, giao thông đồng bộ gần các Khu đô thị lớn Văn Phú, Thanh Hà, Phú Lương, Xa La, di chuyển sang Thanh Trì, Lên trên Văn Quán, hàng xóm của Đa Sỹ. Sổ vuông chính chủ, sẵn sàng giao dịch. Giá: 7 tỷ ( có thương lượng). Liên hệ : Huyền Hà Đông ( 0363703491- 0965472910)- Chuyên gia nhà Thổ cư tư vấn hàng nghìn ngôi nhà tiết kiệm THỜI GIAN- CÔNG SỨC- TIỀN BẠC. Hỗ trợ 24/7 và tư vấn pháp lý, vay vốn.",19/05/2022,Tin thường,batdongsan_so_com_vn_1673824199.6530812,, 5,,,
13 tỷ VNĐ,Văn Phú- Hà Đông, 90m2,"Siêu phẩm Liền kề Văn Phú 90m, 5 tầng thang máy, vỉa hè kinh doanh sầm uất, ô tô, dân xây Cần bán nhà đẹp Liền kề Văn Phú gần toà Victora, khu vực sầm uất, ở kết hợp kinh doanh hay làm văn phòng quá đỉnh với 5 tầng thang máy hiện đại, vỉa hè rộng đá bóng, đường trước nhà ô tô tránh. Xung quanh đầy đủ tiện ích gần chợ, trung tâm mua sắm, siêu thị Metro, trường học, ngân hàng, bệnh viện không thiếu,…khu văn minh đáng sống bậc nhất Hà Đông. Giao thông di chuyển ra trục chính Quang Trung sang Lê Trọng Tấn thông ra Văn La, hàng xóm Lý Thường Kiệt,… Sổ vuông chính chủ, sẵn sàng giao dịch. Giá: 13 tỷ ( có thương lượng). Liên hệ : Huyền Hà Đông ( 0363703491- 0965472910)- Chuyên gia nhà Thổ cư tư vấn hàng nghìn ngôi nhà tiết kiệm THỜI GIAN- CÔNG SỨC- TIỀN BẠC. Hỗ trợ 24/7 và tư vấn pháp lý, vay vốn.",19/05/2022,Tin thường,batdongsan_so_com_vn_1673824200.7890427,, 5,,,
13 tỷ VNĐ,Văn Phú- Hà Đông, 90m2,"Siêu phẩm Liền kề Văn Phú 90m, 5 tầng thang máy, vỉa hè kinh doanh sầm uất, ô tô, dân xây Cần bán nhà đẹp Liền kề Văn Phú gần toà Victora, khu vực sầm uất, ở kết hợp kinh doanh hay làm văn phòng quá đỉnh với 5 tầng thang máy hiện đại, vỉa hè rộng đá bóng, đường trước nhà ô tô tránh. Xung quanh đầy đủ tiện ích gần chợ, trung tâm mua sắm, siêu thị Metro, trường học, ngân hàng, bệnh viện không thiếu,…khu văn minh đáng sống bậc nhất Hà Đông. Giao thông di chuyển ra trục chính Quang Trung sang Lê Trọng Tấn thông ra Văn La, hàng xóm Lý Thường Kiệt,… Sổ vuông chính chủ, sẵn sàng giao dịch. Giá: 13 tỷ ( có thương lượng). Liên hệ : Huyền Hà Đông ( 0363703491- 0965472910)- Chuyên gia nhà Thổ cư tư vấn hàng nghìn ngôi nhà tiết kiệm THỜI GIAN- CÔNG SỨC- TIỀN BẠC. Hỗ trợ 24/7 và tư vấn pháp lý, vay vốn.",19/05/2022,Tin thường,batdongsan_so_com_vn_1673824201.7604437,, 5,,,
7 tỷ VNĐ,Kiến Hưng- Hà Đông, 60m2,"Bán nhà phân lô, vỉa hè, ô tô tránh, Kiến Hưng, Hà Đông, 60m, 5 tầng, dân xây Cần tiền cho con du học nước ngoài nên cần bán gấp nhà đẹp, có vỉa hè rộng kinh doanh, làm văn phòng hay ở rất tốt, đường trước nhà rộng ô tô tránh, thiết kế 5 tầng hiện đại đầy đủ công năng sử dụng. Xung quanh nhà đầy đủ tiện ích gần sân bóng, bể bơi, chợ dân sinh, siêu thị, ngân hàng, trường học các cấp., dân cư đông đúc kinh doanh sầm uất nhất khu vực. Cơ sở hạ tầng, giao thông đồng bộ gần các Khu đô thị lớn Văn Phú, Thanh Hà, Phú Lương, Xa La, di chuyển sang Thanh Trì, Lên trên Văn Quán, hàng xóm của Đa Sỹ. Sổ vuông chính chủ, sẵn sàng giao dịch. Giá: 7 tỷ ( có thương lượng). Liên hệ : Huyền Hà Đông ( 0363703491- 0965472910)- Chuyên gia nhà Thổ cư tư vấn hàng nghìn ngôi nhà tiết kiệm THỜI GIAN- CÔNG SỨC- TIỀN BẠC. Hỗ trợ 24/7 và tư vấn pháp lý, vay vốn.",19/05/2022,Tin thường,batdongsan_so_com_vn_1673824203.2434773,, 5,,,
"4,5 tỷ VNĐ",Thanh Bình - Mỗ Lao - Hà Đông, 37m2,"Thiết kế: Nhà xây 4 tầng chắc chắn cửa gỗ, cầu thang gỗ Nhà có 4 phòng ngủ, 3 phòng vệ sinh + 01 phòng khách + 01 phòng thờ tầng 5 + sân phơi Pháp lý: Sổ đỏ chính chủ sẵn sàng giao dịch Liên hệ: Mr Đức Luyện thổ cư : 0911779569 để được hỗ trợ.",19/05/2022,Tin thường,batdongsan_so_com_vn_1673824204.544997, 3, 4, 4, 3, 2
