price,address,Diện tích,Mặt tiền,Lộ giới,Số tầng,Số phòng ngủ,Số toilet,Details,Ngày đăng,Loại tin,id,Hướng
"3,55 tỷ VNĐ","Đường Vũ Tông Phan, Khương Đình, Thanh Xuân", 45m2, 4, 3, 5, 5, 4,"
    Bán nhà Tiến sỹ Trang Vợ chồng trẻ giỏi giang thành đạt,  nhà ở có lộc đã mua biệt thự khu đô thị linh đàm, rất thiện chí thanh khoản nhanh nên giá bán đưa ra thấp hơn thị trường rất nhiều với tòa 5 tầng lừng lững, diện tích rộng cực hiếm, mà giá quá rẻ với thông số sau:+ Diện tích: 45m2, 5 tầng.+ Mặt tiền: 4.5m,.  Giá bán 3.55 tỷ. ( có thương lượng).Vị trí  nằm trên ngõ rộng, thoáng ba gac tránh nhau thoải mái, chỉ 2 phút ra ngã Tư Sở tiếp cận nhanh và thuận tiển di chuyển muôn nơi. Nhà 5 tầng xây mới được mấy năm còn đẹp như mới, khung cột chắc chắn có thiết kế hiện đại, thiết kế tinh tế, phù hợp gia đình nhiều thế hệ sinh sống an lành.+ Sổ đỏ vuông đẹp n, sẵn sàng giao dịch.+ Liên hệ:  E. Phụng thổ địa  (Gọi ngay 0968593755 hoặc inbox 24/24g)+  Nếu cần vay ngân hàng tôi sẽ hỗ trợ vay lãi suất 70%, vay trong 40 năm.+ Em Phụng thổ  địa chuyên nhà đẹp Thanh Xuân, khẳng định căn nhà đẹp và giá rẻ nhất thị trường chủ nhà ở rất có lộc. Chúc quý anh chị 8386 vạn sự may mắn mua được căn nhà như ý.
",05/12/2022,Tin thường,batdongsan_so_com_vn_1673784755.7465048,
"6,35 tỷ VNĐ","Đường Tây Sơn, Ngã Tư Sở, Đống Đa", 60m2, 4, 3, 5, 5,,"Cần bán gấp trước tết, nhà đẹp phố Tây Sơn – Ngã Tư Sở, diện tích rộng 60m2 xây 5 tầng tuyệt đẹp chỉ việc xách quần áo về ở ngay. Cách Ngã Tư Sở 100m, vị trí đẹp, kinh doanh thuận tiện, thiết kế hiện đại với 5 phòng ngủ lớn full đồ cao cấp. Chủ tặng hết lại toàn bộ nội thất Vip. Sổ đỏ nở hậu, pháp lý rõ ràng, giao dịch ngay Liên hệ ngay em Phước Đức : 0369699998 để đi xem nhà miễn phí Nhà đẹp - Ở sướng – Dễ thanh khoản Em Đức tận tâm, chuyên nghiệp, hiệu quả! Xin cảm ơn!",05/12/2022,Tin thường,batdongsan_so_com_vn_1673784756.9223619,
"28,5 tỷ VNĐ","Đường Thái Hà, Trung Liệt, Đống Đa", 76m2, 6, 1, 8,,,"+ Vị trí nằm ở mặt tiền đường Võ Văn Dũng tọa lạc giữa khu vực rất nhiều văn phòng, tòa nhà lớn... 3 bước ra Quận Ủy Đống Đa, Hồ Hoàng Cầu.. An sinh tuyệt đỉnh, vỉa hè rộng để ô tô thoải. Tiện ích xung quanh không thiếu gì. Giao thông đi lại thuận tiện giao với nhiều tuyến phố víp Huỳnh Thúc Kháng,Nguyên Hồng ,Nguyễn Trí Thanh... - Căn nhà với thiết kế văn phòng cực kì hiện đại, nội thất sang xịn, phong cách sang trọng. Chủ thiết kế tâm huyết với 8 tầng thang máy... phù hợp làm văn phòng đại diện cực kì đănt cấp + SỔ ĐỎ CHÍNH CHỦ, sử dụng lâu dài. Nhà có thiết kế đầy đủ, hệ thồng phòng cháy chữa cháy hiện đại, có thang thoát hiểm khi cần + Liên hệ: Nguyễn Dương – để được tư vấn, hỗ trợ xem nhà miễn phí. ",04/12/2022,Tin thường,batdongsan_so_com_vn_1673784757.9596786,
"3,1 tỷ VNĐ",Bách Khoa - Hà Nội, 60m2,,,,,,"Bán nhà riêng phố Trần Đại Nghĩa, khu vực trung tâm, vị trí đẹp, giá chỉ 3.1 tỷ. - Nhà tâm huyết bao năm tu trí làm ăn của chủ tự xây dựng chắt chiu, nên thiết kế kết cấu vô cùng kiến cố, chắc chắn. - Vị trí đẹp, chỉ vài bước chân là ra mặt phố chính. - Ngõ rộng, xe ba gác phi vèo vèo.   Khu Bách Khoa là một trong những trung tâm chính trị văn hóa bậc nhất của Thủ đô nên dân cư vô cùng đông đúc kinh doanh sầm uất, nhiều loại hình dịch vụ điện đường trường trạm hạ tầng được đầu tư đủ cả chả thiếu thứ gì.  - Xung quanh là quần thể các trường đại học lớn như Bách Khoa, Xây Dựng, Kinh Tế Quốc Dân..... cũng như các bệnh viện lớn như Bạch Mai, Ung Bướu, Thanh Nhàn  - Dân trí cao, an ninh tốt, hàng xóm toàn giản viên hưu trí có tuổi thân thiện chan hòa. Chủ bán đi về trông cháu cho con an hưởng tuổi già nên cực kỳ thiện trí. Chi tiết LH: Nhật Nhà Đất  0977194820 (Chuyên Nhà đất Thổ cư với nguồn hàng Hơn 6000 Căn Nhà  Lớn nhỏ Từ 1 – 100 Tỷ trên khắp địa bàn Hà Nội sẵn sàng giúp Khách hàng tìm được những căn nhà ưng ý nhất).Phương châm làm việc:-Tận Tâm, Uy tín , Chuyên nghiệp cái Tâm và cái Tầm đặt lên hàng đầu- Không kênh giá chủ nhà- Miễn phí toàn bộ dịch vụ: Dẫn khách xem nhà, tư vấn pháp lý. ",04/12/2022,Tin thường,batdongsan_so_com_vn_1673784759.011862,
"2,7 tỷ VNĐ","đường Ngô Gia Tự, Phường Đức Giang, quận Long Biên, Hà Nội", 33m2,,, 5, 3,,"Quá Đẹp ! Bán Ngay Nhà Gần Ngô Gia Tự, Long Biên 4T, 33m2 chỉ 2,7 tỷ (Lh:  0965 722 358) + Tầng 1 : Phòng khách + Bếp + wc. + Tầng 2: Mỗi tầng 1 phòng ngủ, 1 wc khép kín. + Tầng 4: 1 Phòng ngủ, 1 phòngthờ, sân phơi.  Nhà đẹp, thiết kế công năng bố trí hợp lý, thi công xây dựng móng ép cọc bê tông cốt thép chắc chắn. Xung quanh gần trường học, chợ, các tổ hợp dịch vụ. Thuận tiện kết nối các tuyến phố như ra đường Ngô Gia Tự, Thanh Am, Đặng Vũ Hỷ, Cầu Đuống..bán kính không xa là Trường Lâm, Hoa Lâm, Ô Cách, Lệ Mật.. Big C Long Biên… Nhà cũng thuận tiện đi sang hướng Thượng Thanh, Đức Giang.. khực phát triển từng ngày của quận Long Biên. LH Mr Tùng : 0965 722 358 ",04/12/2022,Tin thường,batdongsan_so_com_vn_1673784760.0141814,
36 tỷ VNĐ,Hồ Văn Chương Đống Đa Hà Nội, 76m2, 8,, 5,,,"- Diện tích 76m2 X5 tầng. Mặt tiền 8.1m 36 tỷ ( có thương lượng ) - Vị trí vàng, đẹp nhất phố, view hồ, mặt tiền siêu rộng, kinh doanh sầm uất đa dạng ngày đêm.- Thiết kế 5 tầng, kết hợp kinh doanh cafe và karaoke, có lối thoát hiểm cạnh nhà.- Tầng 1: Kinh doanh cafe + 1 phòng! - Tầng 2.3.4: Mỗi tầng 2 phòng karaoke! - Tầng 5: Phòng thờ, sân thượng. - Sổ đỏ chính chủ, pháp lý chuẩn! Liên hệ em Quân để được tư vấn! 0385 94 1802 Miễn ( TG Quảng Cáo )",04/12/2022,Tin thường,batdongsan_so_com_vn_1673784765.9651175,
"4,1 tỷ VNĐ","Đường Quốc lộ 32, Đức Thượng, Hoài Đức", 115m2, 6,,,,,"
    Cực hiếm Bán đất Đức Thượng , Hoài Đức Kinh doanh, Ô tô đỗ cửa 115m nhỉnh 4 tỷ
+ Đầu tư, Xây CCMN, Nhà ở..
- Nhanh tay sinh lời ngay khi cọc
-Vị trí cực đẹp, Gần các trường học cấp 1,2,3, Khu Công nghiệp, Chợ, Khu đô thị,.. Khu vực phát triển mạnh, Tương lai lên Quận Hoài Đức.
- Giao thông thuận tiện Quốc lộ 32, vành đai 4, vành đai 3.5
- Sổ CC, sang tên nhanh gọn. Giá thương lượng. Chủ thiện chí
Thông tin chi tiết liên hệ Mr Đức Nhà Đẹp 0898839292.
Rất nhiều Nhà Đất đẹp phù hợp mọi nhu cầu Anh Chị Em.
",04/12/2022,Tin thường,batdongsan_so_com_vn_1673784766.9463387,
"4,5 tỷ VNĐ","Đường Kim Mã, Kim Mã, Ba Đình", 45m2, 6, 5, 5, 3, 4,"
    
Bán nhà đẹp 45m2 5tầng mặt tiền 6m 4.5tỷ gần ôtô 166 phố Kim Mã Ba Đình, chủ mót bán giá siêu rẻ phù hợp cả đầu tư lướt

MẶT TIỀN KHỦNG - TRƯỚC NHÀ NGÕ 3M - MÓNG LÊN 7 TẦNG THOẢI MÁI

- Ngõ ôtô 290 Kim Mã, kinh doanh cực kỳ sầm uất, thông tứ tung sang 116, 192, 82 Kim Mã, Giang Văn Minh, Đội Cấn, Nguyễn Chí Thanh, Liễu Giai, Văn Cao, Đào Tấn... 
- Nhà thuộc khu cán bộ nhà nước, an ninh dân trí cao, xung quanh tiện ích phong phú quy hoạch ổn định trường trạm, chợ, Bệnh viện, siêu thị, trung tâm thương mại không thiếu thứ gì.
- Thiết kế KBCT chắc chắn, dầm 45 lên tầng thoải mái, nhà có thể cải tạo lắp thang máy.
- T1: Phòng khách + bếp.
- T2: Phòng ngủ + Ban công + Wc.
- T3: 2 phòng ngủ + Wc.
- T4: Sân Phơi + phòng thờ Đã đổ trần full mái, có thể cải tạo thêm phòng ngủ.
- T5: Tum trồng rau.
- Sổ đỏ chính chủ , pháp lý chuẩn. Sẵn giao dịch
Chú ý: Nhà đất cuối năm giao dịch cực nhanh xem ngay kẻo lỡ!
1. LH: A. Hoàng Anh 0934266313 (tư vấn, lọc nhà, xem nhà miễn phí)
2. Link kho nhà đẹp Quận Ba Đình: https://www.facebook.com/332042891070009/
3. Hỗ trợ tài chính cho vay mua nhà đến 80% giá trị căn nhà, lãi suất thấp nhất thị trường.
",04/12/2022,Tin thường,batdongsan_so_com_vn_1673784768.0458636,
"2,75 tỷ VNĐ","Đường Lĩnh Nam, Lĩnh Nam, Hoàng Mai", 35m2, 3, 2, 4, 3, 3,"Nhà xây 4 tầng kiên cố, sẵn 3 phòng riêng đẹp đủ công năng, sổ đỏ chính chủ, chủ mới về ở ngay.+ Ngõ 294 ô tô tránh kinh doanh sầm uất, nhà cách mặt ngõ chỉ 30m, ô tô đỗ sát nhà.+ Nhà gần chợ dân sinh, hệ thống trường học các cấp. Phố Lĩnh Nam kinh doanh sầm uất ngày đêm, tiện ích đầy đủ. xây dựng 4 tầng kiên cố, thiết kế hiện đại, chuẩn công năng:-Tầng 1 phòng khách, bếp, vệ sinh.-Tầng 2,3 mỗi tầng 1 phòng ngủ rộng, vệ sinh.-Tầng 4: 1 phòng ngủ, 1 phòng thờ, sân phơi.+ Sổ đỏ chính chủ, sẵn sàng giao dịch.",04/12/2022,Tin thường,batdongsan_so_com_vn_1673784769.1679242,
6 tỷ VNĐ,"Đường Giáp Bát, Giáp Bát, Hoàng Mai", 58m2, 4, 4, 5, 5, 5,"- -Chính chủ gia đình cần bán căn nhà Giáp Bát, quận Hoàng Mai, 58m2, nhà mới, có sân để xe riêng, ngõ ô tô phi vèo vèo. - -Vị trí đắc địa, không lỗi phòng thủy, cạnh CAP, an ninh cực tốt, ngõ nông, thông tứ tung, xung quanh tiện ích ngập tràn, gần Chợ, trường học các cấp…. đi lại cực thuận tiện. - -Chủ cần thanh khoản gấp. - -Diện tích 58m2 x5 tầng, tổng 6 pn, nhà mới xây cực chắc chắn và đầy đủ công năng sử dụng. -Sổ đỏ chính chủ, vuông vắn, sẵn sàng giao dịch. - -Giá chỉ 6 tỷ ( có thương lượng ). -Liên hệ Mr Minh ( chuyên nhà đẹp ). Sdt cạnh bài đăng, để được xem nhà miễn phí và thương lượng trực tiếp.",04/12/2022,Tin thường,batdongsan_so_com_vn_1673784770.085515,
"9,5 tỷ VNĐ","Đường Nguyễn Sơn, Bồ Đề, Long Biên", 88m2, 6, 3, 3, 3,,"* Nhà chủ tự xây tương đối lâu, khung cột bê tông chắc chắn, sửa sang lên tầng thoải mái.* Nằm khu phân lô cán bộ Hàng Không.* Ngõ thông Nguyễn Văn Cừ, 4 chỗ đỗ cửa.* 50m mặt phố Nguyễn Sơn, 70m mặt đường Nguyễn Văn Cừ.* Tiện ích vô đối ngay tại cửa nhà.* Gần trường học các cấp, các TTTM, các bệnh viện.* Khu dân trí cao, trí thức, thượng lưu.* Giao thông thuận tiện, 5 phút cầu Chương Dương, ngã 6 Cầu Chui.* 20 phút Nội Bài.* Sổ chính chủ, pháp lý chuẩn, sẵn sàng sang tên.",04/12/2022,Tin thường,batdongsan_so_com_vn_1673784771.289409,
"18,6 tỷ VNĐ","Đường Đại lộ Thăng Long, An Khánh, Hoài Đức", 160m2, 8,,,,,"Cần Bán Biệt thự Vinhome Thăng Long Đẳng cấp vượt trội 160m 4 tầng 18,x tỷ  + Đẳng cấp vươt trội, trốn bình yên trốn đi về. - An sinh tuyệt vời, gần gũi thiên nhiên, tiện ích đầy đủ. Hệ thống trường học Vinschool, khu vui chơi thể thao.. Biệt thự đẳng cấp từ trong nhà ra cửa. Khuôn viên phong cảnh sân vườn trong lành. - Để lại toàn bộ full Nội thất cao cấp xịn xò thiết kế công năng đầy đủ ánh sáng tự nhiên, khí tươi trong lành.  - Sổ CC, pháp lý rõ ràng sẵn sàng giao dịch nhanh gọn. - Xem nhà liên hệ Mr Đức Nhà Đep 0898839292 - 0898839292. Rất nhiều nhà đẹp phù hơp mọi nhu cầu Anh Chị Em.",04/12/2022,Tin thường,batdongsan_so_com_vn_1673784772.344,
"2,85 tỷ VNĐ","Thượng Phúc, Tả Thanh Oai, Thanh Trì, Hà Nội", 62m2, 4, 3,,,,"Bán đất thổ cư sổ đỏ 62m2 mặt tiền 4m nở hậu tại Thượng Phúc, Tả Thanh Oai, Thanh Trì. Đất vuông vắn, nguyên thổ, cách đường Thượng Phúc ô tô tránh 1 nhà. Ngõ trước nhà 2,5m thoáng trước vĩnh viễn. Vị trí trung tâm chợ Thượng Phúc, gần vị trí cầu quy hoạch sang Khu đô thị Thanh Hà Cienco 5, cách Cầu Tó 3,5km, sổ đỏ cất két, mốc giới xây bao rõ ràng",04/12/2022,Tin thường,batdongsan_so_com_vn_1673784773.4227805, Đông bắc
"3,1 tỷ VNĐ","đường Mai Phúc, Phường Phúc Đồng, quận Long Biên, Hà Nội", 33m2, 4,, 5, 3,,"Bán Nhà Đẹp Phố Mai Phúc, Phúc Đồng, Long Biên 33m2, 5T chỉ 3,1 tỷ       Thiết kế : + Tầng 1 : Phòng khách, bếp, wc + Tầng 2,3,4 mỗi tầng 1 phòng, wc +Tầng 5: Phòng thờ, sân phơi. Nhà thiết kế đẹp, hiện đại, khu vực Vip của quận Long Biên, xung quanh thuận tiện kết nối các tuyến phố như ra Phố Mai Phúc, Chu Huy Mân, Nguyễn Lam, Nguyễn Văn Linh, Tân Thụy..Bán kính không xa là KĐT Sài Đồng, Cầu Vĩnh Tuy, TTTM Aone Mall Long Biên… Sổ đẹp vuông vắn, pháp lý rõ ràng. Lh ngay cho Mr Tùng : 0965 722 358",04/12/2022,Tin thường,batdongsan_so_com_vn_1673784774.476985,
"4,7 tỷ VNĐ","Đường Hồ Tùng Mậu, Cầu Diễn, Nam Từ Liêm", 32m2, 4, 3, 5,,,"+ Chính chủ cần bán nhà trước tết để thu hồi vốn chủ giảm chào 300 triệu nhà ngõ 199 Phố Hồ Tùng Mậu, Quận Nam Từ Liêm, diện tích 32m2 x 5 tầng giá 4,75 tỷ. + Nhà Hồ Tùng Mậu ngay sát Cầu Diễn, 30m ra khu độ thị Vinhome Gardenia, cách Đại học Thương Mại 500m. + Nhà nằm trong khu dân cư yên tĩnh, ô tô đỗ cổng. Chủ tự xây tâm huyết, rất chắc chắn. - T1: Khách, bếp, vs. - T2,3,4: Mỗi tầng 1 PN rộng, vệ sinh ngoài. - T5: Phòng thờ, sân phơi. + Sổ đỏ đầy đủ, pháp lý minh bạc, sẵn sàng dao dịch. + LH,Hoàng Bắc,ĐT: 0377 610 275, chuyên nhà đất,thổ địa hà nội, dẫn khách xem nhà và Tư vấn miễn phí 24/7 ",04/12/2022,Tin thường,batdongsan_so_com_vn_1673784775.8543022,
"3,6 tỷ VNĐ","Đường Quốc lộ 32, Đức Thượng, Hoài Đức", 62m2, 5,,,,,"
    Cực Hiếm Cần Bán Gấp Đất Đức Thượng, Hoài Đức 60m 2 thoáng, Ô tô nhỉnh 3 tỷ
- Nhanh tay Đầu tư sinh lời ngay khi cọc, CCMN, Chia lô...
- Vị trí cực đẹp, Gần các trường học cấp 1,2,3, Khu Công nghiệp, Chợ, Thiên Đường Bảo Sơn, Khu đô thị,.. Khu vực phát triển mạnh, Tương lai lên Quận Hoài Đức.
- Giao thông thuận tiện Quốc lộ 32, vành đai 4, vành đai 3.5
- Sổ CC, sang tên nhanh gọn. Giá thương lượng. Chủ thiện chí
Thông tin chi tiết liên hệ Mr Đức Nhà Đẹp.
Rất nhiều Nhà Đất đẹp phù hợp mọi nhu cầu Anh Chị Em nhé.
",04/12/2022,Tin thường,batdongsan_so_com_vn_1673784777.2007,
"7,65 tỷ VNĐ",Văn Khê - Hà Đông, 50m2, 4,,,,,"Bán liền kề Văn Khê, Hà Đông 50m MT 4m vỉa hè kinh doanh hơn 7 tỷ Chủ nhà cần tiền bán gấp nhà riêng tại Khu đô thị Văn Khê, Hà Đông xây dựng chắc chắn, các tầng thoáng sáng nhà đẹp ở ngay hoặc làm văn phòng quá chuẩn. Giao thông đi lại thuận tiện ra trục chính nối Lê Trọng Tấn – Quang Trung xuống Yên Nghĩa qua Tố Hữu về Vạn Phúc hàng xóm Dương Nội. Tiện ích đầy đủ của khu đô thị, gần Aeon Mall. Chủ nhà muốn bán nhanh để giải quyết công việc giá tốt nhất khu vực. Sổ vuông sẵn sàng giao dịch. Giá: 7.65 tỷ ( gia lộc). Liên hệ : Huyền Ba La Sat Thổ cư ( 0363703491- 0965472910) – Chuyên gia nhà Thổ Cư tư vấn hàng nghìn ngôi nhà tiết kiệm THỜI GIAN- CÔNG SỨC- TIỀN BẠC. Hỗ trợ 24/7 và tư vấn pháp lý, vay vốn. ",04/12/2022,Tin thường,batdongsan_so_com_vn_1673784778.1940427,
"7,7 tỷ VNĐ",Văn Khê - Hà Đông, 50m2,,, 5,,,"Bán nhà riêng Văn Khê, Hà Đông 50mx5T vỉa hè ô tô kinh doanh hơn 7 tỷ Bán nhà liền kề phân lô khu đô thị Văn Khê, Hà Đông chính chủ xây dựng chắc chắn với 5 tầng hiện đại vừa ở vừa kinh doanh văn phòng, mặt tiền rộng, nhà mới ở ngay. Bán kính xung quanh đầy đủ tiện ích khu đô thị, giao thông thuận lợi ra trục chính Lê Trọng Tấn, đường Tố Hữu giáp Nguyễn Thanh Bình xuôi xuống Dương Nội ra Yên Nghĩa. Sổ vuông sẵn sàng giao dịch. Giá: 7.7 tỷ ( gia lộc). Liên hệ : Huyền Ba La Sat Thổ cư ( 0363703491- 0965472910) – Chuyên gia nhà Thổ Cư tư vấn hàng nghìn ngôi nhà tiết kiệm THỜI GIAN- CÔNG SỨC- TIỀN BẠC. Hỗ trợ 24/7 và tư vấn pháp lý, vay vốn. ",04/12/2022,Tin thường,batdongsan_so_com_vn_1673784779.149486,
"3,4 tỷ VNĐ",Hà Trì - Hà Đông, 41m2,,, 4,,,"Bán nhà Hà Trì, Hà Đông 41mx4 tầng ngõ nông gần ô tô ở ngay hơn 3 tỷ Chú tôi chính chủ bán nhà riêng tại phố Hà Trì, Hà Đông để chuyển sang nhà mới rộng hơn. Vị trí đẹp trung tâm đi lại thuận tiện thông số vàng 41m thiết kế 4 tầng hiện đại thoáng sáng ngõ nông cách ô tô vài bước chân, nhà đẹp ở ngay. Nhà bán rất có lộc, gia chủ thành đạt con cháu đuề huề, xung quanh tiện ích không thiếu. Giáp các tuyến phố chính Bà Triệu sang Tô Hiệu qua Lê Lợi gần Nhuệ Giang sang Văn Quán hàng xóm Phúc La. Sổ vuông sẵn sàng giao dịch. Giá: 3.4 tỷ ( gia lộc). Liên hệ : Huyền Ba La Sat Thổ cư ( 0363703491- 0965472910) – Chuyên gia nhà Thổ Cư tư vấn hàng nghìn ngôi nhà tiết kiệm THỜI GIAN- CÔNG SỨC- TIỀN BẠC. Hỗ trợ 24/7 và tư vấn pháp lý, vay vốn. ",04/12/2022,Tin thường,batdongsan_so_com_vn_1673784780.4200892,
"3,4 tỷ VNĐ",Đa Sỹ - Hà Đông, 41m2,,, 4,,,"Bán nhà Đa Sỹ, Hà Đông 41mx4 tầng ngõ nông cách ô tô 5m ở ngay hơn 3 tỷ Chính chủ cần bán nhà riêng tại phố Đa Sỹ, Hà Đông , xây dựng chắc chắn thoáng sáng nhà vẫn còn mới ở ngay đầy đủ công năng, cách ô tô vài bước chân. Xung quanh nhà đầy đủ tiện ích trường chợ, bệnh viện, sân bóng, bể bơi không thiếu, trục chính vào trung tâm phố cổ Hà Đông Tô Hiệu sang Bà Triệu ra Nhuệ Giang sang Lê Hoàng Phong vài bước ra Văn Quán. Chủ nhà bán đi để chuyển sang biệt thự rộng hơn, nhà rất nhiều lộc. Sổ vuông sẵn sàng giao dịch. Giá: 3.4 tỷ ( gia lộc). Liên hệ : Huyền Ba La Sat Thổ cư ( 0363703491- 0965472910) – Chuyên gia nhà Thổ Cư tư vấn hàng nghìn ngôi nhà tiết kiệm THỜI GIAN- CÔNG SỨC- TIỀN BẠC. Hỗ trợ 24/7 và tư vấn pháp lý, vay vốn.",04/12/2022,Tin thường,batdongsan_so_com_vn_1673784781.4273927,
