price,address,Diện tích,Details,Ngày đăng,Loại tin,id,Mặt tiền,Số tầng,Số phòng ngủ,Số toilet,Lộ giới
18 tỷ VNĐ,Hà Nội, 71m2,"Bán nhà phố Láng Hạ gần trường chợ, tòa kinh doanh cao cấp vị trí cực tốt - LH: 0856 96 8656.Diện tích 71 m2.Xây dựng 8 tầng thang máy.Nhà nằm tại ngõ đẹp nhất phố Láng Hạ, đường ô tô tải, vỉa hè rộng.Khu an ninh tốt, dân trí cao cấp, kinh doanh sầm uất.Kết nối Giảng Võ, Thái Hà, Huỳnh Thúc Kháng, Hoàng Cầu, Thành Công, Hào Nam, Ngọc Khánh…Thiết kế hiện đại, thang máy nội thất cao cấp phù hợp để ở, kinh doanh, làm văn phòng…Sổ đỏ chuẩn.Giá chào vô cùng hợp lý chỉ 18 tỷ thương lượng sâu với chính chủ, bao sang tên, tặng full nội thất xịn.Liên hệ ngay Thanh Bình có 9669 căn nhà đẹp giá tốt - 0856 968 656.Xin cảm ơn.",13/05/2022,Tin thường,batdongsan_so_com_vn_1673825059.9294863,,,,,
5 tỷ VNĐ,Đường Trường Chinh-Đống Đa, 62m2,"+Nhà nằm ở vị trí trung tâm quận Đống Đa, tiện ích bạt ngàn.+Vị trí nhà cách đường lớn 30m, ngõ rộng thông thoáng.+Nhà đẹp mới toanh, khách mua xách vali về ở ngay.+Sổ đỏ chính chủ, pháp lý chuẩn, sẵn sàng dao dịch.LH: Mr. Hoan, 0925088355, Chuyên thổ cư Hà Nội, miễn phí xem nhà 24/7. ",13/05/2022,Tin thường,batdongsan_so_com_vn_1673825061.0794103, 4,,,,
"4,4 tỷ VNĐ","Khuất Duy Tiến, Thanh Xuân", 38m2,"BÁN NHÀ KHUẤT DUY TIẾN – THANH XUÂN, 5 TẦNG 38M2, 4.4 TỶ Bán nhà 5 tầng 38m2 đường Khuất Duy tiến, ô tô dừng đỗ cách nhà 50m, khu vực trung tâm quận Thanh Xuân Thuận tiện đi lại ra đường Nguyễn Trãi, Nguyễn Tuân, Nguyễn Xiển, Nguyễn Huy Tưởng … Khu vực trung tâm của các trường Đại học Nhân Văn, KHTN, Hà Nội, Giao thông … Sổ đỏ chính chủ, giao dịch ngay. Thương lượng trực tiếp chủ nhà. Liên hệ: 0918120568",13/05/2022,Tin thường,batdongsan_so_com_vn_1673825062.1824732, 4, 5, 3, 4,
"15,3 tỷ VNĐ",Đường Phạm Khắc Quảng phường Giang Biên, 90m2,"+ Vị trí đất tái định cư Phường Giang Biên, mặt đường, mặt công viên, đường thông các ngả, kinh doanh các thể loại, view nhìn mênh mông, đón đầu gió Sông Đuống vào thành phố, quanh năm khí hậu tring lành, mát rượi, gần Mầm Non Tràng An. + Sổ đỏ vuông đẹp, cất két sẵn sàng giao dịch.",13/05/2022,Tin thường,batdongsan_so_com_vn_1673825063.3852422, 4,,,,
9 tỷ VNĐ,Minh Khai, 54m2,"MẶT PHỐ VỈA HÈ – RẺ NHẤT MINH KHAI – KINH DOANH VIPS = 54m, 3 tầng, giá chỉ 9 tỷ * Khu vực kinh doanh sầm uất mọi mặt hàng, giao thông thuận tiện, vỉa hè rộng rãi. + Đường Minh Khai thuộc con đường hiếm hoi đã làm mới, nói không với quy hoạch. + Chủ nhà thiện chí, cần bán gấp để chia tài sản. + Hiện trạng nhà 3 tầng, có thể sử dụng ngay hoặc phá đi xây căn nhà đẹp và hoành tráng hơn. + Giao thông: Lạc Trung, Nguyễn Khoái, Tam Trinh, Vĩnh Tuy, Dương Văn Bé, Bạch Mai, Kim Ngưu,… + Sổ đỏ chính chủ, giao dịch ngay. * Liên hệ em Bình, chỉ bán nhà đẹp giá tốt, tư vấn và xem nhà nhiệt tình, miễn phí. * Không tiếp môi giới.",13/05/2022,Tin thường,batdongsan_so_com_vn_1673825064.4523916, 4, 3, 2,,
"16,7 tỷ VNĐ",Hà Nội, 88m2,"Bán nhà đường Giang Văn Minh ô tô vào nhà, kinh doanh đỉnh - LH: 0856 968 656.Chính chủ cần bán nhà phố Vạn Bảo Vạn Phúc Ba Đình - lô góc kinh doanh.Diện tích 88m2.Xây dựng 7 tầng thang máy.Vị trí đắc địa, mặt ngõ ô tô tải kinh doanh tất cả các loại hình xịn spa, nhà hàng, văn phòng,...Kết nối phố Giảng Võ, Đội Cấn, Kim Mã, Núi Trúc, Liễu Giai, Văn Cao, Hào Nam, Cát Linh...Thiết kế xuất sắc đẹp hiện đại, thoáng sáng tuyệt vời, nội thất đẳng cấp 5 sao.Chỉ 16.7 tỷ thương lượng sâu, bao sang tên, tặng full nội thất xịn. Sổ đỏ chính chủ.Liên hệ ngay Thanh Bình - 0856 968 656.",13/05/2022,Tin thường,batdongsan_so_com_vn_1673825065.5055692,,,,,
"1,35 tỷ VNĐ",Thanh Xuân Bắc, 35m2,"SỔ ĐỎ NÉT CĂNG - NHÀ ĐẸP NHƯ HOMESTAY. + Khu tập thể Thanh Xuân Bắc có vị trí đắc địa tại quận Thanh Xuân, kết nối giao thông với nhiều đường lớn như: vành đai 3, Nguyễn Trãi, Nguyễn Quý Đức, Lương Thế Vinh, ... Nhà bán thuộc khu Tập thể được đánh giá là có an sinh hàng đầu của khu vực. Với an ninh tốt, gần với chợ, gần các khu cơ quan hành chính của Quận Thanh Xuân, trường học cấp 123,  gần các trường Đại Học như Đại Học Quốc Gia Hà Nội, Y Học cổ truyền, Đại học Thăng Long, ... +Nhà được thiết kế với công năng sử dụng 1PN, 1PK, 1 WC, 1 Bếp, 1 sảnh chờ. + Nhà bán là tầng 1, gần với sân chơi của khu tập thể, rất thích hợp cho các bác lớn tuổi, trẻ nhỏ, người thích chơi thể thao. + Sổ đỏ đẹp, pháp lý sạch, sang tên trong 1 nốt nhạc. + Giá chỉ nhỉnh 1 tỷ (Có thương lượng). + Liên hệ ngay: 0354526316 Em Thế Anh (Hỗ trợ hoàn toàn MIỄN PHÍ từ xem nhà, tư vấn pháp lý, kiểm tra Quy hoạch, vay vốn ngân hàng, sang tên sổ đỏ…)",13/05/2022,Tin thường,batdongsan_so_com_vn_1673825066.785147,, 1, 1,,
"5,3 tỷ VNĐ",Văn Phú- Hà Đông, 42m2,"Bán nhà lô góc, ô tô vào nhà, 42m, 5 tầng mới , dân xây,Văn Phú, Hà Đông Cần tiền bán gấp nhà đẹp trung tâm Văn Phú, Hà Đông, với 5 tầng hiện đại phong cách Châu Âu do các kiến trúc sư thiết kế tỉ mỉ nhà đẹp lô góc thoáng sáng lung linh. Nằm vị trí đắc địa ô tô vào nhà, đường trước nhà ô tô tránh hưởng trọn lợi ích khu đô thị Văn Phú, xem nhà là mê chỉ việc đến ở. Nhà ra trục chính Quang Trung rất gần, xung quanh đầy đủ tiện ích: trường học các cấp, siêu thị, ngân hàng, chợ, công viên,…khu dân trí cao văn minh, nơi ở rất tĩnh. Giao thông vô cùng thuận lợi ra Lê Trọng Tấn, hàng xóm Văn La, song song với Trần Đăng Ninh và Lý Thường Kiệt, rất gần Hà Cầu. Sổ đỏ vuông, sẵn sàng giao dịch. Giá: 5.3 ( có thương lượng). Liên hệ : Huyền Hà Đông ( 0363703491- 0965472910)- Chuyên gia nhà Thổ cư tư vấn hàng nghìn ngôi nhà tiết kiệm THỜI GIAN- CÔNG SỨC- TIỀN BẠC. Hỗ trợ 24/7 và tư vấn pháp lý, vay vốn.",13/05/2022,Tin thường,batdongsan_so_com_vn_1673825067.8602717,, 5,,,
"5,28 tỷ VNĐ",Mỗ Lao- Hà Đông, 41m2," Nhà đẹp ô tô vào nhà, lô góc, 5 tầng hiện đại, dân xây, 41m, Mỗ Lao, Hà Đông Cần bán gấp nhà đẹp đầu tư nhà xưởng máy móc, do dân tự thuê thiết kế rất đẹp phong cách hiện đại, đầy đủ công năng sử dụng cho những khách hàng khó tính nhất với 5 tầng lô góc ánh sáng ngập tràn, mặt tiền rộng ô tô vào nhà. Gần các trường học, bệnh viện, siêu thị Big C, chợ, ngân hàng .Khu dân trí cao, văn minh, an ninh tuyệt đối. Giao thông di chuyển rất thuận lợi lên Thanh Xuân, sang Nam Từ Liêm, cạnh các khu đô thị lớn: Văn Quán, với làng Việt Kiều Châu Âu Nguyễn Văn Lộc, hàng xóm Trần Phú, cạnh Bưu điện Hà Đông Vạn Phúc,… - Sổ đỏ vuông, sẵn sàng giao dịch. Giá: 5.28 ( có thương lượng). Liên hệ : Huyền Hà Đông ( 0363703491- 0965472910)- Chuyên gia nhà Thổ cư tư vấn hàng nghìn ngôi nhà tiết kiệm THỜI GIAN- CÔNG SỨC- TIỀN BẠC. Hỗ trợ 24/7 và tư vấn pháp lý, vay vốn.",13/05/2022,Tin thường,batdongsan_so_com_vn_1673825068.9733257,, 5,,,
"5,28 tỷ VNĐ",Mỗ Lao- Hà Đông, 41m2,"Nhà đẹp ô tô vào nhà, lô góc, 5 tầng hiện đại, dân xây, 41m, Mỗ Lao, Hà Đông Cần bán gấp nhà đẹp đầu tư nhà xưởng máy móc, do dân tự thuê thiết kế rất đẹp phong cách hiện đại, đầy đủ công năng sử dụng cho những khách hàng khó tính nhất với 5 tầng lô góc ánh sáng ngập tràn, mặt tiền rộng ô tô vào nhà. Gần các trường học, bệnh viện, siêu thị Big C, chợ, ngân hàng .Khu dân trí cao, văn minh, an ninh tuyệt đối. Giao thông di chuyển rất thuận lợi lên Thanh Xuân, sang Nam Từ Liêm, cạnh các khu đô thị lớn: Văn Quán, với làng Việt Kiều Châu Âu Nguyễn Văn Lộc, hàng xóm Trần Phú, cạnh Bưu điện Hà Đông Vạn Phúc,… - Sổ đỏ vuông, sẵn sàng giao dịch. Giá: 5.28 ( có thương lượng). Liên hệ : Huyền Hà Đông ( 0363703491- 0965472910)- Chuyên gia nhà Thổ cư tư vấn hàng nghìn ngôi nhà tiết kiệm THỜI GIAN- CÔNG SỨC- TIỀN BẠC. Hỗ trợ 24/7 và tư vấn pháp lý, vay vốn.",13/05/2022,Tin thường,batdongsan_so_com_vn_1673825070.1491551,, 5,,,
"5,3 tỷ VNĐ",Văn Phú- Hà Đông, 42m2,"Bán nhà lô góc, ô tô vào nhà, 42m, 5 tầng mới , dân xây,Văn Phú, Hà Đông Cần tiền bán gấp nhà đẹp trung tâm Văn Phú, Hà Đông, với 5 tầng hiện đại phong cách Châu Âu do các kiến trúc sư thiết kế tỉ mỉ nhà đẹp lô góc thoáng sáng lung linh. Nằm vị trí đắc địa ô tô vào nhà, đường trước nhà ô tô tránh hưởng trọn lợi ích khu đô thị Văn Phú, xem nhà là mê chỉ việc đến ở. Nhà ra trục chính Quang Trung rất gần, xung quanh đầy đủ tiện ích: trường học các cấp, siêu thị, ngân hàng, chợ, công viên,…khu dân trí cao văn minh, nơi ở rất tĩnh. Giao thông vô cùng thuận lợi ra Lê Trọng Tấn, hàng xóm Văn La, song song với Trần Đăng Ninh và Lý Thường Kiệt, rất gần Hà Cầu. Sổ đỏ vuông, sẵn sàng giao dịch. Giá: 5.3 ( có thương lượng). Liên hệ : Huyền Hà Đông ( 0363703491- 0965472910)- Chuyên gia nhà Thổ cư tư vấn hàng nghìn ngôi nhà tiết kiệm THỜI GIAN- CÔNG SỨC- TIỀN BẠC. Hỗ trợ 24/7 và tư vấn pháp lý, vay vốn.",13/05/2022,Tin thường,batdongsan_so_com_vn_1673825071.358911,, 5,,,
,Tây Sơn-Ngã Tư Sở, 37m2,"+Nhà nằm ở vị trí trung tâm quận Đống Đa, tiện ích bạt ngàn.+Vị trí nhà cách đường lớn 30m, ngõ rộng thông thoáng.+Nhà đẹp mới toanh, khách mua xách vali về ở ngay.+Sổ đỏ chính chủ, pháp lý chuẩn, sẵn sàng dao dịch.LH: Mr. Hoan, 0925088355, Chuyên thổ cư Hà Nội, miễn phí xem nhà 24/7. ",13/05/2022,Tin thường,batdongsan_so_com_vn_1673825072.339288, 5, 4,,,
"13,3 tỷ VNĐ",Nam Tu Liem, 116m2,"Nhà xây thô 4T khách mua về thiết kế hoàn thiện ở ngay theo ý mình. Khu vực đang phát triển nhất Quân mấy phút ra Đại Lộ Thăng Long, Lê Quang Đao.Tầng 1 khách bếp.Tâng 2, 3, 4 phòng ngủ phòng thớ sân phơi.LH: 0845681666",13/05/2022,Tin thường,batdongsan_so_com_vn_1673825073.4533074,,,,,
"4,5 tỷ VNĐ",Quan Nhân, 35m2,"Nhỉnh 4 tỷ có nhà 5 tầng mới tinh tươm ngay Quan Nhân Thanh Xuân – lh: 0376247299. + Nhà 5 tầng, mặt tiền cận 4m, vài bước ra phố. + Khu vực Thanh Xuân vô vàn tiện ích, dễ tới Vũ Trọng Phụng, Nguyễn Trãi, Ngã Tư Sở, Láng, … + Nhà siêu mới, siêu đẹp, trước nhà ngõ rộng dân trí tốt. + Sổ đỏ đẹp, chinh chủ, nở hậu, sang tên nhanh. + Giá cả thương lượng.  Liên hệ: Em Việt Anh Thổ cư 0376247299 để được tìm hiểu và xem chi tiết căn nhà miễn phí.  ",13/05/2022,Tin thường,batdongsan_so_com_vn_1673825074.5852797,,,,,
175 tỷ VNĐ,"đường Hồ Tây, Phường Quảng An, Quận Tây Hồ, Hà Nội", 662m2,"Chính chủ bán nhà ở ven đường Hồ Tây, Phường Quảng An, Quận Tây Hồ, Hà NộiDiện tích đất: 662,30m2 - Đã xây dựng 2 tòa nhà - Sổ đỏ chính chủ+ Tòa nhà số 1: Diện tích: 250m2 xây 8 tầng+ Tòa nhà số 2: Diện tích: 190m2 xây 4 tầng- Tổng diện tích xây dựng: 3.500m2- Tổng có 18 căn hộ (Mỗi căn hộ diện tích trên 130m2)- Hiện đang cho người nước ngoài thuê: 1000.USD/ 1 căn+ Tổng tiền thuê 1 tháng là: 18.000.USD- Có sân trước là: 200m2 - Bể bơi là: 100m2 - Có 1 tầng hầm garaôtô- Vị trí đẹp, giao thông đi lại rất thuận tiện- Khu dân trí cao, an ninh rất tốt, Văn minh thân thiệnGiá bán: 175 tỷ - Bao gồm toàn bộ nội thất - Có thương lượng cho khách thiện trí muaLiên hệ chủ nhà: Anh Hòa: 0903419435 - Miễn trung gian  Nguồn:  http://nhadathanoi.net.vn",13/05/2022,Tin thường,batdongsan_so_com_vn_1673825075.9915168,, 8,,,
130 triệu VNĐ/m2,Hồ Tùng Mậu, 88m2,"- Nhà siêu mới siêu đẹp, cạnh chợ, mặt ngõ kinh doanh sầm uất, ô tô vào nhà. - Chủ xây chắc chắn để ở nhưng đã mua biệt thự nên bán. - Nhà thiết kế hiện đại hệ thống điều hoà âm trần tổng 10 chiếc hiện đại. - Sổ đỏ vuông đẹp chờ chủ nhân tinh tường & may mắn nhất. - Tầng 1,2: Gara oto, thông sàn cho thuê văn phòng. - Tầng 3: 1 phòng khách + phòng ăn + hồ cá cảnh. - Tầng 4: 3 ngủ. - Tầng 5: phòng thờ + sân vườn thượng uyển: bưởi diễn, ổi, khế, … - Liên hệ: Thu Trang 0986520689",13/05/2022,Tin thường,batdongsan_so_com_vn_1673825076.987852,,,,,
69 tỷ VNĐ,"phố Hàng Hành, Phường Hàng Trống, Quận Hoàn Kiếm, Hà Nội", 43m2,"Chính chủ bán nhà mặt phố Hàng Hành, Phường Hàng Trống, Quận Hoàn Kiếm, Hà Nội*** Tòa nhà xây cho người nước ngoài thuê ven hồ Hoàn Kiếm, Cạnh phố Lý Thái Tổ, nhà hàng Thủy TạDiện tích đất: 43m2 x 10 tầng- Diện tích xây dựng: 433m2- Vị trí đắc địa nhất Quận Hoàn Kiếm, kinh doanh vô cùng thuận lợi- Khu dân trí cao, an ninh rất tốt, văn minh thân thiện- Giao thông đắc địa, cách hồ Hoàn Kiếm: 15mGiá bán: 69 tỷ - Có thương lượng cho khách thiện trí muaLiên hệ chủ nhà: Anh Hòa: 0903419435 - Miễn trung gian  Nguồn:  http://nhadathanoi.net.vn",13/05/2022,Tin thường,batdongsan_so_com_vn_1673825078.2325222,, 10,,,
"6,3 tỷ VNĐ",Đường Chu Văn An phường Yết Kiêu, 42m2,Giá rất hấp dẫn 6.28 tỷ. LH Phong 1987 để xem nhà ngay,12/05/2022,Tin thường,batdongsan_so_com_vn_1673825079.304654, 4, 5, 6, 4, 10
"13,3 tỷ VNĐ",Đường Ngô Đình Mẫn phường La Khê, 58m2,"Nhà mới đẹp nội thất sang trọng, thiết kế hiện đại thông thoáng đầy ánh sáng và không khí dễ hài lòng cả những người khó tính nhất.  Khi ta chưa kịp mua căn nhà đã vươn mình lên tầm giá cao hơn bỏ ta lại phía sau. ",12/05/2022,Tin thường,batdongsan_so_com_vn_1673825080.3837674, 5, 5, 4, 3, 5
3 tỷ VNĐ,"phường ô chợ dừa, Đống Đa", 46m2,"Chính chủ cần bán nhà Phố Tôn Đức Thắng, Đống Đa, nhà cực thoáng, vài bước ra hồ Hoàng Cầu, diện tích 46m2, mặt tiền 6m, nhà 3 tầng. Nhà Trung tâm quận Đống Đa,  thông phố Tôn Đức Thắng, tiện lợi ra phố Đê La Thành, ra ngã 5 Ô Chợ Dừa, đi đâu cũng tiện. Gần chợ, siêu thị tiện ích, bệnh viện, hồ sinh thái, khu vui chơi, giải trí, thuận lợi kinh doanh online, cách trường học các cấp chỉ vài phút đi bộ. Sổ đỏ đẹp, sẵn sàng giao dịch Giá thoả thuận Liên hệ Anh Minh, chuyên nhà đất thổ cư, Đống Đa, Thanh Xuân, sẵn sàng tư vấn miễn phí 24/7. ĐT: 0913 220 691.",12/05/2022,Tin thường,batdongsan_so_com_vn_1673825081.362153, 6, 3, 2, 3, 2
