price,address,Diện tích,Mặt tiền,Lộ giới,Số tầng,Số phòng ngủ,Số toilet,Details,Ngày đăng,Loại tin,id,Hướng
5 tỷ VNĐ,"Đường Chiến Thắng, Cát Linh, Đống Đa", 50m2, 5, 2, 1, 1, 1,"Với những người kinh doanh online thì group (nhóm) Facebook là mảnh đất màu mỡ để khai thác và phục vụ cho việc bán hàng. Đó là nơi không mất phí chạy quảng cáo nhưng vẫn có thể tiếp thị sản phẩm tới hàng ngàn người quan tâm. Vậy bạn đã biết cách đăng bài trong nhóm Facebook chưa? Nếu muốn tận dụng tối đa mọi nguồn tài nguyên sẵn có, tiếp cận thêm nhiều khách hàng tiềm năng và gia tăng lợi nhuận với nhóm Facebook, thì bạn không nên bỏ qua bài viết sau đây. Lý do nên chọn nhóm Facebook để tiếp thị sản phẩm Nếu kinh doanh online mà không biết đến nhóm Facebook là bạn đã tự đánh mất đi cơ hội bán hàng tiềm năng của mình rồi đấy. Tại sao ư? Xem những lý do sau đây sẽ rõ. Hoàn toàn miễn phí Nếu sử dụng Fanpage để bán hàng thì bạn sẽ mất phí quảng cáo. Hay chí ít là đổ tiền vào dịch vụ tăng like, để có thể kéo nhiều người biết đến kênh bán hàng trực tuyến của mình. Nhưng với group thì hoàn toàn ngược lại. Bạn sẽ không mất một cắc nào nhưng vẫn tiếp cận được nhóm khách hàng tiềm năng. Chỉ cần đăng bài trong group là mọi thành viên đều có thể tiếp cận được. Không những thế, nếu bài viết có lượng tương tác cao, thậm chí là việc mình bạn tương tác trong bài viết cũng có thể đẩy nó lên đầu nhóm. Nơi giữ chân khách hàng trọn đời Chỉ cần group tạo dựng được niềm tin, tương tác ổn định thì bạn hoàn toàn có thể giữ chân khách hàng và có khách hàng thân thiết. Nếu bạn sở hữu một group riêng thì việc loại bỏ đối thủ cạnh tranh là việc vô cùng đơn giản. Nhận phản hồi của khách hàng một cách tốt nhất Khách hàng thường mong muốn tham gia một cộng đồng để được trao đổi cũng như tiếp nhận thông tin từ người cung cấp. Hãy tận dụng nó để gây dựng uy tín của bản thân đối với những khách hàng mới. Bởi điều này sẽ tạo nên hiệu ứng tin tưởng, tác động trực tiếp đến nhu cầu mua hàng của họ.  Cách đăng bài vào nhiều nhóm trên facebook


Các yêu cầu đăng bài nhóm Facebook
– Bạn phải cần là thành viên của nhóm này – Group cần mở tính năng đăng bài cho thành viên Ghi chú: Hoặc không, bạn phải cần quyền quản trị viên nhóm để có khả năng đăng bài
Hướng dẫn đăng bài nhóm Facebook

Cách 1: Đăng bài theo từng nhóm trên Facebook Nhìn chung, cách đăng bài vào một nhóm trên ...
",02/12/2022,Tin thường,batdongsan_so_com_vn_1673784994.8716364,
"2,7 tỷ VNĐ","Chính chủ cho thuê hoặc bán CHCC tầng 11 toà nhà 184 Hoàng Quốc Việt, Cầu Giấy; 0988231618", 83m2,,,,,,"Chính chủ cho thuê hoặc bán CHCC tầng 11 toà nhà 184 Hoàng Quốc Việt, Cầu Giấy; 0988231618 - Diện tích: 83m2 có 02 PN, 01VS, Phòng khách, bếp (có điều hòa, nóng lạnh sẵn rồi) - Giao thông thuận tiện kết nối với các tuyến đường chính như: Hoàng Quốc Việt, Nguyễn Văn Huyên, Hoàng Hoa Thám - Ưu tiên cho thuê làm văn phòng, hoặc thuê để ở. (trước đây cho ngân hàng thuê làm văn phòng đã hết hợp đồng)  - Giá bán: 2,7 tỷ có thương lượng  - Giá thuê: 9 tr/ tháng có thương lượng  - Liên hệ chính chủ: 0988231618       http://www.sanbatdongsanviet.com.vn",02/12/2022,Tin thường,batdongsan_so_com_vn_1673784995.8141146,
"3,5 tỷ VNĐ","Đường Cổ Linh, Thạch Bàn, Long Biên", 55m2, 5, 5, 5, 4, 3,"- Nhà lô góc, ô tô đỗ cửa, nhìn ra công viên thoáng thích hợp ở, kinh doanh ăn uống - Vị trí phố Cổ Linh, trung tâm giao thương kết nối Long Biên và các quận nội thành. - Phố kết nối Thạch Bàn, Đàm Quang Trung, Nguyễn Văn Cừ  và cầu Vĩnh Tuy, Thanh Trì... - Nắm cách TTTM AON Mall 2km, cách biển hồ Vin ocean pak 3km thích hợp đi mua sắm và đi du lịch biển giữa lòng Hà Nội - Nắm trung tâm chung chuyển các tỉnh phía bắc, thuận lợi giao thông tới: Hưng Yên. Hải Dương, Hải Phòng, Bắc Ninh, Bắc Giang, Vĩnh Phúc... - Xung quanh khu vực các trường đại học, bệnh viện: đh bách khoa, đh xây dựng, bv Tâm Anh, bv Vinmec, bv 108..... LH: Mr Trọng Thọ 0333584689(tư vấn chuyên nghiệp và tin cậy)",02/12/2022,Tin thường,batdongsan_so_com_vn_1673784997.0567906,
"7,5 tỷ VNĐ","Đường Nguyễn Quý Đức, Thanh Xuân Bắc, Thanh Xuân", 48m2, 4, 3, 5, 4, 4,"Chính Chủ bán nhà phố Nguyễn Quý Đức, thanh xuân , Hà Nội, diện tích 48m, ô tô đỗ cửa, nhà 5 tầng, giá 7,5tỉ Vị trí vip trung tâm quận - ôtô 7 chỗ đỗ cửa  - gần ĐH Kinh  trung tâm tiện ích bạt ngàn.  - phù hợp vừa ở vừa kinh doanh văn phòng. Liên hệ: Mrs. Huyền 0967821583 để được hỗ trợ",02/12/2022,Tin thường,batdongsan_so_com_vn_1673784998.0571153,
,"Đường , Đức Hòa, Sóc Sơn", 150m2,,,,,,"Chính chủ cần bán đất Đô Thị Sóc Sơn-Đất Thổ cư - Thanh Huệ Trại- Sóc Sơn nằm trong lõi khu đô thị vệ tinh , dân cư đông đúc- Xung quanh nhà dân xây nhiều, gần tất cả các tiện ích dân sinh- Thích hợp đầu tư sinh lời, mua để xây nhà ở định cư lâu dài...Giá bán : 2,7 tỷDiện tích : 150 m2 ( 18tr/m2 )Địa chỉ : Thôn Thanh Huệ Trại, Xã Đức Hoà, Huyện Sóc Sơn, Hà NộiLiên hệ : 0942033609 ( C Nhung )",02/12/2022,Tin thường,batdongsan_so_com_vn_1673784999.0005898,
"4,8 tỷ VNĐ","Đường Trương Định, Hoàng Văn Thụ, Hoàng Mai", 46m2, 4, 3, 4, 5, 3,"BÁN NHÀ TRƯƠNG ĐỊNH – HOÀNG MAI - NHÀ ĐẸP SÁT PHỐ, NỘI THẤTXỊN, HIỆN ĐẠI, CHỈ VIỆC XÁCH VALI VỀ Ở  + Vị trí đẹp, sau lưng nhà mặt phố, hưởng tiện ích của toà Nhà Nam đô Complex, gửi xe ô tô cách vài bước chân. + Mỗi tầng 2 phòng, 1 wc, đầy đủ nội thất:giường, tủ, bàn ghế, ti vi….khách chỉ việc xách vali về ở. + Tầng 4 làmphòng Thờ+ sân thượng Lý tưởng để thưởng trà, ngắm trăng. + Cầu thang giữa, giếng trời rất thoáng. + Ngõ chung 3 nhà, sân lát gạch đỏ sạch bóng, cổng sắt chắc chắn, để xe an toàn. + Ngõ ô tô thông thoáng có thêm một khu chung cư mới đang hoàn thiện đầy đủ tiện ích. + Đường Trương định mở rộng thì nhà ra mặt phố lớn, tương lai quá đẹp. - Sổ đỏ cất két, sẵn sàng giao dịch Liên hệ : 0586645555 ( Cal,zalo,Tele..)",02/12/2022,Tin thường,batdongsan_so_com_vn_1673785008.4214675,
"7,5 tỷ VNĐ","Thanh Xuân, Hà Nội", 58m2,,,,,,"+ Diện tích: 58 m x 6 tầng thang máy. + Mặt tiền: 4,8 m. + Sổ đỏ phân lô, chính chủ. + Giá bán: 7,5 tỷ.   - Vị trí:  + Trước nhà ngõ ô tô, thông, gần bãi đỗ xe. + Sau nhà khu phân lô phường Khương Đình. + Đầu phố Vũ Tông Phan, gần nút giao thông Ngã Tư Sở cửa ngõ Thủ đô.   - Khu vực:   + Giáp ranh đường vành đai 2 và vành đai 3 di chuyển các quận lân cận rất dễ dàng. + Trung tâm Thanh Xuân cơ sở hạ tầng đầy đủ. + Tiềm năng phát triển mạnh, giá đất tăng cao.  - Thiết kế: + Nhà hai thoáng Phong Thủy tốt. + Phong cách hiện đại tối ưu hóa công năng sử dụng. + Tổng 5 ngủ, bếp, phòng khách đặc biệt khu tiểu cảnh đẹp như khách sạn 5*.  - Nhà phù hợp nhiều đối tượng khách hàng: + Mua để ở. + Vừa ở vừa kinh doanh. + Đầu tư lướt sóng.    - Liên hệ: Mr Hải, 0946 921 974. Chuyên gia tư vấn, mua bán Bất động sản khu vực, Cù Chính Lan, Hà Kế Tấn, Hồ Rùa, Hoàng Văn Thái, Lê Trọng Tấn, Nguyễn Lân, Nguyễn Ngọc Nại, Nguyễn Trãi, Nguyễn Văn Trỗi, Nguyễn Viết Xuân, Phương Liệt, Tô Vĩnh Diện, Trần Điền,  Trịnh Đình Cửu, Trường Chinh,Đường Vành Đai 2, Đường Vành Đai 3, Vũ Tông Phan, Vương Thừa Vũ,... (Anh, chị, em Môi giới, QC xin không làm phiền).",02/12/2022,Tin thường,batdongsan_so_com_vn_1673785009.369929,
"3,75 tỷ VNĐ",Chính chủ cần bán gấp căn nhà xây mới tại phố Cổ Nhuế Trần Cung Phạm Văn Đồng  P Cổ Nhuế 2 Q Bắc Từ Liêm, 34m2, 4, 3, 5,,,"Chính chủ cần bán gấp căn nhà xây mới tại phố Cổ Nhuế Trần Cung Phạm Văn Đồng  P Cổ Nhuế 2 Q Bắc ừ Liêm dt 71 m2 giá 3,75 tỷ Gia đình em cần bán gấp căn nhà xây mới tại phố Cổ Nhuế , Trần Cung , Phạm Văn Đồng,  Phường Cổ Nhuế 2, Quận Bắc Từ Liêm , Hà Nội,  diện tich SĐ 71m2, đã xây dựng 33 m2, còn lại sân cổng,  nhà xây dựng 5 tầng mới tính, trang trí nội thất sang trọng phong cách, nhà sàn gỗ, cầu thang đá tay vị gỗ, tủ bếp gỗ, trần thạch cao nóng lạnh, thiết bị wc cao cấp, tầng 1 thiết kế phòng khách chỗ để xe, bếp ăn, từ tầng 2 lên thiết kế mỗi tầng 1 phòng ngủ wc khép kín, tầng trên thiết kế phòng  thờ, sân phơi, chỗ để máy giặt,  nhà nằm trong khu phân lô dân trí cao an ninh tốt giao thông đi lại thuận tiện, sđcc, giá bán 3,75 tỷ có thương lượng, MTG, môi giới làm phiền.LH chủ nhà anh Thụy,0936359198 hoặc 0961218968 quý khách sẽ được phục vụ tận tình được tư vấn từ A đến Z để quý khách mua được căn nhà như ý.",02/12/2022,Tin thường,batdongsan_so_com_vn_1673785010.6944158, Đông nam
"22,5 tỷ VNĐ","Chính chủ cần bán gấp nhà mặt phố Trần Quốc Vượng Dịch Vọng Hậu Cầu Giấy dt 55 m2 giá 22,5 tỷ", 55m2, 5, 20, 7,,,"Chính chủ cần bán gấp nhà mặt phố Trần Quốc Vượng Dịch Vọng Hậu Cầu Giấy dt 55 m2 giá 22,5 tỷ Gia đình em cần bán gấp căn  nhà mặt phố Trần Quốc Vượng,  phường Dịch Vọng Hậu, Quận  Cầu Giấy, diện tích 43,5m2, thực tế 55m2, mặt tiền 5m, nhà xây dựng 6,5 tầng mới, trang trí nội thất xịn sang trọng phong  cánh, nhà sàn gỗ nhập khẩu, thang máy, thiết bị tiện nghi đầy đủ, thiết bị wc cao cấp, nhà được thiết kế mỗi tầng 1p ngủ rộng rãi, wc, nhà nằm trên mặt phố đường vỉa hè vị trí kinh doanh tốt, giao thông đi lại thuận tiện, sđcc, giá bán 22,5 tỷ  Có thương lượng, mtg, môi giới làm phiền. LH Anh Thụy 0936359198 / 0961218968 quý khách sẽ được phục vụ tận tình được tư vấn từ A đến Z để quý khách mua được căn nhà như Ý",02/12/2022,Tin thường,batdongsan_so_com_vn_1673785012.1325772, Tây bắc
"3,75 tỷ VNĐ","Đường Khương Trung, Khương Trung, Thanh Xuân", 37m2, 5, 8, 4, 3, 2,"Chủ cần bán nhà Khương Trung, Thanh Xuân diện tích 37m2 giá 3.75 tỷ có thỏa thuận  ĐÓN TƯƠNG LAI BỪNG SÁNG _ NGÕ ĐẸP _ DÂN XÂY CHẮC CHẮN _ CÔNG NĂNG ĐỦ CHO CẢ NHÀ!  + Diện tích 37m2 4 tầng giá 3.75 tỷ có thỏa thuận + Mô tả: - Nhà nằm ngách TO và THOÁNG, ba gác đỗ cửa, tương lai mở đường giá trị càng lên cao, dân cư đông đúc. Tiện ích xung quanh nhiều vô kể: trường, trạm, hàng quán, siêu thị, chợ dân sinh … - Hiện trạng nhà xây được chục năm, chủ tự tay xây rất tâm huyết, vì chưa từng tu sửa lần nào nên nhìn có vẻ không được hút mắt, chỉ cần đổ vài thùng sơn vào là long lanh ngay. - Chủ đón quy hoạch gần nhà, mà đón chục năm rồi cảm thấy mỏi mệt, có lẽ lộc để chủ sau hưởng. Chủ cần bán để chuyển đổi mục đích. + Thiết kế: - T1: Để xe + Phòng kho + WC - T2: Bếp + PK - T3: 2 PN + WC - T4: PT + sân phơi + WC chờ. + Thiết kế nhà có thể thay đổi tuỳ vào nhu cầu của ac, nhà chủ ít người ở cũng không hết phòng. Có thể cải tại thành 3PN hoặc 4 PN. + Sổ chủ gửi ngân hàng, khách cọc sâu chủ tự rút. + Liên hệ Tuấn Anh 0981.852.097 để xem nhà miễn phí",02/12/2022,Tin thường,batdongsan_so_com_vn_1673785013.149941,
"7,5 tỷ VNĐ","Thanh Xuân, Hà Nội", 58m2,,,,,,"+ Diện tích: 58 m x 6 tầng thang máy. + Mặt tiền: 4,8 m. + Sổ đỏ phân lô, chính chủ. + Giá bán: 7,5 tỷ.   - Vị trí:  + Trước nhà ngõ ô tô, thông, gần bãi đỗ xe. + Sau nhà khu phân lô phường Khương Đình. + Đầu phố Vũ Tông Phan, gần nút giao thông Ngã Tư Sở cửa ngõ Thủ đô.   - Khu vực:   + Giáp ranh đường vành đai 2 và vành đai 3 di chuyển các quận lân cận rất dễ dàng. + Trung tâm Thanh Xuân cơ sở hạ tầng đầy đủ. + Tiềm năng phát triển mạnh, giá đất tăng cao.  - Thiết kế: + Nhà hai thoáng Phong Thủy tốt. + Phong cách hiện đại tối ưu hóa công năng sử dụng. + Tổng 5 ngủ, bếp, phòng khách đặc biệt khu tiểu cảnh đẹp như khách sạn 5*.  - Nhà phù hợp nhiều đối tượng khách hàng: + Mua để ở. + Vừa ở vừa kinh doanh. + Đầu tư lướt sóng.    - Liên hệ: Mr Hải, 0946 921 974. Chuyên gia tư vấn, mua bán Bất động sản khu vực, Cù Chính Lan, Hà Kế Tấn, Hồ Rùa, Hoàng Văn Thái, Lê Trọng Tấn, Nguyễn Lân, Nguyễn Ngọc Nại, Nguyễn Trãi, Nguyễn Văn Trỗi, Nguyễn Viết Xuân, Phương Liệt, Tô Vĩnh Diện, Trần Điền,  Trịnh Đình Cửu, Trường Chinh,Đường Vành Đai 2, Đường Vành Đai 3, Vũ Tông Phan, Vương Thừa Vũ,... (Anh, chị, em Môi giới, QC xin không làm phiền).",02/12/2022,Tin thường,batdongsan_so_com_vn_1673785014.0864754,
"1,5 tỷ VNĐ","Đường , Yên Nghĩa, Hà Đông", 45m2, 5, 1, 3, 3, 2,"Bán nhà Đại Thành- Trạm bơm Yên Nghĩa Hà Đông 45m2, nhỉnh  1.5 tỷ 3 tầng xây mới. - Diện tích: 45m2 - Xây dựng 3 tầng mới ô tô đổ cổng.  - Thiết kế hiện đại, 3 phòng ngủ rộng.  - Vị trí thuận lợi, di chuyển lên Thanh Xuân chỉ 10km; Mỹ Đình chỉ 12km...Trường cấp 1,2 và chợ dân sinh cách nhà 200m. - Rấy phù hợp với hộ gia đình làm việc khu vực Mỹ Đình, Hoài Đức, Thanh Xuân, Hà Đông.... - Sổ đỏ sẵn giao dịch trong ngày. - Đặc biệt: Hỗ trợ vay vốn ngân hàng 70% giá trị tài sản và hỗ trợ lãi suất ngân hàng cố định 8%/ năm",02/12/2022,Tin thường,batdongsan_so_com_vn_1673785018.1471384,
"4,7 tỷ VNĐ","Đường Quan Nhân, Nhân Chính, Thanh Xuân", 50m2, 4, 3, 4, 4, 4,"
    Chỉ từ 4 tỷ sở hữu ngay nhà riêng ngõ 144 Quan Nhân, Thanh Xuân Nhà đẹp ở ngay, khu vực nhiều tiện ích, sổ đỏ chính chủ - rẻ nhất khu vực.Diện tích 50m2, 5 tầng, mỗi tầng 2 phòng đủ công năng.Nhà đẹp chủ tự thiết kế cực hiện đại, để lại full nội thất liền tường, dọn vào ở ngay.Trung tâm quận Thanh Xuân, ngay cạnh Royal City, vài bước ra đến Ngã Tư Sở, Láng, gần hệ thống các trường ĐH Luật, ĐH Thủy Lợi, ĐH Kiến Trúc, khu dân cư tấp nập, cực nhiều tiện ích.Bãi gửi xe ô tô cách nhà chỉ 50m, khu dân trí cao toàn cán bộ công chức. quá đầy đủ công năng và hợp lí với khu vực như thế này.Gia chủ làm ăn lộc lá, chuyển nhà biệt thự nên cần bán.Giá chào 4.7 tỷ còn thương lượng, sổ đỏ sang tên phút mốt.LH ngay 0988305004 để xem nhà trực tiếp. Cam kết thông tin chính xác 100%.
",02/12/2022,Tin thường,batdongsan_so_com_vn_1673785019.3174965,
"2,85 tỷ VNĐ","Cổ Điển A, Tứ Hiệp", 33m2,,,,,,"+ Bán nhà Cổ Điển, Tứ Hiệp, Thanh Trì, Hà NộiDT: 33m x 5 tầngMT: 3.3mGiá: 2.85 tỷ “ctl”+ Ngõ rộng thoáng, ô tô nhỏ vào đỗ cổng được, gần khu đô thị mới Tứ Hiệp, tiện ích ngập tràn : Siêu thị, trường học, chợ, sân bóng, bãi xe...+ Nhà mới kính coong, thiết kế 5 tầng mỗi tầng 1 phòng, 1 wc, tổng 3 ngủ. + Tư vấn, báo giá, dẫn xem nhà miễn phí, kết nối gặp chủ nhà. Liên hệ em Liên ",02/12/2022,Tin thường,batdongsan_so_com_vn_1673785020.1712177,
"3,5 tỷ VNĐ",Mỹ Đình 2, 84m2,,,,,,"Gia đình chuyển đổi sang căn 3 ngủ nên cần bán căn 2 ngủ diện tích 84m2 tại dự án The Zei Mỹ Đình Đã full nội thất vào ở luôn,các tiện ích của khu đều có thể sử dụng được Lh trực tiếp đi xem nhà : 0984474965",02/12/2022,Tin thường,batdongsan_so_com_vn_1673785021.1964703,
,"Đường Lai Xá, Kim Chung, Hoài Đức",,, 1,,,,"Bán biệt thự liền kề khu đô thị Hinode Royal Park giá chung cư. - Đường trước nhà 12m. - Diện tích 100m². - Hướng Tây Bắc. - Nhà được xây dựng theo thiết kế mới 5 tầng (có hố chờ thang máy). - Vị trí gần ngay hồ điều hoà 8ha của huyện, mặt sau của đại lộ Hoàng Gia.Giá 4xtr/m² (Rẻ như giá chung cư).......Ngoài vị trí trên thì hiện tại em đang còn rất nhiều vị trí căn đẹp,giá tốt nhất thị trường! Liên hệ 0975.82.92.66 - Mr.Lập, Khu đô thị Hinode Royal Park Giới thiệu chung về dự án Hinode Royal Park  ",02/12/2022,Tin thường,batdongsan_so_com_vn_1673785022.0471938,
"6,1 tỷ VNĐ",thanh bình mộ lao, 54m2, 4, 11, 5, 5, 4,"
    LÔ GÓC 2 THOÁNG NGÕ TRƯỚC NHÀ GẦN 4M Ô TÔ ĐỖ GẦN
Mộ Lao Hà Đông 54m 4.5 tầng mặt tiền 4.8m giá 6.1 tỷ còn thương lượng
Mô tả:
-Nhà nằm trong khu dân trí cao, an ninh tốt, hàng xóm thân thiện, gần trường các cấp, chợ Mộ Lao, ngay khu đô thị Mộ Lao, cách Big c, Coopmart, trường đại học Kiến trúc, An ninh, Bưu chính 500m..tiện ích bạt ngàn.
-Ngõ trước nhà gần 4m, ô tô cách nhà 70m, giao thông thuận tiện.
- Nhà lô góc được thiết kế 4.5 tầng, tầng nào cũng có ban công, phòng nào cũng có cửa sổ rất thoáng mát.
+ Tầng 1: Khách, bếp, vs.
+ Tầng lửng: Ngủ.
+ Tầng 3,4: Tổng 4 ngủ, 2 vs.
+ Tầng tum: 2 sân phơi siêu rộng.
-Sổ đổ vuông đẹp, nở hậu nhẹ.
-Nhà có nhiều hướng đi vào, đi ngõ 58 Thanh Bình, ngõ 140 Trần Phú, đi ngõ 108 Trần phú .
-Ace quan tâm lh Nguyên Anh: 0819508701 để biết thêm chi tiết
",02/12/2022,Tin thường,batdongsan_so_com_vn_1673785023.7885802, Nam
"3,9 tỷ VNĐ","Đường Yên Xá, Tân Triều, Thanh Trì", 46m2, 3, 1, 2, 2, 1,"- Bán đất tặng nhà 2 tầng Yên Xá, 46m2, mt 3.5m,  trước sau như 1. - Mảnh đất hiếm thuộc khu được nhiều nhà ĐT săn tìm để xây CCMN. - Được phép xây dựng 7 tầng 1 tum thì có thể xây thành 14 phòng khép kín, thang máy. Đảm bảo doanh thu gần 60tr/ tháng. - Nhà diện tích 46m2, riêng biệt, độc lập, dân trí cao. Chỉ cách khu đô thị Văn Quán chừng 150m, hường chọng tiện ích khu vực. -Sổ đỏ chính chủ, vuông vắn, không cầm cố, tranh chấp. ",02/12/2022,Tin thường,batdongsan_so_com_vn_1673785024.917661,
