price,address,Diện tích,Số tầng,Số phòng ngủ,Details,Ngày đăng,Loại tin,id,Mặt tiền,Số toilet,Lộ giới,Hướng
"3,9 tỷ VNĐ",khương đình, 35m2, 5, 5,"- Vị trí: Mặt ngõ rộng thông sang Hạ Đình,ba gác phi ầm ầm, gần hồ, các trường học, khu vui chơi giải trí. - Nhà lô góc , thoáng sáng, phòng ngủ nào cũng có cửa sổ, đã full nội thất. - Nhà 5 tầng thiết kế hiện đại, chắc chắn. - Sổ đỏ chính chủ, vuông vắn, nở hậu. - Liên hệ ngay em Thảo 0348156621 chuyên thổ cư Hà Nội.",22/04/2022,Tin thường,batdongsan_so_com_vn_1673827014.133918,,,,
"5,9 tỷ VNĐ","Đường Láng, Phường Láng Thượng, Quận Đống Đa", 45m2, 5, 9,"+ Bán nhà Đường Láng, DT 45m, 5 tầng, MT 4m, ngõ thông sang Chùa Láng. + Vị trí gần oto đi lại, nhà đẹp 9 phòng full nội thất, phù hợp cho thuê để ở, dòng tiền hơn 50tr/tháng. + Xung quanh nhà gần các trườn đại học, bệnh viện… + Sổ đỏ chính chủ, pháp lý chuẩn sẵn sàng giao dịch. + Liên hệ xem nhà: Dũng chuyên BDS thổ cư 0948677782/0867502627.",22/04/2022,Tin thường,batdongsan_so_com_vn_1673827015.5780547, 4, 5,,
"2,35 tỷ VNĐ","Chính chủ bán nhà phố Vọng Hà, Hoàn Kiếm, 2,35tỷ, 0865880809", 22m2,,,"Chính chủ bán nhà phố Vọng Hà, Hoàn Kiếm, 2,35tỷ, 0865880809  - Địa chỉ : Phố Vong Hà ,Phường Chương Dương - Quận Hoàn Kiếm - TP Hà Nội.- Diện tích sử dụng : 22m2- Giá 2,350 tỷ ( có thương lượng)- Thiết kế Nhà xây kiên cố 4 tầng 1 tum, 3 phòng ngủ, 3 nhà vệ sinh, 2 mặt thoáng- Vị trí thuộc khu trung tâm, dân cư đông đúc, dân trí cao, an ninh tốt, không gian sạch sẽ thoáng mát- Giao thông đi lại thuận tiện- Gần Trường Mầm non, cấp 1, cấp 2, ủy ban Phường, gần chợ.- Cách Hồ Hoàn Kiếm 500 m, điện nước ổn định.- Sổ đỏ chính chủ, sẵn sàng giao dịch- Giá 2,350 tỷ ( có thương lượng) - Khách có nhu cầu Liên hệ: 0865.880.809 (gọi điện trực tiếp)       http://www.sanbatdongsanviet.com.vn",22/04/2022,Tin thường,batdongsan_so_com_vn_1673827016.6232593,,,,
"15,1 tỷ VNĐ",Hà Nội, 75m2,,,"Bán nhà sổ đỏ đường Hoàng Văn Thái, kinh doanh - SĐT: 0366 555 258.Diện tích 75 m2, 6 tầng thang máy, mặt tiền 5 m.Mô tả vị trí: + Vị trí đắc địa, kinh doanh tốt, đường 2 ô tô tránh nhau thoải mái, ô tô chạy vòng quanh nhà, thông tứ lung tung.Nội thất nhập khẩu châu Âu, thang máy Nhật Bản, sàn, cầu thang gỗ Lim xịn… + Tuyến phố văn minh dân trí cao, khu vực an ninh cực tốt, dân trí cao, giao thông thuận lợi.Kết nối Nguyễn Viết Xuân, Lê Trọng Tấn, Vương Thừa Vũ, vành đai 2.5, bệnh viện, chợ, trường học... an sinh cực đỉnh, hàng xóm toàn tướng tá quân đội.Thiết kế: - Thiết kế khoa học, đẹp, tối ưu hóa công năng sử dụng. - Nhà mới đẹp, chủ giữ gìn cẩn thẩn, xách va ly về ở ngay. - Chủ tự xây để ở, kiên cố, chắc chắn.Thông tin liên hệ, pháp lý: - Sổ đỏ chính chủ, sẵn sàng giao dịch, giá chào chỉ 15.1 tỷ thương lượng mạnh.* Tôi có hàng ngàn căn nhà trên địa bàn Hà Nội, đủ các phân khúc.* Hỗ trợ các thủ tục sang tên, công chứng, quy hoạch, GPXD.* Hỗ trợ vay vốn ngân hàng, giải ngân lên đến 90 %.Liên hệ Ms Thanh ngay (24/24h) để được tư vấn, xem nhà miễn phí - 0366 555 258.",22/04/2022,Tin thường,batdongsan_so_com_vn_1673827017.6056306,,,,
"3,35 tỷ VNĐ","Bạch mai, Hai Bà Trưng", 25m2, 4, 3,"Mô tả: + Nhà sát mặt phố, đường ô tô đỗ cửa. + Nhà xây 4 tầng kiên cố, chắc chắn. + khu dân trí cao, văn minh, an ninh cực tốt. + 2 phút lên bờ hồ, Phố cổ + Giao thông rất thuận tiện, 1 phút ra chợ 8-3, bách khoa, 500m bệnh viện Thanh nhàn, bạch mai, Gần các trường học như cấp 1,2,3 và các trường đại học Bách Khoa, KT Quốc Dân, Xây Dựng… + Giá chào 3.35tỷ,  Có thương lượng. + Diện tích 25m2. + Sổ đỏ sắn giao dịch. +Miễn phí tư vấn, xem nhà 100%. + Liên hệ : Nguyễn Dương  0825920555 Để được tư vấn, xem nhà và hỗ trợ tốt nhất.",22/04/2022,Tin thường,batdongsan_so_com_vn_1673827018.7036936, 4,, 4,
"1,2 tỷ VNĐ/m2","Linh Sơn,Bình Yên,Thạch Thất", 60m2, 1, 1,"-Vị trí:Đà Gạo,Linh Sơn,Thạch Thất-Diện tích: 63,6-Đường nội khu rộng 7-8m-Cách QL21 chỉ hơn 100m-Đường 2 oto tránh nhau quay đầu thoải mãi-Đối diện là asean resort-Cách CNC 1,5km-Đầy đủ tiện ích sống xung quanh bán kính 1km-Đất mặt đường trục chính thông tứ tungLiên hệ mr.Hùng: 0387507522 (có zalo)",22/04/2022,Tin thường,batdongsan_so_com_vn_1673827019.8695743, 6, 1, 8, Đông nam
15 tỷ VNĐ,Nguyễn Đình Chiểu Hai Bà Trưng Hà Nội, 72m2, 4, 4,"- Cần bán nhà phố Nguyễn Đình Chiểu, quận Hai Bà Trưng, ngay cạnh công viên Thống Nhất, nhà vị trí rất đẹp, 2 thoáng ở cực thích. + Phố Nguyễn Đình Chiểu là con phố rất hiếm có nhà bán, nhà chỉ cách mặt phố vài bước chân, giáp với Trần Nhân Tông, Tuệ Tĩnh, Tô Hiến Thành, Lê Đại Hành, Đại Cồ Việt… đây là vị trí không thể đẹp hơn. + Nhà tự xây để ở nên rất tỉ mỉ mà chắc chắn, thiết kế đẹp không lỗi mốt, đầy đủ công năng sử dụng, vị trí 2 thoáng cho nên các phòng đều rất thoáng mát. + Nhà có thể vừa ở vừa kinh doanh như ( cafe, thời trang, spa… ) đều rất phù hợp. + Thiết kế 4 tầng, mỗi tầng 2 phòng rộng, thoáng mát. + Sổ đỏ, sẵn sàng sang tên. + Tài Chính: 15 tỷ ( Thương lượng ) + Quan tâm xin liên hệ: Minh Quang 0327085656 ( Anh chị em môi giới vui lòng không gọi điện, quảng cáo )",22/04/2022,Tin thường,batdongsan_so_com_vn_1673827020.8898444, 4,,,
"5,3 tỷ VNĐ",Trần Khát Chân Hai Bà Trưng Hà Nội, 52m2, 4, 4,"+ Cần bán nhà phố Trần Khát Chân, quận Hai Bà Trưng, vị trí cực kì đẹp, ngõ nông, ngay cạnh hồ Võ Thị Sáu, ô tô tránh sát nhà, bãi gửi oto  chưa tới 100m. + Khu vực an sinh rất tốt, tiện ích xung quanh nhiều vô kể, ngõ thông tứ tung, đi đường nào cũng đều đẹp cả. + Diện tích 52m2 xây 4 tầng, 4 ngủ, mặt tiền 4.5m, mặt tiền rộng hiếm có căn thứ 2. + Nhà có khoảng sân rộng, để trồng cây, nuôi chim thì rất tuyệt. + Sổ đỏ đẹp sẵn sàng sang tên. + Tài chính 5.3 tỷ ( Thương lượng ) + Quan tâm xin liên hệ: Minh Quang 0327085656 ( Anh chị em môi giới vui lòng không gọi điện, quảng cáo )",22/04/2022,Tin thường,batdongsan_so_com_vn_1673827021.9839191, 4,,,
"15,1 tỷ VNĐ",Hà Nội, 76m2,,,"Bán nhà Cù Chính Lan, lõi Hà Nội kinh doanh - LH: 0856 968 656.Diện tích 76m2, 6 tầng thang máy.Mặt tiền rộng: 5m.Giá chào bán 15.1 tỷ thương lượng sâu, bao sang tên, tặng full nội thất xịn.Mô tả: - Chủ nhà chuyên gia về tư vấn xây dựng, xây nhà để ở siêu đẹp, thiết kế hiện đại, nội thất cao cấp. - Vị trí vô cùng đắc địa, phân lô, ô tô tránh, dừng đỗ thoải mái, kinh doanh đỉnh. - Xung quanh tiện ích đẳng cấp, hàng xóm dân trí cao, khu vực nhiều khách săn tìm. - Sổ vuông hoa hậu, cất két.Gọi ngay để đi xem nhà - 0856 968 656.Cám ơn các quý khách đã đọc tin chúc các quý khách tìm được căn nhà đẹp như ý.",22/04/2022,Tin thường,batdongsan_so_com_vn_1673827023.5058458,,,,
32 triệu VNĐ,"Quốc Lộ 6, Khu Công nghiệp Phú Nghĩa, xã Phú Nghĩa, huyện Chương Mĩ, Hà Nội", 153m2,,,"Cần tiền, bán gấp, đất chính chủ.Đất nằm trên trục đường Quốc lộ 6 - Đối diện khu công nghiệp Phú nghĩa.Mặt tiền 6,5m - sâu 23,61m.Mặt đường to, đất vuông đẹp ",22/04/2022,Tin thường,batdongsan_so_com_vn_1673827025.0227878,,,,
"7,8 tỷ VNĐ","Sơn Đồng, Hoài Đức, Hà Nội", 86m2,,,"☑️Trực tiếp phân phối-phát triển dự án Sơn Đồng Center. Thông tin dự án.- Dự án: Khu đấu giá làng nghề Sơn Đồng, Hoài Đức.- Tên thương mại: Sơn Đồng Center.- Vị trí: Xã Sơn Đồng, H. Hoài Đức, Tp. Hà Nội.- Chủ đầu tư: MB Land Invest.- Tổng diện tích: 25.837m2.- Số lượng: 150 căn liền kề.- Diện tích từ: 70m2 - 103m2.- Xây dựng: 4.5 tầng.- Loại hình: Liền kề, Shophouse.- Bàn giao: Xây thô hoàn thiện ngoài.- Hạ tầng đã xong, hiện đang xây thô - sổ đỏ chính chủ - đất ở lâu dài.- Cơ hội đầu tư bất động sản ven đô lượi nhuận x2. ———-------------------------------- ✔️ Liên hệ Hotline: : 0779273787",22/04/2022,Tin thường,batdongsan_so_com_vn_1673827026.388182,,,,
"7,8 tỷ VNĐ","Sơn Đồng, Hoài Đức, Hà Nội", 86m2,,,"☑️Trực tiếp phân phối-phát triển dự án Sơn Đồng Center. Thông tin dự án.- Dự án: Khu đấu giá làng nghề Sơn Đồng, Hoài Đức.- Tên thương mại: Sơn Đồng Center.- Vị trí: Xã Sơn Đồng, H. Hoài Đức, Tp. Hà Nội.- Chủ đầu tư: MB Land Invest.- Tổng diện tích: 25.837m2.- Số lượng: 150 căn liền kề.- Diện tích từ: 70m2 - 103m2.- Xây dựng: 4.5 tầng.- Loại hình: Liền kề, Shophouse.- Bàn giao: Xây thô hoàn thiện ngoài.- Hạ tầng đã xong, hiện đang xây thô - sổ đỏ chính chủ - đất ở lâu dài.- Cơ hội đầu tư bất động sản ven đô lượi nhuận x2. ———-------------------------------- ✔️ Liên hệ Hotline: : 0779273787",22/04/2022,Tin thường,batdongsan_so_com_vn_1673827027.8592484,,,,
"3,45 tỷ VNĐ","Phố Đức Diễn, Phúc Diễn, Bắc Từ Liêm, Hà Nội.", 36m2, 5, 4,"* Bán nhà xây mới cực đẹp (mệnh danh biệt thự 5 tầng giữa phố Đức Diễn). Vị trí đắc địa nằm cạnh trục đường 32. Cạnh đường trên cao, đường lớn Cầu Diễn, Đức Diễn thuận tiện cho việc đi lại. Nhà căn góc 2 mặt thoáng cực kì đắc địa để An Cư, Hưng Thịnh.  -------------- * Thiết kế và công năng: Tân cổ điển sang trọng.   - Diện tích: Nhà 36m2, xây mới 5 tầng. - Tầng 1: Phòng Khách. Phòng ăn + Bếp. - Tầng 2, 3, 4 : Mỗi tầng 1 phòng ngủ Master, vệ sinh. - Tầng 5: Phòng thờ, sân phơi. Tiểu cảnh ngoài trời. * Vị trí: - Vị trí đắc địa cạnh trục đường lớn 32 (Văn Tiến Dũng), đường Đức Diễn, đường Cầu Diễn, đường trên cao,…thuận tiện đi lại và sinh hoạt. - Nhà tọa lạc gần khu trung tâm hành chính với quận Bắc Từ Liêm. Công An phường,… nên an ninh rất tốt. - Vị trí nhà gần trường Mầm Non, tiểu học Phúc Diễn. THCS Phúc Diễn, THCS Phú Diễn A, tiểu học Phú Diễn,…thuận tiện cho gia chủ An Cư, Hưng Thịnh. * Nội thất: - Nội thất cao cấp chính hãng: Cửa chính, cửa thông phòng, tay vịn và bậc cầu thang được làm bằng gỗ Lim tỉ mỉ. Các sàn được làm gỗ Malaysia. - Nội thất thiết bị: Tủ bếp Acrylic An Cường, công tắc, thiết bị điện Panasonic, dây điện Trần Phú,…đầy đủ các thiết bị điện. * Pháp lý: Sổ đỏ chính chủ, giấy phép xây dựng, pháp lý rõ ràng. * Giá chỉ: 3.45 tỷ (có thương lượng, bao sang sổ). * Liên hệ ngay anh Tuấn: 0964 357 352 (Miễn MG, TG).",22/04/2022,Tin thường,batdongsan_so_com_vn_1673827029.154782, 4, 4, 3,
"4,95 tỷ VNĐ","Xuân Thủy, Cầu Giấy", 35m2, 7,,"+ Nhà mới đẹp long lanh, lô góc 2 mặt thoáng. DT: 35m2, 7 tầng, 5m mặt tiền, ô tô đỗ cửa, thang máy êm ru.+ Ô tô đỗ cửa, nhà thiết kế hiện đại, 200m ra mặt phố.+ Nhà gần nhiều trường học (mẫu giáo, tiểu học, trung học, đại học Sư Phạm HN, ĐH Báo chí,…)  , chợ Cầu Giấy, siêu thị Lotte, bệnh viện...., chỉ mấy phút ra các con đường lớn, Xuân thủy, Phạm Hùng, Tôn Thất Thuyết.+ Liên hệ em Đức Anh để xem nhà : 097 551 7689 – Zalo 0975517689",22/04/2022,Tin thường,batdongsan_so_com_vn_1673827030.5690396, 5,,,
"15,2 tỷ VNĐ",Hà Nội, 74m2,,,"Bán nhà đường Hoàng Văn Thái Thanh Xuân, kinh doanh - LH: 0856 968 656.Nhà xây rất đẹp, ngõ rộng, ô tô 7 chỗ vào nhà, kinh doanh sầm uất. + Dân trí cao, hàng xóm toàn người có chức sắc, con cái thành đạt. + Nhà 6 tầng thang máy, thiết kế hiện đại. + Diện tích 74 m2, mặt tiền 5 m. - Tầng 1: Gara ô tô, kinh doanh, vệ sinh. - Tầng 2, 3, 4, 5: Các phòng đẹp, vệ sinh. - Tầng 6: Phòng thờ, sân vườn tiểu cảnh. + Sổ vuông đẹp sẵn sàng giao dịch.Giá chào chỉ 15.2 tỷ thương lượng sâu, bao sang tên, tặng full nội thất xịn.Liên hệ ngay 24/7 - 0856 968 656.",22/04/2022,Tin thường,batdongsan_so_com_vn_1673827031.6900365,,,,
"2,58 tỷ VNĐ","đường Minh Khai, Hai Bà Trưng, Hà Nội", 25m2, 5, 3,"NHÀ ĐẸP Ở NGAY- GẦN Ô TÔ – SỔ HOA HẬUS = 25m, mt 4m, giá 2.58 tỷ * Rẻ nhất trong phân khúc giá, không thể tìm thấy căn nhà nào tốt hơn. - Ngõ trước nhà rộng thoáng, cách đường ô tô chỉ 40m. - Nhà 5 tầng, mỗi tầng 1 phòng, tầng 5 là phòng thờ, sân phơi. - Giao thông: Minh Khai, Mai Động, Đại La, Tam Trinh, Time City, … * Sổ đỏ vuông đẹp, bán gấp trong tuần. * Lh: 0345752279, miễn môi giới. ",22/04/2022,Tin thường,batdongsan_so_com_vn_1673827032.9048374, 4,,,
"5,7 tỷ VNĐ","Bán nhà riêng Phương Mai, Đống Đa 45m2, mt 4.2m đường nhựa ô tô tránh, giá 5.7 tỷ", 45m2, 4, 4,"GIÁ NÀO CŨNG BÁN – TẶNG NỘI THẤTS = 45m2, mặt tiền 4.2m, giá 5.7 tỷ Mô tả: + Vị trí: Phố Phương Mai, Đống Đa. + Giao thông tuyệt vời, bán kính 500m là các bệnh viện lớn: Bệnh viện Bạch Mai, bệnh viện Lão Trung Ương, bệnh viện Da Liễu Trung Ương, Bách Kinh Xây, đường Giải Phóng,… + Trước nhà đường nhựa, ô tô đậu sát cửa, quay đầu. + Thiết kế: 4 tầng, 4 ngủ, sân phơi. Công năng sử dụng hoàn hảo. + Chủ chào giá 5.7 tỷ, giá chốt thực tế bất ngờ. + Sổ đỏ phân lô sẵn sàng giao dịch. * Liên hệ ngay em Bình, 0345752279 để được tư vấn và xem nhà miễn phí mọi khung giờ! * Môi giới bỏ qua bài viết.",22/04/2022,Tin thường,batdongsan_so_com_vn_1673827033.9500475, 4,,,
"3,3 tỷ VNĐ",Hà Cầu- Hà Đông, 37m2, 5,,"Bán nhà ngõ ô tô, 37m, 5 tầng, nội thất xịn, Hà Cầu, Hà Đông Tôi cần bán nhanh nhà đẹp vài bước ra chợ lớn Hà Đông, xung quanh toàn cán bộ công chức nhà nước, mặt ngõ thông, ô tô chạy vòng quanh, nhà xây kiên cố với 5 tầng thoáng sáng, đầy đủ công năng, khu vực dân trí cao, yên tĩnh, chỉ hơn 3 tỷ quá hiếm. Xung quoanh là các trường học, ngân hàng, siêu thị, chợ dân sinh, công viên,...không thiếu thứ gì. Giao thông thuận tiện đi các hướng: phía bắc giáp Đa Sỹ, Phía Tây giáp với Lê Lợi thông ra Bà Triệu, cạnh Khu đô thị Văn Phú, gần Phúc La và các bệnh viện lớn Học viện quân y 103,... Sổ đỏ vuông như tờ A4, sẵn sàng giao dịch. Giá: 3.3 tỷ ( có thương lượng). Liên hệ ngay với em Huyền Thổ cư KINH NGHIỆM GẦN 10 NĂM ( 0363703491- 0965472910) - Để sở hữu hàng nghìn ngôi nhà cùng khu vực, tiết kiệm THỜI GIAN - CÔNG SỨC - TIỀN BẠC.- Tư vấn miễn phí 24/24h( zalo, fb). Tư vấn Pháp lý, vay vốn.",21/04/2022,Tin thường,batdongsan_so_com_vn_1673827034.9334157,,,,
"3,31 tỷ VNĐ",Vạn Phúc- Hà Đông, 37m2,,,"Nhà đẹp Vạn Phúc, Hà Đông, ngõ ô tô thông, 37m, nội thất xịn, nhỉnh 3 tỷ Rất hiếm có nhà Vạn Phúc ngõ ô tô bán, vị trí đắc địa nhà đẹp dân xây kiên cố, các tầng thoáng sáng nhiều phòng rộng đẹp môi trường trong lành, dân đông văn minh. Vài bước ra ngân hàng, trường học, bệnh viện, khu vui chơi, chợ dân sinh, siêu thị...đường thông thoáng, mặt tiền rộng có thể vừa ở vừa kinh doanh nhỏ. Giao thông thuận lợi: phía Bắc di chuyển xuống Ngô Quyền, vài bước ra Yết Kiêu cạnh Bưu điện Hà Đông, lên trên giáp Mỗ Lao, sang đường ra Khu Đô Thị Văn Quán và trục chính Quang Trung,... Gia chủ là doanh nhân thành đạt, nhà rất có lộc ở phất lên từ đó, cần bán nhanh chuyển sang ở biệt thự rộng hơn, bán đi rất tiếc. Sổ đỏ vuông, sẵn sàng giao dịch. Giá: 3.31 tỷ ( có thương lượng). Liên hệ ngay với em Huyền Thổ cư KINH NGHIỆM GẦN 10 NĂM ( 0363703491- 0965472910) - Để sở hữu hàng nghìn ngôi nhà cùng khu vực, tiết kiệm THỜI GIAN - CÔNG SỨC - TIỀN BẠC.- Tư vấn miễn phí 24/24h( zalo, fb). Tư vấn Pháp lý, vay vốn.",21/04/2022,Tin thường,batdongsan_so_com_vn_1673827035.8939395,,,,
"3,31 tỷ VNĐ",Vạn Phúc- Hà Đông, 37m2,,,"Nhà đẹp Vạn Phúc, Hà Đông, ngõ ô tô thông, 37m, nội thất xịn, nhỉnh 3 tỷ Rất hiếm có nhà Vạn Phúc ngõ ô tô bán, vị trí đắc địa nhà đẹp dân xây kiên cố, các tầng thoáng sáng nhiều phòng rộng đẹp môi trường trong lành, dân đông văn minh. Vài bước ra ngân hàng, trường học, bệnh viện, khu vui chơi, chợ dân sinh, siêu thị...đường thông thoáng, mặt tiền rộng có thể vừa ở vừa kinh doanh nhỏ. Giao thông thuận lợi: phía Bắc di chuyển xuống Ngô Quyền, vài bước ra Yết Kiêu cạnh Bưu điện Hà Đông, lên trên giáp Mỗ Lao, sang đường ra Khu Đô Thị Văn Quán và trục chính Quang Trung,... Gia chủ là doanh nhân thành đạt, nhà rất có lộc ở phất lên từ đó, cần bán nhanh chuyển sang ở biệt thự rộng hơn, bán đi rất tiếc. Sổ đỏ vuông, sẵn sàng giao dịch. Giá: 3.31 tỷ ( có thương lượng). Liên hệ ngay với em Huyền Thổ cư KINH NGHIỆM GẦN 10 NĂM ( 0363703491- 0965472910) - Để sở hữu hàng nghìn ngôi nhà cùng khu vực, tiết kiệm THỜI GIAN - CÔNG SỨC - TIỀN BẠC.- Tư vấn miễn phí 24/24h( zalo, fb). Tư vấn Pháp lý, vay vốn.",21/04/2022,Tin thường,batdongsan_so_com_vn_1673827037.170524,,,,
