price,address,Diện tích,Details,Ngày đăng,Loại tin,id,Hướng,Số phòng ngủ,Số toilet,Mặt tiền,Lộ giới,Số tầng
16 tỷ VNĐ,Hà Nội, 70m2,"Bán nhà phân lô, đường ô tô thiết kế rất đẹp phong cách hiện đại phố Trần Đại Nghĩa - SĐT: 0366 555 258.Vị trí trung tâm giữa ba trường đại học Bách Khoa, Xây Dựng, Kinh Tế Quốc Dân. Gần ngã tư Lê Thanh Nghị và Trần Đại Nghĩa. Ngõ rộng ô tô tránh, rất gần phố. - Diện tích: 70m2 x 6 tầng. Mặt tiền rất rộng 7m, thửa đất vuông vắn. - Khu dân trí cao, an ninh tốt, nhiều tiện ích. - Thiết kế đẹp, 2 mặt thoáng ánh nắng ngập tràn. - Nội thất, thang máy xịn hiện đại, thiết kế thẩm mỹ cao. - Sổ đỏ chính chủ đầy đủ.Giá chỉ 16 tỷ thoả thuận sâu.Liên hệ luôn 24/7 em Thanh - 0366 555 258.",15/03/2022,Tin thường,batdongsan_so_com_vn_1673830136.4818933,,,,,,
"14,9 tỷ VNĐ",Hà Nội, 60m2,"Bán nhà cán bộ 5 tầng trong ngõ 17 phố Tạ Quang Bửu - SĐT: 0366 555 258.Cách mặt phố 30m. Gần bể bơi Bách Khoa, SVĐ Bách Khoa, phố Lê Thanh Nghị, tiểu học Lê Văn Tám…Đường trước nhà ô tô tránh, chỗ để xe thoải mái. - Diện tích: 60m2 x 5 tầng, đủ công năng. - Sổ đỏ chính chủ. - Nhà đẹp, xây chắc chắn, thoáng trước sau, vào ở luôn.Giá 14.9 tỷ thoả thuận mạnh.Liên hệ luôn 24/7: em Thanh - 0366 555 258.",15/03/2022,Tin thường,batdongsan_so_com_vn_1673830137.6607394,,,,,,
"6,3 tỷ VNĐ","Võ Chí Công, quận Tây Hồ, Hà Nội", 148m2,"Quỹ căn còn lại tại Udic Westlake - Cam kết giá rẻ nhất khu vực Tây Hồ - Diện tích: 84m2->295m2 - Số phòng ngủ: 2PN-3N-4N-Duplex - Hiện đã trang bị full đồ nội thất CB CĐT - Căn hộ phù hợp cho mọi đối tượng, gia đình, người đi làm, người nước ngoài. -Miễn phí 2 năm phí dịch vụ Liên hệ để xem nhà:/ 0977568223",15/03/2022,Tin thường,batdongsan_so_com_vn_1673830138.8326042, Tây nam, 4, 2,,,
"6,2 tỷ VNĐ","Ngõ Phố Xuân Đỉnh, Phường Xuân Đỉnh, Bắc Từ Liêm, Hà Nội", 48m2,"✅  Bán nhà thiết kế cực đẹp, nội thất gỗ hương sang trọng, sân để ôtô ngày đêm rộng rãi, cách phố lớn Xuân Đỉnh chỉ 40m, ngõ ô tô vào. Vị trí tiện nghi đi lại và sinh hoạt. Diện tích 48m2 x 5T, xây mới kiên cố, chắc chắn và đẳng cấp. --------------------------------------------------------------------- ✔️  Thiết kế và công năng: Kiến trúc Tân cổ điển, sang trọng. Công năng sử dụng tiện lợi: - Diện tích 48m2, 5 tầng mới đẹp, 6 phòng ngủ. - Tầng 1: Phòng khách + Phòng bếp và ăn. - Tầng 2, 3, 4: Mỗi tầng 2 phòng ngủ + Vệ sinh.s - Tầng 5: Phòng thờ. Không gian sinh hoạt ngoài trời, kho giặt đồ, sân phơi. ✔️  Vị trí: - Nhà nằm ở vị trí cực đẹp, ngõ rất nông, rộng rãi, không gian thoáng, nhiều ánh sáng tự nhiên, cách mặt phố lớn Xuân Đỉnh 40m.   - Giao thông thuận tiện, gần Hồ Tây, Ngoài Giao Đoàn, KĐT Tây Hồ Tây, StarLake. Gần trường cấp 1,2,3 Xuân Đỉnh, trường Nội Vụ… ✔️  Nội thất: - Được làm tỉ mỉ với chủ đạo là gỗ Hương: Các cửa, cầu thang. Sàn gỗ Malaysia chống trơn trượt, sang trọng và đẳng cấp. - Thiết bị điện cao cấp, dây Trần Phú đi GEN cẩn thận. Trần Thạch Cao và trần gỗ, đèn LED. Thiết bị vệ sinh TOTO nhập khẩu, vách tắm đứng. - Khu vực thoáng đãng, ngõ phố sạch đẹp, dân trí cao, an ninh cực tốt. ✔️  Cam kết sổ đỏ chính chủ, Giấy phép xây dựng,…sẵn sàng giao dịch. ✔️  Giá thương lượng chỉ: 6.2 tỷ (có thương lượng, bao sang tên). ✔️  Liên hệ xem nhà trực tiếp Mr.Tuấn: 0964 357 352 (miễn TG, MG)",15/03/2022,Tin thường,batdongsan_so_com_vn_1673830140.2478187,, 6, 4, 4, 4, 5
55 tỷ VNĐ,Phạm Hồng thái, 135m2,"Chủ cần tiền đầu tư, muốn nhượng lại mảnh đất vị trí cực đẹp mặt phố cổ Phạm Hồng Thái, Q Ba Đình. Đất mặt tiền cực lớn, vỉa hè rộng rãi. Phố to rộng oto đỗ cửa.Đã xin cấp phép được xây tòa nhà 9 tầng. (8 nổi 1 hầm)Diện tích: 135m2 , mặt tiền 9mGiá: 55 tỷ (CÒN THƯƠNG LƯỢNG, LÀM VIỆC TRỰC TIẾP CHỦ NHÀ)ĐẤT MẶT PHỐ TRUNG TÂM BA ĐÌNH - KINH DOANH - OTO ĐỖ CỬA - MẶT TIỀN LỚNLiên hệ xem thực tế và nhận thông tin chi tiết: 0981367887- Thửa đất vuông như bao diêm, sổ pháp lý chuẩn cất két sẵn sàng giao dịch",15/03/2022,Tin thường,batdongsan_so_com_vn_1673830141.7069159,,,, 9, 17,
17 tỷ VNĐ,Hà Nội, 58m2,"Cần bán gấp nhà phố Hoa Lư, quận Hai Bà Trưng - LH: 0856 968 656. + Vị trí vàng, gần phố mặt ngõ ô tô tránh, lô góc 2 mặt ngõ kinh doanh. + Diện tích 58 m2, mặt tiền 6 m. - Thiết kế: 5 tầng nhà đẹp ở ngay, lô góc thiết kế cực kì thoáng. + Khu vực quy hoạch ổn định, xung quanh toàn nhà cao tầng từ 7 đến 10 tầng. + Sổ đỏ chính chủ, sổ vuông vắn. Khách yên tâm về vấn đề pháp lý.Giá chào 17 tỷ thương lượng sâu, bao sang tên, tặng full nội thất xịn. + Khách mua miễn phí dịch vụ 100%. + Khách chủ gặp nhau thương lượng.Liên hệ ngay lập tức 24/7 để xem nhà thực tế hoặc tìm được nhà ưng ý với kho hàng khổng lồ - 0856 968 656.",15/03/2022,Tin thường,batdongsan_so_com_vn_1673830143.1832101,,,,,,
"1,4 tỷ VNĐ",Uy Nỗ Đông Anh, 48m2," + Bán đất xóm Bãi , Uy Nỗ, Đông Anh, đường trục chính ô tô tránh, gần khu đô thị Quân Đội Tên Lửa. -Vị trí gần khu di tích đặc biệt Cổ Loa, Khu Đô Thị Quân Đội, TT hành chính huyện Đông Anh, Chợ tó , chợ Cổ Loa. -Tiềm năng Đông Anh lên Thành Phố tăng giá phi mã, tương lai tươi sáng. - Gần đường trục Cổ Loa rất rộng một đoạn, tiện ích ngập tràn. -Khu dân cư đông đúc, đi lại rất thuận tiện, dân trí cao. -Pháp lý sạch, sổ đỏ chính chủ, sẵn sàng chuyển giao. -Giá chào 1x tỷ, có thương lượng. -Liên hệ em SƠN để được xem đất miễn phí; 0915.126.183 ",15/03/2022,Tin thường,batdongsan_so_com_vn_1673830144.5976524,,,, 4,,
15 tỷ VNĐ,Hà Nội, 56m2,"Bán nhà phân lô ô tô tránh phố Tạ Quang Bửu - Bách Khoa, quận Hai Bà Trưng - LH: 0856 968 656.Diện tích 56 m2, 6 tầng, mặt tiền 5.2 m, nhà đẹp chỉ việc ở luôn.Toàn bộ đồ nội thất nhập khẩu, thang máy cao cấp…Nhà kinh doanh tốt (dòng tiền 50-60tr/tháng), vỉa hè rộng, ô tô đỗ và tránh nhau thoải mái.Thiết kế hiện đại, tối ưu công năng: - T1 : Gara ô tô + Phòng lớn + WC. - T2-5 : Nhiều phòng, WC. - T6: Phòng thờ, sân phơi.Vị trí đẹp, khu trung tâm, giao thông thuận tiện.Sổ đỏ chính chủ, pháp lý chuẩn.Giá chào chỉ 15 tỷ thương lượng sâu, bao sang tên, tặng full nội thất xịn.Mọi thông tin chi tiết xin vui lòng liên hệ ngay lập tức em Bình, nhận tìm nhà theo nhu cầu - 0856 968 656.",15/03/2022,Tin thường,batdongsan_so_com_vn_1673830145.607952,,,,,,
"6,85 tỷ VNĐ",đường Hoàng Mai- Hà Nội, 65m2,"*Bán gấp nhà riêng đường Hoàng Mai ngõ ô tô thông , kinh doanh đỉnh, tặng nội thất cao cấp. 0345752279 *Mô tả: +Diện tích : 65m2 +Thiết kế: 5 tầng, 6 ngủ, ô tô vào nhà, sân phơi, cầu thang giữa. +Vị trí đắc địa, ngõ thông các ngả, cạnh chợ, trường học, khu dân trí cao. +Chào giá 6.85 tỷ có thương lượng. +Sổ đỏ đẹp giao dịch ngay. *Gọi hoặc nhắn tin em Bình để được tư vấn và xem nhà hoàn toàn miễn phí mọi khung giờ! *Không tiếp môi giới.",15/03/2022,Tin thường,batdongsan_so_com_vn_1673830146.7366543,, 6,, 4, 3, 5
"4,8 tỷ VNĐ","Bế Văn Đàn, Hà Đông, Hà Nội", 54m2," # Bán nhà phân lô, ô tô đỗ cửa, giá đầu tư cần bán nhanh, phường Quang Trung, Hà Đông, nhà mới đẹp về ở ngay. DT 54m, 3T, Giá chỉ 4.8 tỷ. + Vị trí thoáng, đẹp khu phân lô, dân trí cao, an ninh an sinh đỉnh. +  Đường trước nhà ô tô đỗ, đường thông chạy vòng quanh, giao thông thuận tiện, trung tâm phố tiện ích. + Nhà 3 tầng khung cột chắc, thiết kế hiện đại, gồm PK, Bếp, WC, tổng 4 phòng ngủ to rộng, các phòng thoáng sáng, tràn ngập ánh sáng tự nhiên. + Giá đầu tư 4.8 tỷ. + Sổ vuông đỏ đẹp, chính chủ pháp lý chuẩn. + Để tham khảo thêm hàng 100 ngôi nhà mặt phố, vị trí kinh doanh, lô góc, đẹp độc lạ, những khu đất vượng khí đón tài lộc giá từ 3 đến 40 # LH SĐT: Tình nhà phố 0906113879 ( chuyên nhà đẹp, nhà phố, nhà tiềm năng, dòng tiền, có uy tín trong giới nhà đất quận Hà Đông, Hà Nội ).",15/03/2022,Tin thường,batdongsan_so_com_vn_1673830147.9713519,, 4,,, 5, 3
"2,6 tỷ VNĐ",đường Nam Dư- Hoàng Mai- Hà Nội, 32m2,"*Bán gấp siêu phẩm Nam Dư tầm tiền khó kiếm, vị trí đẹp, ở ngay. 0345752279 *Mô tả: +Diện tích: 32m2, 5 tầng, 4 phòng ngủ. thiết kế hiện đại hợp lý. +Giao thông thuận tiện, gần ô tô tránh, trung tâm thương mại, trường học các cấp,... +Chào giá 2.6 tỷ có thương lượng. +Sổ đỏ đẹp chính chủ, giao dịch nhanh chóng.*Gọi hoặc nhắn tin em Bình để được tư vấn và xem nhà hoàn toàn miễn phí mọi khung giờ! *Không tiếp môi giới.",15/03/2022,Tin thường,batdongsan_so_com_vn_1673830149.1232724,, 4,, 4,, 5
17 tỷ VNĐ,"Trường Chinh, Đống Đa, Hà Nội", 132m2,"Bán nhà phố Trường Chinh, Đống Đa 132m2, 4 tầng, mặt tiền 5m, giá chào 17 tỷ có thương lượng.+ Vị trí trung tâm tiếp giáp Ngã tư Sở, tiện ích ngập tràn. Có thể đi vào từ Lê Trọng Tấn.+ Mặt ngõ oto tránh, ngõ nông thẳng, cách mặt phố Trường Chinh 35M.+ Hiện tại là 3 tầng 1 tum, cầu thang giữa:- Tầng 1: Gara 7 chỗ, khách, WC, bếp & 1 phòng phụ ở cuối.- Tầng 2, 3: Mỗi tầng 2PN, 1WC giữa.- Tầng 4: Sân phơi sau, phòng thờ & sân tiểu cảnh phía trước.+ Pháp lý chuẩn, sổ đỏ nở hậu phong thủy.+ Liên hệ: Mr. Hoan 0877.855.777 Zalo, Viber, Fb ( Hoan Biệt thự, Liền Kề, Mặt Phố, Khách Sạn). Miễn phí xem nhà đến tư vấn pháp lý.+ Fanpage: https://www.facebook.com/Estatebds.vn",14/03/2022,Tin thường,batdongsan_so_com_vn_1673830150.7221124,, 5, 5, 5, 8, 4
"2,43 tỷ VNĐ",Đa Sỹ- Hà Đông, 35m2,"Bán nhà Đa Sỹ, Hà Đông, 35mx4 tầng, ô tô gần, ngõ thoáng, nhỉnh 2 tỷ Cần bán nhà đẹp trung tâm Hà Đông xung quanh chợ lớn Hà Đông, các cơ quan hành chính của Quận, gần các bệnh viện lớn, vài bước chân ra chợ đầu mối 365, bán kính xung quanh đầy đủ tiện ích. Nhà đẹp, ngõ thoáng , ô tô gần,có ngân hàng, siêu thị, chợ, bệnh viện, trường học các cấp... không thiếu thứ gì. Nhà thiết kế phong cách hiện đại, khung cột bê tông chắc chắn, đầy đủ công năng sử dụng , các phòng thoáng sáng, nhà mới chỉ việc xách vali đến ở. Giao thông di chuyển các tuyến phố trung tâm: Phúc La, Mậu Lương, Văn Phú, Tô Hiệu, Bà Triệu,Xa La, Nhuệ Giang, Nguyễn Trãi, Văn Quán... Hàng xóm thân thiện, nơi ở văn minh, môi trường trong lành, chủ là doanh nhân thành đạt, nhà rất có lộc. Giá: 2.43 tỷ ( có thương lượng). Sổ đỏ vuông, sẵn sàng giao dịch. Liên hệ ngay với em Huyền địa ốc KINH NGHIỆM TRÊN 8 NĂM ( 0363703491- 0965472910) - Để sở hữu hàng nghìn ngôi nhà cùng khu vực, tiết kiệm THỜI GIAN - CÔNG SỨC - TIỀN BẠC.- Tư vấn miễn phí 24/24h( zalo, fb). Tư vấn Pháp lý, vay vốn.",14/03/2022,Tin thường,batdongsan_so_com_vn_1673830151.7802815,,,,,, 4
"2,45 tỷ VNĐ",Hà Trì- Hà Đông, 35m2,"Nhỉnh 2 tỷ nhà đẹp 35mx 4 tầng, Hà Trì, Hà Đông, ngõ thoáng, ô tô gần Bán nhà vị trí trung tâm giáp Khu đô thị Xa La sầm uất, vài bước ra chợ đầu mối 365, bán kính xung quanh là trường , chợ, bệnh viện, ngân hàng, siêu thị không thiếu thứ gì. Nhà đẹp hiện đại xây tâm huyết khung cột bê tông chắc chắn, phong cách mới thoáng sáng, đầy đủ công năng sử dụng, nội thất xịn. Nhà mới chỉ việc xách vali đến ở. Giao thông vô cùng thuận lợi di chuyển các phố trung tâm: Mậu Lương, Đa Sỹ, Tô Hiệu, Bà Triệu, Văn Quán, Nhuệ Giang, Phùng Hưng,.... Xung quanh đầy đủ tiện nghi, an ninh tuyệt đối, môi trường trong lành, hàng xóm thân thiện, gia chủ thành đạt, khu văn minh đáng sống. Sổ đỏ vuông, pháp lý sạch. Giá: 2.45 tỷ ( có thương lượng). Liên hệ ngay với em Huyền : 0965472910 ( miễn trung gian).",14/03/2022,Tin thường,batdongsan_so_com_vn_1673830152.7187722,,,,,, 4
"2,43 tỷ VNĐ",Đa Sỹ- Hà Đông, 35m2,"Bán nhà Đa Sỹ, Hà Đông, 35mx4 tầng, ô tô gần, ngõ thoáng, nhỉnh 2 tỷ Cần bán nhà đẹp trung tâm Hà Đông xung quanh chợ lớn Hà Đông, các cơ quan hành chính của Quận, gần các bệnh viện lớn, vài bước chân ra chợ đầu mối 365, bán kính xung quanh đầy đủ tiện ích. Nhà đẹp, ngõ thoáng , ô tô gần,có ngân hàng, siêu thị, chợ, bệnh viện, trường học các cấp... không thiếu thứ gì. Nhà thiết kế phong cách hiện đại, khung cột bê tông chắc chắn, đầy đủ công năng sử dụng , các phòng thoáng sáng, nhà mới chỉ việc xách vali đến ở. Giao thông di chuyển các tuyến phố trung tâm: Phúc La, Mậu Lương, Văn Phú, Tô Hiệu, Bà Triệu,Xa La, Nhuệ Giang, Nguyễn Trãi, Văn Quán... Hàng xóm thân thiện, nơi ở văn minh, môi trường trong lành, chủ là doanh nhân thành đạt, nhà rất có lộc. Giá: 2.43 tỷ ( có thương lượng). Sổ đỏ vuông, sẵn sàng giao dịch. Liên hệ ngay với em Huyền địa ốc KINH NGHIỆM TRÊN 8 NĂM ( 0363703491- 0965472910) - Để sở hữu hàng nghìn ngôi nhà cùng khu vực, tiết kiệm THỜI GIAN - CÔNG SỨC - TIỀN BẠC.- Tư vấn miễn phí 24/24h( zalo, fb). Tư vấn Pháp lý, vay vốn.",14/03/2022,Tin thường,batdongsan_so_com_vn_1673830153.906595,,,,,, 4
"6,05 tỷ VNĐ",Nguyễn Văn Cừ phường Bồ Đề, 53m2,"NGUYỄN VĂN CỪ - Ô TÔ ĐỖ CỬA. + Vị trí vô cùng đắc địa, vài phút ra phố Hồng Tiến, Nguyễn Văn Cừ, Nguyễn Sơn, tiện ích không thiếu thứ gì.+ Ô tô đỗ cửa. Cách nhà chưa đầy 50m có ngay bãi trông giữ ô tô ngày đêm.+ Nhà đẹp được xây dựng vô cùng chắc chắn, mang phong cách biệt thự mini, thoáng trước sau vĩnh viễn.- Tầng 1: Sân để xe, phòng khách, bếp.- Tầng 2,3: Mỗi tầng 2 phòng ngủ thoảng sáng, vệ sinh chung.- Tầng 4: Phòng thờ , phòng ngủ trước và sân phơi phía sau.+ Sổ đỏ chính chủ, sẵn sàng giao dịch ngay. Lh: Mai ĐA 0983724773.",14/03/2022,Tin thường,batdongsan_so_com_vn_1673830155.1831787,,,,,,
750 triệu VNĐ/m2,"phố Đường Thành, Quận Hoàn Kiếm (gần chợ Hàng Da)", 130.4m2,"Cần bán gấp nhà mặt phố Đường Thành, Quận Hoàn Kiếm (gần chợ Hàng Da)Diện tích: 130,4m2 - Chiều rộng: 5m- Vị trí đẹp, trung tâm phố cổ- Thuận tiện ở, kinh doanhGiá bán: 750 Triệu/m2 - Có thương lượngLiên hệ chính chủ: 0365785334 - Sổ đỏ chính chủ Nguồn:  http://nhadathanoi.net.vn/nha-mat-pho/can-ban-gap-nha-mat-pho-duong-thanh-quan-hoan-kiem-gan-cho-hang-da-3550.html",14/03/2022,Tin thường,batdongsan_so_com_vn_1673830156.261294,,,, 5,,
5 tỷ VNĐ,quang trung hà đông hà nội, 43m2,"PHÂN LÔ QUANG TRUNG - NHÀ ĐẸP DỌN ĐỒ VỀ Ở NGAY - PHÂN KHÚC SIÊU HIẾM CÒN LẠI CỦA HÀ ĐÔNG - ĐƯỜNG TRƯỚC NHÀ 3M. Nhà bán tại ngõ 8 Quang Trung Diện tích 42.6m , nhà  4 tầng mới siêu đẹp Giá bán công khai 5 tỷ + Tuyệt phẩm siêu hiếm với tầm tiền 5 tỷ của Hà Đông, nhà mới tinh tươm, khách hàng dọn đồ về ở ngay. Oto cách nhà 20m, cách 50m ra mặt phố Quang Trung. + Nhà xây thiết kế 4 tầng. + Tầng 1 : Phòng khách, bếp, wc. + Tầng 2,3 : Mỗi tầng 2 phòng ngủ, wc. + Tầng 4: Phòng thờ, sân phơi, kho để đồ. + Sổ đỏ chính chủ, sẵn sàng giao dịch. Khách mua về chỉ cần xách va ly về ở ngay, phù hợp với gia đình trẻ năng động Nhà thiết kế thông minh , tối ưu giá trị tốt nhất . Khách hàng quan tâm vui long liên hệ số máy nóng Hotline 24/7 : 0844 6666 97",14/03/2022,Tin thường,batdongsan_so_com_vn_1673830159.1158664,, 4, 3, 3, 3, 4
15 tỷ VNĐ,"Pháo Đài Láng, Đống Đa, Hà Nội", 50m2,"Bán nhà mặt ngõ 157 Pháo Đài Láng, Đống Đa 50m2, 6 tầng thang máy, giá chào 15 tỷ còn thương lượng.+ Nhà mới, Kinh doanh, Ô tô, Ô Chờ Thang máy, Vỉa hè.+ Nhà xây thiết kế thông sàn, bố trí thang máy tháng bộ, khu vệ sinh.+ Ngõ 157 Pháo Đài Láng kinh doanh sầm uất, ngõ to như phố vỉa hè rộng. Ô tô đỗ ngày đêm.+ Sổ vuông đẹp.+ Liên hệ: Mr. Hoan 0877.855.777 Zalo, Viber, Fb ( Hoan Biệt thự, Liền Kề, Mặt Phố, Khách Sạn). Miễn phí xem nhà đến tư vấn pháp lý.+ Fanpage: https://www.facebook.com/Estatebds.vn",14/03/2022,Tin thường,batdongsan_so_com_vn_1673830163.859007,, 5, 5, 5, 8, 6
"2,55 tỷ VNĐ","286 Nguyễn Xiển, Hà Nội", 75m2,"-    Vị trí đẹp, ngay mặt đường Nguyễn Xiển, tiện ích xung quanh không thiếu gì, có sân nội khu rộng rãi thoáng mát, siêu thị Topmarket, ngân hàng, trường học các cấp,...-    Căn ""hoa hậu"" của chung cư, thiết kế đẹp, thoáng đãng, đầy đủ công năng với 2 phòng ngủ, 2 WC.- Tặng lại nội thất gồm: tủ lạnh, sofa, máy giặt, bàn ghế, giường, máy lạnh,...-    Sổ đỏ chính chủ, sẵn sàng giao dịch.-    Liên hệ chính chủ: 0961678177 (Miễn Môi giới, trung gian).-       Gía đã bao sang tên. ",14/03/2022,Tin thường,batdongsan_so_com_vn_1673830165.0139246,, 2, 2,,,
